author,updated_at,like_count,text,public
@giovannipoliti8315,2019-03-31T12:41:42Z,0,"Hi @sentdex what if I want to get a DF for all the market by screening for certain parameters, say on a daily timeframe over the last year",True
@gotmygat6316,2019-03-27T16:47:16Z,0,"How would I specify which market to go for?   Supposed I want the TSX market and I would like to use investing.com, is that possible?",True
@tayebbouaziz5581,2019-03-23T10:57:20Z,0,"i like your ""what's going on everybody!!"" , nice tutorial, thank you very much",True
@sumitverma1402,2019-03-15T17:04:40Z,0,wow,True
@larbisahli2273,2019-03-13T05:44:44Z,1,thank you very much sentdex  your tutorials change my life to the better.,True
@ManishGupta-cn7ei,2019-03-08T23:57:16Z,0,Putting the source code on github always gets more views people some people are interested in tutorials which give code... they skip the ones where there is no code given.... but that is if you are looking to get more views and likes...,True
@louie115,2019-02-27T04:01:21Z,0,how can you grab data directly from stock market?  do you need a license for that?,True
@AjayKumar-id7mb,2019-02-24T12:44:30Z,0,"Hey, I want to do the algorithm and data structure course in python. And want to practice question of python. Please suggest me some source to practice question in python. If anyone knows they can reply but only for python practice.",True
@joyjaguar007,2019-02-17T16:44:12Z,1,Would you make a video on how to add two or more indicators,True
@coeurdelion8517,2019-02-12T22:27:24Z,0,You’re the man,True
@donphilip917,2019-02-09T11:09:01Z,0,"What if the site isn’t .com  Say it’s .ca or .co.uk , how would I still have it linked",True
@cod4Rlp,2019-02-08T14:47:03Z,0,why not use a bloody ide?,True
@DanielCetrece,2019-02-06T01:43:39Z,0,Which IDE is used in the video?,True
@molejaboy,2019-02-05T12:40:23Z,2,Don’t know how I took so long to find your channel but thank you! Along with Corey Schafer I’m learning so much faster!,True
@darkshinigami9438,2019-01-24T14:45:06Z,1,"I got "" ModuleNotFoundError: No module named 'matplotlib' "", anyone can help?",True
@joro8604,2019-01-19T07:09:05Z,0,Bravo. Everything worked on the 1st time!,True
@marksw5499,2019-01-11T22:06:52Z,0,so cool. thanks!,True
@derbicalderon2101,2019-01-08T09:41:45Z,0,"First, I want to say thank you to the community for your input and help.  Second, If you're getting errors still, check out this link:  https://stackoverflow.com/questions/47179433/python-2-7-functools-lru-cache-does-not-import-although-installed/52917452#52917452?newreg=b982e43c839c4a43811c23f8b12ae9b6  it helped me out with my errors. Specifically the uninstalling, auto-remove, and reinstalling comment .",True
@Lordhellcrackthesaint,2019-01-06T12:46:28Z,0,How do you get to plain white page like that,True
@elbertmkizy7086,2019-01-02T07:31:51Z,0,did you save the TSLA file on your computer or does panda_datareader.data automatically gets it from yahoo.com?,True
@giridhart,2019-01-01T19:44:43Z,0,Hi Is there a way to get fundamental data from somewhere?,True
@st28rapture,2018-12-28T19:39:23Z,0,"import datetime import pandas_datareader.data as web  start = datetime.datetime(2015, 1, 1) end = datetime.datetime.now() df = web.DataReader(""TSLA"", 'robinhood', start, end)  print(df.head())",True
@lamontpoteat4416,2018-12-22T05:14:07Z,0,Pandas.datareader is giving me a issue. Fix? I've tried all of the fixes in the comments to no avail. Am I missing something or data reader not working?,True
@ivylee6544,2018-12-21T10:30:06Z,0,"Now that it is working, but why is it only 5 days of data?",True
@ivylee6544,2018-12-21T10:14:19Z,0,ImmediateDeprecationError: Morningstar has been immediately deprecated due to large breaks in the API without the introduction of a stable replacement. Pull Requests to re-enable these data connectors are welcome.,True
@deepank2467,2018-12-11T05:57:10Z,0,free cource on youtube must not be banned ........ plz govt's all country plz at least thing about poor student ... who can't afford expensive cource .... or middel class sstudent who cant ...... even afford collage fee ..... some.... we still try ... learn plz govt's plz don't ban free cource on youtube plz........,True
@thabangtsajoa716,2018-12-10T09:09:52Z,0,"Hi Admin, can you please tell me the names of the books and other sources that I can use to learn about Algo strategies that are practical and helpful?thanks tmtsajoa@gmail.com",True
@josephfoltz2423,2018-12-02T05:01:40Z,0,"This is dope information. I'm an awesome trader, very profitable. You should make a tutorial on MQL4/5 showing how to make a forex scalp EA. I literally have a strategy backtested at 95% accuracy over years and years of data, I just dont know how to put it into code.",True
@CyborgGaming99,2018-11-26T20:28:54Z,10,"For anyone having a problem with Google/morningstar api, try iex: 1. in cmd type pip install iex-api-python 2. and then just under df = web.DataReader put 'iex' instead of morningstar Hope that helps :)",True
@moazim1993,2018-11-17T03:28:28Z,0,"can you get a streaming data source from this, Similar to the tweepy video you did? It would be helpful for my side project to have streaming stock data with some indicators on top of the basic ones.",True
@vnansen,2018-11-09T00:00:06Z,0,am a beginner. wondering how can i read line by line from DataReader  to print it in a tabular format in python GUI using tkinter framework?,True
@samayverma2363,2018-11-03T13:36:05Z,0,Is this still relevant in late 2018?,True
@gabilehner633,2018-10-31T09:51:25Z,0,how can I import data for all stocks? Not just a specific ticker?,True
@Chroneperza,2018-10-30T23:32:08Z,0,cannot import style,True
@deonsanchez2508,2018-10-20T21:16:35Z,28,'morningstar' has depreciated use 'yahoo' instead,True
@MrWildDesire,2018-10-10T21:26:06Z,0,how to get streaming updated data from prices provider application like iqfeed ? thanks.,True
@joey424242,2018-10-03T19:43:25Z,0,could you please do a numpy tutorial,True
@MGZ136,2018-09-28T22:52:12Z,0,@sentdex do you have a method for having this outcome with bonds? It would be amazing!,True
@richardblackhound1246,2018-09-26T10:34:35Z,0,"Interestingly, if you use Microsoft's Azure notebooks (free Jupyter notebooks in the cloud), the code works as in the video (including yahoo) as long as you put '!pip install pandas-datareader'  (no quotes) on the first line",True
@KarthikRampur-ql2td,2018-09-22T20:41:50Z,0,simple and neat.Thanks man you saved a lot of time for me.,True
@Paltibenlaish,2018-09-17T17:52:24Z,0,"Hi sentdex, thank you for sharing. I am beginner in python and I am wondering if it's not better to use JavaScript for example chart.js and analize stocks from jsons Apis. For a more comfortable enviourment regarding sharing via web/ Cheers",True
@martinle3944,2018-09-10T20:38:18Z,0,Do you need Pyxll inorder to do this?,True
@stutirahul5635,2018-09-05T09:55:01Z,0,there is api from Tradermade that gives 6-month 60 minutes free data on over 80 currencies- http://dataapi.tradermadepro.com,True
@Aravinthmech,2018-09-04T15:36:03Z,0,how can i use csv file as data frame,True
@irmscher9,2018-08-27T18:03:46Z,2,"Man, you are a star. That's exactly what I needed!",True
@logicreason2736,2018-08-25T06:23:49Z,0,"I run this:  import datetime as dt import matplotlib.pyplot as plt from matplotlib import style import pandas as pd import pandas_datareader.data as web  style.use('ggplot')  start=dt.datetime(2000,1,1) end=dt.datetime(2016,12,31)  and get this  ================== RESTART: C:/Users/artna/Desktop/stock.py ================== Traceback (most recent call last):   File ""C:/Users/artna/Desktop/stock.py"", line 6, in <module>     import pandas_datareader.data as web   File ""C:\Users\artna\AppData\Local\Programs\Python\Python37\lib\site-packages\pandas_datareader\__init__.py"", line 2, in <module>     from .data import (DataReader, Options, get_components_yahoo,   File ""C:\Users\artna\AppData\Local\Programs\Python\Python37\lib\site-packages\pandas_datareader\data.py"", line 14, in <module>     from pandas_datareader.fred import FredReader   File ""C:\Users\artna\AppData\Local\Programs\Python\Python37\lib\site-packages\pandas_datareader\fred.py"", line 1, in <module>     from pandas.core.common import is_list_like ImportError: cannot import name 'is_list_like' from 'pandas.core.common' (C:\Users\artna\AppData\Local\Programs\Python\Python37\lib\site-packages\pandas\core\common.py)  Windows 10, 64 bit  Python version 3.7.0 IDLE version 3.7.0 Tk version 8.6.8  Please help",True
@battlemoose1594,2018-08-20T05:04:51Z,0,Code doesn't work. :(,True
@bryan-9742,2018-08-20T02:48:00Z,0,you should watch your adds Sentdex.  This fraud Jason Bond puts his BS as an add and it can kill this great sites credibility.,True
@PrakashPraaku,2018-08-18T13:34:18Z,0,"im not able to import pandas_datareader.data as web , pls help",True
@leifleoden5464,2018-08-17T05:01:29Z,0,"Okay so I install all the modules with `pip3 install pandas pandas_datareader matplotlib beautifulsoup4 scikit-learn` They install successfully, except for pandas_datareader due to an incompatible version of pandas. However, when I run the code I get an Import error saying I don't have matplotlib. I guess this is because I have multiple versions of python. So who do I find out the number of python versions I have running on my system and how do I force all them them to share modules?",True
@Hungry_Ham,2018-08-16T02:58:03Z,1,"I have uploaded my notes and examples from this course: https://github.com/INASIC/Python-for-Finance   They are quite comprehensive, and I hope they may be of help to anyone that is stuck with any bugs in the code presented in this series. In addition, they can be quickly skimmed to get a gist of what you might learn from this course, which I can also recommend.  Best of luck, and enjoy 😊",True
@zachmarks5310,2018-08-15T16:06:24Z,1,"getting an error that says: ""cannot import name 'is_list_like'"" -- any ideas on how to fix?",True
@Dominickhrndz314,2018-08-12T19:44:07Z,12,"You can now use Robinhood in place of morningstar, google, and yahoo.",True
@gustavoenriquenievesboliva5259,2018-08-11T23:31:55Z,0,">>>import pandas_datareader as web Traceback (most recent call last):   File ""<pyshell#0>"", line 1, in <module>     import pandas_datareader as web   File ""C:\Python\lib\site-packages\pandas_datareader\__init__.py"", line 2, in <module>     from .data import (DataReader, Options, get_components_yahoo,   File ""C:\Python\lib\site-packages\pandas_datareader\data.py"", line 14, in <module>     from pandas_datareader.fred import FredReader   File ""C:\Python\lib\site-packages\pandas_datareader\fred.py"", line 1, in <module>     from pandas.core.common import is_list_like ImportError: cannot import name 'is_list_like'  This is the other error when I try to import the module",True
@gustavoenriquenievesboliva5259,2018-08-11T21:45:41Z,0,"Hi! ... I have a problem with pandas-datareader, python does not recognize it like a module:  Traceback (most recent call last):   File ""getting_stock_price_data.py"", line 5, in <module>     import pandas_datareader as web ModuleNotFoundError: No module named 'pandas_datareader'  But when I check my pip list, the panda-datareader 0.6 is already install. If you can help me with that, would be great.... Thanks",True
@theurbanist4854,2018-08-05T06:46:43Z,12,"#Using Robinhood to make this look like tutorial # August 5, 2018  import datetime as dt import matplotlib.pyplot as plt from matplotlib import style import pandas as pd import pandas_datareader.data as web style.use('ggplot')   start = dt.datetime(2000,1,1) end = dt.datetime(2018,7,31)   df = web.DataReader('CNP', 'robinhood', start, end) df.reset_index(inplace=True) df.drop(['symbol', 'interpolated', 'session'], axis=1, inplace=True) df.rename(index=str, columns={'close_price': 'Close',                               'high_price': 'High',                              'low_price': 'Low',                              'open_price': 'Open',                              'volume': 'Volume',                              'begins_at': 'Date'}, inplace=True) df.set_index('Date', inplace=True) df.head()",True
@topraman33,2018-08-05T04:32:13Z,2,"Google, Yahoo and recently Morningstar (https://stackoverflow.com/questions/51630874/getting-a-request-error-404-in-python-while-accessing-an-api) don't appear to work at the moment. The only one I was able to get working was quandl:  ```df = web.DataReader(""TSLA"", 'quandl', start, end)'''  You'll have to reverse the data frame so that it's in the same order as sentdex's:  ```df = df.reindex(index=df.index[::-1])'''  Beware that the column labels will be different (e.g. ""AdjClose"" instead of ""Adj Close"").  Also for anyone struggling with importing pandas_datareader, this may be your fix:  https://stackoverflow.com/questions/50394873/import-pandas-datareader-gives-importerror-cannot-import-name-is-list-like",True
@kashish9296,2018-07-22T03:05:24Z,0,"Hello , i have installed all the packages , but while running the program it gives the error ""import pandas_datareader.data as web"" , ""from .data import (DataReader, Options, get_components_yahoo,"" , ""from pandas_datareader.fred import FredReader"", ""ImportError: cannot import name 'is_list_like'""  , Can you help me where i am doing wrong . Thanks!",True
@quantumly57,2018-07-17T04:14:37Z,6,This is pure gold... Saves so much time and energy than a CS/business degree. Thank you.,True
@jimmymosiah4333,2018-07-16T09:06:05Z,0,"Hi sir, I'm applying your scripts in order to do my own market analysis(Optimal portfolio, CAPM..etc) but I'm getting this result: ""NameError: name 'web' is not defined "" should I define web? How to please? because I'm a biginner. Many Thx",True
@eshwarank6043,2018-07-13T15:13:03Z,2,I installed all the packages with no errors. But i still get errors related to the packages. i use a 32 bit launcher on a 64 bit system . Pls help,True
@aperson1181,2018-07-13T02:08:23Z,0,i have the latest python and the cmd code didn't work 'pip' is not recognized,True
@aperson1181,2018-07-13T02:04:37Z,0,"i have the latest python, how to install the packages?",True
@JeanPierreSchnyder,2018-07-01T12:43:02Z,0,Just started the tuto. Looks very good ! Where can I find the python source files ?,True
@aneeshantony401,2018-06-26T17:43:15Z,0,"raceback (most recent call last):   File ""C:/Python36/project/webtest2.py"", line 5, in <module>     import pandas_datareader.data as web   File ""C:\Python36\lib\site-packages\pandas_datareader\__init__.py"", line 2, in <module>     from .data import (DataReader, Options, get_components_yahoo,   File ""C:\Python36\lib\site-packages\pandas_datareader\data.py"", line 14, in <module>     from pandas_datareader.fred import FredReader   File ""C:\Python36\lib\site-packages\pandas_datareader\fred.py"", line 1, in <module>     from pandas.core.common import is_list_like ImportError: cannot import name 'is_list_like' >>>  Pls Help",True
@RahulSingh-xo6tq,2018-06-25T12:08:00Z,0,It says RemoteDataError,True
@eromattiffarg,2018-06-24T00:04:10Z,0,Took this course and just sold my own algorithm to BoA for $10 million yesterday Morning. Thanks for helping me take the first step.,True
@dyn0might191,2018-06-23T07:20:51Z,0,"3:30 - 3:38, truth.",True
@tristanshah9716,2018-06-21T14:02:12Z,0,for those having problems installing data reader via pip. Here is the latest dev version: pip install git+https://github.com/pydata/pandas-datareader.git,True
@TheGbelcher,2018-06-17T13:50:29Z,0,If you get ImportError: cannot import name 'is_list_like' try pd.core.common.is_list_like = pd.api.types.is_list_like before running import pandas_datareader.data as web,True
@lucccar,2018-06-16T01:05:35Z,7,It seems Yahoo API services  don't work anymore... Is there another way to get finance data?,True
@WicharyD.,2018-06-12T18:27:03Z,0,"Hallo sentdex i have a problem: ""ImportError: cannot import name 'is_list_like'"" what i'm doing wrong can u help me?",True
@akashreddyeda9547,2018-06-06T20:22:59Z,0,"File ""PythonProgramminp1.py"", line 5, in <module>     import pandas_datareader.data as web   File ""C:\Python35\lib\site-packages\pandas_datareader\__init__.py"", line 2, in <module>     from .data import (DataReader, Options, get_components_yahoo,   File ""C:\Python35\lib\site-packages\pandas_datareader\data.py"", line 14, in <module>     from pandas_datareader.fred import FredReader   File ""C:\Python35\lib\site-packages\pandas_datareader\fred.py"", line 1, in <module>     from pandas.core.common import is_list_like ImportError: cannot import name 'is_list_like'",True
@akshaykadam6636,2018-06-04T19:42:50Z,0,will u please update me about the pandas_datareader cuz i m getting an import error,True
@frostbiite7722,2018-05-26T20:01:56Z,0,"Dude.., you are freaking amazing.",True
@aayesharaj1759,2018-05-26T06:35:34Z,0,"i m getting this error while  running  Traceback (most recent call last):   File ""C:/Users/Iqbal/AppData/Local/Programs/Python/Python36-32/Scripts/1.py"", line 5, in <module>     import pandas_datareader.data as web   File ""C:\Users\Iqbal\AppData\Local\Programs\Python\Python36-32\lib\site-packages\pandas_datareader\__init__.py"", line 2, in <module>     from .data import (DataReader, Options, get_components_yahoo,   File ""C:\Users\Iqbal\AppData\Local\Programs\Python\Python36-32\lib\site-packages\pandas_datareader\data.py"", line 14, in <module>     from pandas_datareader.fred import FredReader   File ""C:\Users\Iqbal\AppData\Local\Programs\Python\Python36-32\lib\site-packages\pandas_datareader\fred.py"", line 1, in <module>     from pandas.core.common import is_list_like ImportError: cannot import name 'is_list_like'",True
@sdr224,2018-05-24T21:18:04Z,0,"Question here:  I have been using morning star for my data source.  I am iterating through a list of 500 stocks and some of the tickers that I am using are not producing a data frame. its not even throwing an error, its running the code without finishing and without progressing to the next ticker in my list.  How do you recommend I have my program check if the data reader will produce a dataframe so that this doesnt happen?  For context, one of the tickers that I am getting stuck on is QRTEA.  Edit:   After a very long time it finally outputted this error  RuntimeError: maximum recursion depth exceeded while calling a Python object",True
@lpelz3693,2018-05-24T18:36:57Z,0,pip installed data-reader to site packages and now i get error when import pandas_datareader.data as web,True
@samg7247,2018-05-23T19:52:36Z,0,"Hi there, I'm just starting out with your videos and having troubles unfortunately. I've done most of what you did as well as include the changes I noticed in your recent comment to update the code. This is what I have:  import datetime as dt import matplotlib.pyplot as plt from matplotlib import style import pandas as pd import pandas_datareader.data as web  style.use('ggplot')  start = dt.datetime(2010,1,1) end = dt.datetime.now  df = web.DataReader('TSLA', 'morningstar', start, end) df.set_index(""Date"", inplace=True) df = df.drop(""Symbol"", axis=1)  print(df.head()) ___________________________ It gives me a few error codes when I go to run it and I can't quite figure out what's going wrong. I'll copy those as well. Think you could have a look? I'm using PyCharm running 3.6   /Users/sam/PycharmProjects/untitled2/venv/bin/python /Users/sam/Library/Preferences/PyCharm2018.1/scratches/scratch_1.py Traceback (most recent call last):   File ""/Users/sam/Library/Preferences/PyCharm2018.1/scratches/scratch_1.py"", line 5, in <module>     import pandas_datareader.data as web   File ""/Users/sam/PycharmProjects/untitled2/venv/lib/python3.6/site-packages/pandas_datareader/__init__.py"", line 2, in <module>     from .data import (DataReader, Options, get_components_yahoo,   File ""/Users/sam/PycharmProjects/untitled2/venv/lib/python3.6/site-packages/pandas_datareader/data.py"", line 14, in <module>     from pandas_datareader.fred import FredReader   File ""/Users/sam/PycharmProjects/untitled2/venv/lib/python3.6/site-packages/pandas_datareader/fred.py"", line 1, in <module>     from pandas.core.common import is_list_like ImportError: cannot import name 'is_list_like'  Process finished with exit code 1",True
@dannyzilberg3101,2018-05-14T12:00:42Z,0,"beautifulsoup4 didn't install, i managed to do it with calling it bs4",True
@marcelmir5316,2018-05-05T13:00:40Z,0,Have you made money with that (honestly)?,True
@ezioarno15,2018-04-28T21:53:54Z,0,what font is he using? someone please reply,True
@dipamvasani8727,2018-04-25T16:41:09Z,0,How can we use this for Indian stocks?,True
@kentlord22,2018-04-19T17:22:30Z,0,How do i get the stock for other country? lets say malaysia?,True
@marianoabrile,2018-04-17T16:54:00Z,0,How can i set the last close price into a variable ?,True
@hamad.learns,2018-03-30T19:20:32Z,0,Thanks a lot for this. I TOTALLY appreciate it ! Do you have patreon  ?,True
@sentdex,2018-03-27T21:13:35Z,188,"Now that Google has also thwarted our efforts, here is a quick example of grabbing data with morningstar instead:   import datetime import pandas_datareader.data as web  start = datetime.datetime(2015, 1, 1) end = datetime.datetime.now() df = web.DataReader(""TSLA"", 'morningstar', start, end) df.reset_index(inplace=True) df.set_index(""Date"", inplace=True) df = df.drop(""Symbol"", axis=1)  print(df.head())",True
@RTMaster1,2018-03-27T20:53:24Z,0,"now that yahoo and google have been deprecated, you should switch to something like alpha vantage, and the wrapper for python: https://github.com/RomelTorres/alpha_vantage  essentially: pip install alpha_vantage  and in your python script: from alpha_vantage.timeseries import TimeSeries ts = TimeSeries(key='YOUR_API_KEY', output_format='pandas') df, meta_data = ts.get_intraday(symbol='TSLA',interval='1min', outputsize='full')  you can get your api key for free at alphavantage.co  also im not sure about the start-end-thing, but their documentation should help with that",True
@stevesamah4018,2018-03-27T10:33:30Z,0,Try 'Morningstar' instead of 'yahoo' or look at doc for alternatives.,True
@stevesamah4018,2018-03-27T10:32:53Z,0,Try 'Morningstar' instead of 'yahoo' or look at doc for alternatives.,True
@stevesamah4018,2018-03-27T10:32:46Z,0,Try 'Morningstar' instead of 'yahoo' or look at doc for alternatives.,True
@stevesamah4018,2018-03-27T10:32:39Z,0,Try 'Morningstar' instead of 'yahoo' or look at doc for alternatives.,True
@kennyPAGC,2018-03-26T15:21:18Z,0,"Google and Yahoo finance are dead now. What are some alternatives for stock data? Stock, ETF and indices if possible.",True
@hansong1993,2018-03-24T15:37:08Z,0,Both yahoo and google APIs have been terminated? I seem to get errors for both portals o.o,True
@racquetup9457,2018-03-19T21:59:52Z,0,Google has disabled the URL. Get out find another job!,True
@emanuelgirardi6781,2018-03-15T20:57:03Z,0,"I'm just starting out, so sorry for the stupid question: But, how do I install / import these modules? Thanks a lot",True
@Duxaization,2018-03-15T01:56:02Z,1,"I keep getting this error when typing the first sheet of code.  ModuleNotFoundError: No module named 'pandas_datareader'  I have installed it numerous times, and it is still not working. Can I get some help please?",True
@fredrikpahlman8975,2018-03-14T08:28:37Z,0,"Hi,Below row give me the following error:df = pd.read_csv('tsla.csv', parse_dates=True, index_col=0) TypeError: to_csv() got an unexpected keyword argument 'parse_dates' What is wrong here?How can it be corrected?",True
@fredyalcoser6898,2018-02-21T09:40:58Z,0,"Hi Sentdex,    you have amazing content on youtube and thanks to you for sharing your knowledge. I want to ask for your advice so I could make the best decisions I could make. I am going to become a quantitative trader however, I am not too sure where to start. This is what I have in mind, buy a learn anything for finance, then go to quantopia and start putting my own strategies to the test.  My questions to you would be: *Is python for finance enough to algo trade?  *where else can you test your strategy besides Quantopia ?  * What eles do I need to learn to becomes a quant, from the programming perspective?  *what is your how to learn recommendation,  from first to last order?  Any other advice would be great to.  thanks",True
@LuisRamirez-gc5ds,2018-02-18T15:02:26Z,0,"Hey man, I wanna thank you about this tutorials. They compliment my current studies into quantitative finance.  I want to ask something about pandas.  I installed all packages (Matplotlib, pandas, pandas_datareader, skilearn, etc), but when I write the exact same code as you write to check if I can run it, Python shell shows me some kind of error which I don't know how to handle. (Using Python 3.6.4)  ""RESTART: C:/Users/Luichi/AppData/Local/Programs/Python/Python36-32/pyf.py = Traceback (most recent call last):   File ""C:/Users/Luichi/AppData/Local/Programs/Python/Python36-32/pyf.py"", line 12, in <module>     df = web.DataReader('TSLA', 'yahoo', start, end)   File ""C:\Users\Luichi\AppData\Local\Programs\Python\Python36-32\lib\site-packages\pandas_datareader\data.py"", line 291, in DataReader     raise ImmediateDeprecationError(DEP_ERROR_MSG.format('Yahoo Daily')) pandas_datareader.exceptions.ImmediateDeprecationError:  Yahoo Daily has been immediately deprecated due to large breaks in the API without the introduction of a stable replacement. Pull Requests to re-enable these data connectors are welcome.  See https://github.com/pydata/pandas-datareader/issues""  I don't understand what I should do in this case. Hope you can help me.  =P =)",True
