author,updated_at,like_count,text,public
@casualcomputer6544,2018-02-16T05:33:48Z,0,I got this:   ImmediateDeprecationError:  Yahoo Daily has been immediately deprecated due to large breaks in the API without the introduction of a stable replacement. Pull Requests to re-enable these data connectors are welcome.  See https://github.com/pydata/pandas-datareader/issues,True
@casualcomputer6544,2018-02-16T05:30:55Z,2,"I got ""raise ImmediateDeprecationError(DEP_ERROR_MSG.format('Yahoo Daily'))""",True
@kim8u96,2018-02-11T19:54:26Z,5,"yahoo is down and google has problems, try with quandl (just write quandl instead of yahoo)",True
@jacobwilkins7728,2018-02-11T17:24:42Z,0,Any thoughts on possible stable API's now and into the future?,True
@FadilMucia,2018-02-09T14:57:20Z,0,"For those who want to analyze last 5 days variations.  start = dt.datetime(2017,1,1)  todayYear = dt.datetime.now().year todayMonth= dt.datetime.now().month todayDay= dt.datetime.now().day end = dt.datetime(todayYear,  todayMonth , todayDay)  df = web.DataReader('TSLA', 'google', start, end)  print(df.tail(5))",True
@robertofernandezandersson1797,2018-02-03T16:46:23Z,0,How can i get the pricing data now that yahoo and google doesn't work?,True
@ShukyPersky,2018-01-29T22:01:34Z,8,web.DataReader is deprecated. Is there any update on this video?  Thanks,True
@waitaklau3568,2018-01-25T18:17:00Z,0,How to read Hang Seng Index (HSI)???,True
@lifehapad,2018-01-20T16:55:51Z,0,"lol. Meet you again, great tutorial!",True
@SwaggahDontStop,2018-01-11T16:02:26Z,392,"Boss: WE'RE LOSING MONEY, JIM! YOU'RE ALGO ISN'T WORKING!!!  Jim: But do the graphs look good though?  Boss: Damn, they do look good. Carry on.",True
@paulmasaka1177,2018-01-07T23:37:05Z,0,All of these packages come with anaconda,True
@user-rm6jp4rt3n,2018-01-06T06:46:36Z,0,"import datetime as dt import matplotlib.pyplot as plt from matplotlib import style import pandas as pd import pandas_datareader.data as web  style.use('ggplot')  start = dt.datetime(2017,10,13) end = dt.datetime(2017,11,5)  df = web.DataReader('TSLA','yahoo',start, end) print (df.tail(6))  =================== RESTART: C:/Users/a/Desktop/123.py ===================                   Open        High         Low       Close   Adj Close  \ Date                                                                      2017-10-27  319.750000  324.589996  316.660004  320.869995  320.869995    2017-10-30  319.179993  323.779999  317.250000  320.079987  320.079987    2017-10-31  320.230011  331.950012  320.179993  331.529999  331.529999    2017-11-01  332.250000  332.609985  320.260010  321.079987  321.079987    2017-11-02  300.130005  308.690002  292.630005  299.260010  299.260010    2017-11-03  299.500000  306.250000  295.130005  306.089996  306.089996                   Volume   Date                   2017-10-27   6979700   2017-10-30   4254400   2017-10-31   5672300   2017-11-01   8457300   2017-11-02  19791400   2017-11-03   8894000",True
@pd1216,2018-01-02T21:28:42Z,0,"Hey Harrison, thanks for this.... much appreciated. Quick question.... If I want multiple stocks data in a single workbook, how can that be done. ie what I am looking for is one csv file as an output, with data for different tickers on different tabs within the same workbook or csv file... eg MSFT, GOOG, NFLX, FB ..... All of these in the same csv file on multiple tabs. Secondly, can these prices be sorted in the output file begining with end date and then flowing down into the start date ( I can run a manual filter on this after the csv is created, However, what I want to know is, if we can get the output csv file when created by the Python code, sorted with latest date running down the the earliest date ..... Thanks in advance buddy",True
@laplaya0000751,2017-12-29T08:57:58Z,0,"Hello,  Great video and great help !  I've got a question :  I'm french and i would like to extract stock data from the french market known as CAC40 and i don't succeed to extract any value. They are all wrong and python is based on US market. How can i do please ? I want to do it with the iterative maneer and the simple way also. Thanks for your help, Regards,",True
@abcborgess,2017-12-26T18:42:22Z,0,What reading do you recommend for those who doesn't understand finance?,True
@Cullinan000,2017-12-23T00:10:05Z,0,Hi! How can I know which stock exchanges are available for importing data? Is there a list?,True
@florianny8558,2017-12-08T20:05:17Z,0,I apprechiate it. You helped me a lot with this video.,True
@bstrauch24,2017-12-08T00:32:25Z,3,Why does df.head() return dates from 2010 when the start date is 2000?,True
@zpeter674,2017-12-07T09:04:56Z,0,awesome videos,True
@printhelloworld1413,2017-12-06T20:52:49Z,0,QUALITY CONTENT!!! SUBBED,True
@FuZhixiang,2017-11-28T07:39:09Z,0,"I like your videos. As for this one, after importing data from the web, the name of the first column has a weired format (it locates lower than other column names). Then how to solve it?",True
@MatthieuVlogs,2017-11-27T03:15:17Z,0,Thank you for this great resource! Kind of an odd question: but how do you get your python text in different colors? Mine are all green.,True
@shujatmunawar3316,2017-11-26T22:12:11Z,1,"Unrecognized backend string ""ggplot"": Can you help me please",True
@fconteEBdotcom,2017-11-24T03:22:51Z,0,For all those with datareader.data panda problems see https://www.youtube.com/watch?v=ZkKY9Zlli2k Essentially you need to downgrade to 0.19 of python,True
@arunimsharma7305,2017-11-14T07:38:11Z,0,"This works fine only for NASDAQ stocks. I trying to work with NSE stocks, its giving an error. How can i fix it?",True
@RobertChN,2017-11-12T20:00:00Z,0,"Hi, I got and error even after edit the pandas-datareader line (df = web.get_data_yahoo('GOOG', start, end))   This is my code:    import datetime as dt import matplotlib.pyplot as plt from matplotlib import style import pandas as pd from pandas_datareader import data, wb style.use (""ggplot"")  start = dt.datetime(2000,1,1) end = dt.datetime(2016,12,31)   df = web.get_data_yahoo(""GOOG"",start,end)  print (df.head(6))   and this is my error:      df = web.get_data_yahoo(""GOOG"",start,end) NameError: name 'web' is not defined  Can anybody help me? Thanks.",True
@salvadorsahagun1732,2017-10-26T11:48:26Z,0,Are you a virgin?,True
@deanemarks8611,2017-10-19T18:48:01Z,0,What program can I use this with now?  They shit down quantiopia robinhood integratuon.,True
@danidin77,2017-10-14T03:08:31Z,0,"Hi Sentdex. First of all thanks for your lessons.  I am new to Phyton... I watched a few and they are wonderful !!  I have a question: I made some excel spreadsheets trying to do some stock analysis. They contain logic and graphs. I want to plant stocks data into existing spreadsheet, in a specific location, without hurting the other parts of the spreadsheet. I did manage to insert the data with openpyxl, but the graphs in the original were deleted... I also tried xlwings, but that doesn't work at all for me. It will be good to know what can be done to inset the data without touching anything else. Thanks in advance for your answer!",True
@93ariebombarie,2017-10-04T15:57:27Z,0,"Pandas datareader doesn't seem to be working for me. When importing pandas_datareader on mac, I get the following message (help would be very much appreciated): Traceback (most recent call last):   File ""/Users/user1/Data retrieval/Data retrieval yahoo finance.py"", line 1, in <module>     import pandas_datareader.data as data   File ""/Library/Frameworks/Python.framework/Versions/3.6/lib/python3.6/site-packages/pandas_datareader/__init__.py"", line 3, in <module>     from .data import (get_components_yahoo, get_data_famafrench, get_data_google, get_data_yahoo, get_data_enigma,  # noqa   File ""/Library/Frameworks/Python.framework/Versions/3.6/lib/python3.6/site-packages/pandas_datareader/data.py"", line 7, in <module>     from pandas_datareader.google.daily import GoogleDailyReader   File ""/Library/Frameworks/Python.framework/Versions/3.6/lib/python3.6/site-packages/pandas_datareader/google/daily.py"", line 1, in <module>     from pandas_datareader.base import _DailyBaseReader   File ""/Library/Frameworks/Python.framework/Versions/3.6/lib/python3.6/site-packages/pandas_datareader/base.py"", line 8, in <module>     from pandas import Panel, DataFrame ImportError: cannot import name 'Panel'",True
@juancruzalric5771,2017-09-23T02:27:13Z,0,I have another question for you. I have finished the Django tutorial and i'm working on a récipe  blog and i have a Lot of foreign keys reference. example: i have categories of food and also the food. ITS a relation 1------> Many. Can you do a tutorial or an example of how to make a model and a View show this information. Thanks! You are awesome,True
@juancruzalric5771,2017-09-22T19:33:50Z,0,"Having trouble here: line 2, in <module>     import matplotlib.pyplot as plt ImportError: No module named 'matplotlib'",True
@jukiantunen,2017-09-17T09:36:03Z,0,Why when i open these i get some weird question marks and shit that you cant read? Where should i open them?,True
@TheMusabbirmazhar,2017-09-15T21:56:04Z,0,"Hi Sentdex,  When I try to run the code in ""Python Programming for Finance p.1"", I get this error (I'm using Windows):  Traceback (most recent call last):   File ""C:/Python27/python finance practise/stock1.py"", line 2, in <module>     import matplotlib.pyplot as plt ImportError: No module named matplotlib.pyplot  I installed matplotlib after seeing this error from https://sourceforge.net/projects/matplotlib/?source=typ_redirect  I just installed, did nothing after...  It still gives me an error - do you know how to correct this? Would be glad to hear back. :)",True
@MrGMXander,2017-09-14T04:48:50Z,1,"Hey everyone, I tried researching and using the pinned comment but I still cant get the the data of the stock ticker to come up. I have imported the fix-yahoo-finance module but I still keep getting   Auto-overriding of pandas_datareader's get_data_yahoo() is deprecated and no longer available.     Use pdr_override() to explicitly override it.  Is there any other ways to get financial data, I am looking in to quandl now but that is different and I am worried I can't follow this video series if I go down that path.   If anyone has gotten the fix-yahoo-finance module working, please let me know!",True
@TheVamos101,2017-09-14T02:25:39Z,0,Can you extract data from any other finance other than yahoo finance and google finance? Any help would be appreciated. I'm trying to create a framework that can scrape data from different finance websites. Any suggestion on this?,True
@muharrembaykara2201,2017-08-30T11:48:14Z,0,Thanks for this very usuful tutorial,True
@SoumitraChakravarti,2017-08-29T15:00:36Z,36,"Edits: import pandas_datareader as web  df = web.get_data_yahoo('GOOG', start, end)",True
@stonkycats,2017-08-28T23:19:20Z,1,"Hello, I am trying to do this on a mac with iOS sierra. I keep getting the error that there is no module named matplotlib. I've checked my spelling, and I double checked that I installed matplotlib through terminal using anaconda. Can you help me please?",True
@nimishbansal8282,2017-08-13T16:14:47Z,0,Sir where to learn the basics of stock and finance before getting into this course,True
@jakekrolak6092,2017-08-08T21:37:31Z,0,"Is Google not working for anyone? Cause it isn't working for me... Yahoo sometimes returns data, but google never does...",True
@BMGuitarr,2017-08-07T18:49:34Z,0,Thank you sir,True
@padmareddy6670,2017-07-31T06:57:44Z,0,"I tried to copy the steps you are showing in the tutorial. I have a MacBook Pro, Early 2013 with MacOS Sierra ver.10.12.6 I installed Python 3.6.2 and installed it. I tried to use IDLE.app When I finished typing: Import matplotlib.pyplot as plt, I got the following error message: Traceback (most recent call last) File ""<Pyshell#0>"", line 1,  in <Module> Import Matplotlib.pyplot as plt ModuleNotFoundError: No Module named 'matplotlib' I could not go beyond that sentence. Thanks. Venu Reddy",True
@farukhshaikh7219,2017-07-28T00:59:23Z,0,@sentdex Thanks a lot for your series on Python. Just now started this tutorial. I am from India and was trying to get prices for Indian stock market. When i replace TESLA with Nifty or Reliance its not working stating cannot find. I checked google finance site to get exact code for stock Reliance. I tried to capture fiddler trace and compare logs between Tesla and nifty. I think url generated by code for Indian stock is populating incorrectly. Could you please help me if know what should be done?,True
@willem3277,2017-07-17T23:06:13Z,0,"So, 'google' now imposes CAPTCHA validation when doing large sums of requests. Does anyone have another alternative?",True
@fluctuating_coordinates6516,2017-07-13T12:30:48Z,2,"hi sentdex,  I have solved the ' http connection error' issue myself we have to replace 'yahoo' in code with 'google'  running code:  import datetime as dt import matplotlib.pyplot as plt from matplotlib import style import pandas as pd import pandas_datareader.data as web import numpy as np style.use('ggplot') start=dt.datetime(2000,1,1) end=dt.datetime(2016,12,31) df= web.DataReader('ERIE', 'google', start, end) print(df.head())  But still, this code has a drawback.   this code only works for american based companies and not for indian companies.  Being an INDIAN i want this to also allow indian market based comapanies.RSVP   KUSHAL",True
@fluctuating_coordinates6516,2017-07-13T12:14:10Z,0,"Hi sentdex  Yahoo finance API which you are using i your code is being discontinued, so plaese provide alternative to that. RSVP  kushal",True
@hamugela,2017-07-11T02:23:12Z,0,this not work anymore since yahoo stopped the service. Anyone try to implement quandl and offer the complete demo code ? https://stackoverflow.com/questions/44112403/yahoo-finance-api-url-not-working-python-fix-for-pandas-datareader,True
@michaelstrong5487,2017-07-08T01:16:04Z,0,"LOL ""so even if you're losing money , at least your graphs look good"" lol!",True
@fffppp8762,2017-07-05T13:09:07Z,1,ModuleNotFoundError: No module named 'pandas_datareader'  what's wrong with it?,True
@klutchbaby,2017-07-03T04:34:19Z,0,how do you do more than 1 stock at a time?,True
@learning8667,2017-06-28T01:11:42Z,0,"What's the main difference between this playlist and the ""Python for Finance with Zipline and Quantopian"" playlist? Is anything in the older one outdated? Thanks",True
@wuilmerponte1570,2017-06-21T18:48:54Z,0,downloading data from Yahoo not longer works! please advise. I have to type Google to make it work. Can you fetch more that 4000 lines?,True
@vrumivruni,2017-06-17T14:32:10Z,0,When Im downloading scikit-learn it gives me an error: Failed building wheel for scikit-learn Anyone had this error? pls help,True
@ISMFlowerShow,2017-06-16T12:34:57Z,0,Can you help get the Indian stocks??,True
@johnn3186,2017-06-15T19:07:48Z,0,"so I followed your codes here, on a mac in my terminal, however, I am unable to populate the shell, is there another step I am missing? please advise",True
@kennyPAGC,2017-06-15T16:08:07Z,1,have you considered doing constraint programming in python to model a CSP? maybe a sports scheduling problem with constraints? that'd be pretty dope,True
@Enyonam214,2017-06-10T17:10:26Z,0,This is exactly y I am learning python. I'm not at the level yet to dive into this video but I'll be back in a few days. Thank you so much for this.,True
@sourest_lem,2017-06-09T23:58:11Z,0,"I love your content so much, really. Your stuff is amazing <3",True
@kmillanr,2017-06-09T04:58:05Z,0,got it. used google,True
@kmillanr,2017-06-09T04:55:55Z,0,"hi, i'm having trouble fetching the data from yahoo. your code gives me the following error:  RemoteDataError('Unable to read URL: {0}'.format(url)) pandas_datareader._utils.RemoteDataError: Unable to read URL:",True
@coinlord420,2017-06-07T06:32:00Z,0,Does the yahoo finance api not work anymore?,True
@Wilewee,2017-05-27T22:03:22Z,68,"I had to change the datareader to:  web.DataReader(""NASDAQ:TSLA"", 'google', start, end)   instead, as yahoo was not giving me info ( RemoteDataError: Unable to read URL: ...  )",True
@balagoogle1885,2017-05-25T03:49:03Z,0,can you some basic videos on python for absolute beginners,True
@balagoogle1885,2017-05-25T03:48:57Z,0,can you some basic videos on python for absolute beginners,True
@neilarmstrong5810,2017-05-20T09:57:08Z,1,"while running web.DataReader('GOOG', 'yahoo', start, end),  I get following error: RemoteDataError: No data fetched using 'YahooDailyReader' - how to debug it?",True
@TheMrCatDogRabbit,2017-05-19T09:53:46Z,1,"Help :( I get this error:     File ""E:\My programs\Python\Anaconda\lib\site-packages\pandas_datareader\base.py"", line 120, in _get_response     raise RemoteDataError('Unable to read URL: {0}'.format(url))  RemoteDataError: Unable to read URL: http://ichart.finance.yahoo.com/table.csv?a=0&ignore=.csv&s=TSLA&b=1&e=17&d=4&g=d&f=2017&c=2000",True
@wildcard1210,2017-05-18T04:25:24Z,0,Do you use Git?,True
@andr3wloo,2017-05-16T22:24:17Z,6,does this still work? yahoo seems down?,True
@vincentuhlke3018,2017-05-09T10:05:09Z,0,Does anyone get also the error: AttributeError: '_NamespacePath' object has no attribute 'sort'  :S,True
@reddynishanth3936,2017-05-09T04:06:04Z,0,"This was the error when I tried to implement the above code:- Traceback (most recent call last):   File ""E:\Code\sentfin1.py"", line 11, in <module>     import pandas_datareader.data as web   File ""C:\Users\My Computer\AppData\Local\Programs\Python\Python36\lib\site-packages\pandas_datareader\__init__.py"", line 3, in <module>     from .data import (get_components_yahoo, get_data_famafrench, get_data_google, get_data_yahoo, get_data_enigma,  # noqa   File ""C:\Users\My Computer\AppData\Local\Programs\Python\Python36\lib\site-packages\pandas_datareader\data.py"", line 7, in <module>     from pandas_datareader.google.daily import GoogleDailyReader   File ""C:\Users\My Computer\AppData\Local\Programs\Python\Python36\lib\site-packages\pandas_datareader\google\daily.py"", line 1, in <module>     from pandas_datareader.base import _DailyBaseReader   File ""C:\Users\My Computer\AppData\Local\Programs\Python\Python36\lib\site-packages\pandas_datareader\base.py"", line 13, in <module>     from pandas_datareader._utils import (RemoteDataError, SymbolWarning,   File ""C:\Users\My Computer\AppData\Local\Programs\Python\Python36\lib\site-packages\pandas_datareader\_utils.py"", line 5, in <module>     from pandas.core.common import PandasError ImportError: cannot import name 'PandasError'",True
@justinpamintuan5456,2017-05-01T13:13:09Z,0,Hi!! is it possible to get the minute data instead of the daily data from yahoo api?,True
@johnnyscott7153,2017-04-29T21:36:40Z,0,"I installed all the libraries you mentioned and ran the script but got an error. It says ""No such file or directory: 'gg.plot' and 'OSError: 'gg.plot' not found in the style library and input is not a valid URL or path.' I've found many sites about how to install gg.plot but they won't install properly. Is there another library/package I can install and also get gg.plot? I installed Python 3.5 on Windows 10 64bit.",True
@hello_world1837,2017-04-24T20:31:15Z,1,"Hi, I am using python36 and pip installed pandas datareader, yet it pumps me an error when I trying to  import pandas_datareader.data as web  this is the error return ;   Traceback (most recent call last):   File ""F:\Downloads\Python Work\try figuring thigns out\finance\try.py"", line 1, in <module>     import pandas_datareader.data as web   File ""C:\Python36\lib\site-packages\pandas_datareader\__init__.py"", line 3, in <module>     from .data import (get_components_yahoo, get_data_famafrench, get_data_google, get_data_yahoo, get_data_enigma,  # noqa   File ""C:\Python36\lib\site-packages\pandas_datareader\data.py"", line 7, in <module>     from pandas_datareader.google.daily import GoogleDailyReader   File ""C:\Python36\lib\site-packages\pandas_datareader\google\daily.py"", line 1, in <module>     from pandas_datareader.base import _DailyBaseReader   File ""C:\Python36\lib\site-packages\pandas_datareader\base.py"", line 13, in <module>     from pandas_datareader._utils import (RemoteDataError, SymbolWarning,   File ""C:\Python36\lib\site-packages\pandas_datareader\_utils.py"", line 5, in <module>     from pandas.core.common import PandasError ImportError: cannot import name 'PandasError'  I was trying to lookup online yet I could not find any solution, anybody can help?",True
@olfmombach260,2017-04-20T08:35:24Z,1,8:08 I love how the tail needs more space just because Tesla's stock rose so extremely :D,True
@randiaz95,2017-04-18T11:18:56Z,0,Dude Brilliant! I hope you can teach us how to get fundamental data outside of the Quantopian API also!,True
@Prashant-SJC,2017-04-17T16:44:51Z,3,"for the example you have shared , i am getting error with import pandas_datareader.data as web. Do i need to do it in different way",True
@JJFisher91,2017-04-04T01:52:02Z,0,"In case you are wondering, Edward Snowden is using idle3. Type idle3 in your terminal and it should open it. Then go to file and open. That should get you to a similar screen as him.",True
@minabenjamin3660,2017-03-25T04:05:03Z,0,"I can't install pandas on my machine (MacBook), can you help pls?",True
@CaptainKage,2017-03-24T13:35:15Z,0,Could you help me with getting whole output with all prices? :)  as an output I get only this 2011-01-11 126.248814 2011-01-12 127.808929 ... 2015-10-20 133.165604  first 30 and last 30 values with code print(df),True
@Son_Of_Bangoua,2017-03-23T13:23:51Z,0,"Hello, I''m having serious trouble installing scikit-learn. Using CMD to intall, I get the message ""Scientific Python (SciPy) is not installed."" BUT THEN, when I try to install SciPy, this is the message I get   Command ""c:\users\cedric\appdata\local\programs\python\python36-32\python.exe -u  -c ""import setuptools, tokenize;__file__='C:\\Users\\cedric\\AppData\\Local\\Te mp\\pip-build-mfrz88kv\\scipy\\setup.py';f=getattr(tokenize, 'open', open)(__fil e__);code=f.read().replace('\r\n', '\n');f.close();exec(compile(code, __file__, 'exec'))"" install --record C:\Users\cedric\AppData\Local\Temp\pip-kpaqyonj-recor d\install-record.txt --single-version-externally-managed --compile"" failed with error code 1 in C:\Users\cedric\AppData\Local\Temp\pip-build-mfrz88kv\scipy\  Don't know what to do and I really need this for work",True
@arishtanemi-by6fi,2017-03-22T13:41:46Z,0,No thumbs down :) everyone loves you,True
@mehul21,2017-03-18T22:07:01Z,0,Thank you very much for this series. :) :),True
@dougp4503,2017-03-12T19:11:35Z,0,"Though not necessary for this tutorial, I was unable to install scikit-learn. The error msg said scipy is needed. When I attempted to install it an error occurred saying I should use pip for installing, which I'm using. I went to the scikit-learn website mentioned in the error msg, but it wasn't really helpful. Has anyone else had problems installing scikit-learn? Any help is appreciated.",True
@nunosilvestre3197,2017-03-11T00:25:17Z,0,Can get DateTime Module to work :( using Ubuntu 16.04 HELP!  always get:   import datatime as dt ImportError: No module named datatime,True
@sigurdaab,2017-03-10T20:35:40Z,0,"I wrote down exactly what you did for the first example, but got the following error, why? I have version 3.6.1. AttributeError: module 'pandas_datareader.data' has no attribute 'datareader'",True
@pt7266,2017-03-02T21:42:42Z,1,So i get an attribute error when i try to run this code. Googling gets me to tpoics saying that it is an issue with pandas being used instead of pandas_datareader. What do you do to solve this?,True
@GodsNode,2017-02-26T05:52:13Z,0,As soon as I pressed that F5.....WHAT IS THIS VOODOO THAT YOU SHOW ME???!?!?!?,True
@YaqianShen,2017-02-24T04:15:40Z,0,Thanks so much for this series of tutorial. They are so helpful! Just wonder where I can find the source code of this tutorial.,True
@0xbitbybit,2017-02-14T05:50:24Z,1,"You should do a series about finding an edge in trading with Python! With futures too, not always stocks etc.",True
@cyl5207,2017-02-07T13:19:59Z,0,you are awesome! my hero!,True
@animesh3436,2017-02-05T06:47:57Z,0,Which IDE do you use for Development ?,True
@MrStetsonator,2017-02-03T02:42:55Z,0,I love your stuff! Glad to see you are posting more and more videos.,True
@WritingTheActs,2017-01-29T18:48:13Z,3,Extremely frustrating have been trying to get Python up and running and getting all sorts of errors.,True
@elddyhosea9036,2017-01-28T21:01:14Z,0,Edward can you please add the code as part of the video series. It's inefficient for us to pay attention to the lesson while trying to keep up with typing,True
@vedantgawade9812,2017-01-22T04:58:54Z,0,Can we use pycuda for doing the hard work ??,True
@msufan3758,2017-01-20T19:42:34Z,0,Can I use this on Quantopian or do I need to actually download the files mentioned?,True
@VibhuthaKumarage,2017-01-20T13:53:55Z,0,I missed your videos @sentdox.. You made a huge surprise..,True
@raviteja-wy2xq,2017-01-19T18:35:24Z,0,Hey how do we do this for forex trading can you please consider currency pairs instead of stocks please,True
@otacon1024,2017-01-18T17:20:50Z,5,"Cool, I've been writing a complete Bitcoin trading app for the past week or two, so this could end up being a good reference and source of ideas like your previous finance videos.  I hope you'll at least touch on genetic algorithms when backtesting, you mentioned them in passing before but never really covered them, and it would be awesome to see your take on them.",True
