author,updated_at,like_count,text,public
@raviraaja1282,2017-01-18T10:44:58Z,0,upload videos at slow rate.. :P because if you start uploading any shit named as python... my entire day will be lost from college assignments and projects becoz i keep on listening to your idle :P /.....ha ha.... dude your tutorials are awesome :)  please complete drone tutorials asap .........,True
@akiriisio8558,2017-01-18T08:51:50Z,3,"Hello! Thank you for these tutorials, they are awesome. Can you recommend any good book(s) about analytics with Python?",True
@jenniferqi6880,2017-01-18T06:19:02Z,0,Thx a lot for your effort. it really helps a lot!!!!,True
@skmn07,2017-01-18T04:45:41Z,0,Hi I regularly  follow u r tutorials..  For fetching stock data you  used to specify quandl so far..  Any you not using it in this series..  Can explain more abt data reader..  How does it figure out which yahoo api it has to call to fetch data,True
@oliverli9630,2017-01-18T02:23:36Z,1,what a shame this datareader only deals with stocks... i wish it could do something like BZH17.NYM and AUDUSD=X,True
@paulovenz8037,2017-01-18T00:30:56Z,2,"Can you please explain the OANDA REST API with python, Thanks Sentdex, I'm a huge fan of your channel",True
@iancarrasco5430,2017-01-17T22:47:54Z,0,How does the pandas data reader get stock data from a string that just says yahoo.,True
@litojonny,2017-01-17T22:05:11Z,540,thanks a lot Edward Snowden!,True
@MentiSnap,2017-01-17T21:32:28Z,0,You mean Altaba :P,True
@femaledeer,2017-01-17T21:26:30Z,1,Is this similar to Quandl ?,True
@jakegoykia6117,2017-01-17T20:24:26Z,0,Nice!,True
@TThomas939,2017-01-17T20:18:24Z,0,This looks so interesting! Inspired me too start learning Python,True
@asaf158,2017-01-17T20:06:57Z,0,python 3 !!!!!!!!!!!!!! thank youuuuuuuuuuuuuu :),True
@jogurtnaturalny,2017-01-17T19:33:30Z,1,Python3 ! Awesome,True
@antopolskiy,2017-01-17T18:51:04Z,0,"man, you're so awesome. thanks for doing these, I love to learn new stuff from you. even if I am not particularly interested in using it at the moment. you're always very concise and clear, at least to me.  if you have a moment, may I ask you if you ever think about some kind of ""advanced python course"" and if you do, which topics you'd include in such series?",True
@jonatanisse6362,2017-01-17T18:43:44Z,3,"Hey man, great video series as always! Quick question, are you planning on looking into options and respectively option volatility?",True
@CollPowers,2017-01-17T18:42:18Z,0,"Lol... As I was just wondering where you had been, and started your series of videos on Data Analysis with Pandas, just yesterday.",True
@user-vr3gn2hy2m,2017-01-17T18:41:26Z,1,Hello. Have you ever found any sources that provide   any  kind  of historically-related  datasets? Demographics at least?  And also any kind of modelling examples  through machine learning in related fields?,True
@mikeroit,2017-01-17T18:37:38Z,3,i was getting worried! its been a while!,True
@luno_b5312,2017-01-17T18:34:50Z,1,Awesome :D your videos have helped me tremendously :),True
@chipScoD,2017-01-17T18:23:18Z,38,6 sentdex videos at once? Holy cow there goes my evening!,True
