author,updated_at,like_count,text,public
@munagalavenkatesh7166,2022-07-26T10:56:24Z,0,"Jay , you missed to add decision tree to model interpretable by design bucket",True
@arnaiztech,2021-06-02T10:34:25Z,1,just Awesome!! Very looking forward to wath more videos of this playlist (XAI guide). I think this kind of YT video could be the next style of taxonomy and review papers.,True
@blasttrash,2021-06-01T04:10:56Z,0,"Hi just curious, which tool or website do you use to create all the diagrams?",True
@TimPrien,2021-05-20T09:05:19Z,4,You cannot imagine how helpful your videos are! Thank you so much for your explanations!,True
@anjanisuman6428,2021-05-18T13:56:45Z,1,Awesome. Thanks a lot Jay!,True
@Mutlaq777,2021-05-18T13:22:30Z,2,Thank you Jay! شكراً لك !,True
