author,updated_at,like_count,text,public
@artur-rdc,2023-04-28T23:17:50Z,0,"People will keep hyping this stuff up as AGI until someone actually goes and builds it. They have no idea how to even think about intelligence. Actual AGI will make more mistakes, not less. It will be less obedient, not more. It won't require loads of training data or be dependent upon it to learn. We're going in the opposite direction of AGI. But you don't need AGI to make something interesting.",True
@deveshbeeharry1635,2023-04-28T22:27:40Z,0,"I think AI should be democratised. Everybody should have a chance to be happy. The general public should be educated on AI. Our mentality on time, health, wealth, governance, safety, lifestyle should probably change. AI should always be used for the good of carbon-based lifeform on earth. ​It should also be preserved for historical purposes. Cultural history has been a great part of human development. It should be used as a tool for now until we learn more from the technology.",True
@nano7586,2023-04-28T22:18:38Z,0,"30:57 I was also curious to see if ChatGPT has a random number generator and well, it wasn't super accurate. Telling it to ""Draw me 80 samples from a normal distribution with mean 10 and stdev 5."" (generated these values by ""thinking"" and no packages or thelike) gave me values that result in a mean of 9.23 and a stdev of 3.15, which I'm 99% certain is not a large deviation by chance but the result of its inability. I also asked it to draw 80 more and performed a t-test and F-test to see if both samples equal in terms of mean and stdev - they don't. The values also didn't look super normally distributed in a histogram. But it's still impressive that it is capable of producing something.",True
@marsrobotcs,2023-04-28T21:53:35Z,0,Ayo,True
@VictorGallagherCarvings,2023-04-28T21:52:35Z,0,I am glad you said something about the bias in these models. It seems to me you would want something neutral on almost all topics except those that are crimes. Also anyone reading this may want to check out the study on 'Rozado’s Visual Analytics' where it is demonstrated that chatGPT is far left on almost all political topics. I don't see how they could get a bias like that unless the dataset expressly excludes everything else in the political spectrum.,True
@D3cker1,2023-04-28T21:18:20Z,0,"Yep, it is wrong to kill a baby even if its in a womb... Yup, things can be really complicated.  How do you teach an A.I. that?🤐",True
@Ezechielpitau,2023-04-28T21:04:59Z,2,"Here's one point that sometimes seems to not get the attention it deserves in my opinion: I've played around with earlier language models once in a while... and ignoring the content, just focusing on the language, they were pretty mediocre. Their English was usually not perfect but pretty decent. But when I checked their German or Spanish, it was usually bad, really bad. I'm a bit of a grammar nazi and have not once seen a single grammar or orthographic mistake in German, Spanish or English with chatGPT. What's more, my gf is a native Bosnian speaker and on the admittedly few examples she saw, she was certain that it did not contain any mistakes whatsoever.  I mean, you can't tell me Bosnian was high on their priority list.  With these newest language models it seems that language correctness in itself is completely solved (or at least 99.9%)...",True
@cacogenicist,2023-04-28T20:15:24Z,10,"I think by older definitions of ""AGI,"" talking about ""sparks"" of AGI in these systems is not unreasonable at all. I used to mean a system that was human-like in its breadth, not a ""narrow AI."" It didn't used to necessarily mean a super-human system, or a system that could do _everything_ as well as all humans. I think if you took 3.5 or 4 back to 2006, and showed it to AI enthusiasts of the time, it would widely be considered AGI-ish.",True
@JazevoAudiosurf,2023-04-28T20:00:57Z,0,"1. we need more context length, so that less information gets lost through summarization 2. we need much deeper nets, gpt-4 is not good enough for new insights 3. we need the software infrastructure for agents that chain prompts, an auto-gpt but much better, so that it can run and reason by itself 4. we need better multi modality and models that can be fed big data or at least agents/tools that can interprete big data  I would guess we get all these within 3-10 years, then we hit AGI what we have built yet is a good intuition but the reasoning through time is why our civilization is advanced. the world for gpt-4 is not like it is for us with 5 senses, it's just text/images. it started off in abstraction, a human baby starts at reality. then it learns to think through time and combine the intuitions and we call it thought, that leverages our intelligence to infinity if we had infinite time. gpt-4 is immediately maxed out, there is no thought that can improve, it has to feed its output back to itself. with a proper feedback, the leverage for the model would be much higher than our thought leverage because its base reality is already scientific",True
@SRTIEP,2023-04-28T19:32:09Z,0,404,True
@cacogenicist,2023-04-28T19:08:12Z,6,"As for math, Wolfram Alpha makes a fine math module. The general purpose leaning, core LLM doesn't have to do everything in a cognitive architecture -- which is the direction of things, I think -- especially where it can be done faster and more accurately by some expert system component, and then integrated by the LLM.",True
@CorvusAI,2023-04-28T19:00:42Z,0,"I'd love to hear your thoughts on the ""Overreliance"" section. Also if you dive into the Bar exam section, I believe the test is graded by the paper authors.",True
@sinanisler1,2023-04-28T18:57:24Z,0,thinking of building a new pc with 3090 24gig for AI do you have any recommendation for other parts ?,True
@cacogenicist,2023-04-28T18:43:04Z,0,"Their linearity (I _think_ that's the issue) can also lead to an inability to parse some sentences featuring recursion, with multiple embedded clauses, plus a possessive -'S at the end of a the noun phrase. For example:  _It's the man who threw the rock that struck the drone that crashed through Mrs Johnson's window's dog._  Question: Who possesses the dog?     It has a hell of a time with that, explaining that there's not enough information to determine who owns the dog. When I subsequently supplied multiple sentences like this:  _It's the man who threw the rock that struck the drone's dog._  _It's the man who threw the rock's dog._  And then asked it again to consider the initial sentence, it apologized for its prior misunderstanding, and got it right. Whereas initially it couldn't even figure out the referent of ""it.""",True
@myleswright7996,2023-04-28T18:29:34Z,0,I am going to harass you until you put out more neural network from scratch videos.,True
@aa-xn5hc,2023-04-28T18:29:23Z,0,Great and looking forward to your next video on open assistant,True
@xphis0528,2023-04-28T18:21:38Z,0,"I agree human supervision needs very much to be there, so further improvement can have actual utility, otherwise the improvements might not have real value to humans.",True
@ozorg,2023-04-28T18:00:44Z,0,great stuff!,True
@val_evs,2023-04-28T17:47:58Z,0,why OpenAI is it called open if they have a Proprietary license?,True
@wktodd,2023-04-28T17:09:29Z,3,"You need write a follow up book , explaining structure of LLMs and GPTs etc.",True
@vincentparker6103,2023-04-28T16:58:50Z,4,"Very insightful post, Sir! The intersection of technology, ethics and policy here are incredibly interesting. God tier display in critical thinking for us all to aspire to. Thank you for the level head and keeping it real!",True
@get_youtube_channel_name,2023-04-28T16:57:56Z,0,"I have limited experience in nlp so what im about to say might be wrong or mightve been already brought up by recent studies  I question the language understanding ability of LLMs because: 1. if the training data is this large, how do we know the good performance on some hard problems (like spatial understanding) came from understanding but not remembering? We can create a dataset containing ALL possible scenarios and train a model and it will destroy everything 2. LLMs can be quite sensitive to input prompts, could this be an indicator that the model rather remembered all the patterns than understood the language and logic behind it 3. it's suspicious that they report multimodal samples only related to explaining jokes. I'd imagine there will be plenty of reddit meme posts with people asking why it's funny and other people explaining. There are many other multimodal benchmarks, as far as I remember some of them were really difficult, and I wonder if they reported test results of those",True
@get_youtube_channel_name,2023-04-28T16:43:14Z,6,totally agree with your points about leakage and data compression. We need to have more discussions like this.,True
@TonyTheTrain,2023-04-28T16:41:50Z,59,It's so cool to watch this video and think that you've been talking about this stuff for years and now the rest of world finally sat up and paid attention. I wonder if GPT 3 & 4 just hit a tipping point where the output was good enough to be fed into other systems and make something out of it for the average tech-enthusiast.,True
@get_youtube_channel_name,2023-04-28T16:34:31Z,1,Agree with your points about making their work public. Their excuses are just ridiculous I don't believe a word of it,True
@youtubeusername1489,2023-04-28T16:10:55Z,2,"I think i read somewhere that openai ceo said something along the line of ""gpt4 is coming and it is more powerful(or better?) than chatgpt(or gpt3) but you will be disappointed', meaning it is better than chatgpt but not in a way that most people expect. May be he predicted the overhyping, either by the public or Microsoft.",True
@fnegnilr10,2023-04-28T16:06:15Z,0,"Hope this is not a deep fake by AI, to make us feel less threatened..... :)",True
@MaJetiGizzle,2023-04-28T16:05:54Z,69,The most realistic non-hype based breakdown of these developments in LLMs I’ve heard thus far.  Great video as always sentdex!,True
@sinanisler1,2023-04-28T16:05:11Z,0,we are in a hardware bottleneck   we need new kind of GPUs for AI 5090 should be 1TB vram or something I don't know that kind of hardware we need RIGHT NOW...,True
@Pongant,2023-04-28T16:01:44Z,0,-text-davinci-003 is GPT 3.5-  Edit: must. not. bullshit.,True
@dr.mikeybee,2023-04-28T15:55:14Z,0,I find I'm using Google's BARD most of the time.,True
@angrybob8126,2023-04-28T15:53:15Z,0,Heres a view and a comment i got no idea what ur talking about,True
@abhay6621,2023-04-28T15:53:10Z,1,"I agree that the FOOM concerns of these LLMs are over-hyped. But saying that GPT4 is not that big of a step up from GPT3.5 sounds absurd to me. GPT3.5 makes way too many mistakes and hallucinates way more often than GPT4.  Whenever I'm programming and run out of GPT4 quota, I mostly just wait and do stuff on my own because working with GPT3.5 is kind of frustrating. This is web dev framework stuff that I'm not at all familiar with. Maybe if you're already familiar with what you're programming you might not see that big of a difference since you'll be filling in the gaps yourself.",True
@RipYaZa,2023-04-28T15:52:27Z,3,I see a paradigm shift in the way we work. The ability to use AI models and tools that get developed will accelerate the way we work.,True
@Nif3,2023-04-28T15:46:05Z,0,"The worst fucking title for a paper, ever.",True
@LG51hacker,2023-04-28T15:42:05Z,0,You are right about underlying technology. It is literally the same.,True
@RipYaZa,2023-04-28T15:40:44Z,0,Are the biases sometimes not just different visions of certain people that wrote about the topic?,True
@Zero11_ss,2023-04-28T15:38:55Z,3,There is already so much censorship and bias in these models - forcing their morals onto the user even for normal stuff. I'm afraid this will lead us to the next wave of social control,True
@jamosmithlol,2023-04-28T15:34:27Z,0,"I have been working with GPT4 since it was available, and the analogy I use to describe their differences is that GPT3.5 is like working with an unruly high schooler while working with GPT4 is like working with an egotistical professor. I can notice the difference in outputs pretty quickly, even ignoring speed. I don’t think Microsoft is exaggerating.",True
@AHN1444,2023-04-28T15:31:48Z,0,"sentdex can a LLM be fabricated directly? One transistor for each node? have like a LLM card to use on a PC?,",True
@tiefkluehlfeuer,2023-04-28T15:22:14Z,1,"Can you investigate, how these models run (inference) in a non-GPU setup? RAM is way cheaper than a large GPU. Is that a viable option?",True
@ChaseFreedomMusician,2023-04-28T15:21:10Z,4,"What I have found for GPT4 is if I am giving it coding tasks that there are no existing similar code where it is abasically having to infer from white papers how it might code something it does WAY better. Example: I used it to create a spiking neural network implementation in C# 3.5 was having a super difficult time with cohesion, GPT4 not as much but also not perfect. The thing neither could do was effectively write code to train an SNN",True
@therealOXOC,2023-04-28T15:20:08Z,0,conclusion: you're not special,True
@serta5727,2023-04-28T15:17:31Z,3,GPT-4 is very advanced im comparison to ChatGPT 3,True
@axiomvp7808,2023-04-28T15:14:15Z,0,I see a k with out the bottom line going down,True
@klammer75,2023-04-28T15:13:27Z,2,Very thoughtful and even handed review and presentation….well done sir and keep up the good work!🦾,True
@omnijack,2023-04-28T14:59:27Z,7,"Thanks as always for in-depth coverage of this. And for making the point re: ""It isn't AGI until it does all [relevant] things together"" (vs in isolated examples)",True
@TankorSmash,2023-04-28T14:59:01Z,1,"I appreciate the ending there, where you point out the 3.5 vs 4 and how it might be overblown. I didn't think of it that way and I think you're right to criticize them.  Maybe  there's a good reason for it, or maybe they're deliberately letting the world decide how they feel about it.  There was a Sam Altman/Lex Friedman podcast where Sam A. talked a lot about limitations and how OpenAI just sees it as a technology, so maybe it's MSFT who's more focused on hyping things up.  Thanks for putting the video out!",True
@zephyr4813,2023-04-28T14:53:15Z,0,My God man. What is your IQ?,True
@mattizzle81,2023-04-28T14:38:01Z,126,"I'm surprised that you don't find a major difference between GPT-3.5 vs GPT 4 for programming. My experience is quite different, to the point where I use GPT-4 exclusively despite the slowness and expense. I quickly get frustrated with 3.5 whereas I usually find GPT-4 to be almost perfect for all but the most complex things I ask of it",True
@user-yj3mf1dk7b,2023-04-28T14:34:04Z,3,it's 2 months late,True
@markwdalton,2023-04-28T14:29:21Z,1,"So far GPT or other LLMs, transformers nothing near intelligent nor learning nor logic nor AGI.  It is a useful tool, but simply a search + linked list + hash table.  Just a statistical likelihood. No understanding either.  Just probability based on data provided and weights & filters.  Nothing related to truth/""fact"".  Popular opinion basically.  Highly over hyped. Again yes useful. Always verify and think as a actual intelligent being. (Concerns are more in trust for medical or driving a car where lives are at stake. Or even code.) Always verify.",True
@easyBob100,2023-04-28T14:25:19Z,0,"Prompt:  Maniac has responded with a scornful remark. ChatGPT:  Approach, and repeat ultimatum in an even firmer tone of voice. Add the words, ""or else"".",True
@dadashvespek7004,2023-04-28T14:21:33Z,0,was this a live event,True
@jeffwads,2023-04-28T14:15:48Z,18,The newly released 30b Open-Assistant model is pretty good.  It does quite well on those tests.,True
@ceilingfun2182,2023-04-28T14:15:39Z,6,I never thought AGI will happen this soon.,True
@cecureSammich,2023-04-27T15:20:16Z,15,"I agree entirely with what you're expressing regarding Microsoft, and a few other entities, having a role to play as keepers of the safeguard - some great insight you've shown here with this. I'm really enjoying the content you've put out recently - how you've taken more of an informative/professional thought-provoking approach with the topics. It really sets the example that we need today in having an educated and openly mindful consideration of where these ideas are heading in the near future!🎉❤",True
@Stinosko,2023-04-27T15:09:03Z,3,Coool!!!? 🎉,True
