author,updated_at,like_count,text,public
@RheaBhalekar_,2024-05-12T07:34:25Z,3,You're a great teacher and a singer too . Double BAM!,True
@proggenius2024,2024-04-14T17:03:07Z,1,You are amazing! Gifted for teaching. Loved the song ❤,True
@Renatus_Eruditus,2024-04-13T09:24:51Z,1,Double BAM!!,True
@PunmasterSTP,2024-03-22T13:52:09Z,0,"A didn't realize there'd be a full sing-a-long video, but in hindsight it makes sense!",True
@TheRayanKhan,2024-02-02T00:10:12Z,1,Best teacher ever ❤,True
@farlesh1000,2024-01-21T22:32:24Z,2,Love all your work.  Entertaining and extremely effective!  This is how teaching anything should be done.  BAM!,True
@arenashawn772,2024-01-10T17:46:24Z,1,This is more than hilarious and I fell off my chair laughing while learning something. Thank you for making my day 🥰,True
@douglasespindola5185,2023-11-04T15:14:11Z,1,"SQ soon in Spotify, Deezer, YT Music, etc.",True
@marcosegeagutierrez-cortin2245,2023-11-03T20:55:58Z,1,Love your videos. We need to find your QTLs for this dominant trait,True
@tutosiOS5,2023-10-17T03:29:04Z,1,Hooray! For this song that explain that fancy terminology. Now it's clearly explained.,True
@anuragpateriya787,2023-10-04T04:31:43Z,3,Tabla on the back caught my attention....how many things do you do josh..? Awesome...❤,True
@lightgrid,2023-10-02T09:57:12Z,1,This is amazing,True
@Akshay_IITK,2023-09-21T19:43:59Z,1,Triple bam,True
@alishawasthi8837,2023-09-11T15:20:58Z,0,"so basically, confusion matrix is actually confusing?",True
@zeno.x-edit02,2023-07-15T15:48:42Z,0,I saw  an instrument called “Tabla” behind you.,True
@AnashuaBanerji,2023-07-14T03:29:54Z,1,I detect a tabla in the background with high sensitivity 😅,True
@marouasedoud7033,2023-04-22T22:51:47Z,1,❤❤❤,True
@kridsumangsri964,2023-03-13T12:43:43Z,1,good song ^^,True
@arrozenescau1539,2023-03-04T19:36:36Z,1,i came to this video thinking i would waste my time but i actually learned more with this then trying to read articles,True
@imanurrahaman1521,2023-02-18T13:24:54Z,1,BAM,True
@misunsong291,2023-02-06T12:46:49Z,3,I can’t stop listening to this song. So addicted😂😂😂 He’s a real genius🎉🎉🎉,True
@suzhenkang,2023-01-21T05:52:37Z,1,talented,True
@mikemayuare8235,2023-01-12T13:25:16Z,3,"I had an exam yesterday, given a formula (they just gave the formula and I knew it was recall), the options were sensitivity, specificity and none. I just sang the song in my head and in the end was the answer, magic!",True
@dylanbolger6317,2022-12-12T22:51:59Z,1,Amazing,True
@etornamtsyawo6407,2022-11-24T14:11:08Z,2,"Look, I got a really strong A in my machine learning exams because of your videos. You put in a lot of effort and I really appreciate it. Now I'm working on my thesis which involves applying machine learning concepts to determine adulteration in food. I'm back here then! I hope to return and thank you again for going through this phase as well! Double bam!",True
@tanyasingh2781,2022-11-23T15:20:44Z,2,I was going through articles online to get intuition behind recall and precision and all those formula was making thing worst for me . Then I thought of searching on statquest and BAMM!! in a minute you make me understand these so confusing terms... Thank you so much!!!,True
@ollieandotis,2022-11-19T01:25:46Z,1,So close to a perfect loop video given that recall is sensitivity 😅,True
@MLDawn,2022-11-11T23:09:08Z,1,I can hear a flute in the background... would have been amazing,True
@RajatSaxena35,2022-10-16T10:34:44Z,1,Why isn't there any Nobel Prize for teaching?,True
@claybar3998,2022-07-30T08:54:28Z,1,"(soft) bam, for all those sensitive peeps out there. :)",True
@Lucas-hr1mj,2022-07-14T04:40:32Z,3,"This morning I'll be taking my (hopefully) last test (and it involves the exact content of this video too!) before graduating in CS, just saw this video and it reminded how your content helped me as a freshman 4 years ago, thanks a lot!",True
@statquest,2022-07-11T16:30:53Z,0,Support StatQuest by buying my book The StatQuest Illustrated Guide to Machine Learning or a Study Guide or Merch!!! https://statquest.org/statquest-store/,True
@aaronmay-zhang3555,2022-07-01T05:38:52Z,5,Absolutely brilliant. I’ve tried to memorize this for years. Always falls out of my head. This song is stuck in my head. You nailed it :),True
@NshimaBiotech,2022-05-30T03:14:31Z,1,triple bam!!!,True
@MrKB_SSJ2,2022-05-24T08:20:17Z,1,So beautiful 💗,True
@dacianpeng7076,2022-04-24T13:40:06Z,1,coolcoolcoolcoolcool,True
@HarmonicaTool,2022-03-23T12:45:26Z,4,"Loved the ""BAM"" at the end.",True
@alaknandaagarwal8431,2022-03-15T19:11:38Z,10,"I thought only I got confused between these! Its great to see the confusion matrix is so confusing to so many people. 🙂 Also, great song! Will help me to remember.",True
@mohammedlabeeb,2022-03-07T15:18:39Z,1,OMG so funny,True
@pistasheth4012,2022-03-05T11:12:31Z,1,Tabla in next video,True
@xinjietang953,2022-02-24T09:00:42Z,3,"First time to see you. See, this is whom I followed for more than 1 year",True
@mrwhatevs3760,2022-02-23T01:15:11Z,0,"Hi StatQuest, could u make a video about attention mechanism? Been struggling a bit, I know u can make me understand",True
@thiswasme5452,2022-02-21T14:42:38Z,2,You are a Legend!,True
@simran1277,2022-02-20T13:54:52Z,3,"I watch your videos and they are way too awesome! I love how simplified and stunning your explanations are. I have seen your maximum likelihood, probability vs likelihood and many more videos. They are fun to watch and I learn a lot. Thanks a lot. Just a small request, if time permits kindly make a video on maximum a priori estimate and its comparison with MLE.",True
@sinanajafi1656,2022-02-20T09:36:17Z,0,Josh please make a video of recurrent neural networks. I've learned a lot from you. Thanks for all the hard work.,True
@ordopa1,2022-02-18T11:14:50Z,0,Are you singing that sensitivity and recall are the same?,True
@darbyl3872,2022-02-17T19:32:33Z,0,"So, sensitivity has a level of precision. Any percentage for specificity?",True
@victorialiu8677,2022-02-17T16:58:33Z,1,Could you do a video on canonical correlation analysis? Your videos are better than almost all my teachers! Thanks!,True
@abubakarsunny5992,2022-02-17T14:25:19Z,1,"would you like to explain  conditional gradient descent like frank wolfe, robust  regression, PSGD, Mirror Descent  please",True
@hsoley,2022-02-15T15:40:59Z,1,Double BAM!!,True
@CodeEmporium,2022-02-15T06:39:01Z,11,Can't wait till this goes platinum,True
@markkirby2543,2022-02-14T16:47:06Z,5,Wow! That's terrific. Now I can remember which one is which. Thanks Josh!,True
@hemphillmc,2022-02-14T15:04:09Z,4,This song will reduce awkward fumbling when discussing metrics with other groups,True
@brianh.7051,2022-02-13T02:16:29Z,1,Damn this is so catchy! Thanks Professor.,True
@chessfreak8813,2022-02-12T06:18:12Z,21,You are THAT ideal person who ACTUALLY LOVES what you do in my mind! Love you! BAM!!!,True
@KnightofniDK,2022-02-11T20:48:11Z,42,"So far, I've had 100% sensitivity in predicting the occurence of one or more BAMs in StatQuest videos!",True
@THEMATT222,2022-02-11T11:03:23Z,1,New video! Noice 👍,True
@sohambiswas588,2022-02-11T07:37:08Z,2,Hey man is that a tablaa in the background!?,True
@HarshKapadia,2022-02-10T21:41:01Z,13,Nice one! You're really good at these! Thank you for the effort you put into your videos!,True
@jlopezg8,2022-02-10T19:50:52Z,1,"I like it, but I think this could've been a perfect infinite loop",True
@oldcowbb,2022-02-10T19:30:23Z,1,double bam,True
@alexxby6205,2022-02-10T18:00:38Z,2,Don’t make me sing this song in my head during the interview😂,True
@2minuteschool929,2022-02-10T17:58:01Z,3,I missed you for an year🤔💯🎈,True
@jabi3jabi3,2022-02-10T17:36:52Z,2,Banger,True
@somyamaheshwari5299,2022-02-10T17:35:29Z,2,BAM!!,True
@astronautom2,2022-02-10T17:35:14Z,3,You're awesome! Thanks for your efforts on helping us learn with minimum efforts.,True
@arshadkazi4559,2022-02-10T17:27:07Z,0,TPR…FPR…,True
@ciancian2861,2022-02-10T17:26:29Z,104,This is all I needed. Now I'll for sure graduate in my Data Science master!!!! xd,True
