author,updated_at,like_count,text,public
@AlexTheAnalyst,2021-07-13T11:31:52Z,234,Did I overdo it with the sound effects? Maybe.  Do I regret it? No.,True
@shital5464,2024-01-18T00:43:57Z,0,No one made video about this but this is must video for so many people to understand that y only courses are not going to help you need to do actual practical work and to work on skills,True
@nelsoncolon4535,2023-12-30T18:16:39Z,0,"During the past year, I have been taking multiple classes. I felt that courses are not the best way to learn something. You have to learn by doing. In 2024, I want to increase the number of projects that i do.",True
@Nikopup,2023-06-17T00:54:14Z,1,"I just started learning SQL last Wednesday and I'm a person who can get stuck in a course loop too. I'm at that point where I know I need to start playing around with datasets since I have a decent grasp of at least the very basic commands now, but I guess I'm a bit timid. So I appreciate this message very much! I think I watched this video at the right timing for me to hear it. Thank you Alex for all your insights and wisdom!",True
@icelerate8141,2022-11-06T23:51:17Z,0,"I agree. Start doing courses and finishing them. Once you have done enough, do some guided projects. After you do enough, do some of your own projects and build your portfolio.",True
@christophergreen3809,2022-07-24T17:09:20Z,1,There comes a time when knowledge needs to be translated into actual use.,True
@andregaspar382,2022-07-21T20:57:18Z,0,I just saw this video and that exactly what I needed to hear. Thanks once again!,True
@avellian6840,2022-03-27T06:50:09Z,1,My name is Tanya and I am course addict LOL.  I always think I'm not good enough but then I breeze through the course.,True
@allisonwilton9752,2022-01-27T21:01:16Z,0,I just signed up for my first course :) im thinking of splitting my time between 50% course material and 50% implementing those strategies with projects !,True
@TehzeebR,2022-01-26T03:54:02Z,1,I love courses 😅 but this video is accurate.,True
@tundemerinubi9371,2022-01-16T19:05:21Z,0,This course is designed for the challenges I'm facing now. I have taken a series of courses before without practice.   I need where and who I can work with as an intern and I can do it for free for anyone that could help me out and mentor me. I have excel knowledge and little SQL.  Thanks,True
@WholeLifeBoogie,2022-01-14T05:21:05Z,0,Great message! Agreed! Thank you!,True
@lpnumb10,2022-01-09T23:35:41Z,0,"I feel like there is a balance, you want to learn the fundamentals properly, but then you have to apply them to understand how things work in practice. I think this is an iterative process, learning something, apply it, be confused about another aspect, take a course in that, apply it, confused about another thing, read about it in forums, apply it…etc",True
@uduakekere4382,2022-01-01T20:43:08Z,0,This video came in timely considering I personally decided not to take anymore courses but to build my portfolio this year👍,True
@marcelogarcia3481,2021-12-14T23:02:44Z,1,Thanks for those words!! I need to stop doing courses and run away from the course purgatory,True
@uwentv5302,2021-11-22T19:58:39Z,0,bloom's taxonomy,True
@MrPolyalert,2021-11-10T11:17:42Z,1,I feel like your youtube series has helped me learn sql waaay more than any sql courses i've taken. i think what also helped was i used data from twitch to make my own tables and play around with that data,True
@Diana-jk4tq,2021-11-04T02:04:21Z,0,Thank you so much! I hope I will find in your videos how to create a portfolio.,True
@mlna_arifff6813,2021-10-22T03:44:25Z,0,"I've learned a lot of online courses about data analyst for maybe 3-4 months. It feels like, I do nothing without applying it to a real project and I want to start it from this week  But an online course is really helpful if you are from beginner level and doesn't have a background in",True
@carlosmunoz2148,2021-10-20T11:33:06Z,0,What if the course you are taking is actually a project?,True
@AljIsHere128,2021-10-11T08:03:50Z,0,Hey Alex Thank U for that insightful wisdom.  I am concerned on the type of statistics class someone must take for Data Analysis.  Is that a course on Udemy?,True
@zaidvoyage4277,2021-09-20T19:40:14Z,2,"Alex i took more than 10 courses on Data analyst and I cant focus on anyone ... Thanks man , I needed this video",True
@placemyname6051,2021-08-20T00:13:14Z,1,"Hi Alex, I'm from Indonesia. This is my first time learning about data analysts. My background was a programming bachelor's degree, but I have no experience of programming or analyst. In my country, they're always looking for experience for an analyst, so I think it's really hard for me to find a job or even an internship. I've taken a few courses too, and I think it didn't help a lot. Yes, I need practice, a lot of it. Thanks for your video. I'll try my best to keep doing my best as an analyst and put it in my portfolio.",True
@sarahbrooks4403,2021-08-19T09:22:07Z,1,"Thank you so much, I bookmarked your links. Love this stuff! Thank you thank you!",True
@lemaywebdesign,2021-08-10T22:08:28Z,0,The problem is that I don’t know how to get started with a project. It’s challenging to marry what I’ve learned with what I need to do with what I know.,True
@nishamehta7335,2021-08-10T12:43:00Z,0,If Stephen Amell was a Data Analyst,True
@diomeeboy2277,2021-08-09T04:48:06Z,0,"Hi Sir Alex, I want to take the course for data science, but I am not a bachelors degree holder and I have no experience in this field. am I qualified?",True
@jacktrainer4387,2021-08-07T18:11:55Z,1,"Course ""purgatory?"" I see you are being generous. 😆 Per data, if you have a city with an open data portal, like Chicago, you can hit up that.",True
@Chuquemeka,2021-08-05T20:07:13Z,1,Thanks Alex I hope you are getting better now.,True
@suzannenwofor2132,2021-08-05T06:08:22Z,0,"Hey Alex, what do you think about Datacamp?",True
@MahtabAlam-uf8db,2021-08-04T18:50:27Z,1,lol I just saved half a dozen guided projects on coursera...thx for the advice,True
@ranjitn159,2021-08-04T12:32:31Z,1,"I have never in my life took a single course. But I wanted to do it now, so I clicked on YouTube and the first video that gets recommended to me is this.",True
@claudiocaniggia8001,2021-08-03T12:56:39Z,0,i think i still need a courses to understand the basic. i can't do anything with data if i doesn't even know what process i need to do 😂,True
@SoyElta,2021-08-03T07:20:35Z,0,Unreal how many programing videos YouTube suggests...I don't have the slightest interest.  I must have similar likes to people who program..,True
@loop9821,2021-08-02T16:49:49Z,0,"I know I'm a course addict. My portfolio is virtually non-existent yet I'm a recent university graduate with a computer science degree. I just don't have strong enough interest in anything to make a meaningful project. As a result, I can't land any job interviews, let alone jobs, since employers are not compelled by my resume's project section. Am I screwed?",True
@connie6616,2021-07-31T10:30:39Z,0,"Very true. You need to apply what you learn in the courses straight away in your work or projects, otherwise, it's just head knowledge and soon forget it.",True
@angeloalonzo5500,2021-07-31T04:37:05Z,0,"True,I only do this because HR likes to see this in your resume, if not of this I would busy myself self-studying documentations, books etc. And not courses or certificate",True
@nathanp.5563,2021-07-29T16:16:34Z,0,"Do you think taking courses is a by product of the job hiring process as a whole? where ""credentialing"" is the primary motivator for hiring as compared to experience ?",True
@pinakinchaudhari95,2021-07-29T06:10:57Z,0,"Wow, i get to know about google's Dataset search!",True
@gdj777,2021-07-28T23:24:45Z,1,"And don't be afraid to fail:  "" The Master has failed more times than the beginner has even tried """,True
@mrwalkan,2021-07-28T15:03:00Z,2,"Some people  just gets enrolled in online Courses just to get ""Certification of Completion"" like me",True
@Figuringout.404,2021-07-28T05:25:50Z,1,Passive vs active learning,True
@BeingAnAnalyst,2021-07-28T03:16:10Z,1,"Wow, thanks for sharing. I think it's good business as there is more course taking individuals compared to self project making ppl. It makes sense to advertise new courses and not where to apply using the self project. Besides, I think it is difficult to convince ppl that you know how to without a certificate/course.  I was told in two interviews that I was lying and don't know what I was talking about. That's cos I wasn't certified. Maybe one should stop with online courses and rather focus on joining a community through certification or being chartered.",True
@rafidzulfikar1616,2021-07-27T14:29:50Z,0,I just started being productive from my lazy ass and was going to enroll some courses but youtube recommend me this thing i-,True
@JK-jt3lr,2021-07-27T09:20:13Z,0,"I have a shit load of courses on Udemy, and I'll take your advice at face value. I'll finish them all eventually, but 2-3 at a time and then apply the knowledge in a few projects.",True
@vadeguay,2021-07-27T08:06:27Z,0,Stop using imperatives in almost every video title! Getting annoying over time!!,True
@busimo,2021-07-27T06:43:53Z,0,Take my course on how to stop talking courses,True
@hellopm5357,2021-07-27T06:28:38Z,0,Yeah thats True..Now i should Start a Course on 'How to stop Taking Courses' 😂,True
@n.manasseh8615,2021-07-25T21:19:15Z,0,Same is true for college degrees.  So many people get a college degrees as if that is all they need to get a good job. You need to get actual hand-on experience also.,True
@2sweet2be4got10,2021-07-25T17:34:44Z,0,"I am the same , literally on my last of 11 for the past 6 mths lol... and I made up my mind about actively practicing now that I found an area I can use to maintain my career as a main skill  and the rest as knowledge. I wanted to make sure I can always understand all the departments I deal with (and planned very specific courses to be of value) ... so after personally developing that understanding and im now I can focus on actively practical skillset and apply them as much as possible.",True
@the_9to5_traveller,2021-07-25T17:29:06Z,2,Thank you Alex. Timely word!,True
@MirajMusicUSA,2021-07-25T16:45:15Z,0,Great channel brother. How can I get in touch with you for a 1 on 1?,True
@thisathema,2021-07-25T12:33:55Z,1,"Oh, you need to tell this to every HR on the world.",True
@yosh_2024,2021-07-25T11:56:19Z,1,Great piece of advice 👍,True
@baw7198,2021-07-25T08:00:43Z,0,"Make a course about ""how to avoid course purgatory"" to make the idea more clearly.",True
@gideonmail5071,2021-07-24T22:04:39Z,1,"Youtube 😭😭, how to stop taking courses",True
@fredirecko,2021-07-24T16:58:30Z,0,This is just another way of saying…”practice”…….,True
@hariobayu4941,2021-07-24T14:49:51Z,0,"I think course is only good for jump start when you really a beginner, acquiring the basic knowledge, and then the rest is about practice more",True
@CoolDude911,2021-07-24T13:10:41Z,1,"At a certain point, books are better. They go into way more detail. If you read a few of the best books on a programming language and apply it, you are well on your way to become an expert.",True
@Bashar3A,2021-07-24T08:41:57Z,0,Watching this and getting inspired to take course on data analysis,True
@lukecaetano8405,2021-07-24T05:53:43Z,1,Main idea that I took away: diversify your knowledge of how you apply what you learned in your courses. Seek ways of applying knowledge to grow your understanding and don't trap yourself to a course. Courses are not bad though and good to start out.,True
@yakosti,2021-07-24T04:05:08Z,0,This video made me realise that I was doing it wrong.😱,True
@dec13666,2021-07-24T01:23:26Z,0,"What about taking new courses about new skills or knowledge?  I mean I get your point regarding ""I took 8 courses on Python"" (BTW, why did you take so many of them? 😂), but I was wondering whether ""one course per new skill, and a fair amount of exercises afterwards"" was a good approach.",True
@siddharthGupta632,2021-07-23T23:18:55Z,0,I feel that's a bad clickbait. This will discourage good teachers to come out with innovative methods. I learned all my coding from courses and wonder if the teacher would have ever taught if not paid. This is individual's responsibility to finish the course.,True
@MsSoldadoRaso,2021-07-23T16:50:41Z,0,Imagine only taking courses and not practicing with what you have learned🤣,True
@revolvency,2021-07-23T14:27:14Z,0,"I'm not a coder, but I do takes a lot of courses. Skillshare, Udemy, Coursera, Masterclass, Domestika, you call it.  I'm on art & design course purgatory, lol",True
@MascrisSensei,2021-07-23T07:49:44Z,0,"I hate course. Simply because it will make you lazy to do things on your own. I prefer self learning and ask people when I hit a wall. Or you can ask someone to teach you, so much better than pay a course.",True
@skillmeup53,2021-07-23T05:21:12Z,0,"So Praxis then? Praxis =  The synthesis of theory and practice, i.e. you practice the theory of what you learnt and develop the skill. Basically, practice makes permanent. The more you do it, the better you get.",True
@innocentrage1,2021-07-23T04:48:38Z,0,My Udemy library is starting to look like my Steam library. Lots of stuff unplayed,True
@nishanthd7552,2021-07-23T04:28:35Z,0,Shows an ad to buy a new course..,True
@minhtam5051,2021-07-23T02:50:46Z,0,"We stil need to take courses that are neccesary. They are like tool boxes. Once we have those, we can use those in our projects. Without courses we find it difficult to start.",True
@crism8868,2021-07-23T02:44:31Z,0,Any course worth it's salt will invite you to embark in a project right after it,True
@VikingMan44,2021-07-23T00:25:42Z,17,"This is good advice. I've been quite the opposite throughout my career and that fact is one of the primary reasons I have been so successful. I'll take a course every so often, but then I immediately turn to real world experience to truly solidify the knowledge in my brain. Until you see the technology implemented top to bottom in a system that actually does something useful, it often remains an abstract concept that needs to take root. There is no teacher quite like experience.",True
@Chirpieshome,2021-07-22T22:37:18Z,0,This is happened to me now I'm trying more practical approach,True
@soerenna,2021-07-22T18:07:41Z,1,Great advise thanks a lot and also great to see so many people on the path of self-improvement :D!,True
@beej741,2021-07-22T15:19:33Z,0,"It makes sense because companies that provide courses make their money... by providing courses. And the more courses you take, the more money the providers make.",True
@beej741,2021-07-22T15:17:03Z,0,Your example of For Loops hit me. I'm still not sure how they work lol,True
@haojiang4882,2021-07-22T15:03:02Z,64,"According to Andrew Huberman, a neuroscientist at Stanford, THE best way to learn is to make and fix mistakes during repeated practice on a single detail under different scenarios, as many as possible, and mistakes are essential in the process of acquiring new knowledge and skills. However, ironically, taking courses basically takes all that mistake-making away from you. So it's pretty reasonable to say that taking courses is an overrated way of learning.  By the way, I highly recommend Andrew Huberman's podcast. Check it out if you're interested.",True
@serpentphoenix,2021-07-22T13:14:34Z,1,Why you need to stop posting clickbait.,True
@wannabedal-adx458,2021-07-22T12:18:10Z,0,"Can I go to Google Datasets, type in my name, and see everything they have on me? Asking for a friend (who works at the NSA, but don't worry about it)! ;)",True
@nikolaisandbeck6951,2021-07-22T12:10:07Z,0,"I like to take courses to learn what a language can and cannot do. And then I do small projects to learn how to do it :)  Most of my learning time is spend on tinkering.  About scraping, as I can understand, scraping from Facebook is not permittet anymore without the expressed consent of facebook. I talk with a guy who did a NLP project as his bachelor thesis, and he told me they had to copy paste data manually. Here we talk about comments, is there any other data they have which is still up for graps?",True
@johongirrahimov2343,2021-07-22T11:29:05Z,0,"I've following rules when it comes to consumption and masterting any INFORMATION: 1. Mantra: Knowing without applying is not knowing 2. Knowing is 1%, Applying 99% to achieve mastery",True
@SudiptaAdak-vu3su,2021-07-22T09:41:17Z,0,"Just pick a course(educator) you like, cause going through books/documentation are kinda very tough at first then try to apply it on small projects(50% different) from the ones shown in the course. Thats my go and it really helps. Educators like : NetNinja, Stephen Grider, Brad Traversy, Abdul Bari are  awesome. I think knowing the basic features and implementation is worth knowing. We need not invest hundreds of dollars on COURSERA just for certification and stuff.",True
@doomelements4679,2021-07-22T09:30:34Z,1,Alex: Don't take too many courses Me: Logs into Coursera and see only 1 course with 10% completion.  Me haz sad.,True
@pixelpox11,2021-07-22T09:02:52Z,2,"This is what I've been calling a tutorial hell. I've been there. I always remind myself how I wasted like half a year on doing python over and over. I get reminded of this anytime I see some free courses on a subject on YouTube, and people being extremely positive and happy about them in the comments while they are literally just learning for loops over and over :/  Also there is a severe lack of intermediate and advanced courses that would either force you to do much harder projects or challenges or give you a lot more information on optimization of your code and deep dive into the software-hardware interactions, like memory allocation and so on.",True
@tr.j4079,2021-07-22T08:37:22Z,0,Now where can I sign up for the full version of this course?,True
@tr.j4079,2021-07-22T08:36:21Z,0,Only take a course when you are going to use it soon. Just-in-time learning 🙌 or apply for an exam so you’re forced to use it.,True
@anonymousrashiyama1432,2021-07-22T06:53:20Z,0,Why You Need to Stop Watching Youtube!,True
@johnwilliams7999,2021-07-22T05:28:45Z,0,Can you recommend a course about quitting courses,True
@Andre-sj8mu,2021-07-22T03:03:39Z,0,"I completely agree. I learn by doing; however, I did learn some tricks while taking the google certificate, the best way for me to understand is by doing stuff that is part of the job.",True
@CuriousCauliflowerX,2021-07-22T00:12:27Z,0,"Gee, who would have thought being a mindless idiot about something doesn't work. Paid courses aren't designed to teach you - they're designed to get you to do more courses. There's SOOOO MUCH free python stuff which is put out not to make money.",True
@claw320,2021-07-21T23:48:26Z,0,"Yeah a person ""gets good by doing"". So if you are say, learning Python, you do TONS of Python coding and consult online resources when you need to know something or answer a question. There is also a talent factor ( in anything ) which will limit the results of any individual. You can't learn or buy talent, you are born with it. Things like hard work and experience simply develops the talent a person is born with it, but won't surpass it. What this means is that you can never use courses/hard work/experience to COMPENSATE your way beyond your natural talent level. That's just a fact of life. Your potential in ANY field is limited by your natural abilities in that field. You develop that max-potential mostly by doing, with the right amount of instruction/studying mixed in.",True
@vipulsinghal3456,2021-07-21T19:58:07Z,0,YouTube and Instagram will make you believe that anything and everything you do in your life is a mistake.,True
@josetijerino5198,2021-07-21T19:42:26Z,0,How can be possible this video shows recommended to be. 😂,True
@platinumpineapple9943,2021-07-21T19:41:02Z,0,You mean getting scammed by stupid “enterpernuers trying to sell a course?”,True
@bhargav7476,2021-07-21T15:26:12Z,1,Build and end-to-end project( from live data scraping to plotting predictions on a live website) you'll learn more than any course you've taken,True
@ianuragaggarwal,2021-07-21T12:55:19Z,0,Most are not able to apply.,True
@crytpoex_ploiter4295,2021-07-21T10:09:31Z,0,Dislikes are from udemy addicts,True
@alonzoslim,2021-07-21T07:23:37Z,0,"Hello. Quite an interesting advice there.  I seem to be in a ""Wilderness"".  Is there an email address I could reach out to? I really would appreciate some expert advice, but don't want a plethora of suggestions to confuse me further. Thank you!",True
@txx8302,2021-07-21T02:11:14Z,0,"To be honest, YouTube crash course and free videos and Google searches when the problem comes in real life taught me a lot rather than courses on Coursera and Udemy. Just my views but yes real life problem are best.",True
@katelynwilson6907,2021-07-21T01:42:00Z,0,"Come up with a project and then learn the skills that you need to complete that project. For example, in learning python I came up with my own hangman game. There were a lot of skills I either didn't have or didn't fully understand that were necessary to complete the project, so I looked them up as I coded. Slowly I learned new things or finally understood how something worked once I was applying it to my unique situation and learning how changes affected how that code worked.",True
@germanmartinez5790,2021-07-21T00:55:45Z,1,Thank you so much!,True
@VikingThorM,2021-07-20T23:51:35Z,1,That is just the video I was looking for! Thanks a lot Alex! You rock!,True
@erjohn5404,2021-07-20T22:46:07Z,0,"Ya know this guys just givr stupid advise just learn the way you want, Theres types of learning thats the reality",True
@taylorbosier,2021-07-20T16:55:32Z,31,"Interviewer: ""Can you tell me what a join is?"" Me: ""Hold on, let me pull up ""TOP 10 SICKEST SQL SKILLS YOU NEED TO KNOW"" on youtube""",True
@zibusisosiso-sibanda7649,2021-07-20T16:22:06Z,1,Thanks so so much. Much luv,True
@lankonthungezung9360,2021-07-20T14:25:12Z,2,Hahaha... I m taking  online  course to get good at Math for my high school Should I stop?,True
@dividendstockpicker9531,2021-07-20T13:19:13Z,83,"He is one step ahead, I buy courses, but don't finish them",True
@tj_flow_,2021-07-20T12:46:36Z,2,thats short and crisp video thats very nicee of u,True
@mrwho.7163,2021-07-20T09:49:07Z,5,"knowledge is enough , we must apply : bruce lee",True
@jamtheham5003,2021-07-20T07:50:42Z,1,"Taking courses isn't bad, it's just the people who don't take courses in the right way. Take one course, complete it, understand it, learn everything from it, and then move to another course. And practice a lot lot lot!",True
@ivantrj,2021-07-20T07:42:03Z,1,This is so true. Great advice,True
@luqmanhamdan9285,2021-07-20T05:33:32Z,8,"I start getting bored after taking a course, not even finished it because most of the stuff I already know. It just I know but I didn't applied it. So I straight away doing some simple project.",True
@longmundawam5739,2021-07-20T04:55:10Z,5,"Now after watching this, I'm done taking courses",True
@jamesleleji6984,2021-07-20T03:02:20Z,0,"Please I have a question about SQL. How do you add a calculated column to a table. For example,  in MS Excel,  you can create a column based on the values of other columns and each time data is entered in the other columns, the formula result shows in the calculated column you created . How do you do this in SQL. Thanks",True
@scharlesworth93,2021-07-20T02:15:00Z,0,books are dope tho - if you do exercises or related projects,True
@jennytumay,2021-07-19T23:58:32Z,1,Yess this advice 👏👏,True
@Rafael-qx2ye,2021-07-19T19:08:41Z,0,"Honestly, I found myself going through this rabbit hole as well. Now, I just watch something introductory (usually a video or two) about what I want to learn and then focus on projects and have 1 or 2 good books on the subject that help me out with the syntax (such as Python or R programming). Great video!",True
@pramodacharya5866,2021-07-19T18:32:19Z,0,"So, dont go to college and take courses. Instead apply it on datasets and analyze them?",True
@khwlel,2021-07-19T16:21:59Z,0,"To be honest with you, your videos are becoming very repetitive, this is constructive feedback. You always talk about the same things but different videos",True
@MiguelReyesDeveloper,2021-07-19T16:21:09Z,15,For every course you have to do a project with what you learned (:,True
@tetocaloscojones8229,2021-07-19T13:46:23Z,1,nice mustache !,True
@vaani6393,2021-07-19T12:30:49Z,2,Hello Alex!! .. The company I'm going to apply for uses Mysql and I have already learnt many things in Mysql... Will I be able to follow your portfolio projects.. In which you used T-sql??,True
@serefsendil7606,2021-07-19T12:08:59Z,1,"Thank God, i got this advice right before start the certification program 😂 Now i need to reach some projects ✌️ Thanks for advice",True
@unknowninfinium4353,2021-07-19T11:13:05Z,0,I am currently taking business analyst course because My MBA degree is worthless and I cant even find a job with this degree.,True
@carmenprieto9693,2021-07-19T04:39:21Z,2,"I love the way u speak, I can understand everything u say. English, is not my first language.",True
@azizaafrin8682,2021-07-19T03:50:57Z,1,This was really helpful. Right now I am in this position. Thanks for the data sources. I didn’t know about Google Data search.,True
@GodAboveAll888,2021-07-19T03:40:56Z,0,Any advise on finding practical projects related to business Analyst course,True
@abiodun6897,2021-07-19T00:09:57Z,0,I shouldn't take a course? What about I don't know the fundamentals of a language,True
@apamwamba,2021-07-18T19:09:05Z,0,Yes true.. That has been my approach...You can not keep sitting for exams for ever and ever...When are you going to practice...,True
