author,updated_at,like_count,text,public
@rahuljaiswar294,2022-09-17T16:34:47Z,0,please attach the files used by you,True
@kantethatvik6740,2022-05-24T05:21:06Z,0,Please attach the required files for practice Thank You,True
@kaltoumrachdi2086,2021-11-21T00:17:08Z,1,plz attach the files used,True
@datasciencepreparationhub9933,2021-09-30T06:58:04Z,0,Thanks for the video,True
@sandipansarkar9211,2021-09-23T10:00:07Z,0,finished watching,True
@louerleseigneur4532,2021-07-06T07:51:27Z,0,Thanks,True
@rockybaba1,2020-12-02T11:18:03Z,5,Please attach the required files for practice Thank You,True
