author,updated_at,like_count,text,public
@fernandes1431,2022-05-24T14:08:09Z,3,Can't thank you enough for the clearest and best explanation on YouTube <3,True
@jongcheulkim7284,2022-05-19T09:48:16Z,1,Thank you so much^^,True
@kd6600xt,2022-05-17T14:40:56Z,4,"Quick note: At 43:30 instead of using the plot_confusion_matrix() which is now depreciated, you need to use ConfusionMatrixDisplay.from_estimator(). This can be done as follows: Include: from sklearn.metrics import ConfusionMatrixDisplay at the start with the other imports. Then when printing the confusion matrix you need to use the line: ConfusionMatrixDisplay.from_estimator(clf_xgb, X_test, y_test, display_labels=[""Did not leave"", ""Left""])",True
@alexpowell-perry2233,2022-05-12T13:58:01Z,0,Great video! Can you do a video on EBM (explainable Boosting machines) please?! This would be really helpful - thanks!,True
@lollmao249,2022-05-08T17:52:20Z,0,can i use this to predict stock market ? for time series forecasting ?,True
@harshbordekar8564,2022-05-07T11:16:56Z,1,Thank you for the awesomeness!!,True
@mehrdadzamirian,2022-04-20T05:35:28Z,0,"I have a question about handling the pd.get_dummies(). When it is used for gender, it turns out the ( M or F) to  a  single column of 1 and 0. But if get_dummies is used for a column that has 3 or more unique values, it creates columns equal to number of unique values. Isn't it better to use argument drop_first=True to reduce the redundancy. If not, when do you recommend to use this argument?  BTW, thanks a lot for these great videos! I have learned a lot.",True
@Mohith7548,2022-04-12T18:04:26Z,0,Expected to prune features based on their importance - feature selection!?,True
@Mohith7548,2022-04-12T17:36:57Z,0,XGBoost works with categorical data as well. Why did you encode those columns??,True
@yelyzavetatymoshenko1572,2022-04-11T15:12:29Z,1,Great one!,True
@navyasreepinjala1582,2022-04-06T04:29:15Z,2,I love your teaching style. Extremely helpful for a beginner like me. Really helped me a lot in my exams. No words. You are the best!!!!,True
@skyw_nker3723,2022-03-27T18:13:48Z,0,"50:26 very good representation of what my parents understand I'm doing thanks for the great tutorial! do you consider doing one about bayesian (or gradient descent) optimization to the hyperparameters tuning?",True
@marekslazak1003,2022-03-19T18:56:05Z,3,"Jesus, i just learned more over 10 minutes of this than i did throughtout an entire semester of a similar subject on CS. ++ tutorial",True
@tantalumCRAFT,2022-03-18T17:46:22Z,3,"This is hands down the best Python tutorial on YouTube.. not just for XGBoost, but overall Python logic and syntax. Nice work, subscribed!!",True
@v1hana350,2022-03-11T22:24:23Z,0,I have a question about the Xgboost algorithm. The question is how parallelization works in the Xgboost algorithm and explain me with an example.,True
@francovega7089,2022-03-06T01:24:35Z,1,I really appreciate your content Josh. Thanks for your time,True
@keyurshah8451,2022-03-01T06:57:28Z,1,"Hey Mate, amazing tutorial. Very complex problem explained in really simple and effective way.  I am using XGBOOST for one of the classification model and after watching your video it made me realise I can further improve my model. So thank you again and keep making those videos. Kudos to you and long live data science 🙏🙏",True
@sunsiney7014,2022-02-20T21:10:02Z,1,Great video! Very informative and clearly explained! Could you please also present BART?,True
@teresitaeyzaguirre4741,2022-02-11T13:34:48Z,1,I love you statq,True
@gisleberge4363,2022-02-10T08:10:43Z,1,"Appreciate the Python related videos...helps to manoeuvre the code when I try to replicate the method later on...easy to follow the whole thing, also for beginners... 🙂",True
@shahreyarnajeeb1006,2022-02-03T16:20:41Z,0,"Hi great video, Can't we use SMOTE to balance the data so we get good predictions for both 'leaving' and 'not leaving'?",True
@sandipansarkar9211,2022-01-21T14:00:53Z,1,finished watching,True
@samxu5320,2022-01-16T11:59:07Z,1,Your pronunciation is the most authentic and clearest that I have ever heard,True
@tillgrimminger8199,2021-12-20T15:30:08Z,0,"Hi Josh,  I'm only an undergrad so I can't be sure, and please dont crucify me :), but wouldn't stratifying the train test split result in passive data leakage because we ""know"" the exact percentage of people leaving the company in the test set? In Sklearns documentation stratify is mentioned as a parameter when used in cross-validation. This makes sense as you wouldn't want differenty balanced folds when hyperparameter tuning, however in the final evaluation wouldn't it be good to test the performance on differently balanced data?  Love your videos!",True
@tamirganor,2021-12-20T08:53:06Z,0,Grate video just one comment for the eval_metric = 'aucpr' it is the area under the percussion recall curve and not  the FP TP curve,True
@romanroman5226,2021-12-11T19:14:23Z,1,Awesome video! The cleanest xgboost explanation a have ever seen.,True
@ArunKumar-fg1yj,2021-12-08T15:32:23Z,0,"Hello Josh, I am trying to follow your steps. However,  plot_confusion_matrix(clf_xgb,                       X_test,                       y_test,                       values_format = 'd',                       display_labels=['Did not leave','Left'])  Throw an below error message:-  XGBoostError: [09:28:33] c:\users\administrator\workspace\xgboost-win64_release_1.5.1\src\c_api\c_api_utils.h:161: Invalid missing value: null  Can you please tell me what i am doing wrong",True
@Dollar123Bills,2021-12-06T00:08:14Z,1,That was amazing,True
@SergioPolimante,2021-12-01T19:57:02Z,1,This kind of content is SUPER HARD to produce. I really understand and appreciate your effort here. Thanks and congratulations.,True
@kaushikmahmud,2021-11-06T04:06:47Z,1,"DO NOT USE ""missing=None"" TO AVOID ERROR. Took me 1 hr to find the error.  clf_xgb = xgb.XGBClassifier(objective='binary:logistic', seed=42) clf_xgb.fit(X_train,            y_train,            verbose=True,            early_stopping_rounds=10,            eval_metric='aucpr',            eval_set=[(X_test, y_test)])  plot_confusion_matrix(clf_xgb,                       X_test,                       y_test,                       values_format = 'd',                       display_labels=['Did not leave','Left'])",True
@eskoo8396,2021-10-29T06:51:51Z,0,hi! at 41:30 it should be validation set and not test set. am I wrong? thanks!,True
@Learner_123,2021-10-18T23:47:44Z,1,"Many thanks for the wonderful tutorial.   Would please support in getting the error when I run the code line -> plot_confusion_matrix(clf_xgb,                        X_test,                        y_test,                        values_format='d',                        display_labels=[""Did not leave"", ""Left""])  XGBoostError: [10:35:55] /Users/runner/miniforge3/conda-bld/xgboost-split_1631904775127/work/src/c_api/c_api_utils.h:161: Invalid missing value: null Stack trace:   [bt] (0) 1   libxgboost.dylib                    0x0000000135d7ee74 dmlc::LogMessageFatal::~LogMessageFatal() + 116   [bt] (1) 2   libxgboost.dylib                    0x0000000135d7842f xgboost::GetMissing(xgboost::Json const&) + 271   [bt] (2) 3   libxgboost.dylib                    0x0000000135d86541 void InplacePredictImpl<xgboost::data::ArrayAdapter>(std::__1::shared_ptr<xgboost::data::ArrayAdapter>, std::__1::shared_ptr<xgboost::DMatrix>, char const*, xgboost::Learner*, unsigned long, unsigned long, unsigned long long const**, unsigned long long*, float const**) + 529   [bt] (3) 4   libxgboost.dylib                    0x0000000135d85ffe XGBoosterPredictFromDense + 350   [bt] (4) 5   libffi.6.dylib                      0x000000010bfc2934 ffi_call_unix64 + 76   THANKS, IT WAS RESOLVED WHEN I CHANGED MISSING=NONE to MISSING=1 in clf_xgb = xgb.XGBClassifier(objective='binary:logistic', missing=1, seed=35, use_label_encoder=False)",True
@pacificbloom1,2021-10-17T18:54:39Z,1,Wonderful video josh.....pleasee pleasee pleasee make more videos on start to finish on python for different models.....i havr actually submitted my assignments using your techniques and got better results than what i have learned in my class  Waiting for more to come especially on python :),True
@imranselim5978,2021-10-14T18:32:19Z,1,"Thank you for the excellent content and walk through. While One Hot Encoding the categorical variables should not we use k-1 variables for k categories? For example, for the Payment_Method column if Mailed_Check=0, Electronic_Check=0, and Bank_Transfer=0 doesn't that imply Credit_Card=1 and make Credit_Card column redundant?",True
@trendytrenessh462,2021-10-11T09:29:29Z,2,"It is really lovely to be able to put a face to the ""Hooray!"", ""BAM !!!"" and ""Note:""s 😄❤",True
@rishikesh2598,2021-10-02T18:12:52Z,0,where to download this IBM data source from?,True
@zeusserch98,2021-09-28T08:36:13Z,0,Why you use one hot encoding? Does the xgboost work well with categorical data?,True
@yk4993,2021-09-26T21:06:20Z,0,"Could you please further elaborate on what you exactly mean by ""One-hot encoding is not for logistic/linear regression""?",True
@abdulkayumshaikh5411,2021-09-20T08:31:19Z,1,"Hello josh, you are doing amazing work keep doing",True
@hamidghaedi7202,2021-09-12T22:08:59Z,0,"Hey Josh, thanks for making great videso and  songs :)!  In my data I gam getting a large number of NaNs and want to run XGBoost to solve a classification probelm. Do you think it will be OK to use XGBoost to deal with that situation like having 50% of missing values in some variables with 200,000 observations (row numbers)? Based on the some of the replies you have posted I guess so.   In the data , I have some columns in them  I can observe data is between -5 to +5, if I set NaNs to 0 things will mess up right?",True
@NLarsen1989,2021-09-03T14:41:10Z,1,"Yikes, if I ever understand something enough to explain it as succinctly as you do then I'd be very happy. I've been smashing through a lot of your videos the last few days after spending countless months on python, sklearn and all the usual plug and play solutions and it's not been until I've started watching these that I've started to feel things click into place",True
@vianadnanferman9752,2021-08-30T19:00:43Z,0,"thanks a lot for this tutorial. please, what about multiclass classification? in GBM one vs rest is utilized but here as I read softmax and softprob can be applied but I don't know how they work.",True
@subhadipghosh5787,2021-08-28T00:02:07Z,0,"Can you tell me when i dump a xgboost tree it gives me ""cover"" for each perent node... What is that?",True
@shazm4020,2021-08-27T15:40:53Z,1,Thank you so much Josh Starmer! BAM!,True
@shazm4020,2021-08-27T14:44:49Z,0,I have a question that if the missing value in the variable is integer or float. How we should deal with it? We write it to be 0 or what else?,True
@algorithmo134,2021-08-26T07:21:21Z,0,Why are these videos not in 1080p or 4k?,True
@maurosobreira8695,2021-08-18T17:22:17Z,1,"A true,  real Master Class - You got my support!",True
@rohitrajora9832,2021-08-11T10:42:06Z,0,"Hi Josh, it would be extremely helpful if you could provide the link to the datasets that you use in these kind of videos ...bam.",True
@ruchi3491,2021-07-26T05:30:05Z,0,Hi Josh. one request can you do more of these start to finish series. Also please create a separate playlist for these start to finish videos. Thank you so much for your efforts.,True
@muskanroxx22,2021-07-23T15:17:00Z,1,You're a very kind human being Josh!! Thank you so much for making these videos. Your content is gold!!! I am new to data science and this is exactly what I needed!! :)  Much love from India! <3,True
@saikiran-mi3jc,2021-07-21T17:48:28Z,0,Could you please do videos pn catboost,True
@andrewxie9896,2021-07-21T13:21:39Z,0,"I can see how replacing with a zero for one-hot encoding is meaningful, but say for example, you had a continuous variable ""age"" to predict weight. In that case, you would cluster all the missing ""ages"" (replaced with 0) with the newborns. If age, foot_length, hair color and eye color were the features, and the labels were weight, I feel like 0 for age (probably expected to be of highest importance to weight) would break for the elements with missing and replaced data.age == 0?",True
@andrewxie9896,2021-07-21T13:05:53Z,1,"you are simply an amazing human being, also the notebooks are great! :D",True
@DavidTran23,2021-07-19T00:57:55Z,0,Do you have a version of this for RStudio?,True
@harshavardhanasrinivasan3125,2021-07-18T03:06:40Z,1,Reaaally amazing!!,True
@CalifornianViking,2021-07-15T04:03:45Z,0,"Hi Josh - great video. I have a question about missing data. I see that it is normal in statistics to ""fill out the missing data"" and I sometimes see the attempt to replace missing values with 0. This is a practice that I don't understand from two perspectives:  First, why is it neccesary if you have enough data to train the model? Wouldn't it be better to just eliminate the data?  Second, my experience is that unkown (missing) data is not the same as 0 (or any other data value). It has been the root of a lot of analysis issues that I have seen. It would be better to make a dataset where the data is truly is missing so that predictions can be made on what missing data means for the probability of an outcome. I understand that no charges is the same as 0 charges, I don't understand that a missing (unknown) age is a 0 age. I really like the way that SQL handles this with NULL values, which specifies that the value is unknown, the same is true for np.NaN.  Would you mind comment on these two perspectives?",True
@k44zackie,2021-07-10T15:19:43Z,1,Thank you very much for nice video! Very helpful for me.,True
@pengqian192,2021-07-02T00:55:50Z,0,I do really like your videos regarding GBDT and XGboost series. Could you please post a video regarding LightGBM?,True
@thiagotanure2212,2021-06-30T18:26:41Z,3,amazing tutorial Josh! Shared with my friends =D  Could you do one of these about pygam? It would be amazing :),True
@xuantrung13,2021-06-24T16:15:48Z,1,Triple BAM !!!,True
@alexblablabla5632,2021-06-22T21:33:56Z,0,Not sure if anybody has already asked this: why is it OK that One-Hot encoding makes k variables rather than k-1? Multicollinearity?,True
@Kal-Racso,2021-06-16T19:20:20Z,0,"I executed the first round of optimization but I got different outputs (not the ones commneted below first round), even though I used the same seed. Anyone knows what could be happening? And really, really amazing tutorial, thanks a lot!",True
@derek-kuang,2021-06-06T21:17:55Z,1,"Great lecture! I just purchased and downloaded the Jupyter Notebook. But I got a confusing error, hopefully, I could get some hints here. Thanks  After running the notebook in the XGBoost  1.4.0, if I initialize the clf_xgb by the following with missing=None,  clf_xgb = xgb.XGBClassifier(objective='binary:logistic',                              eval_metric=""logloss"", ## this avoids a warning...                             missing=None, seed=42,                              use_label_encoder=False)  I will get ""Invalid missing value: null"" error by calling   plot_confusion_matrix(clf_xgb,                        X_test,                        y_test,                       values_format='d',                       display_labels=[""Did not leave"", ""Left""])  I know it is because of the model since I got the same error by calling `clf_xgb.predict(X_test)`.  I found a related SO thread but not sure why we still have missing value after data cleaning.  https://stackoverflow.com/questions/67245147/getting-a-weird-error-when-trying-to-run-xgboost-predict-or-xgboost-score   Thank you!",True
@nepalm222,2021-06-03T22:44:52Z,1,"Great Content, subscribed",True
@TomerSalsa,2021-06-01T06:51:06Z,0,"Great video, love your content! I ran the notebook as-is, and got an exception during the ""plot_confusion_matrix(...)"" call  XGBoostError: [06:48:41] ../src/c_api/c_api_utils.h:161: Invalid missing value: null  Did anyone run into it? Thanks",True
@albinthomas7072,2021-05-19T06:35:36Z,0,Is there something wrong with my code if it stopped after building just 23 trees in the clf_xgb.fit ? as opposed to 55 in the video?,True
@kelvinhsueh5434,2021-05-18T17:37:14Z,24,You are amazing. Can't imagine how much work you put into those step-by-step tutorials.  Just bought the Jupyter Notebook code and it's beyond worth it! Thank you :),True
@albinthomas7072,2021-05-17T07:35:36Z,1,For the dataset used in the video -https://www.kaggle.com/yeanzc/telco-customer-churn-ibm-dataset,True
@mdaroza,2021-05-14T06:36:44Z,2,Amazingly organized and well explained!,True
@bishwarupdey10,2021-05-10T20:31:26Z,0,Love your videos ❤️❤️ would you please make a video on ensemble learning techniques and also on time series analysis in python would be of great help.,True
@VarunKumar-pz5si,2021-05-09T12:02:55Z,0,Dataset link?,True
@VarunKumar-pz5si,2021-05-09T11:22:46Z,1,I'm very grateful to have you as my teacher.,True
@minseong4644,2021-04-28T03:14:42Z,1,Such an amazing job Josh.. Couldn't find any better explanation than this! Mesmerizing!,True
@jinwooseong2862,2021-04-27T06:48:40Z,1,I watched your all video for XGBoost. It helps me a lot. very appreciated!,True
@josephhayes9152,2021-04-16T23:05:17Z,1,Thanks for the great tutorial! You covered a lot of details (mostly data cleaning) that are often overlooked or skipped as 'trivial' steps.,True
@karannchew2534,2021-04-11T15:24:46Z,0,51:41 Send them StatQuest coupons instead. Better alternative to milkshake coupon.,True
@karannchew2534,2021-04-11T12:18:21Z,0,Question please.  Why isn't Zip_Code one-hot-encoded?,True
@Ankit-gq8gl,2021-04-08T03:33:11Z,0,"can we use xgboost for unsupervised learning as there is mandatory parameter Y_train. In algorithms like Isolation forest, we can set Y=none, is there such option here?   Also, is simply filling X_train twice in the .fit function is the way?",True
@znull3356,2021-04-06T05:03:09Z,92,"Please keep doing these long-form Python tutorials on the various ideas we've covered in earlier 'Quests. They're great for those of us working in Python, and they give me another way to support the channel. It has been a more-than-pleasant surprise that as I've grown from learning the basics of stats to machine learning and eventually deep learning, StatQuest has grown along with me into those very same fields.  Thanks Josh.",True
@mssnal,2021-03-29T20:16:29Z,1,Awesome man,True
@rubyjiang8836,2021-03-26T14:10:15Z,0,i always thought the voice is fake voice generated by machine... but it turns out to be real,True
@jwxdxd,2021-03-21T03:55:22Z,1,You are amazing! Thank you so much !!,True
@markrauschkolb5370,2021-03-20T14:17:11Z,9,"Extremeley helpful - would love to see more from the ""start to finish"" series",True
@srmsagargupta,2021-03-10T20:05:31Z,0,"Question Sir: how can we get display the tree with best auc score, i.e. 55th iteration. Also, can we use the rules directly or every time we have to run the model. Thanks in Advance",True
@daniloyukihara2143,2021-03-07T15:46:30Z,1,"hurray, i picture you totally different!  Thanks a lot for all the videos!",True
@gemon39,2021-02-19T13:11:59Z,0,thank you so much for the video! How could  you install kite with mac in jupyterlab ?,True
@farlem92,2021-02-17T15:11:17Z,1,"Hi Josh, thanks for the amazing content as always.   Maybe you covered this and I just missed it so apologies in advance but from roughly 41.47 in the video you use the training dataset to build the model and at the same time you are evaluating the model using the test dataset. This test data is used in tandem with the early stopping parameter and when the ""aucpr"" score stops increasing, the model then stops processing and choses the epoch that has the best ""aucpr"" score that resulted from the test dataset.   I am wondering if there is a problem in using the test dataset in order to chose the best iteration for the model to stop on? The test dataset is data that the model has not seen before so should the model be trained on a training dataset, and evaluated with a validation dataset, and then once the optimal epoch has been selected then you can predict the outcomes on the test dataset, which the model has not seen before.  Maybe I have misunderstood slightly but hopefully this makes sense.",True
@TheSpiralnotizblock,2021-02-15T10:53:08Z,0,"I just finished watching your video and thought it was very good. It was a nice introduction to XGBoost.  I wanted to use XGBoost to predict tennis matches, which player is most likely to win from a match. Is that even possible with XGBoost?",True
@tejaskulkarni5386,2021-02-13T13:17:32Z,1,"I wish I was allowed to pay you money, you life saver You will have to do with a sub for now :P",True
@bedirhangundoner9627,2021-02-10T11:00:46Z,0,"We made two possible parameter values. And firstly, since max_depth = 4 and has the middle, we got it. And since l_rate = 0.1 and it's the highest on its list, we also tried the higher values on the 2nd try, [0.1, 0.5, 1]. At this point I have a question; Isn't it possible for [max_depth = 3, l_rate = 0.05,] to be better than [max_depth = 4, l_rate = 0.1]?  I thought this cost was possible. But I think it's worth it: Is it better to avoid the possible cost of time than the possible cost of incorrect parameters? (of course by searching the optimum point) Am I correct or is there something missing?",True
@joshuanasr5226,2021-01-29T14:09:18Z,0,"Hi Josh, thanks a lot for a video! This Joshy needs help! I am new to all this programming stuff and am learning it for a university project. I downloaded anaconda with the numpy, xgboost, pandas.... but I am not able to import them into Jupyter. Any clue what the problem can be?",True
@nalidbass,2021-01-20T16:21:42Z,1,"Josh, won't there be target leakage when we evaluate 'aucpr' on the testing dataset to determine the number of trees?",True
@bjg4320,2021-01-11T01:12:56Z,0,I have a question why we need to keep the imbalance data and do not use oversampling or undersampling to handle the imbalance data?,True
@Pooja-ok4xt,2021-01-06T11:46:32Z,0,Video for difference between restricted estimate of maximum likelihood and maximum likelihood,True
@1386imran,2020-12-29T04:04:00Z,1,Do I see a tabla kept in the background....😅,True
@sudheerrao07,2020-12-28T16:19:54Z,5,"Wow. Finally I see a face for the name. Your previous videos have had immensely helpul. I assumed you are a very senior person. I am not measuring your age. I mean, your way of explaining seemed like a professor with half a century of experience. But in reality, you are quite young. Thank you for all your simple-yet-detailed videos. No words to quantify how much I appreciate them. 🙏",True
@santoshpanchal4644,2020-12-19T20:03:48Z,0,"Hi, nice video. Quick Question. How to output model for deployment on spark. Can you give some guidance on best practice for deploment in production.",True
@its_me7363,2020-12-18T11:14:25Z,2,"Can we use xgboost for multilabel classification? If yes, what parameters should be changed?",True
@henkhbit5748,2020-12-08T15:47:43Z,1,"Greatly appreciated this videoLike you said, telcos should gives more effort to tie the current customers. In real practice you want to know what the probability is that a current customer will no longer renew the subscription. You should then try to bind the customer with a high risk with incentives.",True
@abhishekchandrasekaran97,2020-12-02T16:50:25Z,0,"Hi Josh, Great video. Can't thank you enough for this.  One issue I am facing:  Whenever I run GridSearchCV and pass the param_grid, it is always returning the lowest value (magnitude) in the list for each hyper-parameter that I have passed.  Even when I change the range it keeps doing this. I never get the middle value and when I fit the model with the 'optimal_params.best_params_' output values after 2 rounds, the accuracy for 'Did not Leave' prediction increased but accuracy for 'Left' prediction decreased further, which is not awesome.  Any inputs on why this could be happening? One more doubt sir if I may, how do we interpret the leaves of the tree that we drew. I understand it is just one tree but can we guess an approx classification of 'left/did not leave' by looking at the leaf values? If yes, then how?",True
@Madsope,2020-12-01T14:23:06Z,0,"Really like the video! Clear explanation. I had already given XGB some shots and I used LabelEncoder from sklearn. That way, categorical data is not mapped to thousands of columns. My result (without optimisation) actually improves then over pd dummies. Is that essentially the same or am I missing something?",True
@hugochiang6395,2020-11-29T17:12:15Z,0,Great video Josh!  I have a question.  What if the missing data is numerical?  Wouldn’t setting it to zero throw off the calculation since we don’t one hot encode numerical variables?,True
@beautyisinmind2163,2020-11-28T08:12:05Z,0,"sir, during coding for multiclass classification, say y has 4 categories A B Cand D when I label the using label encoder using following code from sklearn.preprocessing import LabelEncoder ly = LabelEncoder() ly.fit_transform(y) then it assign labeling randomly, how can i label them on my desired way like this, A = (1 0 0 0 ), B = (0 1  0 0), C = (0 0 1 0), D = (0 0 0 1), or A =1, B =2, C =3 D =4",True
@saketnarendra8864,2020-11-27T11:12:56Z,0,"ValueError: Unable to parse string ""Afghanistan"" at position 0 what to do",True
@beautyisinmind2163,2020-11-26T17:00:23Z,0,do we need feature scaling for XGBOOST or not? and another question how can we optimize hyperparameter using heuristic algorithm like PSO?,True
@helttt,2020-11-24T02:32:09Z,0,Great presentation. How do you get access to the IBM sample data? Is there a link?,True
