author,updated_at,like_count,text,public
@danemerson6963,2020-11-22T19:47:44Z,0,It looks like the example tree that you selected to draw was classifying around the numerical value of zip code? Would it make more sense to one-hot encode this value since it is not appropriate to model zip codes as continuous data?,True
@nehabalani7290,2020-11-19T06:23:34Z,2,Good to also see you sing rather than just hear :).. i had to comment this even before starting the training,True
@jaikishank,2020-11-13T09:46:06Z,0,"Thanks Josh for the webinar and the Notebook is a great resource and ready reckoner with all the requisite tips.                                                                                                                                            One clarification on the Hyperparameter tuning as below is requested here... For ex. i did cross validation from a list of values of gamma and arrived at one value x as best parameter and do the next iteration of another parameter for ex learning_rate,fixing gamma vallue and then fix and do the third iteration for fixing both gamma and learning rate and search for best value of min_child_weight , and so on. In the process what we are getting is best values for these three gamma,learning rate and min_child_weight and will this remain intact for all combinations of other hyper parameters. Once we get the best parameter value we can freeze them for the final model. Do u have any presentation on xgboostregressor?? Thanks in advance...",True
@jimmyrico5364,2020-11-09T14:47:48Z,1,"This is a great piece of work, thanks for sharing it!  Maybe the only additional piece I'd add which I've found useful on the documentation of XGBoost is that one can take advantage of parallel computing (more cores or using a graphic card your machine or you could have on the cloud) by simply passing the parameter (n_jobs = -1) while doing both, the RandomizedSearchCV stage and the setting the XGB regressor type (XGBRegressor for example).",True
@tooljerk666,2020-11-06T04:35:23Z,0,Why do you not use xgb.DMatrix for test/train? I thought that was necessary for XGBoost.,True
@DrlGSN,2020-11-03T08:48:54Z,0,"Hello Statquest, thank you for this amazing tutorial. I just have one quick question on this. For One-Hot-Encoding, do I need to drop one categorical class for each categorical feature like what we are supposed to do in Linear and Logistic Regression?",True
@tooljerk666,2020-11-02T03:23:19Z,0,"When using the model on new, unknown data, do you put the new data through the same process of changing strings to nums, or do you use the transformed values, like they were used with dummy values. Do you instead gather a number of the new data points and go from there? Also, why wasn't the DMatrix attribute used?",True
@yogeshbharadwaj6200,2020-11-01T11:41:45Z,0,"Hello Sir, Thanks a lot for the video with step by step very detailed explanation. Have a doubt, understand that from data science models we can do predictions, eg like in this video we tried to predict whether customer would stop taking company service or not, but does model answers (or provides info) about what were the main reasons due to which customers are deciding to stop taking service i.e which inputs datapoint/observations are the main drivers of predictions. Reason to ask this question is, in practical scenario when we do such customer churn predictions and present it to senior leaders/Management, the question from management will be, do we know what are the top 3 reasons why our customers would decide to stop taking our service ?  Sorry for lengthy question, but got this doubt when I was thinking about how management would react when we present such predictions from model. Thanks in advance and for the awesome video once again.",True
@yoniziv,2020-10-31T13:21:58Z,1,Triple Bam! thanks for your great tutorial,True
@tas3159,2020-10-29T21:34:43Z,0,Thanks for that very clear tutorial.  A question. On 21:25 why do you use loc and not iloc.,True
@danielmagical6298,2020-10-19T10:24:46Z,2,"Hi Josh, great job really helpful material as I'm discovering XGBoost just now.   Thank you and keep you great work!",True
@nitishkumar-bk8kd,2020-10-17T10:11:31Z,0,"hey josh , loved your video , very informative  especially the hyperparameters  there is also a parameter ( min_child_weight  ) can u explain what that is ?",True
@tulanezhu,2020-10-16T22:23:28Z,0,This is very helpful. Could you explain how does XGB do multi class classification? Does it use a softmax method or one-vs-rest method?,True
@zheyizhao4865,2020-10-15T06:41:50Z,14,"Hey Josh, I just purchased all of your 3 Jupyter Notebook! I transferred from Econ major to Data Science, it was a nightmare before I find your channel. Your channel shed the light upon my academic career! Look forward to more of the 'Python from Start to Finish' series, and I will definitely support it!",True
@tooljerk666,2020-10-11T20:40:16Z,0,"Great video. I found a similar dataset on Kaggle, but where do you find the dataset used in the video? Tried Googling it but can[t find the exact dataset.",True
@udbharat_official,2020-10-07T05:13:02Z,0,Really!!!... u play tabla ?,True
@dcscla,2020-10-07T00:18:37Z,0,"Hi, Josh, I'm having troubles with this code. I bought the Jupyter Notebook. I'm windows 10 and I'm getting this error :  CalledProcessedError: Command '['dot', '-Tsvg']' returned non-zero exit status 1. [stderr: c'Format: ""svg"" not recognized. Use one of:\r\n  This is in the second to last cell of the jupyter notebook. Any idea about why I'm getting this error after installed and added graphviz to my system path? I have searched a lot, but did not find a solution to this.",True
@abulaitijiang,2020-10-03T02:43:29Z,1,"Hi, thanks for amazing video. How do you know which parameters you tune can help improve predict true positive(people Left) percentage? Is it the metric: aucpr parameters did the magic? Or I am missing something?  Thanks in advance",True
@user-tz9sr4fy1z,2020-09-25T06:51:58Z,0,I'm still stuck downloading xgboost The code you said (and any other code I found on the internet) does not work for me..ideas?,True
@Jopapy09,2020-09-19T09:37:31Z,0,"@StatQuest with Josh Starmer    what do you think about this discussion https://github.com/szilard/benchm-ml/issues/1 It seems that one-hot encoding isn’t necessary for tree-based algorithms, but you may run into a problem using this on linear models. I personally find ordinal encoding is more than sufficient and it significantly reduces your memory footprint if you have quite a few categorical features.",True
@levongaloyan7079,2020-09-16T09:14:37Z,1,Thank You,True
@narendrasompalli5536,2020-09-14T06:09:31Z,0,Sir can you please do a video on stacking algorithm,True
@sreejaysreedharan4085,2020-09-03T20:30:06Z,1,Lovely and priceless video Josh...BAM BAM BAM as usual !! :) God bless. .,True
@aaltinozz,2020-09-02T19:45:09Z,1,all week searched for this thank u very much <3,True
@anuradhadas8795,2020-08-29T04:56:28Z,0,Great Video!! One query though.. Why is one-hot-encoding not for logistic and linear regression?,True
@quasenerd5476,2020-08-27T18:36:12Z,0,"Excellent tutorial! Thank you very much  27:52 you mentioned that it's not proper to convert categories to numbers. The same applies even when the categorical data in question is naturally ordered? (such as income classes, where the next class always has a greater income level)",True
@satria5403,2020-08-25T15:24:40Z,0,"Hi Josh, great video as always.  Will support you with buying the Notebook. I wonder if you can walk through us building XGBoost model using spark?",True
@megalaramu,2020-08-25T10:42:56Z,0,"BAM!!! Another awesome stat. But josh one question though. While replacing the missing values with 0, just because it was categorical replacing with 0 helped us identify exactly which is missing, incase the column or the feature having missing value is numeric then as well replacing the missing value with 0 is a good idea ??",True
@queueoverflow,2020-08-23T14:53:57Z,0,I thought you were going to write a XGB from start to end...,True
@darksoul1381,2020-08-23T11:08:02Z,1,I was wondering how to find stuff regarding dealing with actual churn data and sampling issues. The tutorial addressed a lot of them. Thanks!,True
@haskycrawford,2020-08-21T22:47:39Z,1,I love the channel! Eu aprendo + aqui do que a Graduação! You great josh!,True
@obadajabassini3552,2020-08-20T16:19:30Z,0,We need more advanced statistics content :) how about stochastic processes e.g. Brownian motion. A lot of us would like more complicated topics to be explained by you :),True
@Fressia94,2020-08-20T15:13:19Z,1,many thanks to your great and so understandable video. It literaly helps me a lot in Python and XGBoost package,True
@andrewnguyen5881,2020-08-14T19:45:54Z,0,"Again another quality video, I was following along with your every word, which did bring up come questions: 1. When XGBoost deals with missing data, does it ever consider splitting the missing data in half?    --Using your example, would it ever do 1 blue and 1 green? What would happen if XGBoost encountered a data set with alot of missing values?                                                         2. When you ran your Cross-Validation, was there a reason you only used 3 values for each hyperparameter? Could you have done more if you wanted to? 3. When I ran my Cross-Validation, my scale_pos_weight didn't change even though I used the same parameters you did. What do you think the problem could be?",True
@godoren,2020-08-13T20:40:13Z,2,"Thank you for your job, the explanation of the topic is very clear and transparent.",True
@Krath1988,2020-08-13T17:51:20Z,102,"Liked, favorited, recommended, shared, and sacrificed my first-born to this video.",True
@azecem6187,2020-08-13T16:20:45Z,1,Thanks a lot Josh!,True
@RahulVarshney_,2020-08-13T11:58:54Z,3,"""25:36"" that's what i was waiting for from the beginning...Truly amazing.. You are providing precious information..CHEERS",True
@jessehe9286,2020-08-13T07:03:40Z,6,"Great video! Love it!  request that you do a comparison of XGBoost, CatBoost, and LightGBM, and a quest on ensemble learning.",True
@diegorueda3991,2020-08-12T19:28:41Z,0,"Hi, I have followed this tutotial step by step, but, when I get to the part of modelling, I keep gettin the following error message: ""'DataFrame' objects are mutable, thus they can not be hashed.""  Does anyone knows what this could be?  Something I've noticed is that when I use the function ""get_dummies()"", the dtype of the resulting columns is ""uint8"" instead of ""int64"" or ""float64"".",True
@MarshallDTeach-yr2ig,2020-08-12T14:56:19Z,0,Backpropagation please sir 😭😭😭,True
@fgfanta,2020-08-12T13:42:34Z,0,"This is gold, thank you! I am a rookie of this stuff, still I am unsure one-hot encoding is the best to do, especially to encode the city; being a category with high cardinality, all those variables for 1-hot encoding will require many splits (I guess). Perhaps using a different encoding, like mean encoding or frequency encoding, would be better, may allow to have a good fit with fewer splits.",True
@yurimartins1499,2020-08-12T13:27:04Z,1,"Thank you Josh!! As a suggestion, you could do a StatQuest explaining the measures in market basket analysis?",True
@learnmandarinwithkaili1102,2020-08-12T01:57:12Z,0,play at 1.25x would be better,True
@kojsbarv,2020-08-11T11:37:46Z,0,"Love your work and a great webinar! Just one nitpick, you are not setting stratify to y for yes but passing it the target labels array. https://youtu.be/GrJP9FLV3FE?t=2279",True
@TheDhrv04,2020-08-11T11:15:32Z,1,Quadruple Bam !!!!!!!!!!,True
@KukaKaz,2020-08-10T04:48:02Z,5,Yes pls more videos with python❤thank u for the webinar,True
@danielpinzon9284,2020-08-09T23:48:58Z,1,"Love u Josh.... you are a TRIPLE BAM!!!  Greetings from Bogotá, Colombia.",True
@ketanshetye5029,2020-08-08T10:40:07Z,1,"could not help u with money right now , but i watched all the adds in video , hope that helps u financially . love u videos . keep up!!",True
@julieirwin3288,2020-08-07T20:27:32Z,3,What did we do to deserve a great guy like Josh ? Thank you Josh!,True
@saeedesmailii,2020-08-07T17:49:30Z,2,"It was extremely helpful. Please continue making these videos. I suggest making a video to explain the clustering with unlabeled data, and predicting the future trend in time-series data.",True
@Beyond90Days,2020-08-06T17:36:03Z,1,41:38-41:39  hahahahaha that was quite innocent mistake,True
@geoffreyzhang,2020-08-06T12:07:03Z,2,"I like your videos. Just one comment here. Most of time it is not good to use true test data as your validation data set. That is kind of ""treating"".",True
@parismollo7016,2020-08-06T11:27:52Z,3,I haven't watched it yet but I know this will be great!!!!!!!! Thank you Josh.,True
@abhinaym5923,2020-08-05T20:07:48Z,4,I am purchasing the Jupiter notebook to contribute to your work! Thanks a lot for this video! You are awesome! Will be very very happy to have more ML tutorials and thank you Josh!,True
@dagma3437,2020-08-05T19:55:30Z,0,I'm so glad you are a bad-ass stats guru and a teacher waaaaaaaaay before a singer and a guitarist ...Thank you! ;),True
@robingutsche1117,2020-08-05T18:14:35Z,0,"Dear Mr. Starmer, thanks for this amazing video once again. Could you explain why you use logistic regression as the objective parameter of the XGBoost classifier? Thanks and best regards",True
@OrionEx88,2020-08-04T18:35:58Z,1,"Thank you for this great video! By the way, do you have the link to download the dataset?",True
@anggapradikta1050,2020-08-04T08:04:12Z,1,Nice guitar,True
@hollyching,2020-08-03T22:56:52Z,0,Thanks Josh for another GREAT video! Just some sharing and minor questions. 1. try pandas_profiling when doing EDA. I personally love it. :) 2. some features are highly correlated (eg: city name and zip code). Do we need to handle that before running XGB? 3. Why choose 10 for early_stopping_rounds 4. What’s the difference between  - df.loc[df['Total_Charges']==' '] - df[df['Total_Charges']==' '] 5. What’s the difference between  - y=df['Churn_Value'].copy - y=df['Churn_Value']  Many thanks in advance!  H,True
@redaterjani8323,2020-08-03T17:00:48Z,0,"Hi, thank you for this amazing webinar. I have one question : Does Xgboost perform better with LabelEncoding than One hot encoding ?  I did some research and I find that one hot encoding is more adapted to linear models like ( linear regression, SVM .. ) and perform worse with tree-based models ( RandomForest,Xgboost .. ) Can I have some explanation ? Thanks in advance",True
@ramons.g5135,2020-08-03T11:50:13Z,0,"Hi Josh, great video as usual!   Just one question: when you run GridSearchCV, how do you tell the function how many trees to build? I see that when you use the .fit method in this classifier you can set the ""early_stopping_rounds"" which gives you control on the number of iterations being run, but when you use the GridSearchCV, how do you do this? For instance you know that when you use the GradientBoostingClassifier you can tell it to run ""n_estimators"", but seeing the XGBboost documentation I can't seem to find it anywhere...",True
@arnaiztech,2020-08-03T08:47:51Z,1,Really cool!! BAM BAM BAM!!,True
@Flaming88,2020-08-03T06:49:40Z,0,"Hi Josh,  Question on setting colsample_bytreee in XGBoost, is it will reduce the accuracy since the feature space expend on categorical data due to One-Hot-Encoding? In the end the model fails to evaluate the entire dataset while being trained because setting this parameter will randomly sample the column hence the model fail to grasp the actual context from the data due to One-hot-encoding. Is it doing something like LabelEncoding is much better option?  I am still new, but correct me if I am wrong on my point above.  -Ken",True
@shnibbydwhale,2020-08-02T23:06:34Z,0,"Hi Josh! Loved this video. I had a quick question about OHE vs Dummy Variables. I know that you used the pd.get_dummies method in this video, but this is a broader question about the two methods. I have a decent stats background and I know that when you are doing linear or logistic regression and you need to create indicator/dummy variables, you only need k-1 dummy variables where k is the number of unique categories for a given variable. I noticed that you did not drop one of the returned dummy variables for each column that you got from the pd.get_dummies method to create reference categories for your variables. Is this something that XGBoost handles just fine? And does this work for other common ML algorithms like SVMs or ANNs? Do you even need to create reference categories in ML algorithms? Which of the pd.get_dummies method or OHE generally yields better results? Thanks so much and keep up the great work! Your videos always put a smile on my face, and teach me a few new things in the process!",True
@starmerf,2020-08-02T21:45:07Z,1,Awesome hooray,True
@felixwhise4165,2020-08-02T18:46:27Z,1,just here to say thank you! will come back in a month when I have time to watch it. :),True
@SaurabhKumar-mr7lx,2020-08-02T12:19:05Z,0,"I have been tuning XGBoost for long, but it's like every time I look at your videos I will learn something new. One query on encoding. As per my experience, one hot encoding doesn't add extra information & also increases the feature space. Is it not suggest to use frequency encoding in such cases.",True
@haohuynhnhat3881,2020-08-02T08:53:02Z,0,i hear about category embedding instead of onehot encoding. Can you make a video about it?,True
@Azuremastery,2020-08-02T08:51:57Z,1,Thanks for sharing! Informative.,True
@rrrprogram8667,2020-08-02T08:14:54Z,0,When is xgboost with R coming out??,True
@metasoft0221,2020-08-02T07:00:03Z,0,"Thank you. Hi Josh, can you do the same program for LightGBM too?",True
@haohuynhnhat3881,2020-08-02T06:47:31Z,0,how about  multiple imputation using chain equation MICE? i am learning it for my project right now and i think that it is interesting.,True
@viniantunes5944,2020-08-02T00:42:12Z,4,"Josh, you're the didactic in person form.  Thanks!",True
@damienhood3306,2020-08-02T00:30:23Z,0,Is the Jupiter notebook lesson available anyway?,True
@dbporter,2020-08-01T21:47:31Z,0,could you mix the guitar,True
@theredflagisgreen,2020-08-01T21:33:12Z,1,This is magical.,True
@marceloherdy2379,2020-08-01T21:14:02Z,1,"Man, this video is awesome! Congratulations!",True
@zakkyang6476,2020-08-01T20:28:21Z,2,to check nuniquev value for each column use this: for col in df.columns: print(f'{col}: {df[col].nunique()}'),True
@PradeepMahato007,2020-08-01T20:20:08Z,2,"BAMMMMM !!!   This is awesome 👍 Josh !! Thank you for your contribution, really helpful for new learners.😊😊😊",True
@chiragpalan9780,2020-08-01T19:55:02Z,5,This guy is amazing.                         DOUBLE BAM 💥 💥,True
@arijitdas4504,2020-08-01T19:47:19Z,9,"If ""Stay Cool"" had a face, it'd be you :)",True
@sunnyp3484,2020-08-01T19:12:30Z,0,"Josh, next time you make such videos, please make sure that your cursor is visible. It helps a lot!!",True
@BiffBifford,2020-08-01T18:57:08Z,12,I am not a math geek. I am here strictly for the intro song!,True
@huseyin405,2020-08-01T18:29:07Z,2,Baaaaaaaaaaaaaaaaaaaaaaam,True
@MasterofPlay7,2020-08-01T18:23:15Z,1,"wow you are great instructor, very well explained! Are you also familiar with big data such as apache spark?",True
@ashrukhtf3183,2020-08-01T18:17:00Z,0,I am unable to open url to download jupyter notebook,True
@NoOffenseAnimation,2020-08-01T18:14:30Z,2,I'm early! BAM!!!,True
@RahulEdvin,2020-08-01T18:13:45Z,10,"Josh, you’re well and truly phenomenal ! Love from Madras !",True
@statquest,2020-08-01T18:13:24Z,50,NOTE: You can support StatQuest by purchasing the Jupyter Notebook and Python code seen in this video here: https://statquest.gumroad.com/l/uroxo  Support StatQuest by buying my book The StatQuest Illustrated Guide to Machine Learning or a Study Guide or Merch!!! https://statquest.org/statquest-store/,True
@FlexCrush1981,2020-07-17T20:56:01Z,3,Very enjoyable webinar Josh. Thanks for posting. I'm not 100% sure how to interpret the leaves. The largest leaf value is 0.188 where Dependents_No<1 is true. Does this mean customers who fall into this category are the ones most likely to churn out of all the other combinations?,True
