author,updated_at,like_count,text,public
@Allyheartzz,2019-03-14T14:18:02Z,0,"Can't you create, and open the file before the for loop, and then close it after the for loop?",True
@xahin96,2019-01-10T11:17:27Z,0,"Sentdex i need your help for the following situation: I have a excel with multiple rows where some rows starts with ""##bla bla"". I want to simply delete these entire rows !",True
@chandus2496,2017-04-25T19:00:35Z,1,Why are we opening the file over and over? Can't we just open it once with 'w' instead of 'a' and get the same thing?,True
@manachovas,2017-04-03T03:10:10Z,0,"Hey +sentdex,  How can I choose the lines that will be saved to the new CSV? Let's say I just want to include rows where the arb value is greater than 5, for example.",True
@sescalaster,2016-09-14T13:53:10Z,0,"Hello, great video. I'm trying to get my script to read through multiple csvs in a folder I got. I'm just starting out with the script but I'm already getting an error message:  import pandas as pd import numpy as np   path = r'C:\Users\Sergio\Desktop\Agricien\Taboga_sugar_cane' with open(path, 'rb') as csvfile:       def main():         wavelength, reflectance = np.loadtxt('cana_5000000.asd.txt', delimiter=', ',unpack=True,dtype='float')  main()  ## This is the error ''' PermissionError: [Errno 13] Permission denied: 'C:\\Users\\Sergio\\Desktop\\Agricien\\Taboga_sugar_cane'",True
@serdip,2016-01-08T13:49:27Z,0,"Great tutorial! Thank you for posting this information.  Why would you put the commands to open and close the output file inside a loop? Isn't it better to open the file before the loop and close it once the loop has terminated?  Also, to address the issue of the final \n, could we put the \n at the beginning of each line except the first one? For example   saveFile = open('newCSV.csv', 'a') x = 0 for eachDate in date[-1]:    if x = 0:       saveLine = eachDate + ',' + rate[x] +',' + arb[x] + str(int(arb[x]) + 3) else:      saveLine = saveLine + '\n' + eachDate + ',' + rate[x] +',' + arb[x] + str(int(arb[x]) + 3)  saveFile.write(saveLine) saveFile.close()",True
@lavanyaaddepalli,2014-07-01T13:00:17Z,0,"saveFile = open('newfile.txt','a') is showing syntax error  and i am also tryin to open a text file which has .dat extension is size is more than 1 gb",True
@orionbay1017,2014-02-10T23:58:51Z,0,"Hi! If I have a csv file including 3 rows for x y z. These are the names of files in 3 diff folders x, y, z. How can I write a code to tell python to loop through the values in the csv file and then copy the files with the corresponding names from x, y,z folders into my working folder, rename them into a, b,c  ; use those files to do something then replace them with the new files but still name them a, b, c."" I guess this pretty complicated.",True
