author,updated_at,like_count,text,public
@Thisisrealfia,2023-12-28T06:11:14Z,1,"somehow this video very related to my condition and situation at the moment, unless that ""amnesia"" for sure 😆 thanks for givning best tips, Alex!",True
@mumpodaaman,2023-12-28T03:52:43Z,0,"Hi, how to do the projects",True
@Gameboob,2023-12-28T01:12:50Z,0,"1:07, starts",True
@irhusker6569,2023-12-27T19:06:40Z,1,"Hi Alex, how long did you work as an analyst?",True
@dallysinghson5569,2023-12-27T17:54:22Z,0,Would help to explain how one gets to play around with Tableau without paying through the nose.,True
@rusanmoments,2023-12-27T16:37:34Z,0,Thank you Alex,True
@taetae7778,2023-12-27T14:56:07Z,1,"Do Data Analysts work typically alone? Like other than interacting with Data Scientists and stuff?  I’m a Developer and I’m used to working with other devs, so I’m a bit scared about having to work all alone",True
@husseintarek3358,2023-12-27T14:25:13Z,0,Nice,True
@ayubkhan-ks2mv,2023-12-27T13:19:22Z,0,Do you think AI will take entry level positions of data analyst?,True
@EggheadAssasin,2023-12-27T13:17:13Z,0,I needed this. Thank you so much,True
@user-ql5bc9od9t,2023-12-27T10:48:49Z,0,can i have 30 m talk with alex,True
@Trionyxification,2023-12-27T07:12:36Z,0,"Hey Alex, what's your name on LinkedIn?",True
@davidchait367,2023-12-27T06:30:17Z,3,Thanks for the video. You briefly mentioned verticals like finance or healthcare. I don't think you've done a video on verticals. Would you be able to? 😊,True
@cynthiaryu5628,2023-12-27T04:51:29Z,0,"Hi Alex, when are you going to offer discount with you bundle course again? Thanks!",True
@christopheratkinson635,2023-12-27T04:15:01Z,5,"@AlexTheAnalyst how long would you estimate it takes to learn those basics (SQL, Excel, Tableau) for someone working full-time ~52 hours a week? The 2 month goal mentioned would be a bit lofty 😊",True
@enohdataanalystgirlie,2023-12-27T03:27:30Z,0,Can you make a playlist based on this recommendation please 🙏🥺,True
@veronicambah7108,2023-12-27T01:31:52Z,0,"I am interested to become a data analyst this 2024 but am from a zero background, need help.",True
@andh2627,2023-12-27T00:15:11Z,0,"Hey Alex, thoughts on CodeAcademy?",True
@yon_draper,2023-12-26T23:13:35Z,0,Great video. Thanks Alex!,True
@Chinekeh,2023-12-26T23:01:10Z,0,Cloud Platform? Can you explain?,True
@slapto,2023-12-26T21:41:36Z,30,Thank you for everything you're doing for the community Alex! Im tapped in and will become a data analyst in the next 6 months.,True
@mohanadzidane9292,2023-12-26T21:25:14Z,1,"Amazing, As always",True
@jeremyv12,2023-12-26T20:27:42Z,32,"Appreciate you making a video about this Alex!   It's been 4 months and I've completed the courses/Projects for PowerBI, Excel, Tableau as well as the Coursera Google Data Analyst Certification.   I'm on a week vacation and I was overthinking and wondering what I should be doing next and this gave me some direction on where to go. Finishing up my portfolio/ resume page and the SQL questions next!",True
@rexhua4833,2023-12-26T18:01:39Z,0,This is a Christmas gift that came late. Or is it my Amnesia.,True
@martinjavierconti4639,2023-12-26T17:52:43Z,0,"I had  that three skills, SQL, Excel and Tableau and i dont get a Job xd",True
@daltonbay6295,2023-12-26T17:44:45Z,2,please which laptop do you recommend for someone starting his data science journey ?,True
@ruben6372,2023-12-26T17:42:08Z,10,i am very new to data analytics. thanks for the video. my 2024 number 1 goal is to learn data analytics.,True
@tahmidimamraad,2023-12-26T17:03:37Z,788,"Summary: 1. Learn Excel, SQL, Tableau or any BI tool and all of these should take around 2 months to learn 2. Do projects on those (2 on SQL, 1 on Excel and 1/2 on Tableau) 3. Build a resume and add projects and skills on the resume 4. Work with a recruiter to get job or to maximize your chance to get interviewed 5. Prepare for both general and technical interviews (tech interviews are mostly on SQL) 6. Lean any Cloud platform and AI if you have more time",True
@felipepereira3061,2023-12-26T16:15:43Z,0,IMHO there are 2 more thinks: Learn an ETL tool and get certifications,True
@Ajithra-zv8eu,2023-12-26T16:00:37Z,3,Can you make a video on DIY data analyst curriculum on coursera like you did in 2023 or can I follow that DIY curriculum in 2024 as well?,True
@kimiya.r.n,2023-12-26T15:41:16Z,12,"I agree with the skills you named in this video to be needed in the jobs, but I see a lot of people who are graduated with computer science degrees, or studied data science in bootcamps and now all of us are applying for the same jobs. Although in reality maybe the job needs only Excel and SQL, I feel like in the competition with those guys we have no chance with only the skills you mentioned.",True
@adeagboadelekanbenjamin9497,2023-12-26T15:07:10Z,4,Thank you for this video. I just bought bundle course on Analyst Builder.What a beautiful way to prepare for 2024!,True
@nelsonugwuagbo1214,2023-12-26T14:56:15Z,258,"Hello Alex, thank you for all you're doing for the newbies in the data analytics community.   I want to become a data analyst and I've started following tutorials on your channel, especially your 70 videos data analytics bootcamp.  I'm really committed to learning and practicing as much as I can believe before the end of 2024, I will land a role as a data analyst.  I'll come back to quote this comment when I finally land a job.  To everyone who is starting the journey to become a data analyst in 2024, I wish us all good success.  Once again, thank you Alex",True
@somaansa939,2023-12-26T14:45:02Z,1,Thanks Alex!,True
@mohamadafreedpasha8820,2023-12-26T14:31:19Z,0,I appreciate your Idea to help with learning The Data Analyst.,True
@mohamadafreedpasha8820,2023-12-26T14:25:59Z,0,So good idea to teach the Data Analyst sir.,True
@devgupta8657,2023-12-26T14:19:38Z,0,Would love more SQL content from you ..,True
@mohammadadil9544,2023-12-26T14:06:42Z,2,"if someone is want to become a data analyst after a 6 year of gap, what he/she will do?is it possible?",True
@DarkRaviForDeath,2023-12-26T14:03:49Z,3,"I just want to complain a bit here. I have a MSc in math and finished it two years ago from today. This mean's I've been job hunting for two years and am completely miserable stuck in my parents house. I've tried everything and more that you've mentioned above, including reaching out to recruiters, cold applying, asking for virtual coffee chats, building a presence on LinkedIn, etc.   Just this year I've applied to over 1000 jobs now with only 1 interview, which was a senior data scientist position if you can believe it. I guess senior positions have less competition - starting to think its better to upskill to a mid level now and then go for those jobs and senior positions since entry level isn't a thing anymore.   I did a bootcamp too but of course they are all mediocre at best. Honestly, after recently seeing a random youtube video of a 19 year old lie on his resume and get a job, I'm not gonna lie and say I'm not tempted to do this at this point. I am in Canada though, if that makes a difference. We do have some immigration issues it seems.",True
@NeduTeaches,2023-12-26T13:46:52Z,0,"Thank you, Alex. This is detailed",True
@vishaljhaveri7565,2023-12-26T13:44:33Z,0,2 sql 1 excel 1 2 in tableau.,True
@chanukamadusanka7442,2023-12-26T13:42:09Z,9,"I started to learn data analytics tools from your chanel and right now i have gained a lot of knowledge like excel,power bi,sql,python.thank you so much ❤️",True
@liliasara4489,2023-12-26T13:40:11Z,1,Thanks😊,True
@hashimkhan9907,2023-12-26T13:38:47Z,0,i'm  SQA but now i wanna switch to data analyst,True
@mohamedsheik1905,2023-12-26T13:37:38Z,1,"Hey Alex - thanks for posting this. I am intermediate in Excel, Tableau , and SQL. I am starting a data analytics masters program in January and the focus is on Python. What would you do if you were in my shoes?",True
@mugomuiruri2313,2023-12-26T13:28:49Z,0,not bad,True
@johnkuczmanski6012,2023-12-26T13:28:06Z,1,"When looking for our first job as a data analyst, should we look for an office job with many co workers or is it possible to get a remote job?",True
@HumanPediax,2023-12-26T13:26:44Z,0,"Hi alex! your content is very helpful, and i am waiting for you data analyst using macbook.. coz my blocker right now is using mac... very excited ur upcoming data analyst using macbook! Thank you and Merry Christmas  🎄",True
@user-pq2em2ck3x,2023-12-26T13:15:59Z,2,God bless you Alex. I have learnt a lot from your channel,True
@sawendalbshar8875,2023-12-26T13:14:35Z,8,"Thank you Mr. Alex I started following you more than a year ago and I am learning a lot and a lot from you and the most amazing thing is that my English has become very strong by watching and learning  from you it's great to develop in many ways by Education, watching and training  but I have a request from you to have a pdf file It includes a roadmap and video links to become a data analyst that you all love and appreciate",True
@CRIME_MASTER_GOGO_,2023-12-26T13:13:31Z,0,Merry Christmas Alex 🎄 🎄 🎄 🎉🎉🎉,True
@ganeshgani3325,2023-12-26T13:02:42Z,1,Suggest some freelancing tips in data analysis sir,True
@MrShaahG,2023-12-26T13:02:22Z,130,This video was needed with the new year around the corner and with people thinking about their resolutions,True
@s...2581,2023-12-26T13:00:56Z,1,First view and comment ❤,True
