author,updated_at,like_count,text,public
@noraiz5105,2024-05-28T18:42:00Z,0,Add visualizations also. You are a data analyst 😢,True
@westernfreedom5031,2024-05-20T22:11:50Z,0,I am 51 white male and retired military intelligence. should I abandon all hope? I know HR hates my kind.,True
@lawrenceheung7920,2024-05-20T02:41:24Z,0,Any online course to advise as a start ?,True
@tomasm329,2024-05-09T00:04:05Z,0,"Hey Alex, thanks so much for your vids.  Learned so much so far but still scratching the surface.  Any thoughts on data analytics skills for specific industries? Healthcare for instance?",True
@alibabaalided,2024-05-05T16:01:00Z,0,❤❤❤Thank you !❤❤❤,True
@henry-zh3rv,2024-05-01T13:51:20Z,0,"Hi Alex, I am planning to become a data analyst within the next one year. I am learning Python and R at the moment. I intend to learn SQL, Tableau and power BI as well. I must confess I feel quite overwhelmed sometimes as it feels like there is a lot to learn but I want to keep working at it. I will work through your videos on the data analytics bootcamp. Thank you very much for making many fulfilled across the world",True
@justinaadk5081,2024-04-26T03:49:51Z,0,Does this mean a traditional education isn’t necessary?,True
@Pewpewmaya,2024-04-12T23:21:36Z,1,Alex is there a specific boot camp you can recommend? I work a full time job with horrible hours which really get in the way of trying to learn on my own without direction.,True
@CultureFit-ms7vs,2024-04-10T22:09:27Z,0,"I've seen a lot of Excel courses on Udemy. I'm not sure which one to take. Do I need to take just General Excel or focus on Excel for the Data analyst? Also, can you attach the link for the Excel course to take through Udemy or Google certificate, please?",True
@vanessalewis1449,2024-04-10T16:55:59Z,0,Thank you Alex! I am seeking to transition from technical support roles into data analyst roles. I am going to follow your suggested path of learning SQL and Tableau. I have Excel on my resume already but I need to brush up and create some projects. Thank you very much for these tips!,True
@mahhingaminggate5028,2024-04-09T13:00:28Z,0,What a Beutiful Guy you are,True
@TheDailyDose2910,2024-04-08T02:34:57Z,0,I’m currently studying bachelors in business administration! So what should I major in?,True
@beadsbyrosy1033,2024-04-03T17:53:24Z,0,"Alex thanks alot for this video, i have been having difficulty with where to start my learning from. Thanks again",True
@geekatari4391,2024-03-30T02:39:42Z,0,What are the chances of landing a remote job as a self-taught data analyst?,True
@Y_uel49,2024-03-27T16:12:31Z,0,Like this video was done for me... Thanks alot,True
@emankhaled3431,2024-03-25T06:27:34Z,0,See you after 6 months,True
@kylamulvanity7706,2024-03-23T17:03:38Z,0,Thanks for the video and information I’ve been thinking about data analytics for a wile I work as a pre school teacher and looking for a different career path I have no experience in data analytics and just started the google data analytics certification course .,True
@mrmurtol2281,2024-03-23T16:05:33Z,0,"I'm a 46-year-old gardener, but I am looking to get in a career with better money and more prospects. I don't really have any IT skills, would I be able to pick up the skills necessary to retrain in data analysis?",True
@realcirno1750,2024-03-19T19:19:35Z,1,yeah if i were reviewing a guy's resume and his experience is just some project he did in excel i would just throw his shit right in the trash the guys who actually have masters or bachelors in statistics or data science are being laid off and they need jobs bro you arent gonna beat them with youtube university knowledge,True
@realcirno1750,2024-03-19T19:14:05Z,0,bro you need to learn statistics otherwise ytou dont know anything💀💀💀💀,True
@bobby45825,2024-03-15T21:28:42Z,0,"Any job that depends on me knowing programming is instantly wiped off my list. Programming is a very micro task. I like Macro tasks, like network administration or handling hardware.",True
@askaralipattani8222,2024-03-09T08:04:44Z,0,Loved it !! Thank you ❤,True
@RaoulMofor,2024-03-08T21:01:21Z,0,Thank you so much Sir Alex your video inspired me and encouraged me to keep tte candles light,True
@maurine3553,2024-03-08T11:10:45Z,1,"Im gonna leave this here to look back to when i make it.  By july this year. I will have mastered excel, sql,  tableau l and python. By the end of this year i will have landed a data analytics role. By the end of 2 years i will be will be a data scientist. Help me God 🙏🏾",True
@danyellefoster4188,2024-03-08T04:24:47Z,9,"1. Research what an analyst does  2. Research the skills : SQL, Excel, Tableau to start. Learn more later. 3. YouTube University is free. Udemy, Coursera, and *Analyst Builder* for more in depth learning.  4. Create portfolio and projects 5. Create resume  6. Work with a recruiter(s)- better tactic than just submitting many resumes  7. Nail interview and get the job!",True
@obed_m16,2024-03-01T19:26:12Z,0,Opinion: Working with a recruiter seems work only in the West. I have reached to numerous of them but all in vain - since they don't respond.  The only option I have is to go the traditional way and launch the Freelance journey to chase my passion.,True
@Hesilo14,2024-03-01T13:54:53Z,0,I really wished your courses were free i am from nigeria and we cant even pay for things in dollar  any solution,True
@VAIBHAVMALHOTRA19,2024-02-29T13:44:46Z,1,Thank you so much for this video. I was getting frustrated for several days now I feel relaxed.,True
@deepagosai9862,2024-02-29T12:30:06Z,0,Hi. Thank you for the information. Do we need to have a Bachelor Degree first to become a Data Analyst?,True
@t3t0fifa,2024-02-27T00:20:55Z,0,Serious question. I’m starting to look more and more into this career pathway. I have no college degree but I’m willing to learn and put in the work. Is it realistic of me getting a job with no degree? Any advice would be greatly appreciated,True
@sarahnachia2654,2024-02-24T14:28:08Z,0,🎉🎉😢😢😮😮❤😅😊,True
@sarahnachia2654,2024-02-24T14:26:33Z,0,I love the video thank  you sir 😂😂😂❤❤😊😊😮🎉,True
@Zat898,2024-02-22T03:15:56Z,0,"Hi Alex, thank you for your great video ❤ I just changed career to data science field but I am zero in math and programming. On 2023 I got an advance diploma in Data science still I don’t have any real work experience in data analytics. I watch some videos on YouTube but still I am not confident enough 😢 my background is in research and administration, totally different thing. Do you think what I did was correct?",True
@PatienceAnyim,2024-02-20T16:15:27Z,0,"Thank you Mr Alex for your great work.... please I just get to know about data analytics and I am interested in learning more about it,a beginner....I hope i am able to learn more on your channel.",True
@shovabaral2797,2024-02-20T15:21:49Z,0,"Hello, how i can contact you in person?",True
@AliAli-li4ys,2024-02-20T08:22:33Z,0,Great video. Please provide a discount code for your website.,True
@Paul-yq5ym,2024-02-16T17:14:59Z,0,"Thanks for the video. Looking for a data analyst role. I am a Sr Data Engineer with 25 years SQL experience, MS in data science, proficient in python. Will check out Analyst Builder.",True
@divyamnigam2070,2024-02-15T23:22:05Z,0,"Hey Alex, I am 23 years old, I am doing MBA and my bachelor was Engineering Physics, I am good in math and with numbers and particularly in stats, I am thinking of pursuing data analyst job and end goal would be to become a data scientist. I have no previous experience, I know basic excel and python.  I want to start learning to be data analyst but I fear I wont find a job and I will get demotivated. Should I pursue to be a data analyst?",True
@user-ff9et7bw8h,2024-02-15T22:29:28Z,2,Thank you Alex....,True
@jamesm.3967,2024-02-15T19:26:15Z,0,Thank you. Liked and subscribed. 😊,True
@dianasilva6996,2024-02-15T14:51:15Z,0,What shoud I choose to learn? Tableau or Power BI?,True
@talalkhan359,2024-02-14T16:05:16Z,0,Is there anyone that wants to start learning about data analysis and knows the correct or beginner path to do it? cuz I need some guidance,True
@user-zd3pq2tv3q,2024-02-14T04:52:37Z,1,"I have an experience in Sales overall of 4 years, earning in between 55k to 60K INR if I learn such skill will it help me to switch my career to Data Analysts?",True
@im5610,2024-02-13T21:31:32Z,0,"Hey Alex please make a new video of your thought about data future. Where’s all this thing going. Layoffs not ending, AI, market job cutting. Looks like the future will be in one man band.  The guy who can do almost everything for the medium wage",True
@apamwamba,2024-02-12T16:47:37Z,0,Python??,True
@joseO12326,2024-02-10T21:42:07Z,0,Is there a free Tableau or should i just keep working on PowerBI?,True
@nathanieljosephgutierrez,2024-02-09T22:55:17Z,1,"Thank you so much for providing such a wealth of resources. I've already signed up for the website and I'm really excited to dive into hands-on projects for SQL and Python. Rest assured, I won't disappoint you!",True
@gregvivian3474,2024-02-09T21:48:12Z,0,"As a beginner, which of your videos is an introduction",True
@insanegaming8238,2024-02-07T17:26:51Z,0,"Hey sir This video is really helpful for me as I am thinking for majoring big data analytics in the near future it cleared all my doubts and every question I had  Also I would really need your help here as in is there any community of data scientists or like a discord server or something like that where I can meet experienced and skilled data analyst like you and have a good talk about the topic.  Thank you!!",True
@olajokesjourney,2024-02-05T22:03:02Z,0,Hello everyone…What would you recommend for a beginner data analyst or cybersecurity to go into? Which pays more and is more marketable?,True
@Osiriscribe,2024-02-05T07:56:21Z,1,Tableau costs 900 dollars xD im poor bro,True
@sigliph7697,2024-02-04T13:34:37Z,0,"Alex, there are no jobs! What's the point",True
@emraholga,2024-02-03T16:04:54Z,0,Harika bir paylaşım tebrikler,True
@OUNVictory,2024-02-01T03:53:35Z,1,I'm planning to change my career to this,True
@miguelsoares3680,2024-01-31T23:27:29Z,1,I will begin this tomorrow and see if i get a work in a year because i work 7h of work so i have a bit less of time to study,True
@AlejandroSanchez-vg7hf,2024-01-31T16:25:42Z,0,My question is do people without the degree get hired after taking a boot camp ?,True
@Alex-bd4ov,2024-01-31T03:56:04Z,0,Where do you learn this thing from?,True
@temitopedacrownfit,2024-01-29T19:26:06Z,0,I'm glad I found this video. I was very confused and trying multiple things together but now I know what to do.,True
@ArifAli-hg1eq,2024-01-28T22:12:19Z,0,Thanks Alex for well delivered great info.,True
@Sara11014,2024-01-27T12:55:32Z,1,شكرا لك، تحدي هذه السنة هو تعلم تحليل البيانات ❤️‍🩹 سأفعلها,True
@abdufaza954,2024-01-26T21:15:44Z,1,"Hello there ,  So I got data analysis and visualization using power BI nano degree from udacity. If I want to build up from there, what do u think I should do ?  Even if I have to get some affordable courses.  Thanks 🙏",True
@Charlesanalyst,2024-01-26T04:57:08Z,0,"❤Alex you are wonderfully made, thanks for this video",True
@monamonicat,2024-01-24T11:12:05Z,0,"Hi Alex, thanks for the video. It helps to visualize the pathway to start becoming a data analyst. Cheers to you!",True
@stewartdavis7562,2024-01-24T03:39:32Z,0,"Hi Alex, Would you know how to download SQL if you have a Mac? I am having trouble figuring it out",True
@anyiwo9,2024-01-23T20:29:26Z,0,I only got 6 months left to make it happen. Got to save this,True
@muhammadkashif9996,2024-01-21T23:58:13Z,1,Its been few weeks since I have started Learning R and I find it interesting but a lot people are pushing me to go for. Python what do you suggest on this?,True
@sg44eggeg,2024-01-19T13:54:23Z,4,"Since I saw you last year, I’ve completed the Google Data Analytics Certificate, and I am on the capstone for the Advanced Certificate. First education I’ve completed, hopefully I can get it together to become fluent enough to pass interviews. They were difficult for me to retain enough to pass with aid, but maybe now a second pass will bring me where I need to be.",True
@Mr.Arshad-oc1fd,2024-01-19T05:30:37Z,0,How much hours will be possible to get Data analyst goal,True
@stephenpeterwandera9176,2024-01-18T09:34:56Z,0,"Amazing video. I’ve used Power Bi, Python and R and I feel like I need to go back and refresh. This was so needed. Thanks mate.",True
@TrashPanda57,2024-01-17T15:51:33Z,0,Imagine forgetting everything other than wanting to become a data analyst. Then you watch yourself teach you things. Would be mine boggling.,True
@Jill_Liu,2024-01-17T11:17:14Z,0,GREAT THANKS VERY CLEAR AND INFORMATIVE VIDEO. APPRECIATE IT ALL.,True
@MsHaynez,2024-01-16T20:18:51Z,1,"I just purchased the excel course and I’m looking for the files to go along with the tutorials, did I miss something l? Especially for the project or am I supposed to create my own files?",True
@juandavidperalta9869,2024-01-16T14:16:19Z,0,"When you are in the interview, how do you show your project portfolio?",True
@toancdu,2024-01-16T09:13:08Z,0,"Hello Alex, firstly: I would like to say thank you so much for your share about how to become DA in fastest way. secondly: I am really wanting to become a Data Engineer, could you share with me the way to become a Data Engineer in a fastest way, what I would to study. Thank you so much for your help. I wish you with health and success.",True
@karrietaylor2766,2024-01-16T03:39:44Z,0,so you would not go to university or anything like that? You would just self-study at home even with no knowledge whatsoever? Just curious because i'm thinking about a career change at 26 years old and not sure how i should go about it. Thank you,True
@amarachukwujoyamobi7030,2024-01-15T12:22:52Z,0,Thank you so much Alex for this. 😊,True
@amarachukwujoyamobi7030,2024-01-15T12:22:40Z,0,I’m on track learning all of these and I seriously need study buddies for accountability. I can be quite hard doing it alone. Please hit me up if you want to be study buddies.,True
@nn9762,2024-01-15T12:16:00Z,0,"Hi Alex, I wanted to buy , 20%  code expires, pls if you can extend it",True
@DavidxBessah,2024-01-14T21:06:59Z,0,"Alex, thanks for that insightful brief on sharpening a career as a Data Analyst",True
@jeremydumanski7584,2024-01-14T19:19:18Z,0,"Hey man, I'm 17 years old right now and in my junior year of high school. Realistically, would it be possible for me to get a job in data science by the end of my senior year?",True
@user-io6nu8uc4x,2024-01-14T12:25:33Z,0,thank you very much for sharing Alex!,True
@Kumbirai-bx4gu,2024-01-13T14:38:28Z,0,Do you recommend learning SQL on codeacademy?,True
@semedmemmedov8595,2024-01-12T17:30:12Z,5,"İ've started today ,  let's see next 6 months what'll happen",True
@maryemmdini9408,2024-01-11T14:57:52Z,0,hello Alex thank you for this informative video . but how to find recruiters in Europe does any one try such a method to find a job in data?,True
@Toohottorot,2024-01-11T02:52:58Z,0,This is exactly the video I was looking for. One question though: What resources do you use to keep up with changes in the industry?,True
@ahmedfc8226,2024-01-09T21:03:35Z,0,"Thanks for ur effort, can i  finish ur road map in 2 months considering that i will study for 8 hours a day? I am completely free and plan to take it as full time job. Thanka in advance",True
@user-to2wy5rw8u,2024-01-09T03:43:31Z,0,"This helps me a lot. For someone who wanted to change my carreer, this is a great help. Thank you!",True
@zaydan_diary4434,2024-01-09T03:38:58Z,0,is it still possible to become freelance data analyst after we stop from our main job at age 55 years old?,True
@khizarstudy2095,2024-01-08T11:45:40Z,0,"Hey Alex, can you please recommend a good Python DSA course ?  We all gotta nail those DSA interviews for jobs I know there are 1000+ DSA courses out there but rare any is in Python or just not up to par.  Any recommendations please ?",True
@F.U.E.L,2024-01-07T19:43:42Z,1,Does lying in your resume helps?,True
@TheFrancoF2,2024-01-07T04:21:16Z,8,"Oh my! I'm actually trying a change in career, going from the Army to Data Analytics and your channel appearing in my recommended list is just amazing! I'm taking the Google Data Analytics (beginner) and was a little bit confused to where to go after it.  I'm gonna 100% take a look at some of your courses! Thank you, Alex!",True
@ShowBizJunkie,2024-01-06T05:26:37Z,0,What kind of project in SQL?,True
@wn7616,2024-01-06T00:50:39Z,0,Any feedback for data analyst school or bootcamp that legit and guaranteed placement jobs? Thanks,True
@prosperosayinoma,2024-01-05T17:52:03Z,0,Amazing sir. Can I get the link for downloading my SQL on 32 bits system,True
@raohammadraza7056,2024-01-05T17:12:34Z,0,"Hello Alex : Thank you very much, you have made it easy for me to learn the next steps. You have given me a path. I have watched a lot of playlists on your channel. Thank you so much",True
@joshuakober9001,2024-01-04T17:51:37Z,2,"A Portfolio is something I had never thought of after Graduating.  Having a place to showcase my skills has not only been a gamechanger, but has been a way to help boost my own confidence within the Data World. 😁",True
@activeafk,2024-01-04T15:50:13Z,0,Great video... simple and straight to the point,True
@TheLilliantaylor,2024-01-04T03:43:42Z,9,"The way Alex words things and explains things really just clicks with my brain.   I would love a resume building video that has examples for both the newer individuals to the work force in general, but also for people who are trying to make a career shift after 10yrs of work experience and seeing how to make your previous work still support your career shift. Especially what kind of transferable skills might be worth highlighting.",True
@gabrielabeninibitencourt5950,2024-01-03T23:21:10Z,0,"Hi, i am a lawyer and I don't want to do it anymore and I am really interested in data analyst. But I  don't have any knowledge of mathematics (just basic mathematics) and programming, do you think it's possible",True
@HappyHealthyOutlet,2024-01-03T16:20:28Z,2,Is data analyst still a thing in the world of ChatGPT/AI? Just curious.,True
@stevew4079,2024-01-03T15:07:58Z,1,"Alex, can you tell me what would be different in health? I work in a health department (finance role, not actual health role) but figure it’d make sense to transition to data analytics in the field I’ve been in.   What would be different in the ‘how to get there?’",True
@Triple8z,2024-01-03T13:23:09Z,2,I’ve heard you and many other experts say “build projects” … can you expand on what that actually means?,True
@mahabhiru4108,2024-01-02T12:56:26Z,0,Talking about AI. What need to know is how to put a setting just to make AI work like we need to be. Because when you can overcome AI brain. It will provide you with is more confidential and not suitable to civilian. That what I tough. For me it start with understand on how Operation System work.,True
@tamiratsolomon4655,2024-01-02T12:07:48Z,0,But some said now it is the era of  MLops rather than data science. unless you have all required skills in  MLops it is very difficult to be hired. what do you say?,True
@triplea2443,2024-01-02T00:55:28Z,0,Heyyyy your back!!!😅❤,True
@williammcneill2753,2024-01-01T18:54:24Z,1,"I agree that the skills are essential but Alex omits the requirement to have a network of people who can speak about your work as a data analyst and even more important is domain knowledge. Interview 1 : Interviewer : ‘Looks great, just give us four names of people you have worked with in data analysis and give us examples of projects from work where you implemented (insert company’s domain here) using SQL, PowerBi, Python and Excel.",True
@ernestnzombu1972,2024-01-01T18:10:54Z,0,Hello Alex happy new year to you and your family i want ask a question those prices on your courses on promo is it for one year duration or for a month i am talking about 4 and 6 courses bundles .,True
@successchoco,2024-01-01T12:48:36Z,1,"A friend recommended me here and I'm ready, focused to take this opportunity and make it a success. 2024 is a good year and i will stay focused on learning data analytics",True
@rakeshrs1998,2024-01-01T11:41:04Z,0,"Hi Alex, I'm working on Discoverant, I hope u know about Discoverant. Is there any tips which u can provide me for my growth?",True
@mmmmotivation3348,2024-01-01T08:28:38Z,1,My new year resolusion .... become data analyst in 6 months Thank u Alex for giving me new idea,True
@knw-seeker6836,2024-01-01T07:54:38Z,0,Could you tell me in which way becoming a data analyst differs to a becoming a data scientist?,True
@ryanmagnusson2475,2024-01-01T05:42:00Z,0,"GREAT ADVICE!  Prioritize; Excel, SQL, and a business intelligence software - I just have a lot more experience with PowerBI [over Tableau], plus it comes with MicroSoft Suite so many companies have it.",True
@milanvulic7947,2023-12-31T20:04:33Z,64,"Hello Alex, I cannot thank you enough for these videos here. Before 5-6 months i was just wondering about Data Analyst job, and started practicing excel and sql with these guides. At that time i was teacher of economics in high school in Serbia, and wasn't satisfied with that. One month ago I've landed a Data Analyst job, and guess what, i'm just starded. I want to learn python and dive into machine learning it's really interesting for me and drives me. Thank you a lot mate. Best regards from Serbia. 👋🇷🇸",True
@marvellousanthonyhorsfall6273,2023-12-31T14:35:59Z,0,"Alright, it's 2024. Let's do this!!!  Thank you Alex for being an inspiration for me as I begin my journey to becoming a data analyst.",True
@favourizuagba231,2023-12-31T04:01:47Z,0,Thank you so much for your tutorial,True
@chanmeida1726,2023-12-31T02:34:43Z,0,Hi Alex. Understand the advantage of joining your analystbuilder is the practice of Technical question. But you also sell just the courses (without the technical questions). May I know how is the courses at analystbuilder different from the bootcamp at your youtube channel?,True
@thetraviator3933,2023-12-30T14:13:00Z,0,Thank you Alex. Great insights. Woke me up to the need to polish up my SQL.,True
@AFoxForThought,2023-12-30T05:41:16Z,0,"To anyone willing to answer this question, numpad or no numpad?",True
@henryibehayalaayala6331,2023-12-30T02:31:57Z,0,"Thank you for this video,  i have learnt data science for beginners,  i jump into digital marketing,  I'm also doing project management,  and i want to come back to data science,  hope I'm in the right track?",True
@kanchanachristopher5465,2023-12-29T14:37:02Z,0,Hey alex please make a playlist with azure devops as well,True
@barneyy6942,2023-12-29T11:13:08Z,1,Do you think data analytics will go redundant in the coming years due to AI?,True
@user-wz7xb5zd3y,2023-12-29T08:33:06Z,0,"Hello Alex, i want to ask you about cloud platform. Why does any data analyst need it? What is the point? How do we use that platform? Which cloud platform do you prefer? Thank you",True
@akshaychaurasiya1309,2023-12-29T04:35:29Z,1,Which cloud platform is best to learn to get a job in India?,True
@akshaychaurasiya1309,2023-12-29T04:31:29Z,0,"Is there any scope for data analyst in 2024? Tech market is down, hiring looks tough. Please guide",True
@daltonbay6295,2023-12-29T04:16:33Z,2,please which laptop do you recommend for someone about to learn or start data science ?,True
@theBadBen,2023-12-29T01:50:30Z,0,Amnesia Alex is going to love it when he finds a library!,True
@pedromarcos1541,2023-12-28T22:51:43Z,7,i just finished my marketing degree which gave me some exposure to business analytics. im gonna persue that route and this video really helped me with guidance. thank you and i hope we all get our future analytics jobs and self actualise!,True
@romelcasillas2286,2023-12-28T20:29:12Z,0,"Thank you Alex, just what I am looking for.",True
@dhanurgarg9988,2023-12-28T18:44:16Z,3,thank you so much alex for the amazing 70 video data analytics course .,True
@firstname4337,2023-12-28T17:25:45Z,2,3:18 -- if amnesia Alex doesn't remember he's married then he probably will be broke after the settlement,True
@userwheretogo,2023-12-28T16:42:04Z,0,same content and flip over and over again from 2022 to 2023 to 2024,True
@raisul6039,2023-12-28T14:45:28Z,0,Do you have a dedicated video for how to create a portfolio in a particular platform?,True
@y1.5,2023-12-28T11:25:40Z,0,Never seen data analyst opening for freshers they want experience of at least 2 years,True
@siahcount7891,2023-12-28T10:59:00Z,0,How about replacing tableau with python dashboards and reports? and having excel but having python alongside it?,True
@mrdatabyte,2023-12-28T09:54:35Z,0,Great video! I am creating animated videos related to data analytics and getting inspiration from you!  https://www.youtube.com/@mrdatabyte,True
@saritaxsingh,2023-12-28T08:40:52Z,3,You are the best mentor I could ever ask for.,True
@Ma16767,2023-12-28T07:56:14Z,0,"Thank you for all your videos, I love your channel. If I may ask you a question please: As a Non-Tech backgroup professional who wanna do career shift, what is fast/better to get job as data scientist/ analyst? Get bachelor (BS) in analytics or BS in CS with analysts courses/certificates or BS in business administration with CIS/MIS?",True
@SAKE42able,2023-12-28T07:07:07Z,3,"Good video thank you Alex but I started to learn Python them I will learn SQL, Excel and Power Bi or Tablue not sure yet I think python can do all of it and the automation too",True
