author,updated_at,like_count,text,public
@statquest,2020-04-01T14:48:44Z,75,"Correction: 16:45 We should be dividing by 4-1, not 5-1. Oops! :)  Support StatQuest by buying my book The StatQuest Illustrated Guide to Machine Learning or a Study Guide or Merch!!! https://statquest.org/statquest-store/",True
@larissacury7714,2024-05-27T21:59:45Z,1,❤,True
@mitch6151,2024-05-21T05:32:47Z,1,Thank you for your outstanding teaching. This teacher is a legend.,True
@Mike-vj8do,2024-04-30T10:44:50Z,1,"The Lebron James of maths videos, seriously",True
@fourquarks,2024-04-30T08:23:50Z,1,Great vid,True
@fsarker,2024-04-25T01:48:08Z,0,Great explanation of covariance @statquest. Can I ask what tool you use for the animations used in the video?,True
@TheMato1112,2024-04-11T17:22:16Z,1,better than ChatGPT-4 :),True
@qvanerp4449,2024-03-19T07:48:03Z,0,how many adds do you wanna pump in a single video mate?,True
@raltonkistnasamy6599,2024-03-03T17:51:52Z,1,Man thank u so much,True
@rahulv7700,2024-03-01T14:44:03Z,4,"Bam! The clarity of concepts, simple yet effective graphics and your amazing voiceover just made this nasty concept so damn interesting! You got a new subscriber):",True
@SantiagoMolano04,2024-02-22T01:11:35Z,4,"Our stats for engineerin prof really really makes us feel deserted, you have no idea how much hope finding your channel has injected into us. Bless.",True
@koteswararaochinnam957,2024-02-09T08:01:46Z,0,Part 2 ?,True
@theblinkingbrownie4654,2024-01-26T17:03:28Z,0,Would you consider posting night mode versions of your vids? Maybe in an unlisted playlist,True
@lennartfreriks5977,2024-01-19T10:13:44Z,1,"it's a very good video, but why do you use complex things like mRNA transcripts in a cell to explain it? Just stay with the apples in the shops and it would be perfect!",True
@abanoubyounan-3285,2023-12-22T07:28:03Z,1,"It's super clearly explained, Hurray !!!.",True
@user-wt6oe8nm7y,2023-12-13T16:16:10Z,1,so useful video to explain everything i need,True
@nick45be,2023-12-04T00:26:51Z,0,"Yeah, but why we multiply the two deviations (x-xmean)×(y-ymean) in the covariance formula?",True
@snay71,2023-11-16T10:16:27Z,0,I love you man this is so freaking good,True
@MunirSehwail,2023-11-02T06:21:09Z,1,Since its multiplication and addition does Cov(x.y) = Cov(y.x),True
@eleonoraioimo8607,2023-10-31T15:44:57Z,0,Good video but I don't get why you had to talk about gene X and gene Y when you cold have made the explanation easier talking only about APPLES! People get less confused if you use simpler examples..,True
@mohamedmohamedabdallah13,2023-10-29T22:37:44Z,1,dude i have been studying this for years  it is the first time to really understand the covariance ty <3,True
@KevinLobo-vs5dw,2023-10-15T11:11:03Z,0,"Can you please explain the formula of co-variance , why is x-xbar multiplied with y-ybar/n-1? I want to understand why it is multiplied",True
@astridfjord7791,2023-10-10T19:53:45Z,2,A masterful educator!  Thank you Josh!,True
@amitpalkar6442,2023-10-07T07:57:44Z,0,Why do we mulgiply X-X mean into y-ymean why cant we add them ? What is importannce of multiplication instead of adding,True
@razorphone77,2023-10-06T16:48:38Z,0,"At what point is it not useful to consider a 'positive' relationship as positive anymore? Or a negative one as negative? If the actual value has no meaning other that its positive or negative, you could have a practically horizontal straight line and still call it positive. The only way there is genuinely no relationship, is if one of either X or Y has a fixed value.",True
@jiviteshvarshney3644,2023-09-26T14:08:29Z,1,BAM! 🙂,True
@pianobunzz6514,2023-09-19T12:24:38Z,1,"I want to give you a hundred likes after watching your video. It's very smooth and easy to understand. You're suitable for being called ""teacher"" in this world. Thanks man.",True
@edwardseo7468,2023-09-19T11:33:46Z,1,Bam.,True
@user-gc5ih9fm5y,2023-08-28T15:37:58Z,1,I kinda tried to figure out something like this when I was trying to understand covariance few weeks ago but with your visual explaination it is way easier to understand. Thank you very much for StatQuest,True
@amkhrjee,2023-08-26T23:14:40Z,1,This was awesome! ,True
@nathanzimmerer9830,2023-08-26T18:34:25Z,0,"I'm guessing that in real experimental data, it's rare for the covariance to evaluate to zero even if there's effectively no relationship between the measured quantities. If that's true, is there a certain value of how ""close"" to zero the covariance should be to indicate no relationship? Or given the limitations on conclusions drawn from the magnitude of covariance, are further tests needed?",True
@JanLaalaa,2023-08-26T07:34:06Z,1,BAMM!!,True
@fangcewu6279,2023-08-20T14:27:04Z,1,the best math video ever,True
@rajns8643,2023-08-13T07:36:04Z,1,18:57 How can the mean increase but the observed data remain the same?? Isn't the mean calculated from the observed data itself?  PS: Outstanding explanation! I really love your way of teaching!,True
@lv5966,2023-08-07T13:50:18Z,0,no volume,True
@GireeshAbburi,2023-08-05T03:04:35Z,0,sir how to  correspond the green and red values sir  i did not un derstood how  u mapped  for negative slope graph,True
@joserobertopacheco298,2023-08-04T09:58:23Z,1,Wonderful explanation and  edition,True
@BECEOOOJUHILPATEL,2023-08-02T05:18:14Z,0,"the video content and explanation was amazing and outstanding . but please don't do that           """"tutut..tu.tutut..tu"" that irritates a lot buddy .",True
@ernestsevilla3802,2023-07-27T16:38:55Z,1,Extremely entertaining and helpful. BAM!,True
@saputrauta09,2023-07-27T15:55:33Z,0,"can someone please tell me, why in covariance equation, we divided the sum by n-1? not n?, because in some other references, they divide it by n, and some other divide it by n-1 ?",True
@sabrewolf479,2023-07-21T01:48:27Z,1,Brilliant explanation. Thank you!,True
@ssuyash8,2023-07-01T11:14:52Z,1,❤ No comments..  Just love and respect,True
@nattyzaddy6555,2023-06-27T22:31:38Z,0,"What if you standardized the scales so that that values of each axes went from 0 to 1, so it could not exceed 1 or cold not go below 0, that would make it non sensitive to scale",True
@Zaznobable,2023-06-18T13:11:26Z,1,This is best video in all Youtube,True
@lenko_me,2023-06-10T16:49:49Z,1,18:23 Triple Bam is required here,True
@ThePredator315000,2023-05-04T04:50:28Z,1,I like how he says double bam,True
@vaibhavsahdev6615,2023-05-02T20:41:05Z,1,Amazing. thank you for such a fun and informative video,True
@jissabraham901,2023-04-25T05:26:08Z,1,"Top work! Loved to listen and learn. Thank you. Can you clarify a doubt - In the covariance formula, why do we take (n-1) in the denominator, and not n?",True
@margaerytt,2023-04-19T04:43:20Z,1,BAM,True
@harivignesh9617,2023-04-12T16:56:57Z,1,u deserve 1M likes,True
@oldcowbb,2023-03-25T07:01:06Z,0,the true beauty is when you put in a matrix with the variance,True
@yj9032,2023-03-14T11:07:52Z,1,Where were you when I was in school!,True
@TheRandomFolder,2023-02-28T04:34:58Z,0,No proper defination is given in the entire video.  BAM.,True
@faviorc2,2023-01-30T18:18:38Z,2,"Jesus Christ, this was an amazing explanation. Thank you Sir..",True
@manas0211,2023-01-25T23:15:13Z,0,So is covariance like a unit vector?,True
@TheNettforce,2023-01-25T12:40:46Z,1,"Thanks for the great videos, positive correlation between watching and understanding ",True
@misesliberty,2023-01-22T16:15:54Z,1,God bless you. You are geek rockstar. You saved me while my tutors terribly failed. :),True
@rishabhkaul5556,2023-01-20T12:02:36Z,1,"You are a legend. Your way of teaching is mindblowing. You make understanding concepts , a walk in the parkfield ! Thank you",True
@marczolghadri,2022-12-30T11:44:26Z,1,Thank you. Concepts become easy with these clear explanations.,True
@totomo1976,2022-12-28T13:34:57Z,1,I really appreciate the effort you put into making these educational videos. You're my hero!,True
@ritubhatt3092,2022-12-25T14:38:05Z,6,It is the best video there is on Co variance. Made life absolutely easy. Thanks a lot from India🇮🇳 🥰!! DOUBLE BAMMM!,True
@saurabhmahra4084,2022-12-11T13:00:06Z,1,"Thank you, Josh. I am a university student who just learned covariance like never before. Thank you so much.",True
@lugaresyplantas7819,2022-12-08T00:30:55Z,9,"It's incredible, repeat, INCREDIBLE how you manage to turn difficult things into simple, easy to understand things.  Thank you so much josh ! Greetings from Colombia 🐸",True
@oyuncubirlii,2022-11-21T05:13:04Z,0,OMG I hate the bam just stop it pls!!!,True
@pointkablan198,2022-11-19T08:56:42Z,1,BAAAM !,True
@yifuzuo9894,2022-11-12T02:26:37Z,1,BAAAAAM!,True
@smoks4833,2022-11-10T09:45:25Z,1,BAM,True
@minglee5164,2022-10-29T15:21:19Z,1,Bam😂,True
@dragonmateX,2022-10-22T20:40:56Z,0,"As soon as I saw the covariance formula I was like ""Hey look its linear regression sum of least squares!""",True
@conradsun7160,2022-10-19T23:00:13Z,1,"thank you for explaining it so well! ive been studying statistics for 4 years + now but because covariance is, as you said, hard to interpret, so I never actually had a firm grasp of what it is (even thou ive used it countless times) this is so helpful",True
@ghymes1999,2022-10-07T11:43:38Z,1,Great video :),True
@meetpanchal4908,2022-09-29T14:09:33Z,0,Seriously speaking very Bad example to teach this topic.this - this distance and all get confused for a bit of time,True
@raa__va4814,2022-09-27T17:38:56Z,1,"im gonna subscribe BAAMMMMM, and because that was extremely important im gonna repeat that ... im gonna subscribe BAAAMMMMM",True
@aguspe532,2022-09-24T17:23:01Z,0,Why do we use n-1 instead of n in the divisor? Great explanation!,True
@bingbingsun6304,2022-09-21T04:47:30Z,1,"BAM,BAM,BAM!!!!",True
@faicornelius2601,2022-09-14T20:46:53Z,1,"Thanks so much brother, this is the way everyone should learn. this dude is awesome. Thanks buddy",True
@mohammedsalih5865,2022-09-05T19:05:56Z,1,It looks like you have an error in your calculation at 10:33 you have (24-17.6)(33-24.4) but it should be (24-17.6)(38-24.4). The last point should (29-17.6)(33-24.4. )Let me know if I am mistaken.,True
@asadkhanbb,2022-08-31T14:19:33Z,1,"BAM, Hoorrraaayyyy! Excellent explanation :)",True
@zappist751,2022-08-17T19:05:36Z,1,Mr. Starmer this is awesome! How long does it take u to make a video?,True
@user-qn3dp6pg7j,2022-08-15T08:27:42Z,1,Finally i understand the purpose of myltyplication . The main idea is to see trend . Negative or positive. Thanks,True
@CurtisBooksMusic,2022-08-14T02:06:54Z,1,This video has helped me out a bunch for my level 1 CFA exam. 👍,True
@muniko2,2022-08-10T18:30:29Z,1,BAM! Thanks for this video!,True
@stevebarratt888,2022-08-05T07:27:29Z,0,"In the 'no trend' examples, it feels unexpected to show one variable with a fixed value. A cloud of values centered around the two means was what I thought was a no trend scenario.",True
@fernunez2131,2022-07-19T22:10:09Z,1,"Great video!! At the end of the video I was waiting the ""Shameless Promotion""  because of the other videos hahaha. Thanks for the  videos!",True
@juancruzsaldano8998,2022-07-14T01:07:28Z,1,"First i hated the BAM! but now i love it, everytime you say, i say it too",True
@tobiasjohnson,2022-07-10T13:57:19Z,0,"In the denominator, why do you subtract 1 from n? Wouldn't it make more sense to divide by the total sample size, so that you can get the average covariance per datapoint?",True
@shubhamkumar-nw1ui,2022-07-03T17:23:43Z,0,Can you make a music video out of turutuutuu tu tu turutuu tu tu,True
@devlinmcbane7255,2022-06-23T02:18:44Z,1,Omg thank you!,True
@dr.bigfudge6497,2022-06-22T18:43:12Z,3,"your explanation are just too good, I hope every teacher becomes like you",True
@amirmohammadjalili2676,2022-06-03T09:09:50Z,1,tnx Josh.You’re great as always.,True
@nouiel-ajou7881,2022-05-29T11:54:22Z,0,"Hey Josh thanks for the great video it was very good explained (as in all statquest videos)  Just a short remark:  Maybe it would be worth noting somewhere in the video or in the comments that covariance can only be used to measure linear relationships or the absence of them.  E.g. if the function would be something like  y = x2, it could very well be that over all Cov(x,y)  0, while there is a clear relationship between the 2 variables, just not a linear one.  I think that might be worth mentioning somewhere, just to make clear that Covariance is only about linear relationships.   Please let me know if I’m wrong there(which of course could be the case) or did an error in my thinking. And of course, thanks for the great content!",True
@EVERYTHIN_007,2022-05-18T11:07:47Z,1,You are a great stat teacher on YouTube,True
@_Anna_Nass_,2022-05-17T02:50:41Z,1,I wish I could give my tuition to you 🥹,True
@AFlockOfToasters,2022-05-06T08:50:09Z,1,Bam!,True
@ovechristophermattmann880,2022-05-05T16:20:55Z,0,man this cringy humor is unbearable. Why is this the only guy with useful stat tutorials??,True
@bob_bobsen,2022-05-02T15:24:56Z,1,You really are doin the math,True
@nhannguyenhaithanh6069,2022-05-02T07:25:35Z,1,I love this guy <3,True
@Omegabraham12,2022-03-27T15:16:36Z,1,Thank you a lot!,True
@harshdhamu9915,2022-03-27T12:59:05Z,1,bam.,True
@Professor_oh,2022-03-24T23:34:24Z,1,Great !,True
@haongngoc1215,2022-03-20T00:10:42Z,1,I love this guy,True
@beaniebaby_rei,2022-03-17T21:58:57Z,1,I wish Josh was my professor 😁,True
@fanzhang3746,2022-03-09T00:09:03Z,1,Meeeaowww ~~,True
@poojakabra1479,2022-03-01T21:46:14Z,1,The BAMM feels like a little pat on the back,True
@mohamedsarfaras7675,2022-03-01T05:14:48Z,1,"wow. ,i should have started seeing videos 10 years back.",True
@yimingshao4240,2022-02-26T07:32:27Z,0,"I have a queation about the negative covariance, if there are even number of data point in these two quadrants, the multiple outcome will become positive, what about this kind of situation?",True
@akashnair9395,2022-02-19T17:54:14Z,1,TRIPLE BAM!!!,True
@sophiahennouni3276,2022-02-06T19:47:02Z,1,"Brilliant channel, now every time I don't get a statistical concept seen in class I go look for the Quest!!! Actually even when I think I understand I still check the Quest :) Thank you so much for your amazing work, Josh.",True
@hariprasadpargunan1,2022-02-05T08:19:28Z,0,This is the great video of all Covariance videos that I watched. Once again you are the best! I am little curious to know how the formula for Covariance come up at 7:37,True
@fernleaf1,2022-01-28T16:14:42Z,1,appreciate the effort involved in making these videos.,True
@shubhammodanwal6713,2022-01-26T02:21:57Z,2,Feels like I am watching dora the explorer.. 😅😅 love it,True
@chesneymigl4538,2022-01-22T02:07:55Z,1,"OMG! I know this video is older and really has nothing to do with genetics, but I work with mRNA and got such a rush with the first explanation. Not many math examples go with something nerdy. LOL",True
@magexcloudy,2022-01-21T04:42:58Z,2,I'm more of an apples type of guy,True
@donjr3270,2022-01-19T11:53:18Z,1,Awesome as always!,True
@inpaulwetrust,2022-01-16T10:28:26Z,0,11:15 shouldn't n=10-1 ..? since there are 10 measurements,True
@usama57926,2022-01-13T17:49:56Z,2,amazing...........,True
@abipalash5299,2022-01-12T19:02:30Z,1,"Just love you sir,💖  from Bangladesh",True
@data-science-ai,2022-01-06T15:27:45Z,1,Statquest is all I need,True
@mariaamithapennington3737,2021-12-31T12:48:52Z,1,"Mud becomes crystal. Thanks, Josh!",True
@MyMy-tv7fd,2021-12-25T01:57:04Z,1,"very well explained, bravo",True
@mirmubashir3128,2021-12-05T07:46:04Z,0,Sir how large covariance  means  strong  relationship. ... although  covariance   means    differences  in two data set  plzzz explain this,True
@ewreish,2021-11-26T05:00:43Z,1,Really intuitive video,True
@AnkitKumar-wq4kc,2021-11-15T18:02:28Z,1,This is pure gold!,True
@jaredgreathouse3672,2021-11-15T16:10:15Z,0,"I don't know how familiar you are with it, but I would LOVE tutorials on stuff we do in econometrics such as.... minimization for synthetic control models, like the formula for how weights are generated, distance matching (you know, what we'd do for propensity score analysis), and this one technique called nuclear norm regularization, a cousin of LASSO, Ridge, and Elastic. But other than that, thanks so much for everything you do, this and Khan Academy has carried me from 6th grade to right now in my first semester of Ph.D in public policy.",True
@vigneshr5575,2021-11-14T22:44:39Z,1,BAM!,True
@alireza2974,2021-11-14T11:49:53Z,0,so exiting really,True
@Artaxerxes.,2021-10-20T05:13:16Z,0,Josh why do you feel the need to dumb it down to the level of apes. We can understand it fine without the hurray and bams,True
@Artaxerxes.,2021-10-20T05:08:39Z,0,the BAM is cringe. Please remove it,True
@tinou9714,2021-10-18T13:20:28Z,1,Bam.,True
@shashankchaurasia8358,2021-10-17T06:54:26Z,1,This guy is a genius !,True
@AugustNocturne,2021-10-13T09:08:57Z,1,Awesome video!,True
@PremKumar136,2021-10-09T16:16:39Z,1,BAM.....Now I know about Co-Variance.,True
@what8856,2021-10-08T23:39:46Z,1,"Please correct me if I am wrong:   For the example you gave about the apples, the relationship is not truly covariance, right? Covariance is a function of strictly two random variables. However, in the apples example, the measurements of the number of green and red apples from each grocery store would be coming from ten different random variables. If however, we measured the number of green and red apples from one particular grocery store, but on different days - then this would be coming from only two random variables, and we could calculate covariance.  Thanks for the amazing videos!  Edit: Actually if you assume the r.v.'s of the number of green and red apples from each grocery store to be i.i.d., then we can compute the covariance, right?",True
@MrTimmy23,2021-10-05T20:50:34Z,2,"Amazing, this was exactly what I was looking for. An explanation for why the formula works",True
@adityakhedekar9669,2021-10-02T08:52:20Z,1,plz include covariance matrix too,True
@FitnessAndHappiness,2021-10-01T18:29:10Z,1,Awesome class 🎉🙏🏻,True
@jaouadrahouani4975,2021-09-29T18:53:47Z,2,"Had problems understanding this for a whole year, you solved all of that in 20 minutes, god bless you",True
@deepknol,2021-09-25T16:04:11Z,1,Wish I could like this video 10 times!,True
@npraneeth6743,2021-09-19T18:00:51Z,1,"AWESOME,,, BAM  BAM  BAM....",True
@sharachchandrabhat8428,2021-09-15T04:43:30Z,0,If covariance is zero then one can assume there is no trend or that the lines drawn are horizontal or vertical. However neither of these two lines indicate that there is no trend.,True
@arthurus77,2021-09-06T16:56:29Z,1,thank's so much man ;),True
@huynguyenhodinh8709,2021-08-23T06:30:40Z,1,LOL loving these little tunes,True
@jaydhanwant4072,2021-08-22T07:36:15Z,1,The songs and little SFX are the only ray of light for the rather dark life :),True
@calvinlu6897,2021-08-09T16:14:21Z,0,"still don't get it, what is the difference between covariance and correlation, can someone help",True
@stephenpoole6415,2021-08-02T18:41:19Z,1,Josh Starmer = best YT instructor,True
@fernandogutierrezcabrera4757,2021-08-02T02:24:27Z,2,"I love your work. I didn´t understand covarice until i saw your explanation, I didn´t undertand it for 1 year!  Awesome channel",True
@yutassmilehealsme6572,2021-08-01T22:51:32Z,1,Best channel for learning stats,True
@shangauri,2021-07-24T07:11:07Z,0,What is the reason behind the denominator 'n-1' in calculating covariance? Why not n or n-2 etc.?,True
@pamelavarela1235,2021-07-22T06:21:38Z,2,"Seriously Josh, you are THE BEST !!! Thanks for such clear explanations.",True
@abhi9029,2021-07-17T15:32:50Z,1,possibly one of the best explanation.,True
@kuuuyajim,2021-07-15T21:38:55Z,1,BAM!,True
@bihanbanerjee,2021-07-15T10:29:09Z,1,thank you <3,True
@shubhamswain9848,2021-07-10T08:19:59Z,0,"Sir, from where i can get all the slides",True
@dario8863,2021-07-01T12:50:49Z,1,BAM!!!!,True
@irajlohrasbi,2021-06-20T01:38:26Z,0,"Dear Josh, I was blown away by your artistry and mastery of expressing statistical topics in a clear and appealing manner. Thank you for devoting so much time and effort to this. By the way, there seems to be a minor error in the calculation of covariance (the section between 7:30~12:00). The value of Y for two points (x = 24, y = 38) and (x = 29, y = 33) has apparently been replaced incorrectly. I think it should be modified as follows: Covariance = ( ( 3 - 17.6 ) × ( 12 - 24.4 ) + ( 13 - 17.6 ) × ( 10 - 24.4 ) + (19 - 17.6 ) × ( 29 - 24.4 ) + ( 24 - 17.6 ) × ( 38 - 24.4 ) + (29 - 17.6 ) × ( 33 - 24.4 ) ) / 4 = 438.8 / 4 = 109.7 If it is wrong, please correct me. Thank you once more for everything.",True
@starship9874,2021-06-02T02:53:24Z,3,0:00 Awesome song and introduction 0:24 Review of variance 1:07 Motivation for Covariance 5:59 Types of Covariance relationships 7:32 How to calculate covariance 17:00 Why covariance is hard to interpret 20:31 Motivation for Correlation 21:20 Summary  Maybe add this to the description for easier skipping,True
@user-kn9wu7ts9m,2021-05-25T12:57:04Z,1,Thanks a lot ! it give me an intuitive explanation of the covariance !,True
@ninaddongare6514,2021-05-22T14:00:07Z,1,"That damn book makes it look so confusing, thanks for simplification 🙏",True
@sharan9993,2021-05-17T12:20:19Z,1,I am watching statquest for entertainment 😂😂,True
@assafv1,2021-05-13T19:08:18Z,0,"Great Video. Does the absolute value of the covariance represents how spread the data is along the line that fits to it? That is, spread from the point of (x_average,y_average)",True
@paromitasharma9870,2021-05-08T20:08:00Z,1,Why so awesome!!!,True
@henry_immanuel02,2021-05-06T10:51:48Z,1,amazing opening song😂😁,True
@samdb8393,2021-05-03T19:59:58Z,1,"excellent, greatly appreciate.",True
@zhenhuahuang291,2021-04-27T12:45:47Z,0,Can you do one for Autocorrelation and cross-correlation? Thanks.,True
@FRANKWHITE1996,2021-04-23T06:53:11Z,1,well explained,True
@albertoderfisch1580,2021-04-19T14:31:56Z,2,This channel is awesome. I love your teaching style ❤️❤️❤️,True
@xpto3698,2021-04-16T02:39:46Z,1,Good for intuition,True
@haneulkim4902,2021-04-13T22:45:43Z,0,"Thank you Josh! One questions, why n-1 in the denominator instead of n?",True
@regexPattern,2021-04-04T20:35:36Z,2,One of the best videos I've seen. Your channel helps me undestand math better than many channels that speak in my native language.,True
@hangchen,2021-04-02T01:49:48Z,0,1:52 2 2 2 2 2 2 2 2 2 2 2 2 2 2 2 2 BAM!,True
@aureal710,2021-04-01T23:48:14Z,1,"Wouuw triple BAM, your explanation is very easy to consume. Great Josh!!!!",True
@jasonq4816,2021-03-29T05:37:39Z,15,"Not specifically on this video, but I hope you know your channel in general is a blessing to a lot of us out there. I took stats in undergrad and grad school and I can say with certainty you're the best stats teacher I have ever encountered. I don't use the word ""enlightened"" lightly but I sometimes feel that way after watching some of your videos on stats/machine learning. A lot of concepts I struggled with in undergrad/grad school and with CFA, somehow you're just able to explain them so effortlessly in a way I can understand. I really really wish you all the best with this channel!",True
@nancyboukamel442,2021-03-20T21:33:01Z,1,You are my super man <3 I loooove ur explanation,True
@oreoshake5951,2021-03-06T15:42:24Z,2,This is super BAM!!!,True
@Delbertfrost2000,2021-02-24T23:45:29Z,1,Excellent video,True
@reshamgoyal6945,2021-02-13T08:23:56Z,1,I just got to know the meaning of independence of scale. Bam !! Thanks statquest. 😊,True
@softpeachhy8967,2021-02-12T09:40:24Z,0,"I'm confused now, the 5 cells or stores, why are they necessary? When you have data of gene y and gene x, why the 5 different cells matter here? My point is that you don’t always know whether your data or two variables are in pairs...?",True
@tassoskat8623,2021-02-08T15:43:42Z,1,Simply the best! You made my day a little better again 😃,True
@andrej9811,2021-02-07T21:01:11Z,1,BAAAAMM !!!,True
@think2086,2021-02-07T16:46:00Z,27,My cat thanks you. She learned a lot and is now doing my finances for me.,True
@christopherparker4370,2021-02-06T19:10:33Z,0,Apples for the dummies watching,True
@qinqinkong8330,2021-01-31T06:46:41Z,1,BAM!!!!,True
@kausalyaakannan7064,2021-01-30T17:28:14Z,1,Am I the only one whom reply Josh's Hello😂 Although the topic is unrelated to me I will purposely view the video just for your awesome intro!,True
@prapulpoonacha7385,2021-01-19T13:43:05Z,1,its funny how I see that there are people who would dislike the video,True
@nick_g,2021-01-18T17:23:24Z,0,If you sold coffee mugs there is a high likelihood I would buy one. Bam!,True
@deepanshudashora5887,2021-01-17T07:38:55Z,1,Hip hip hurrah i am doing the math🤣🤣🤣🤣🤣,True
@erdiozyldrm7108,2021-01-14T19:09:28Z,1,"So precious, very understandable. Asthonishing job. Thanks a lot.",True
@user-bz8nm6eb6g,2021-01-14T04:02:52Z,1,Thanks!!,True
@vidishmannur2460,2021-01-10T06:18:04Z,1,Bam!!,True
@amizan23,2021-01-08T19:31:40Z,1,Your videos are way better than most of the paid courses.,True
@Sandeep-zu6we,2021-01-05T15:05:52Z,72,"I don't know why, but I feel like there should be  ""Superlike"" button on these types of  youtube videos",True
@inkarhappy,2020-12-28T18:38:47Z,1,"Hooray:) I found a super videos about the basics of statistics on Youtube! Watching your videos like "" do do do do do do"" and I understood ,BAM!",True
@addicted2youtub,2020-12-24T02:31:23Z,0,Your channel is the best. Do you have any plan for the relationship between Multiple regression and Partial correlation?,True
@AzlanShahAShafiuddin,2020-12-18T03:29:18Z,1,You make statistics interesting to learn,True
