author,updated_at,like_count,text,public
@Retrosenescent,2020-07-03T22:27:05Z,0,"10:22 you could also just do my_list = enumerate(""abcd"")",True
@AundreL,2020-06-26T14:07:55Z,0,"4 years later still the best tutorial available thank you so much, sir.",True
@saunaknandi1814,2020-06-21T20:24:00Z,0,Its so wonderful na the course which should be a paid one is available for free,True
@harshkanumuri3977,2020-06-16T11:30:28Z,0,"it says "" append() takes exactly one argument (2 given) "" what should i do? ( i am using an IDE called Spyder) . I tried the code in another python IDE and it works. I am confused why this is happening? Please help me",True
@youvanced6593,2020-06-16T05:10:50Z,0,But isn't he creating a tupple in the last example? what made it a generator?,True
@pcwinstead,2020-06-07T16:26:23Z,1,Amazing. Thank you.,True
@ranjaninatarajasharma5917,2020-05-30T14:33:45Z,1,Just luv it,True
@abidvu2472,2020-05-25T17:41:52Z,0,"I've learnt a lot from your videos. Thanks heaps.  I have a question though.  When I tried to print(zip(names,heros)),  the result I got was zip object at....(I'm using Google Colab to practice alongside with your vids)  Anyone can help me on this one, I'll very much appreciate it.  Thanks x",True
@JoshuaDHarvey,2020-05-21T00:36:14Z,2,"Great video, thank you! 11:03 is your print zip(names, heros) a configuration? I was only able to get print(zip(names,heros)) to return <zip object at {memory_loc_id}>",True
@rockzzzta9796,2020-05-20T06:53:59Z,0,"Sir, can you make a detailed video on maps and lambda function too?",True
@vladi21k,2020-05-18T17:00:07Z,1,Thank you for this great tutorial!,True
@onurkoksalan4462,2020-05-15T11:59:15Z,1,I couldn't use print function without (). How can he use like this? 3.7 anaconda btw,True
@PrabhuShreeRamKiJai,2020-05-07T05:03:09Z,0,i cant get it at 15:29 if you used {} then why output is in [ ] and in ( ) why curly{ }?????,True
@alixaprodev,2020-05-06T17:22:10Z,0,i think this comment may help some one if we want to create a list of even then evenlist=[x for x in range(10) if not x%2]   i am watching the video while coding. i am new to python and its interesting language.,True
@alixaprodev,2020-05-06T17:16:34Z,0,"if we want to pass more than one params to the lambda function the  map(lambda n,x: n*x,range(4),range(4,8,1))   we can do in this way.",True
@Mykas2,2020-04-30T09:25:56Z,0,"Thanks for the video! I have two questions: 1) Why don't you put parenthesis before print? It doesn't work for me this way and I always need to put print(). 2) It looks like zip works for you as print zip (names, heros). If I do that (with parenthesis after print), it just prints the location in memory. I have to use print(list(zip(names, heros))) in order to get the pairs. How come you don't have to use list in your example?",True
@yashrathi6862,2020-04-29T16:03:13Z,1,Can't you use dict  function instead of dictionary comprehension?,True
@k.m.jiaulislamjibon1443,2020-04-27T14:42:03Z,0,is there any way of using list comprehensions like N = 4 now i want a list like arr = int(input()) --> for 4 time at a time separated by space in a line? Sorry for my bad english. i can for arr = [int(x) for x in input().split())] but that doesn't use the N value to check ? Is there any way to get fixed input with list comprehensions . TIA,True
@shivasiddharthnarayanan,2020-04-22T20:37:04Z,0,"which py version are you using ? py3 doesnt support print statements as you show here.., right ? Am I correct ? Are you using py2  ? If you are using py3, can you please explain how to have this feature enabled for print method...?",True
@jeevan999able,2020-04-21T08:38:51Z,0,thers a slight tint of southern accent in your English,True
@yuchai4696,2020-04-19T14:50:15Z,0,very helpful videos,True
@prasadp8265,2020-04-12T13:56:30Z,0,Best Python tutorials in youtube!,True
@mrweisu,2020-04-07T18:46:11Z,0,What is the meaning of 'comprehension' in these operations? That is the most puzzling point for me personally. Thanks.,True
@FamFitFun,2020-04-04T20:05:17Z,0,"'check out 11:21' when i tried to print (zip(names,heros)) it throws output <zip at 0x10aa9bf00> instead of printing . i am using python 3 in Anaconda env.?",True
@TheAasalem,2020-04-03T16:53:02Z,0,Can pickle be used in list comprehensions loop?,True
@palsumit1,2020-04-03T00:04:02Z,0,Do you have a tutorial on python script to scrape data out of tables embedded in PowerPoint files?,True
@uiato,2020-03-31T20:14:39Z,2,CONCISE and ELOQUENT are the words for you. First content youtube channel that I don't have to speed up the videos. Thanks!!!,True
@GeoPoly55,2020-03-28T13:50:59Z,0,does it work for string also,True
@safiullahkhansherzad7214,2020-03-25T02:29:54Z,0,Corey I've been following your tutorials for quite a couple of months and what you teach is clearly unique than what other tutors are teaching on youtube. I mean the concepts and topics you choose. would you plz suggest me some books for learning python and django more in depth ? I hope to get a reply soon.,True
@eternalblue4660,2020-03-19T00:16:36Z,0,Great video.,True
@Press_StartGameplays,2020-03-18T11:23:01Z,0,"Dude, thank you. I have learned a lot with this video. I was about to quit my bachelors degree ‘cuz I though I was not good enough. You saved me.",True
@immanuel4747,2020-03-17T18:12:20Z,1,You are great and I am now a great fan of u,True
@ZeeshanKhan-rp9or,2020-03-05T06:40:35Z,0,Corey Your communication skill is at another level. You just speak so clearly. I love that. How did you achieve this mastery? Any tips...,True
@riyan5259,2020-02-29T04:10:29Z,3,I'm so mad at the viewers for not subscribing.. Mate you DESERVE a million subscribers.,True
@Z0Gab,2020-02-26T00:37:00Z,0,"This video is good and i want to save it for further rewatches, so im commenting this so that i dont forget.   Bump",True
@antoniolewis1524,2020-02-15T19:49:56Z,0,Where did n come from when nums is the variable  called ? N can't  be a keyword ?,True
@psysc0rpi0n31,2020-02-08T12:41:13Z,0,"In dictionary comprehension examples, you use pairs 'name: hero', but then you use 'zip(names: heros)'. Right before this, you actually mention that we need to use the same names or the program won't recognizes the variable names. So, how here you can use different names?",True
@senolkurt7864,2020-02-08T07:53:50Z,0,"List comprehensions can also be used for nested list: `nested_list=[[1,2,3,4,5], [6,7,8,9,10]] x = [item for inner_list in nested_list for item in inner_list] print(x)` and it prints:  [1, 2, 3, 4, 5, 6, 7, 8, 9, 10]",True
@user-he4ef9br7z,2020-01-20T02:46:26Z,0,is there any advantages of comprehensions over using map and filter and lambdas . which is faster and which do you prefer and why?,True
@kerwinso,2020-01-17T14:59:12Z,56,"Corey, you have really helped me to make the leap from beginner to intermediate Python programmer. I'd heard of list comprehensions before, but never dictionary comprehensions. Once again, many many thanks!",True
@graymalkinHaim,2019-12-18T01:26:41Z,0,"What I dislike about Comprehensions is that they could be wasteful if all you need is to run on certain values and instead in order to make things more ""readable"" you run on all values.",True
@tsumardi,2019-12-12T01:07:13Z,0,coming from C/C++ list comprehension is beautiful and makes sense. lambda is ugly like C++ syntax.,True
@vmehtav,2019-12-10T22:17:06Z,0,"Hi, In Python3, zip methods returns a zip object instead of a list. Can you please amend the video to update the information?",True
@soumyazyx,2019-11-20T19:35:57Z,1,Thank you Corey for your time and effort. Keep spreading the knowledge,True
@rahaasadimehr3512,2019-11-14T15:46:06Z,0,"Thanks again and again for the great videos. I have a question about the dictionary aggregation. Let say we have a list of dictionaries with multiple keys, each key has a list as a value, now we want to aggregate the key's values :  lst = [ {T1:[id1, id2,id3]}, {T2:[id4,id5]},{T1:[id4,id5]}]   ---> aggregation result :  lst = [ {T1:[id1, id2,id3,id4,id5]}, {T2:[id4,id5]}]",True
@iiit2tech,2019-11-13T08:28:45Z,1,Must say your videos are best in class and I have learnt so much from them. Your explanations are very clear and makes even tricky concepts easy to grasp.,True
@TheDouglasTrevino,2019-11-07T03:48:42Z,0,"Great video series. BTW: You can use a list comprehension to print the generator object as well. I'm running this in Anaconda 3.7 on Pop OS 19.04.  nums = [1,2,3,4,5] my_nums = (n*n for n in nums) print([n for n in my_nums]) pwd# [1, 4, 9, 16, 25]",True
@jonathandaniel7321,2019-10-27T17:01:31Z,1,the most important python video I ever saw,True
@brianevans4,2019-10-24T14:27:44Z,1,very useful video!,True
@wcottee,2019-10-23T21:00:21Z,0,"Maybe this was asked already but in the last example why do we use ""yield"" instead of ""return""?",True
@davidtodd9918,2019-10-14T20:30:26Z,1,"Thanks. I had not heard of set comprehension or generator creation using parens, and I appreciated the excellent refresher on other topics!",True
@programmer2736,2019-10-10T03:18:29Z,0,"Is this valid in 2019? For example, I noticed yield, isn't it 'return' in python 3.7?",True
@boxcubestudios,2019-10-03T19:58:36Z,1,Fantastic teaching!,True
@thevinsilva8190,2019-10-02T21:31:29Z,0,"11:12 try mylist = list(zip(heroes,names))",True
@Lu3ck,2019-09-27T22:14:49Z,0,"I think I may be the only one experiencing the issue with zip. I'm having to do this: var = list(zip(names, heros)); print(var). Anyone else having this issue? (this is with python 3.7 btw",True
@logeshgopi4212,2019-09-24T11:11:39Z,1,thank u so much corey its really useful; keep on going\\\,True
@sudhakannan3080,2019-09-19T15:55:50Z,1,Very good video to understand list comprehensions,True
@vaclavvlcek4527,2019-09-13T21:06:01Z,0,"Hi,  concerning the creation of dictionary based on two lists, let me please just contribute, that we could also write my_dict = dict(zip(names, heros) This is probably the shortest syntax ;)",True
@Proth7,2019-09-11T19:18:11Z,0,I've heard you saying my dick 12:28,True
@sriramkolipakula4096,2019-09-11T16:18:24Z,0,how to print odd position of the string using slicing can you please explain sir...,True
@peterchen5710,2019-09-10T13:30:39Z,1,Finally see an ad in this tutorial video! Chosen not to skip the ad so Corey gets the pay from Youtube! This is the least I can do to express my gratitude for the great teacher! <3,True
@Ryebanana,2019-09-04T06:59:30Z,1,Glad I found your channel.   I am working my way through Automate the Boring Stuff with Python and stopping after every chapter and watching your videos has helped so much in understanding the topics in greater detail.,True
@ajith1804,2019-08-19T15:32:43Z,5,"To be frank,this is the best video for learning about list comprehension on Youtube!",True
@kajalmishra6895,2019-08-17T08:43:14Z,1,Love the video ....,True
@karanmalhotra1858,2019-08-09T18:02:00Z,0,"my_list = [(letter , num ) for letter in'abcd' for num in range(4)] this actually appends ... what if i want to extend this list. how to do that and how to print the list in new line like:- for -------:     print(list) // this will print in new line print(list) //this will print in single line  so, how to extend the list and how to print in new line using list comprehensions",True
@ezraanna1,2019-08-09T10:43:01Z,1,I think you are very good at Python and the way you present things; clear & to the point. You are among the best out there. God bless you!,True
@mihaidinca2062,2019-07-10T18:48:51Z,0,"when i print zip(names,heros) it gives me this: <zip object at 0x100657e08>. Just in case i make list(zip(names,heros)) it works, but i am usig python 3.4",True
@chigglywiggly,2019-07-08T06:57:55Z,1,Best series of videos on Python on the internet.,True
@ozzyfromspace,2019-07-01T15:47:04Z,1,"When I saw the for loop with two iteration variables, my mind just lit up. Does the for loop used in that case necessarily have to have the structure of a list containing tuples, or was that just the convenience of the zip() function that generated that data structure? I'm wondering because I've seen something similar when .items() is added to the end of a dictionary for quicker processing (in a Dataquest tutorial I'm doing). I noticed that .items() returns a data type called dict_items, that's why I'm wondering.... Thank you, and whether you respond or not, I just want you to know that your tutorial presentation style and communication is highly effective! Thank you!",True
@ronit8067,2019-06-27T08:12:37Z,0,why use a generator function when basically same thing can be achieved by a simple for loop or comprehensions. what is the purpose of generators,True
@bismeetsingh352,2019-06-17T03:31:59Z,0,python==pseudocode,True
@rotrose7531,2019-06-08T13:32:39Z,5,"Your python series conquer the whole youtube, the explanation is concise and to the point. I especially enjoy those real word examples, Hope you will make a series to feature more and more real world examples. Thank you.",True
@LuCaaZ7,2019-06-05T01:57:57Z,0,"I was searched the solution for the ""zip"" method before reaching that part of the video. Wasted about 30 minutes to realize it was down there :(                                           At least got +1 in troubleshooting.",True
@lechterred9519,2019-05-30T08:31:45Z,0,"12:28 ""my dick""",True
@InnoTech_Insights,2019-05-28T02:41:06Z,0,Then what is the difference between Comprehension and Generatoe @corey Schafer,True
@shazkingdom1702,2019-05-22T14:45:21Z,4,"I suddenly remember my best Algebra 👨‍🏫 because of you! - Thanks Corey, I wonder where you are right now,  want to shake hands with you and meet you!, You are a great teacher. 👨‍🏫",True
@siqizhang,2019-05-09T23:01:24Z,0,"Good video. But list comprehension is a pretty redundant piece of syntax; All of its use are covered by map, reduce and filter functions, which do a lot more.",True
@kamolusmonov6540,2019-05-01T12:01:49Z,0,"About the last one, generator expression, it is more likely to call that list comprehension?",True
@animapandey,2019-04-19T10:27:56Z,1,Best tutorial......Thank you so much,True
@JasonKuang,2019-04-12T18:35:49Z,1,thank you!,True
@KirillBezzubkine,2019-04-05T08:42:38Z,1,your vids are godly,True
@raat1,2019-03-29T18:16:27Z,2,i normally don't post comment .. But could not help on this one. Very well laid out .. nicely explained and very well planned ... good job thanks,True
@sodapopinski9922,2019-03-05T07:17:16Z,1,what if you didn't want to nest the loops instead of output a0/a1/a2/a3/ .... you wanted a0/b1/c2/d3 with wouldn't be nested how would this be written in a list comp,True
@sarar2047,2019-02-25T05:07:18Z,1,i am bit confused as to why i would need a generator if i can just use comprehensions?  Do u have more examples where a generator might be more appropriate to use than a comprehension ?,True
@THULAA100,2019-02-21T08:28:11Z,2,Awesome .,True
@harnathatmakuri2394,2019-02-19T05:36:23Z,2,learned a lot from this best video ever seen thank u,True
@ACohen,2019-02-18T19:08:52Z,1,"for Python 3.7:  names = ['Bruce', 'Clark', 'Peter', 'Logan', 'Wade'] heros = ['Batman', 'Superman', 'Spiderman', 'Wolverine', 'Deadpool'] print(*zip(names, heros))",True
@mandeepubhi4744,2019-02-18T14:20:48Z,2,"An elegant approach of illustration, Beautiful!!!",True
@RajanKumar-lv7ve,2019-02-08T06:33:07Z,0,my program says SyntaxError for zip function... can someone please help?,True
@olee_7277,2019-02-02T13:34:47Z,111,I know Im immature but every time someone calls a dictionnary variable : my_dict I burst out laughing,True
@astspace6708,2019-01-24T05:44:58Z,1,"Since the last example is a generated comprehension without the ‘yield’, how can one tell if it is a list comprehension or a generator comprehension? Is important to be able to distinguish them?",True
@Gameplays4u2,2019-01-21T04:02:52Z,2,OMG you made these concepts to simple it took me forever to understand generators till I found your video.,True
@deepgsingh,2019-01-14T01:18:47Z,2,"Awesome, I have watched all of your python videos and they are great stuff , Thank you",True
@tunkyi7162,2019-01-13T10:24:36Z,2,Thank you bro. Your lectures are GOLD!,True
@petkoelenkin5713,2019-01-13T06:44:35Z,0,Love these videos! Im hoping that you would achieve these 300 patrons for Rasbery Pi videos.,True
@kalangiprasad4073,2019-01-12T12:33:10Z,0,"names = ['Bruce', 'Clark', 'Peter', 'Logan', 'Wade'] heros = ['Batman', 'Superman', 'Spiderman', 'Wolverine', 'Deadpool'] print(zip(names,heros)) #print zip(names,heros)-------> This way is not working in my PC.  output:- <zip object at 0x00F097B0>  How to reslove it @Corey,can you please reply for it Its at 11:10 minutes",True
@anirband3082,2019-01-11T19:37:14Z,5,"haha he said ""my dict""  12:27",True
@ROC4Life96,2019-01-11T01:02:02Z,1,"This wasn't what i was looking for, BUT i am very glad i stumbled upon this video! Thank you!",True
@jebipunnoose,2019-01-09T16:39:49Z,0,my brain hurts,True
@sunchit,2018-12-28T05:56:04Z,0,What IDE are you using? How are you running the code in Sublime Text?,True
@XBoysGaming22,2018-12-21T12:34:26Z,2,Good Stuff!,True
@stawag3478,2018-12-17T09:38:44Z,2,simply awsome,True
@djcoolio8096,2018-12-11T21:04:01Z,2,The best explanation ever! You're making our lives so much easier! Thanks!,True
@abdurahmanomoruyi7753,2018-12-08T18:47:28Z,0,hey can Someone help me with using the zip function in python 3.7. I tried printing the zip function but it gave me a function location,True
@tongliu1076,2018-12-07T23:20:21Z,1,"I want to add 'else' for practice. I found: I tried [n for n in nums if n % 2 == 0 else 0], it didn't work.  But [n if n % 2 == 0 else 0 for n in nums] worked out. However, [n if n % 2 == 0 for n in nums] didn't work either. I got confused.",True
@tongliu1076,2018-12-05T23:38:38Z,2,I watched every topic video before the topic my class is going to reach. It makes my class so easy.,True
@tongliu1076,2018-12-05T23:36:04Z,2,NIce contents,True
@HappyAnimals3D,2018-11-27T17:35:53Z,2,This was very informative. Your examples helped a great deal.,True
@JAREMAIALOOK,2018-11-25T00:16:47Z,2,"I am very grateful that you make these videos, keep up the great work!",True
@zackm7541,2018-11-21T05:48:05Z,230,Corey I hope you always go to bed feeling good about your work and helping out the community. Thanks for your very clear tutorials.,True
@kedwards127,2018-11-18T06:05:17Z,2,You just saved me on my homework assignment. I looked at several resources online and asked three different people and your video is the only thing that made the light bulb in my head turn on (in learning dictionary comprehensions)!! Thank you.,True
@sahilsharma-hj4gq,2018-11-17T12:49:12Z,2,oh mannnnnn....... simply AWESOME.. You teach way better than most of the python tutors. Your detailed explainations are dope.,True
@lovejaexi707,2018-11-16T02:02:23Z,2,thank you！you are amazing at teaching! love you~,True
@mrmoinn,2018-11-14T05:13:16Z,0,"Would all of the examples work with range(1, 11) replacing nums?",True
@bulldawg4498,2018-11-13T02:24:53Z,2,Excellent presentation ...,True
@craigwarren4123,2018-11-09T18:34:23Z,0,"Great tutorials.Also.... my_list = [ n % 2 = 0 for n in nums ] works as well, to return list of true/false if item is odd or even.",True
@olimhon3188,2018-11-03T13:26:36Z,2,It is very easy to understand,True
@Shubhamsingh-eg9qv,2018-11-03T04:37:00Z,2,It really helpfully for me thanku..,True
@isaackay5887,2018-10-31T17:59:10Z,4,"For Python 3.6+, it's *NO LONGER* just the *_reduce(your_function, your_data_sequence )_* method.  You *MUST* first *_import functools_* , then you use _* functools.reduce(your_function, your_data_sequence) *_",True
@moj8301,2018-10-18T19:29:59Z,0,After watching this if you want to practice the concept he just taught visit this website and read the article i promise you that you will be able to write your own list comphresions easily https://www.pythonforbeginners.com/basics/list-comprehensions-in-python,True
@jaiverma1,2018-10-16T22:03:39Z,0,dude! Generator is  different thing. you can not use comprehension for this.,True
@abhishekomi1573,2018-10-13T06:34:33Z,0,$ python p7.py <zip object at 0x02DD93C8>  why i always get this,True
@aadishjain6838,2018-09-27T01:49:50Z,0,when im using zip function in python3 it just says <zip object at 0x1041a4d48> > ....what should i do ?,True
@tripkendall,2018-09-17T15:13:27Z,0,"I am trying to address the weak spots in my Python.  List comprehension is among them, so I have been seeking further edification on the subject.  I say all that to say that this video was great, but maybe you could make a video that goes beyond the scope of this one while remaining on the general topic?  You have a style and method that is easy to follow and I appreciate your time.",True
@vatsavsree4783,2018-09-15T12:06:18Z,0,"result = { x+y for x in range(3) for y in range(3)} , i want know the values in result  ,i taught there would be 9 values(i.e sum of all combinations of 0,1,2 in x and 0,1,2 in y but answer is 5 i'm not understanding its control flow, thanks in advance",True
@milutinndv,2018-09-11T12:14:49Z,0,"print(list(zip(names,heros)))",True
@raidermack8723,2018-09-07T01:34:26Z,0,"I'm having an error code that could laughable to someone with your knowledge.  I've created a list, (for example 1-10)when attempting to access an element in that list (beginning with [0] - [9] ). I get an 'out of range' error.  Can you please help with this?  This baby step issue but I'm not seeing it.",True
@ashj1165,2018-08-31T13:45:00Z,2,Best video on lists.,True
@RandomShowerThoughts,2018-08-30T00:56:30Z,7,the amount of material I have learned from this channel is literally amazing!,True
@MihailButnaru,2018-08-28T23:33:45Z,3,You are a legend!,True
@ArunKumar-qy6fm,2018-08-25T18:50:50Z,2,Explained wonderfully.  Thank you.,True
@MegaJohn144,2018-08-15T23:16:28Z,11,"I just started learning Python and decided to rewrite a program in Python that I first wrote in C++. I wanted to use a lot of these Python features to eliminate all those those for-loops. So far, my Python program is turning out to be a lot more complex than I thought it would be. (I think I'm over-thinking the problem.) I'm hoping I can use list comprehension to eliminate a lot of that coding and fully utilize the power of Python. I happened to find your video, and I know it is really going to help me. I was also looking for a way to code, debug, and run .py files. You are doing things in Sublime Text that I didn't know you could do. I'm looking forward to watching the video again and following along, as well as watching more of your videos.",True
@TheKaushal8686,2018-08-15T05:01:02Z,2,best python videos on youtube..,True
@rsdntevl,2018-08-14T03:42:01Z,0,haha.. my dict,True
@CipriValdezate,2018-08-13T07:52:06Z,2,Very good!!,True
@rocky_xiao,2018-08-03T14:00:52Z,0,Why do we bother to use generator with (n*n for n in nums) instead of a list [n*n for n in nums]?  thanks.,True
@AbdulwahabDev,2018-08-01T01:54:56Z,2,thank youuuuuu,True
@antonioburke7716,2018-07-29T12:16:16Z,2,"You are the best on youtube, God thank you.",True
@bialcus69,2018-07-28T09:50:32Z,0,This udemy ad make me cringe!,True
@priyankkharat7407,2018-07-25T06:20:25Z,2,Amazing tutorial! Very Helpful,True
@ppant,2018-07-18T14:37:30Z,2,You are a great teacher. Keep it up! Thanks,True
@nasalee3729,2018-07-14T18:45:16Z,101,"04:15 python 3.6 should this: my_list = list(map(lambda n: n * n, nums))",True
@davidalexander829,2018-07-07T22:25:45Z,0,"File ""<ipython-input-21-1d8e5942b84a>"", line 3, in <module>     my_dict[names] = heros  TypeError: 'tuple' object does not support item assignment Oops!  Sorry, just read a comment that Corey is using version 2.7.",True
@valeriewang6244,2018-07-06T17:31:08Z,4,Corey!!!! You are so nice!!!!!!!,True
@nikhilbhardwaj6055,2018-07-06T16:35:18Z,1,<map object at 0x00000145D9560B00> but i'm getting this as output while trying n*n with lambada,True
@vijaykribha4223,2018-07-02T09:43:12Z,0,can you explain the use of * in python.,True
@novicetech1,2018-06-29T15:33:26Z,2,Wow! Now I finally understand list comprehensions. Thanks Corey. Another great tutorial.,True
@chungeyeme,2018-06-26T10:23:10Z,0,Question: the builtin function filter() and map() are returning class 'type'. How could you assign a type value to my_list,True
@shritamkumarmund5273,2018-06-20T10:34:53Z,0,"I have a doubt on variable iteration. Let's see my outputs.  .py file: *********** i=20 a= [1, 2, 3, 4, 5] for i in a:  print(i) print(i) print(i) print(i) print(i)   Output: 1 2 3 4 5 5 5 5 5  It's totally changing my defined value of the variable. Can you please tell me, how to fix it for a better programming.",True
@santoshbhosale7881,2018-06-16T15:51:50Z,0,Hey Corey!!.. Thanks a lot for the series of tutorial.. it is making my life easier as am a learner. Can you post some tutorials purely based on Data structure and Dynamic Programming. It would be a great help,True
@nawendusingh2858,2018-06-15T16:58:17Z,1,"for those who found this channel late,Corey is using Python 2 and the map+lambda function in this example will return a map object  in Python 3.x. more explanation can be found at https://stackoverflow.com/questions/1303347/getting-a-map-to-return-a-list-in-python-3-x.  The following 2 ways now work in Python 3:- 1.  my_list = [*map(lambda n: n*n, nums)]  print(my_list) 2. my_list = map(lambda n: n*n, nums) print(list(my_list))",True
@mariaaraujo3042,2018-05-28T10:41:00Z,0,"'more readable way', hahaha what a joke!",True
@subhasnandy391,2018-05-27T15:04:49Z,0,Are generator expressions faster than comprehensions by any chance ?,True
