author,updated_at,like_count,text,public
@subhasnandy391,2018-05-27T14:27:38Z,0,"I found one query here. When the list of names and heroes was created, 'Clark' was present as the second element. However, on usage of zip(names, heroes), the corresponding tuple ('Clark', 'Superman') shifts to the end. Any explanation as to why it happens ?",True
@irkhamwidhisaputro5739,2018-04-07T17:45:45Z,0,"best bruh, thank you",True
@zes7215,2018-04-07T07:53:18Z,0,"no such thing as shouldx or familix or exp have to exp or not, nonerx",True
@faleru,2018-03-26T13:50:34Z,0,Is this python 2 or 3?,True
@PacifiqueNzitonda,2018-03-24T08:13:34Z,0,I'm beginner in Python and I learn it for Rigging task in Maya. Thank you so much!!!,True
@shivanikumar6752,2018-03-12T16:17:18Z,0,you're awesome!,True
@Beatsbasteln,2018-03-12T12:34:28Z,0,that's awesome,True
@babbalaminou7697,2018-03-09T06:09:29Z,0,I subscribed. You are good! Thanks!,True
@pavelpavlov8143,2018-02-21T19:57:18Z,0,Great stuff.Thanks Corey!!!,True
@sushichanel7299,2018-02-20T09:36:10Z,0,"I have this errors when using map(lambda()) combination. <map object at 0x024F3310> . My whole code is nums = [1,2,3,4,5,6,7,8,9]  my_list = map(lambda n: n*n, nums)  print(my_list)  ---------------------------------- nums = [1,2,3,4,5,6,7,8,9]  # my_list = [n for n in nums if n%2==0] my_list =filter(lambda n: n%2==0,nums)  print(my_list)  Errors: <filter object at 0x02D73310>",True
@SriramM289,2018-02-18T02:58:55Z,0,"Corey, do you have videos on django 2.0 ?",True
@stillyi,2018-02-12T20:36:59Z,0,how do you comment and uncomment multiple lines with # at one command?,True
@geekyprogrammer4831,2018-02-10T23:08:39Z,2,You definitely deserve more views!,True
@lukamilosevic8947,2018-02-09T17:22:35Z,0,Much better than slatkin...,True
@hongphuongo1862,2018-02-02T07:23:16Z,0,"Thank you for the video, I'm just a novice and this helps me a lot. I have a question: in dictionary examples, I just happened to 'discover' that I can have the same output with this: new_dict = dict(zip(names, heros)) print(new_dict) Is this legit in practice? Or have any downside? Or maybe this is just new in Python 3?",True
@CheiithooCat,2018-02-01T12:13:29Z,0,Pinche espiderman nadie lo quiere,True
@denver1037,2018-01-31T15:19:50Z,3,"Great Video! As usually! If I could (if youtube would allow it), I would give you a thousand ´like´! Thanks for your work!",True
@SriramM289,2018-01-30T16:47:03Z,0,Observe the following list comprehensions: L=[n*n for n in range(11)] K=[2n for n in range(11)]  The 2nd comprehension syntax throws an error. Can someone explain why?,True
@JonesDTaylor,2018-01-16T15:33:25Z,0,Awesome tutorial,True
@SriramM289,2018-01-16T13:41:50Z,0,"HI Corey, I see that zip() when tried to print throws an error. A google search revealed that one should use __next__() to print the next pair. Do not know if the example cited in this video works in Version 2.0",True
@RaviPrakash-tc5nw,2018-01-11T18:38:05Z,0,Sir please make a video on Algorithms in Python,True
@Lowzenza4,2018-01-09T23:25:36Z,0,Can you make tutorials using pandas and dataframes? That is the stuff I am struggling with.,True
@nickt423,2018-01-07T18:50:47Z,0,"How is he able to use the print function without the parenthesis? For example, he writes print my_list instead of print(my_list).",True
@acamineronewyork8593,2018-01-05T22:57:35Z,0,You are the best !!!! Thank you,True
@riturajborah8529,2017-12-26T06:44:58Z,0,"Hi Corey, thanks for such wonderful and clear tutorials. I have one simple doubt. While running the below code, I am getting the output as ""the memory location instead of data."" Can you please explain the issue, I am running the codes in Jupyter Notebook.   nums = [1, 2, 3, 4, 5, 6, 7, 8, 9] mylist = map(lambda n: n*n, nums) print(mylist)  output ""<map object at 0x0000000005B2BF60>""",True
@davidm.johnston8994,2017-12-21T07:02:22Z,0,Why do you always use n*n instead of n**2? Is it somehow more efficient?,True
@annamarcus1249,2017-12-16T22:42:13Z,0,can you do a tutorial on map,True
@stevefrt9495,2017-12-14T17:14:09Z,0,thanks you so much,True
@rohankudale1392,2017-12-09T17:50:10Z,0,It is confusing to see how generators work in terms of program flow. Can you explain or suggest on how I can trace?,True
@RC-bl2pm,2017-10-27T05:35:56Z,1,Boy you're a good teacher! Great explanation followed by meaningful demonstration. Clear.Punchy. Keep going I'll keep watching.,True
@haoyangrocks,2017-10-21T11:23:43Z,0,Super fantastic video!,True
@sbarter,2017-10-04T06:08:46Z,0,these videos are the beeznees,True
@stefanvig,2017-08-03T05:31:25Z,0,"Can't print map, filter, or zip directly with python 3, because they return iterators.  Need to make it a list() for printing... Great videos!",True
@pmons1337,2017-07-26T13:20:59Z,0,this is beautiful can't wait to get into your tutorial,True
@lolaplolap1,2017-06-15T01:56:57Z,4,12:28 My Dick...... *my_dict,True
@silvanadonato7869,2017-06-06T19:04:32Z,0,One question: where have you found the terminal for sublime? :),True
@mohankumarbalasubramani3410,2017-05-09T12:00:18Z,0,"nums = [1,2,3,4,5,6,7,8,9,10]  mapped_list = map(lambda n: n*n, nums) filtered_list = filter(lambda n: n%2 ==0, nums) well,  my question is .. is it possible to implement filter and map with one line of code using LAMBDA ?",True
@papaschubo7828,2017-05-08T21:15:58Z,0,"Thank you for the python videos, really great, they help a lot, very precise! I started with python and have the following problem which causes a knot in my head. I have a list of numbers , and need  all pairs of numbers out of a list[1, 2 ,3, 4, 5, 6] with a a certain index distance like - distance =1  result 1,2  2,3  3,4  ... or distance=3  result 1,4  2,5  3,6 ....... is this possible with comprehensions ? Thanks again!",True
@justinstar9710,2017-05-08T02:54:28Z,0,"great tut, taught me a lot which school did not on the same subject.",True
@DM-py7pj,2017-04-30T18:22:42Z,0,"Excellent video.  i am following a tutorial on time series forecasting that has the following lines of code:  dateparse = lambda dates: pd.datetime.strptime(dates, '%Y-%m') data = pd.read_csv('C:\\Users\\USER\\Desktop\\AirPassengers.csv', parse_dates=[0], index_col = 'Month', date_parser = dateparse)  I was wondering if it is possible to use a list comprehension for the date_parser function?  I had tried: dates = ['1949-04', '1949-05'] dates_list = [pd.datetime.strptime(dates, '%Y-%m') for date in dates] print(dates_list)  However, i get the following:  TypeError: strptime() argument 1 must be str, not list  Is there a way around this to allow conversion of each date value in a column from e.g. 1949-04' to '1949-04-01 00:00:00' using list comprehension? I appreciate that here a function  is being called.",True
@averaguilar,2017-04-18T04:36:30Z,10,Somehow my cortex was aroused when the comprehension parts started.,True
@kyachalaaa3542,2017-04-05T14:25:11Z,0,plzz add a tutorial for abstraction in Python... asap,True
@brisketbaron,2017-04-04T22:53:17Z,0,"nice one, should do some huge random stuff both ways and cmp execution times. Did you thumbs down your own videos just cause?",True
@joselima9398,2017-03-31T02:57:51Z,0,"finally, you have glued this together in my head. thanks!",True
@ventin75,2017-03-20T13:25:25Z,0,"how do you remember which types of brackets to use for each example? The obvious ones are [ ] for list, { } for dict, ( ) for sets.",True
@leithhawkins2165,2017-03-18T04:59:06Z,0,Awesome Tuts.  Well thought through but clear and concise !  well done,True
@jeffreystockdale8292,2017-03-17T01:24:12Z,16,"1st time seen this explained, I agree, your lack of ""ummms, uhs, hold-ons, etc."" are very pleasing to the ear, great instructor. Thanks.",True
@snpsforyomom,2017-03-14T07:45:30Z,0,awesome video! I didn't know about sets and generator compressions. will be trying them out. thanks!,True
@user-hk2jx5mj6z,2017-03-13T16:18:54Z,0,Thank you.,True
@mrskumarvlogs4021,2017-03-10T00:41:40Z,0,Nicely explained.  well done. and Thanks.,True
@bogdanjcnd,2017-03-02T20:06:29Z,0,"I have a question about  zip . In case of print(zip(names,heros)) I received  <zip object at 0x00000172F53A37C8>  I wonder why  you  received a tuple as on output.",True
@srineeshsalur524,2017-02-23T12:22:11Z,0,"i am getting output as <filter object at 0x00D25AF0> when i use lambda functions pls help code: nums = [1,2,3,4,5,56,70] king = filter(lambda o:o%2 ==0,nums) i am using pycharm",True
@lokeshbhatt4u,2017-02-17T09:32:31Z,0,"Great, fast paced contents with nice illustrations !",True
@lennyadams8275,2017-02-14T03:23:24Z,0,"Fantastic video! Thank you for sharing your knowledge with us, Corey! :-)",True
@deandre1988,2017-02-14T01:52:48Z,0,"heroes*,  good vid",True
@Robert-nl2jv,2017-02-12T02:48:13Z,1,Great videos! How about a tutorial for map and lambda? I've worked through a couple beginner Python books and haven't heard of these.,True
@insanecbrotha,2017-02-01T10:55:28Z,0,the dict comprehension works also with something like this (this was my first idea when I read the verbose task description): : fullname_dict = {names[i]: heros[i] for i in range(len(names))}  Unlike the given solution this throws an IndexError if the iterables don't have the same len though.. :(,True
@isaaslan1317,2017-01-31T20:41:17Z,0,hello can you show how to change from for loop in to list comprehensions,True
@battlemode,2017-01-26T16:35:47Z,1,"Really good tutorial, very clearly and concisely explained. Thank you!",True
@enockaddey,2017-01-11T21:37:59Z,0,Thanks so much! Great examples.Very helpful!,True
@sharadchandakacherla8268,2017-01-09T16:09:21Z,0,thanks man.,True
@eclecticmirage,2017-01-08T17:40:34Z,0,Fantastic tutorial. Thank you.,True
@carlgusler1554,2017-01-05T14:58:20Z,0,Great and helpful video.   Which IDE is this?,True
@maziarghorbani,2016-12-20T23:54:30Z,0,You are a talented tutor. Thanks,True
@saradeeee,2016-12-14T20:33:59Z,0,"YES! thank you so so much! All other tutorials kind of just mention this casually thinking that we understand what is going on, but we cant really know what's happening until someone actually explains it! You are an amazing teacher",True
@24junar,2016-12-11T14:08:57Z,2,"This is the best python tutorials I've ever seen so far. Clear, very detailed, even the examples and text editor you've use is perfect. thanks, looking forward for more advance python techniques in the future. Once again.. thank you so much",True
@MatiasEzelQ,2016-11-27T13:51:23Z,0,Very good videos!,True
@hslilly,2016-11-18T15:31:28Z,3,"Thanks for the videos. Just subbed.  n.b.: Python3 zip returns an iterator, I needed to create a list then print.",True
@HuyNguyen-tk9iw,2016-10-14T05:33:50Z,0,That was really good. Thank you very much.,True
@sanjayshr1921,2016-10-06T19:59:01Z,0,how do i create multiplication table using LC(List Comprehension) ?,True
@jmack6046,2016-09-14T04:23:24Z,3,i love u,True
@pkaramol,2016-09-08T07:59:17Z,0,Perhaps an alternative to list with my_nums if even:  my_list = [n for n in nums if not n%2],True
@gyan2664,2016-08-25T23:47:21Z,0,Can you please make some tutorials on python3 and  selenium framework....,True
@gyan2664,2016-08-25T23:46:04Z,0,"your tutorials are really helpful and best available on you tube they are very detailed I have gone through multiple tutorials on Python for ex Sentdex ,newboston .but none is as detailed as your you have gone from basic to advance .......thanks man ....",True
@CoolGuy-ez8lj,2016-08-13T16:18:45Z,0,"Thanks for your videos on python. I need tutorial on the datetime, time and calendar modules on python with easy understandable examples from the scratch on those modules.  Can you help me with that?",True
@ProbuddhaNag,2016-08-01T20:41:10Z,0,I am learning Python and your videos have been more than helpful. Thank you very much!,True
@anuradhapani1918,2016-07-17T04:26:53Z,5,very nicely explained! thanks,True
@jerril42,2016-05-31T02:27:06Z,1,I'll never look at lists the same again :),True
@darrenandveronica,2016-05-28T08:45:01Z,1,"Succinct yet comprehensive, and beautifully explained. I am really getting a lot clearer about python through your videos - thank you.",True
@americaexpointernational5277,2016-04-30T12:17:47Z,0,excellent,True
@ravi2047,2016-04-21T02:45:34Z,0,Very helpful video. :) One question though! To remove the duplicates in an array we can simply use the set function right? my_set = set(array),True
@Pd69bq,2016-04-12T09:29:50Z,0,"for the dict/hash comprehension, imo using dict function is shorter and easier. especially in python 3 since zip returns its own ""zip type"". although, you still can unpack returns with the same way, but type less is alway good, right?",True
@w.schobel1514,2016-04-09T09:01:51Z,0,your videos are brilliant! glad i found your channel,True
@themossinator,2016-03-31T19:55:48Z,0,"Hi, what program are you using here to run your code? I love the dark background, great vid, thanks",True
@RameshK-rn3hf,2016-03-12T14:45:26Z,0,Excellent,True
@leshghett8956,2016-03-02T23:52:46Z,0,"Just wanted to know how you put comment symbols on multiple lines at once, thanks.",True
@lamarts100,2016-03-02T04:06:29Z,0,Great job!   This is way better than the for loops.   Crystal clear explanation...,True
@spizeck,2016-02-23T05:01:00Z,4,Brilliantly done. You were very well prepared and it showed. Bravo sir.,True
@serhiy2020,2016-02-18T06:23:56Z,0,"This is probably my favorite feature in Python. Thanks for these videos, you're a great teacher!",True
@SeekHeart,2016-02-10T00:35:48Z,40,"Hey Corey, could you do a video on lambda, map, reduce and those family of lovelies?",True
@FirdausAziz,2016-01-24T05:53:52Z,3,Great tutorial... mind doing one on decorators?,True
@playgoods,2016-01-01T14:58:10Z,0,Great,True
@zzspenz7492,2015-12-14T20:58:18Z,0,"...great way to bring into context lambda and functional - very clear/informative, excellent!!",True
@VMSaloudi,2015-12-11T07:28:51Z,44,"A person could be a good programmer but good programmer != good teacher. You are the best python teacher on YouTube. Thanks for making our lives easier by putting the hard work in making those videos and explaining the concepts in simple and understandable form.   Also, whenever you have time, please consider making video on decorators.",True
@vinc9846,2015-09-01T08:37:50Z,32,"at 12:00 you are able to create dict from zip: dict(zip(names, heros))",True
@PavelKarateev,2015-08-26T17:41:54Z,0,PEP8 violations in a tutorial video drive me crazy = (,True
@SSCrow,2015-08-24T18:43:35Z,346,"I have to say that your videos are among the best that I've found on youtube for learning python. You're very well spoken, and your examples are great at illustrating the concepts!",True
