author,updated_at,like_count,text,public
@Fake_Disciple,2020-07-24T15:37:19Z,0,Your website is seen as unsafe,True
@alericcusher11,2020-07-24T15:36:59Z,0,I see that iced coffee!,True
@ashishankit9911,2020-07-24T15:36:12Z,0,Congratulations for the book 🎉,True
@fuba44,2020-07-24T15:35:09Z,0,"This will be awesome, glad to hear you are doing well and is safe.",True
@jieqi6341,2020-07-24T15:32:43Z,0,That book will be my bible!!!! I am in China but will buy it!!! Soo good to hear from you man!!!,True
@tawanike,2020-07-24T15:32:09Z,0,Glad to hear you are doing fine.,True
@kioshiki4519,2020-07-24T15:30:57Z,0,Glad to hear you're okay and I'm certainly happy to wait for the book to be finished.  You've got plenty of other videos in your channel I've not watched to keep me busy 😁,True
@lifeafteraleekx,2020-07-24T15:29:34Z,0,"If you wear glasses, you are the deep fake version of Edward Snowden lol",True
@aravindudupa957,2020-07-24T15:27:45Z,1,me thinking 1 hour ago: Long time no video Sentdex new video notification pops up,True
@dibsdib3697,2020-07-24T15:27:21Z,0,Glad to hear your still alive ( https://www.youtube.com/watch?v=l0zmCUVB0Yw ) Thank you for the much needed update.,True
@edwardlemay1955,2020-07-24T15:20:42Z,0,Really can't wait for part 6!,True
@deojeetsarkar2006,2020-07-24T15:19:45Z,3,"I thought you were only an internet hero, but here you are, a real-life hero indeed.",True
@riccardoronco627,2020-07-24T15:16:21Z,0,Are you going to publish a book on Python from zero? thanks,True
@PABLO-oq1kt,2020-07-24T15:15:41Z,0,What is his problem with justice? I'm French so I can't understand everything,True
@riteshzd,2020-07-24T15:15:07Z,0,"I see the flame thrower, hmm...",True
@giovannipizzato6888,2020-07-24T15:11:16Z,0,"I would use Adobe Indesign for formatting books. The program can automatically show the page number in the format you wish, and structuring a hundred to a thousand page book can be made in minutes. That is, if you've got all your content sorted out.",True
@anishneunaha6312,2020-07-24T15:11:04Z,1,Love the content. Someday will come down to meet you and have a wonderful session to learn from your insight and interest you in some thought provoking discussion. God bless you. Best Wishes!,True
@AM-jx3zf,2020-07-24T15:09:20Z,0,"stay safe, brother",True
@krishnaramasimha,2020-07-24T15:08:39Z,1,"Hey Harrison, you inspire me a lot. I want to get started with Machine Learning but I don't know how to.... Can you help me out ? Big fan of yours 😍😍😍",True
@bluesdog88,2020-07-24T15:08:27Z,1,"Love the The Boring Company Not-A-Flamethrower, they are worth a small fortune on ebay!",True
@vishcorpgames9471,2020-07-24T15:07:06Z,69,sentdex: some of you might know my wife is a ph..... me: *YOU HAVE A WIFE?*  jk stay safe,True
@claymotupalli4513,2020-07-24T15:05:51Z,0,Glad to hear you're safe! God bless you!,True
@palaashatri,2020-07-24T15:04:27Z,0,I see sentdex I click 👍🏻,True
@adempc,2020-07-24T15:02:27Z,0,Thanks -,True
@KishoreKumar-uz8ir,2020-07-24T15:00:58Z,0,You won't believe me. Suddenly I remembered you today and went to check if you had uploaded any new videos and I was saying to my friends in whatsapp that it had been 2 months since you posted a video. Then a few hours later I got the notification saying sentdex uploaded a new video. Its such a coincidence. Dying to see you get back to GTA-V. That is the series which made my final year project possible.,True
@afonsorafael2728,2020-07-24T14:59:58Z,0,glad you're alive and well,True
@rambharat35,2020-07-24T14:59:56Z,0,Sentdex is back ..,True
@aggyz7534,2020-07-24T14:57:44Z,1,Please unban me from your discord server :( I'm very sad and sorry,True
@ruslansayfullin6194,2020-07-24T14:57:16Z,0,Thanks for your lessons from Russia.,True
@HarshithMK,2020-07-24T14:55:07Z,0,HAHA I spot Corey Schafer in awesome humans,True
@risncch6595,2020-07-24T14:54:34Z,0,you don't use a mechanical keyboard? what kind of a programmer are you?,True
@kentvandervelden,2020-07-24T14:53:11Z,0,"Super inspirational, keep at it! Stay safe",True
@godfist9333,2020-07-24T14:53:04Z,0,I am on your Ml course rn. Gl for me,True
@mytechnotalent,2020-07-24T14:52:16Z,0,Glad to hear you are ok and well!,True
@reghunaathaa1654,2020-07-24T14:52:14Z,0,why are you suing udemy??,True
@jeff4877,2020-07-24T14:52:14Z,0,What if...this isn't Harris and Daniel had to create a AI video because something went wrong with Harris and *plot twist* Harris was really Edward Snowden this entire time......     Glad your back,True
@Shah_Khan,2020-07-24T14:51:41Z,0,Great!!! Pleasure to see you again. You are my inspiration and motivation. Thanks for making great content.,True
@mohammedhafiz8132,2020-07-24T14:51:26Z,0,Greaaaaaat!! ^^,True
@nexovec,2020-07-24T14:50:59Z,0,just write it in latex next time,True
@leonardoxavier1481,2020-07-24T14:50:55Z,0,"Sentdex, do you ship this book to Brazil?",True
@MusingMouse,2020-07-24T14:49:50Z,0,"Take care of yourself and your family first. I bought and am excited about the book, but have no problem waiting. Keep up the great work!",True
@leonardoxavier1481,2020-07-24T14:48:15Z,0,I already missed this face on Youtube. Welcome back!!,True
@victormurphy3511,2020-07-24T14:47:17Z,0,Good too know that your here.,True
@iamjameswong,2020-07-24T14:47:16Z,0,Doing some awesome neural network stuff while playing GTA V on Linux is living the dream!,True
@qlok3626,2020-07-24T14:47:02Z,0,bruh are you working out bro?,True
@yashkurella584,2020-07-24T14:46:43Z,0,Miss you and those mugs 😂❤️,True
@chiragbheemaiah5666,2020-07-24T14:46:07Z,0,Take care man,True
@SeamusHarper1234,2020-07-24T14:45:52Z,4,Some people dip their donuts in coffee. First time I see it the other way around =),True
@pzet9129,2020-07-24T14:45:02Z,0,Ripped,True
@qnmark9432,2020-07-24T14:43:45Z,2,Nice haircut,True
@TechWithSabri,2020-07-24T14:43:41Z,0,yesterday my mind was asking me where is sentdex? i didn't find an answer but now i can answer him ^-^ hope all the best bro. the good things takes time.. love you man,True
@johncaling6150,2020-07-24T14:43:38Z,0,I thought you had COVID. Good to know you are good.,True
@akshittyagi6482,2020-07-24T14:42:46Z,0,An uploaad!!!! Also I wanted to say that I learned about 70% of what I know about programming from your videos(+website) and they are really high quality! Thanks a lot!,True
@list1726,2020-07-24T14:42:35Z,0,Looking forward to the book!,True
@HarshithMK,2020-07-24T14:41:52Z,0,He’s back,True
@gokuldas027,2020-07-24T14:41:42Z,9,Good to know You're okay...  was worried a bit😄,True
@shankarhariharank7837,2020-07-24T14:41:21Z,1,Expecting some Xavier NX deployment tutorials too 👍,True
@mmughal,2020-07-24T14:41:15Z,1,Good to hear from  you 😎,True
@shmarvdogg69420,2020-07-24T14:41:08Z,0,Your still more reliable than most game dev studios :),True
@WaterWheel360,2020-07-24T14:40:48Z,1,Can someone tell me more about the udemy copyright infringement?,True
@MyAeroMove,2020-07-24T14:39:46Z,4,Certificate on one of the nodes (i guess) on nnfs.io expired and haven't been replaced with actual one. And thanks for such unique content!,True
@nicholasn.2883,2020-07-24T14:39:45Z,0,Will buy the sent dex book but physical so I can smack people with it,True
@satyamrout1400,2020-07-24T14:38:41Z,0,Plss take care sir....,True
@WaterWheel360,2020-07-24T14:37:52Z,282,"You have a wife?  Wait, is that even legal?",True
@anonymeister123,2020-07-24T14:37:17Z,0,Pre-ordered!,True
@AshrafVideos,2020-07-24T14:36:57Z,0,welcome back mate. ♥,True
@HT79,2020-07-24T14:35:53Z,8,Year 2022:  NNFS plays GTA VI,True
@fabulamcafee,2020-07-24T14:35:36Z,0,hello. i wonder who you are and why i gifted you a sub. your videos look like they rock.,True
@gitc13,2020-07-24T14:35:04Z,429,the unlike is from udemy,True
@HT79,2020-07-24T14:34:46Z,60,"Aye man, quality > quantity!  P.S. Love that donut mug lol",True
@slayeroff7798,2020-07-24T14:34:45Z,6,Good to see that my fave programmer and tutor is fine :-) !!,True
@ManishKumar-xs9dn,2020-07-24T14:34:10Z,2,"Finally, John snow woke up😆",True
@hemanthkotagiri8865,2020-07-24T14:34:08Z,0,"Whoa, I can see that tummy. Hope you work out on that too as well, you look cool anyway! Thanks for all your content bro! Helping me a lot!!",True
@MoinKhan-qe3iw,2020-07-24T14:34:01Z,1,Bro please teach us GPT-3.,True
@mathematicalninja2756,2020-07-24T14:33:20Z,0,Huge respect man,True
@sandeepkulkarni3695,2020-07-24T14:32:34Z,1,Python plays GTA V! this is what I have been waiting to listen :-),True
@saadaddine6422,2020-07-24T14:32:32Z,0,You rock boi,True
@impossibleyes,2020-07-24T14:31:49Z,28,"Best Luck for your book launch. Edit: Screw everything else, Bring on the GTA CONTENT ASAP.",True
@samuelkahunga5987,2020-07-24T14:31:39Z,1,that mug tho,True
@tanmaydeshpande2409,2020-07-24T14:30:26Z,0,"Hey Sentdex,  Can you please share your email if you are comfortable?  Wanted some help on a project!",True
@K3varun,2020-07-24T14:29:24Z,0,"You have been working out, the gains are evident. Stay safe! Cheers!",True
@karanmishra8192,2020-07-24T14:28:58Z,1,Hii sir can you make some more videos on open BCI brain computer..please,True
@hassenzarroug9159,2020-07-24T14:28:57Z,0,You are the best! Can't wait for your next videos Good luck and God bless you,True
@saideepesh6036,2020-07-24T14:28:43Z,1,Make a video on GPT-3,True
@sureshalex1,2020-07-24T14:27:56Z,0,Thanks for the update mate,True
@aashishc5287,2020-07-24T14:27:41Z,0,Please make android development series... Also your desk setup please!!!! Love from india....😍🙌🙌🙌❤️❤️,True
@piyushtalele3594,2020-07-24T14:27:29Z,43,You are seriously a mentor to all the AI and ML enthusiasts.. We are eagerly waiting for more of your awesome work..🤘🏻🤘🏻🤘🏻🤘🏻🤘🏻 please can you also share the link to where I can get the book you are referring to in the video..,True
@jimshapedcoding,2020-07-24T14:27:22Z,103,Sentdex: Ye I know I wasn't consistent lately  Sentdex's weird mug collection: Heh,True
@IsaacAsante17,2020-07-24T14:27:12Z,20,My brain stopped paying attention to what you were saying halfway through the video; that doughnut cup is something else... But great to know you're doing good!,True
@kenchang3456,2020-07-24T14:27:09Z,0,"Great to hear from you, keep on keeping on :-)",True
@HT79,2020-07-24T14:27:01Z,0,wait wait wait....what's that copyright fuss about?? O.o,True
@srikanth0venkataswam,2020-07-24T14:26:30Z,0,Good to know that all is good.,True
@kevinpunnoor,2020-07-24T14:26:21Z,0,You are just awesome.. all the very best with all the stuffs.. stay safe!,True
@tanmayhire3092,2020-07-24T14:26:12Z,0,From where can I buy the book?,True
@icy-spoon85,2020-07-24T14:25:52Z,1,getting jacked from scratch,True
@vedrathi6592,2020-07-24T14:25:23Z,0,How long do you think it will take when you would start uploading the neural networks from scratch seires videos from now.,True
@indivarmishra6119,2020-07-24T14:25:01Z,0,"Liked it before watching it, you are the best.!",True
@rockyrivermushrooms529,2020-07-24T14:25:00Z,62,We're okay with waiting because the quality will be outstanding.,True
@barbabillios6180,2020-07-24T14:24:44Z,0,Is this Ubuntu you are using?,True
@tunacuma,2020-07-24T14:24:27Z,0,You look good man damn,True
@harshvardhansinghchauhan231,2020-07-24T14:24:11Z,0,Hey will your book be available on amazon,True
@kapilchauhan9774,2020-07-24T14:23:42Z,2,"Biggest question, how did you move from 5 monitors to 1?? 😂",True
@BigBadBurrow,2020-07-24T14:23:31Z,26,Me thinks Harrison's mainly been working on his guns.  KA-POW!,True
@yashwanth9549,2020-07-24T14:23:03Z,43,"One damn thing is that, till date you didn't get  a million subscribers........... That hurts me a lot",True
@ddude957,2020-07-24T14:22:56Z,0,"Bro, your arms are buff bicep-dex. Hope your dog is okay and you survive 2012  2.0",True
@arjunkashyap8896,2020-07-24T14:22:21Z,1,Hey Harrison.. So nice to finally hear from you.. Don't stress out too much. We can wait for part 6. . .,True
@ebrain1010,2020-07-24T14:21:46Z,0,Missed you Bro,True
@sharufbaig5860,2020-07-24T14:21:08Z,0,Cool,True
@jayeshrohansingh6792,2020-07-24T14:21:07Z,3,"Welcome back, missed you ♥️",True
@kakarnyori5457,2020-07-24T14:21:02Z,0,Take care!,True
@darshilpatel7287,2020-07-24T14:20:52Z,0,Am i getting a heart?,True
@dagher.a247,2020-07-24T14:20:22Z,1,"I left Python, since I did not watch you in a while",True
@programming_hut,2020-07-24T14:20:07Z,1,♥️ may you meet that awesome life again,True
@saicharansarikonda7293,2020-07-24T14:20:02Z,1,Why there is much gap for upoading this video,True
@AlphatheRock,2020-07-24T14:19:57Z,0,haven't seen you for long,True
@mr.raviteja1642,2020-07-24T14:19:57Z,1,hai sentdex long-time no see,True
@Mireda-wr3yc,2020-07-24T14:19:38Z,0,❤️✌️,True
@techwithimad4672,2020-07-24T14:19:38Z,0,FIRST 🎉🎉,True
@prateeksharma3257,2020-07-24T14:19:37Z,903,Damn. Snowden has been working out!,True
@MohitSharma-gl6mo,2020-07-24T14:19:37Z,84,Love you mate,True
@mariorossi1456,2020-07-24T14:19:37Z,9,26 seconds ago heeelllllll yeeeaaahhhhhh,True
@thecros1076,2020-07-24T14:19:35Z,1,Bro we're are you ....were is part 6 .... please come fast❤️,True
@gbalachandra923,2020-07-24T14:19:33Z,0,Happy to see you! 😅,True
@chemicalboy2106,2020-07-24T14:19:22Z,0,First,True
@janzugic6798,2020-07-24T14:19:19Z,0,thanks for the update,True
@edugalleg,2020-07-24T14:19:07Z,0,First,True
@ashishsarkar3998,2020-07-24T14:19:05Z,0,first,True
