author,updated_at,like_count,text,public
@chrisholladay,2021-05-19T01:39:58Z,0,"Just picked it up, super excited to read it, can't wait to dive in!",True
@davidstephens5741,2021-05-18T20:03:14Z,0,"Love your work, and very glad you and your family are ok :)",True
@jalaishahn1689,2021-01-21T03:52:41Z,0,i like the penguin cup,True
@honestcheetah,2021-01-15T17:33:19Z,0,Get your book on amazon.,True
@joseph3036,2020-11-22T14:47:48Z,0,0:38 What's up with the lawsuit thing? I cannot any video about it.,True
@filipesemanas4050,2020-10-24T16:36:18Z,0,Sentdex has been removed from Quantopian? O.O,True
@elias1812,2020-10-12T01:49:08Z,0,Nice mug bro,True
@ahmedthegreat3973,2020-09-24T16:37:06Z,0,NNFS Is Expensive,True
@my_j.a.r.v.i.s.,2020-09-24T05:50:23Z,0,"Hey, Man can you do a video on : Implementing face mask detection with raspberry Pi.  Please Please Please.",True
@georgebassemfouad,2020-09-23T14:37:08Z,0,Can you make a video on how to visualise a neural network in python?? Btw I am in process of buying the book of neural network I love your series in of neural networks from scratch... and I hope that you can answer my question soon,True
@joshuablick2693,2020-09-23T11:49:02Z,0,great job man keep it up!,True
@gestucvolonor5069,2020-09-20T12:37:37Z,0,Just thought I'd check back see if I missed some updates since this video was posted. Hope everything is going well!,True
@seyeeet8063,2020-09-20T05:55:26Z,0,can you make a tutorial series about Docker from scratch?,True
@emilschneider1133,2020-09-17T07:18:48Z,0,"After you are done with your book and all that and have time again, it would be extremely interesting to see a series on how to code a crypto trading bot using DQN and pytorch. I know you have made a series about DQN with tensorflow,  but not one about trading and using pytorch. It would be extremely interesting to see that once you have time ofcause.",True
@magokill5208,2020-09-14T18:04:16Z,0,"Can someone help me ?  Make a program that reads whole numbers from standard input, until a smaller number or equal to zero is entered, not being considered for the computation of the output (s). If first number read is less than or equal to zero, write the message “No number greater that zero was read !!! ”. Otherwise write:  (1) What is the largest number read;  (2) If any even numbers have been read, how many were and what is the average of the even numbers. Accurately written to two decimal places;  (3) If any odd numbers have been read, how many were and what the average of the numbers was odd. Accurately written to two decimal places;  (4) If any prime numbers have been read, how many have been and what is the average of the numbers cousins. Accurately written to two decimal places. Definition: An integer is prime if and only if it is greater than 1 and is only divisible by 1 and by himself.  Example Entrance exit 123 4 9 1890 5 -10 Number of Pairs: 2 with average: 947.00 Odd Quantity: 3 with average: 45.67 Quantity of Cousins: 1 with average: 5.00",True
@adjbutler,2020-09-14T11:18:53Z,0,No NNFS NO PEACE!,True
@how2pick4name,2020-09-14T10:44:57Z,0,When is Charles going live again? :o,True
@analisamelojete1966,2020-09-13T01:34:03Z,0,Is the shipping for the U.S. only? I'm from South America and I'd love to get your book (hardcover).,True
@ishudshutup,2020-09-10T05:00:41Z,0,"Thanks for the update, only improvement I would suggest is getting a hot shotgun mic for directional capture, the new NTG5 has a strong signal. In some of your videos, I can barely hear you on the subway with earphones on :(",True
@Aperekahaziq,2020-09-09T13:38:40Z,0,Hey! Almost 1M subs! Congratz! 👏🏻👏🏻👏🏻,True
@ronitaryan5402,2020-09-09T08:22:15Z,0,"sentdex, I am waiting for part 6 eagerly. But I understand you. Bro, take your time,  we'd rather have a good product late than a bad product early.",True
@SM-ht7qf,2020-09-06T06:46:27Z,0,I found a white guy who looks exactly like you  https://youtu.be/QL4ZdpdGuuU,True
@JoabEliotG,2020-09-05T10:23:37Z,1,what is the release date of machine learning part 6 I'm waiting for that surreal experience of seeing it work,True
@ashishsarkar3998,2020-09-03T11:26:31Z,0,"he sir, I am getting an error while while importing tflearn the error is no module name tensorflow.contrib my python version in 3.6.6 64 bit and tensorflow 2.0 with cuda set up properly how can I solve the error",True
@zhw1447,2020-09-02T16:34:01Z,0,"Can u Update the ""Sciki-Learn Tutorial"" ? Because that it's alots new in Sciki-Learn now (2020)  I really like ur video, thanks !",True
@dcanbazlar,2020-09-02T08:46:08Z,0,"In Python, how do I split a string and keep the separators like:  a.split(""abc"")     [123 456 abc]  not removing abc   2.question how to join after a word like dot=""."" a=123 456 abc dot.join(""abc) I want like this ↓↓↓ 123 456 abc.",True
@nq2c,2020-08-31T10:59:10Z,0,long time no video !!!,True
@skilz8098,2020-08-29T00:42:14Z,1,I know you've been busy with everyday life and that the current situation with this COVID thing has made it even harder... but it has been about a month since you released this video giving us an update as to what is going on... I'm just waiting patiently for the next video for your neural networks - machine learning series and curious to see when it will be released!,True
@vincentparker6103,2020-08-26T20:49:12Z,0,2020...#didn't see that comin',True
@samet107,2020-08-25T22:16:44Z,0,Admit it. Youre Stuck and dont know how to continue the series.,True
@adeeb1787,2020-08-25T07:37:00Z,0,Congrats for 1M in advance.,True
@ArjunSingh-sz8ul,2020-08-23T04:45:20Z,0,Thank u for helping us and really you are real hero,True
@yudhisthirsingh8401,2020-08-23T03:43:40Z,0,Love from India,True
@rappf5833,2020-08-22T01:32:28Z,0,"@sentdex wouldn't it be better the QR codes link to a domain you have access to and that domain redirects to youtube? in case YT goes down one day, not sure you do that already",True
@zanidd,2020-08-21T20:11:41Z,0,Snowden o.O?!,True
@bennguyen1313,2020-08-21T13:51:23Z,0,"When did you change the channel name from pythonprogramming to sentdex?  Is neural networks what you used for the self-driving Grand-Theft-Auto demos?    Would love to run it myself, any beginner walk-thru you'd recommend on getting started (tools needed, sources/instructions to build, version of game, etc)?    Is discord the place to go?",True
@harsh7809,2020-08-21T02:50:37Z,0,How the hack you clean that cup? with that hole in between the bottom and top.,True
@Mohamm-ed,2020-08-20T18:51:39Z,0,Do you plant to do more videos about Brain Computer Interfaces BCI?,True
@THE-MNG,2020-08-19T17:57:15Z,0,Can you recommend a tool for encrypting python code?,True
@gokuladethyat1466,2020-08-18T09:04:43Z,0,Waiting for you to reach 1 Million subs.Good Luck!!,True
@vaibhavsingh1049,2020-08-17T14:59:57Z,0,My man,True
@deckplate1,2020-08-16T17:46:49Z,0,I have to ask. I have access to the draft as I preordered the book. Is it worth waiting for the book to come out or can I start learning off the draft? Will there be some things I potentially miss learning off the draft?,True
@palashchanda9308,2020-08-16T13:36:55Z,0,Still waiting for P.6 eagerly..,True
@user-cs5rg1ny8l,2020-08-16T05:44:32Z,0,"import time  nxt_video_time = input(""Sentdex input nxt video's time: "") time.sleep(nxt_video_time)  TypeError: got type NoneType   System crashed on waiting. Waiting for another video to reboot",True
@mithilparikh9100,2020-08-15T22:11:13Z,0,Bro can you put up a video on how to use deep learning using RNN or CNN or any type of neural network to Predict the RUL of machines like input should be vibration data and our model has to segregate the noise and give the time remaining for maintenance,True
@yijunx7552,2020-08-14T23:18:55Z,0,Awesome! Great to see you are doing well! I am looking forward to the rest of the videos. I have already preordered it and cannot wait to read the final version.,True
@muhannadalhazmi8341,2020-08-14T17:00:06Z,0,do a tensorflow 2 with colab (object Detection) tutorial,True
@chanpatil5262,2020-08-14T09:23:58Z,0,"I am eagerly waiting for this book to be out!!! Always loved your work and content. Thanks, Mahn.",True
@brentdreyer1454,2020-08-14T07:20:30Z,6,"Hey sentdex, seeing you brings back an odd feeling that I forgot about. A mixture of stress, excitement and a new world of coding opening up to me. You used to be the voice I came to for advise while I was trying to get my LDA model to work in Python while I was doing my honours is statistics.  It has been about 4 years and I kinda miss those days now. All the best and I am glad to see you are doing well.  - Brent from South Africa    Oh and nice mug.",True
@user-vn9dm6xf1c,2020-08-13T17:12:59Z,0,Update,True
@colinthain4731,2020-08-13T17:07:56Z,0,Thanks for sharing:),True
@yad8187,2020-08-13T10:50:50Z,0,I want to build a search engine do sentdex have any videos related I only trust sentdex........so plz help,True
@Hahalol663,2020-08-12T12:40:03Z,0,"Awesome mug, but how do you get it clean?",True
@youngyulkim3072,2020-08-12T09:09:04Z,0,"Yo sentdex you are really the leader of the youtube ML community. I believe in you, cheers!",True
@thehappycoder3760,2020-08-12T07:22:04Z,0,Thank you for the update. Looking forward to seeing the finished product. Focussing on the quality rather than just getting it done. Reading the draft versions has been a great help in understanding the process. Take care from the UK 🇬🇧. Most likely use your book/video tutorials to encourage others to get into this brilliantly fascinating subject.,True
@VISWESWARAN1998,2020-08-12T05:53:13Z,0,Sentdex can I have a heart too <3,True
@jackarrr,2020-08-10T21:17:07Z,0,Looking forward to more GTA fun,True
@germantuto6637,2020-08-10T03:43:58Z,0,"Gracias por el libro,  lectura recomendada",True
@Jabrils,2020-08-09T16:41:39Z,144,You're my hero sentdex,True
@igweonucassy,2020-08-09T12:33:47Z,0,😬I so want that mug!,True
@d1nx2,2020-08-09T05:16:46Z,0,"Looking forward to your book release! Excited about eventually owning your printed version. Thanks for everything you're doing, sentdex.",True
@luisilabaca5356,2020-08-08T13:06:34Z,0,"dude i got the books months ago and its been soo helpful to have it all along regardless! everytime any updates happen, re reading it has been so helpful. totally appreciate the book!",True
@minhuang8848,2020-08-08T08:21:12Z,1,"Hey, I didn't even realize you were Brave verified. Sent you a nice tip I made from basically watching your videos.",True
@aishahassan6925,2020-08-08T03:04:15Z,0,"Hello sir, can you please make a video on multimodal biometrics authentication ,where you use face key and voice key and fuse them with better FAR,FRR and EER",True
@thePWord101,2020-08-07T21:22:03Z,0,"@sentdex  Sentdex, if you could, are you able to do a video on theclickreader.com  form = N/A print(f""I'm not affiliated by them in any way, shape or {form}"")  I feel like they are also another awesome resource and has really deepened my understanding of deep learning and neural networks.",True
@MrLeonardoibarra,2020-08-07T03:33:20Z,0,"Congrats for the project man! I was able to introduce myself into the whole machine learning world through your videos, so i will definitely buy it!",True
@nemx4u,2020-08-07T01:22:47Z,0,"Keep the great work, can’t wait for more videos",True
@codinginflow,2020-08-06T20:22:36Z,9,That cup looks delicious,True
@cultofsogga5863,2020-08-06T12:15:59Z,1,"You're not a cute great teacher. All you do is advertisements to paid courses, books etc and so on. All you do is obvious tutorials. It is sad. I'd better read books. I only regret wasted time on your channel.",True
@armaangupta9986,2020-08-06T07:20:22Z,0,No problem king we are with you man dont worry you guys are really awesome i really love nnfs take as much time you want 😃👍,True
@msalearning5382,2020-08-05T08:25:47Z,0,you are very good !,True
@allandogreat,2020-08-04T23:38:52Z,0,Be safe!,True
@saurabhsingh6325,2020-08-04T06:46:28Z,6,*NEXT PROJECT : HOW TO CODE A WIFE*,True
@baguettex5127,2020-08-03T19:19:06Z,1,"!!! Your QR codes in the book should link to a redirect so that if the youtube video link somewhat dies, you can change the redirect to somewhere else :) !!!",True
@vincentcleaver1925,2020-08-03T17:50:14Z,0,I miss python! I've been messing around with JavaScript since I got a Chromebook. I paste the HTML code into my blog,True
@inosuke44,2020-08-03T17:36:38Z,0,the Boring Company,True
@dumbestdummies2465,2020-08-03T04:36:56Z,1,not to mention the channel is gonna hit 1mil soon crazy,True
@tasalta,2020-08-02T19:40:48Z,1,Lovely to hear that you are doing good),True
@Praxss,2020-08-02T18:32:30Z,0,Waiting for python plays gta 5 ones again 🔥,True
@Android4LP,2020-08-02T15:16:47Z,0,Which Distro is he using,True
@ramchandracheke,2020-08-02T14:24:53Z,0,I think that many new YouTubers learn from you and still they are behaving like a master. They are sarcastic as well. You are very humble at this stage as well.,True
@ryan382,2020-08-02T10:28:45Z,0,you are awesome,True
@rishabhjain2442,2020-08-02T08:00:54Z,0,you are alive  <3,True
@InfinityJack,2020-08-01T22:55:57Z,1,Can you update the starcraft2 AI toturial? The toturial is outdated,True
@ashutoshmishra1027,2020-08-01T12:42:54Z,0,Hey Snowden....how's it going...lets hack fbi,True
@olavogazzola2650,2020-08-01T05:27:01Z,0,"I just order a copy of the ebook,  I mean have learn so much from the free amazing youtube stuff you post, minimum I can do is contribute to continue it, thanks a lot!",True
@pythondocs1054,2020-08-01T00:47:41Z,1,l dont know how much thanks l should offer u... l've been able to learn from python basics through pygame to opengl u are such an awesome person l wish l am always with you... now l can joke of being a programmer without stepping in a programming school bcause there is no programming/IT school in Ghana,True
@kapileshkothavale2239,2020-07-31T21:04:27Z,0,Edward Swoleden,True
@ifeanyiinnocent7487,2020-07-31T15:20:31Z,0,Dont really know if here is the right place to ask..but can you work me through web development with python...am new to programming..please,True
@prettyu4,2020-07-31T05:25:46Z,0,"We all have some ups and down in our life , Your channel  was the first where I started Learning python and datascience,  Grow strong legend , Wish you a great success have a good day",True
@randallwalkerdiaz1002,2020-07-31T04:13:30Z,0,Just purchased a hard copy; Go Capitalism lol.,True
@Priestessfly,2020-07-30T21:48:35Z,1,"Hey, what microphone do you use to record?",True
@TheGentlemanGR,2020-07-30T19:27:00Z,0,I am a big fan of the series can't wait for the next part. Let please say that the book is very expensive specially for people outside the US.,True
@KumarSaptam,2020-07-30T11:25:37Z,1,That outro was amazing. 👌👌👌👌😊😊(❁´◡`❁)(●'◡'●),True
@lolvivo8783,2020-07-30T08:28:42Z,0,"Hey, great to see u. I tried to go to the video link supposedly on ur issue with udemy but not visible. Is it ur link?  https://youtu.be/X7jf70dNrUo",True
@Kanerade,2020-07-30T08:10:34Z,0,I'm interested in hearing about the Udemy lawsuit?,True
@ankibar,2020-07-30T06:42:08Z,0,"I HAVE BLOODY MISSED YOU, MAN!",True
@Watchingyou-daily,2020-07-30T01:37:59Z,0,It's been a while. You helped me a lot in school with your python lessons.,True
@abhaykshirsagar1166,2020-07-30T01:07:01Z,0,You died and were revived good,True
@emptynestlifestyle4671,2020-07-29T23:57:39Z,0,I sent you $50 didn't get a Thank you or anything. Seems like a bad business model.,True
@ariashahdadi3986,2020-07-29T22:27:58Z,1,hi I'm in Iran and  I was wondering if you could add payment with bitcoin or any cryptocurrency because we don't have access to Paypal or credit card in Iran   thank you,True
@marco.nascimento,2020-07-29T21:21:59Z,0,"Loved the mug hahah stay safe, man, and keep up the awesome work <3",True
@_inetuser,2020-07-29T21:12:21Z,1,waiting patently for part 6 :),True
@Juli1go,2020-07-29T18:00:10Z,0,Love the cookie mug,True
@EricZhu,2020-07-29T16:33:14Z,1,ok sentdex bet,True
@cookiekhai465,2020-07-29T13:55:13Z,0,the donut mug has holes? i thought its a solid mug,True
@Ibrahim-cl8em,2020-07-29T12:33:48Z,0,2020 has been crazy so far😩...we might need to reshape😅.  Stay safe bro!  PS: cool mug!👌,True
@MuthuKumar-ej3fz,2020-07-29T10:29:36Z,0,"""Whats going on everybody..."" r/MadeMeSmile",True
@chickentutorials2123,2020-07-29T04:10:20Z,0,Stay safe our master!,True
@19daredevill,2020-07-29T03:32:19Z,0,We love you. Good to hear back from you.,True
@littlenewton6,2020-07-29T01:45:31Z,0,老哥，你的视频好酷！,True
@benjaminbianchi1804,2020-07-29T00:55:14Z,0,You're great man!,True
@ZackAngelSmith,2020-07-28T22:06:12Z,1,Its amazing that i subscribed to this channel and can be a part of this...,True
@btek8157,2020-07-28T21:12:48Z,1,HE'S ALIVE!  Didn't know Udemy did that. Shame on them. I love all of our videos. Been through most of them already. Can't wait for more to come! Stay Safe and Healthy!,True
@Viralvlogvideos,2020-07-28T21:11:02Z,0,are u alive hahaha lol,True
@niklaswennerstrand1010,2020-07-28T20:53:06Z,1,"Hey, Link in the description to buy the book, please!",True
@josesilva-rodriguez5088,2020-07-28T18:21:15Z,0,So... we should expect a surprise visit from Sarah Connor next month?,True
@jer_chiu,2020-07-28T16:39:37Z,0,looks like edward snowden haha,True
@fernandomaluenda4226,2020-07-28T15:48:51Z,0,I respect the transparency.,True
@maccashighlights5071,2020-07-28T12:50:34Z,0,"So I watched your API python with interactive brokers you made 6 years ago. I have a question that I need with.  this is what I have currently got in my python code module   def main():     conn = Connection.create(port=7497, clientId=999)     conn.connect()     oid = 1     cont = make_contract('TSLA', 'STK', 'SMART', 'SMART', 'USD')     offer = make_order('BUY', 1, 200)     conn.placeOrder(oid, cont, offer)     conn.disconnect()  main()   However, there is a problem that comes up  conn = Connection.create(port=7496, clientId=999) NameError: name 'Connection is not defined  And when I make the Connection into connection, this comes up   conn = connection.create(port=7496, clientId=999) AttributeError: module 'ibapi.connection' has no module 'create'   How could I fix it? FULL SCRIPT VVV  from ibapi import connection, message from ibapi import contract from ibapi import order  def make_contract (symbol, sec_type, exch, prim_exch, curr):     contract.m_symbol = symbol     contract.m_sectype = sec_type     contract.m_exchange = exchange     contract.m_primaryExch = prim_exch     contract.m_currency = curr     return Contract  def make_order (action, quantity, price = None):     if price is not None:         order = Order()         order.m_orderType = 'LMT'         order.m_totalQuantity = quantity         order.m_action = action         order.m_lmtprice = price      else:         order = Order()         order.m_orderType = 'MKT'         order.m_totalQuantity = quantity         order.m_action = action      return order  def main():     conn = connection.create(port=7497, clientId=999) // or Connection.create     conn.connect()     oid = 1     cont = make_contract('TSLA', 'STK', 'SMART', 'SMART', 'USD')     offer = make_order('BUY', 1, 200)     conn.placeOrder(oid, cont, offer)     conn.disconnect()  main()",True
@haydencordeiro,2020-07-28T12:24:42Z,0,Now this is the content i wait for.,True
@nunosilvestre3197,2020-07-28T11:08:13Z,0,Glad to ear you're OK!. Now ...  part 6. :),True
@gokusaiyan1128,2020-07-28T10:01:32Z,0,what has udemy done ? sorry i don't know,True
@husseinnajafli2305,2020-07-28T09:55:24Z,0,"Hey, bro. I am watching you from Azerbaijan. You are the best teachers. Bro, your desktop wallpapers are awesome. Can you give me a link for this awesome wallpapers?",True
@morzariadeep,2020-07-28T09:50:17Z,0,there is a really good course on coursera for tensorflow 2.0 by Imperial College of London. Just check it out. Should be useful for your series.,True
@preethamrakshithp3522,2020-07-28T09:31:42Z,0,my model.predict is painfully slow (3 to 4 predictions/sec ) regardless of model architecture even with capable hardware any advice will help - Thanks,True
@manuelg162,2020-07-28T09:29:22Z,0,Where can I not the book? :O,True
@prithviprakash1110,2020-07-28T09:10:59Z,0,Sentdex got some pretty sick gains there.,True
@raja28chowdhury,2020-07-28T05:32:20Z,0,just one question how you clean that cup well.................,True
@harshthakur7215,2020-07-28T05:06:59Z,0,Wish you find time for more BCI stuff soon,True
@3DComputing,2020-07-28T01:54:11Z,0,"He's got a wife,  no wonder his room is almost tidy...",True
@ufkun20,2020-07-27T22:08:39Z,0,SWOLEdex 💪🏼,True
@codingwithmark2731,2020-07-27T21:37:57Z,0,while True:     print('2020 Sucks'),True
@rollieize,2020-07-27T21:35:42Z,0,"any plans to do synthetic data generation (images, audio, and tabular) using GANs? (something im stuck on at the moment ;) )",True
@boomer_money,2020-07-27T21:22:48Z,0,Hey man just wanted to say thank you for the countless hours of content you've made over the years. You were one of the main reasons I became a software engineer and am now able to support myself by writing code 😄,True
@julianray6802,2020-07-27T20:37:24Z,0,"Glad to hear that you are ok Sentdex. Hope the doggy is better soon, you needed to ssh into his heart and delete the worm file!",True
@JousefM,2020-07-27T20:14:38Z,0,Man how many mugs do you have? :D I must have seen around 100 across all your videos so far!,True
@anujeetswain7368,2020-07-27T20:05:42Z,0,Hahaha coolest ending though!!,True
@preciousomodara8477,2020-07-27T15:08:58Z,0,I just started watching your videos from 2years ago😀,True
@Derpaherpa123,2020-07-27T11:31:12Z,0,Looking ripped bro!,True
@dheerendratomar2725,2020-07-27T09:41:33Z,0,"Really good to see you again. I have one request, Could you please write/start a book/video series for reinforcement learning algorithms (their implementation, tips and tricks)? Thanks",True
@tqv0601,2020-07-27T09:25:55Z,0,Cyber security is exciting for some experiments also,True
@maxyakovlev505,2020-07-27T07:57:22Z,0,Sentdex looking great man wow! <3 hitting the gym ??,True
@boluaygepong5920,2020-07-27T07:37:05Z,0,SENTDEX!!!! We've missed you 😭😭😭😭😭😭😭😭😭😭😭😭,True
@buffedbear8927,2020-07-27T07:22:43Z,0,Do i get acces to the full  ebook if i order the hard cover copy? I saw it was the case with  kickstarter. Cheers to all of you guys!,True
@erfantaghvaei3952,2020-07-27T06:49:49Z,0,Stay safe master,True
@nurislam6345,2020-07-27T05:31:24Z,0,doesn't here any Bangladeshi programers who has been helped by this boss : sentdex 🤔,True
@bhaskary2362,2020-07-27T02:37:06Z,0,Everyone's getting a heart can I get one too,True
@JeremiahT,2020-07-27T01:10:48Z,0,Your desk looks like it was incorrectly UV unwrapped.,True
@felixsnz7764,2020-07-27T00:19:01Z,0,since the the last nnfs video i wanted to learn more so much and i've been learning a lot by myself but even that i will definitely watch the next videos of your nnfs series,True
@SeyedAgent47,2020-07-26T21:26:18Z,0,"I really like your videos. I would have definitely bought your book if I could...But guess living in Iran, doesn't favor my interests... It's bad to be disconnected from the world... If you felt like helping charity or sth, consider sending your book for free to your fan (me:) Wish u nth but bests",True
@chris.jackson,2020-07-26T21:16:10Z,0,Thank you for the update. By the way how do you wash your donut coffee cup?,True
@Molly-ss4fw,2020-07-26T19:44:29Z,13,The thumbnail makes me feel like a girl in a bar that you're about to explain neural networks to while you lean on the counter blocking my escape,True
@satyamedh,2020-07-26T17:15:35Z,1,Your desktop is soo clean. My 2 monitors are filled with apps -_-,True
@anythingbutcash,2020-07-26T16:15:20Z,0,2020 is a bad year...real bad. We will probably top it off with a nice world war with China. China versus the countries that care about their citizens. Who shall win?,True
@murshidmalik8245,2020-07-26T15:55:49Z,0,I am sure u have written a piece of code to like all comments.U r cool,True
@hakspyintelugu7597,2020-07-26T15:47:28Z,0,hey i'm from india and i can't afford your book price please try to reduce for indians,True
@mbonuchinedu2420,2020-07-26T14:01:12Z,0,Awesome humans we all are.  💖🥰🥰🥰,True
@mbonuchinedu2420,2020-07-26T13:55:54Z,0,"Don't worry, we will be waiting for you. 🤣🤣🤣",True
@mbonuchinedu2420,2020-07-26T13:52:13Z,0,Sentdex. 💕💕💕💕💖💖🥰🥰🥰,True
@markusang,2020-07-26T13:02:50Z,0,my nnfs :(((((((,True
@iukeay,2020-07-26T12:46:42Z,0,Legends never die,True
@vipulkaushal1597,2020-07-26T12:42:57Z,0,Why is there no chapter about RL and RNN/CNN ?,True
@terraptr1448,2020-07-26T12:42:34Z,1,"Holy moly, you liked almost everyone. That is some big love going on in here. You are a big legend :)",True
@vipulkaushal1597,2020-07-26T12:41:32Z,0,"What did Udemy do? Did they make a course out of your study material ?...anyways, lol , as these so called ""Marketers"" have zero subject knowledge, just  use whatever they find.",True
,2020-07-26T11:48:10Z,0,Can you make reinforment learning and nlp thinks?,True
@shis10,2020-07-26T11:44:37Z,0,Make More videos on AI ML 😁,True
@eyesgotshowyo7800,2020-07-26T11:21:14Z,0,Mah man is buffed,True
@evilish7,2020-07-26T10:23:51Z,0,Thanks for the update and stay safe! Greetings from Poland,True
@shauryavardhan7225,2020-07-26T10:22:18Z,0,Can anyone update me with the udemy copyright infringement?,True
@taylogs,2020-07-26T08:26:31Z,0,"Great to see you doing good, seems like u've been working out lately 🤭",True
@pushpakgupta7396,2020-07-26T07:12:49Z,0,Now that gpt3 is here...time to change business sentdex,True
