author,updated_at,like_count,text,public
@kaibabcock6348,2018-12-07T13:46:33Z,0,How did you get from video 3 to 4? I don't know what that screen is or how to hook it up. If you could help that would be appreciated.,True
@todorpopov8613,2017-02-15T16:22:33Z,0,Why 2 of the motors sin clockwise and the other 2 spin in the opposite direction ?,True
@satyamshah_,2016-11-28T10:18:37Z,0,sir do we need to calibrate all 4 BLDC to make them run simultaneously ? or should we use controller board to calibrate all 4 of them ?,True
@eduardmedla4243,2016-10-28T19:44:35Z,1,I have to build quadrocopter with raspberry with ultrasound sensors to stop before any obstacle. Is possible to somehow make rapsberry pi affect the fly controller? I am building my first quadrocopter for my master degree. Can you help me?,True
@HeroesOfTimes,2016-07-05T18:25:47Z,1,"One of my escs is way stronger than the others when I test it, I've done ESC-calibration multiple times but nothing fixes it! Any help?",True
@sambhavkumar7870,2016-04-17T04:12:27Z,0,hi I m having some prob can u solve it?The prob is the motor who's esc is connected to m1 is not running. If I change the motors esc then the next motor dosent run it means my esc and motor r fine .,True
@MohammadOmarSalameh,2016-03-14T17:29:31Z,1,"nice job with 4 parts of building and programming, THANKS for your tutorials",True
