author,updated_at,like_count,text,public
@bishwasarkarbishwaranjansarkar,2020-10-09T03:36:25Z,0,Hello Krishna thanks for your video but along with please explain real life use as well. Where can we use in real life.,True
@yashkhant5874,2020-10-08T17:19:39Z,0,GREAT CONTRIBUTION SIR....  THIS CHENNAL SHOULD 20M SUBSCRIBER🤘🤘,True
@anandruparelia8970,2020-10-07T07:01:07Z,0,"If anybody can answer my doubt, We checked the independent features which are highly correlated with each other, We got a list of those! But Why are we removing all of them? Like if there are X highly correlated independent features, we need atleast 1 of them right for prediction purpose?",True
@amarkumar-ox7gj,2020-10-07T05:02:11Z,0,"If idea is to remove highly correlated features, then both highly positive and negative correlation should be considered!!",True
@parms1191,2020-10-02T20:26:57Z,4,"I write the threshold code simply like [df.corr()>0.7 OR df.corr()<-0.7]. Also, I sometimes feel 0.5 is a good threshold but again that's subjective. And would be great to see other Correlations explained as well.",True
@ireneashamoses4209,2020-10-02T17:36:46Z,1,Great video!! Thank you!👍👍💖,True
@rukmanisaptharishi6638,2020-10-02T16:49:11Z,32,"If you are transporting ice-cream in a vehicle, the number of ice-cream sticks that reach the destination is inversely proportional to temperature, higher the temperature, lesser are the sticks.  If you want to effectively model the temperature of the vehicle's cooler and make it optimal, you need to consider this negatively correlated features, outside air temperature and number of ice-cream sticks at the destination.",True
@deepanknautiyal5725,2020-10-02T16:04:50Z,1,Hi krish please a make a video on complete logistic regression for Interview preparation,True
@prabhusantoshpanda5259,2020-10-02T15:13:26Z,0,"While dropping the columns using the list of all corelated columns arent we deleting all of them and not even retaining the ones we actually want.  for example, suppose we get 3 corelated columns in the list. and then apply, corelated_columns=[f1,f2,f3]    : corr>0.8  for e.g x_train=x_train.drop(corelated_columns,axis=1) then all 3 are getting dropped whereas we want only 2 to drop and retain one??  Please clarify.",True
@yasharthsingh805,2020-10-02T14:33:30Z,2,"Sir , can you please tell which website should I refer if I want to start reading white papers.... Please please do reply....I follow all ur videos!!",True
@aayushdadhich4840,2020-10-02T12:38:09Z,1,"Should i practice by writing my own full code including the hypothesis functions, cost functions, gradient descent or fully use sklearn?",True
@gurdeepsinghbhatia2875,2020-10-02T11:03:17Z,8,"I think it all depends on domain that whether to involve the neg corr or not , or we can train two diff models and compare their scores , Thanks Sir",True
@piyushdandagawhal8843,2020-10-02T11:02:59Z,1,"Instead of doing X_train , x_test split, if we find correlation of the whole data and then we compare correlated column's correlation with the dependent feature and then drop only those features among the correlated columns which are less correlated?....does my question makes sense? if it does, would it affect the model?",True
@adiuke1666,2020-10-02T10:02:39Z,1,"At 4:14, Krish Sir tried to get naughty by saying 12""inches""....",True
@prakash564,2020-10-02T09:13:55Z,19,Sir your channel is  a perfect combination of sentdex and statquest. You are doing a great work 🙌more power to you!!,True
@abdelazizhimmi5244,2020-10-02T08:45:54Z,1,"Hey Krish, is the iNeuron Platform available just in India cuz i'm from Morocco and i've already subscribed but no answer from you or your team , what should i do ?  thanks for help",True
@shubhambhardwaj3643,2020-10-02T08:21:23Z,3,Any word is not sufficient to thank you for your work sir ....🙏🙏,True
@megalaramu,2020-10-02T07:27:52Z,1,"Hi kris, in multicollinearity conceps we have both corrlation matrix as well as VIF to remove the collinearity. Which method is best or does that depend upon data",True
@amitrout5419,2020-10-02T07:13:38Z,1,Sir what if we compute the correlation before we split the data and drop the features ?,True
@vijaytogla2614,2020-10-02T07:10:28Z,1,Plzzz help sir..,True
@suneel8480,2020-10-02T07:10:15Z,3,Sir make video on how to select features for clustering?,True
@vijaytogla2614,2020-10-02T07:10:01Z,1,Sir i m in lot of trouble..how i can talk to u...help me out..🙏🏼🙏🏼🙏🏼,True
@vijaytogla2614,2020-10-02T07:09:17Z,1,1 st comment..,True
