author,updated_at,like_count,text,public
@bananamaker4877,2024-05-31T07:17:42Z,0,Hello Corey after 5 years.,True
@carloskhalil5775,2024-05-29T00:06:53Z,0,Awesome tutorials 👌 many thanks,True
@troyke,2024-05-21T05:36:30Z,0,5-20-2024 Created my very first database-driven website - thanks to YOU!  Thank you!,True
@troyke,2024-05-20T21:40:07Z,0,"I'll admit, you have some pretty stiff competition:  Codemy, Idently, Tech with Tim, etc, but I will have to say that you're the best Teacher on youtube!  You go at the perfect pace!  You explain things well, etc  You really couldn't ask for more!  My hat's off to you CoreyMS!",True
@troyke,2024-05-12T15:30:03Z,0,"Corey, once you've activated a venv, does it deactivate if you accidentally close out that cmd window?  I'm finding myself having to constantly reactivate the venv, which is a pain in the ass!",True
@ram_qr,2024-04-15T18:09:26Z,0,you are a very brilliant man,True
@user-mx6yt3wg6t,2024-03-24T13:00:37Z,0,"I like how you present knowledge, it's far more easy to understand then reading the django book tutorial. Thanks",True
@rintu9766,2024-03-15T07:58:24Z,0,can you help me with operational error occur during adding post in admin page,True
@marktaylor865,2024-03-02T21:59:40Z,0,That was all command line. How do I interact with the dB through the views?,True
@Al_Anderson,2024-01-22T01:24:50Z,0,"If you ""python django makemigrations"" command returns ""No changes detected"" then you need to add your app (which is 'blog') to django_project/settings.py INSTALLED_APPS list. Then do the ""makemigrations""",True
@yessirski7868,2024-01-20T00:02:32Z,0,self note: 20:00,True
@productive_dudette,2023-12-11T18:20:25Z,0,"Hey can anyone please help me I am getting an error while making migrations: System check identified some issues:  WARNINGS: blog.Post: (models.W042) Auto-created primary key used when not defining a primary key type, by default 'django.db.models.AutoField'.         HINT: Configure the DEFAULT_AUTO_FIELD setting or the BlogConfig.default_auto_field attribute to point to a subclass of AutoField, e.g. 'django.db.models.BigAutoField'. No changes detected  @coreyms",True
@lemonmonkey9390,2023-12-10T11:32:54Z,0,Do we have to do all these things in the command prompt terminal? I mean can't we just do them in the text editor's terminal or something? Btw thank you so much!!<3,True
@ornatetrout,2023-11-23T11:00:58Z,0,Where exactly our data gets stored?,True
@Paul-Olkov,2023-11-10T10:42:12Z,0,"thanks, man. I'm russian and I 'm not strong enough in English. But I can understand almost 90% you say using subtitles! I wanna say that you have a very undestandable vocabulary and a very clear pronunciation! Thanks one more time!",True
@user-kz1hd5rp2h,2023-09-09T15:04:50Z,0,"past years i was on my undergrad class days,and you save me from datascience and now i am needing to learn more on website, you are my savoior to saving soem complex lesson to an easy way,thank you so much sir",True
@mahsasayadmanesh4584,2023-08-10T09:38:08Z,0,I have forgotten the password for my dummy user! what to do to be able to log in and access the admin page?,True
@pateldhananjay146,2023-07-11T03:59:31Z,0,Migration of data is too good,True
@LiveDimi,2023-05-20T13:07:00Z,0,"Hello there. First of all I would like to say Thank You for this very good introduction to Django. I managed to follow along so far and I am very happy to proceed. There is one thing right now at the end of this Video, that I can't solve. I hope someone could give me a tip. When I go to the Blog Homepage, I get all the blogs ordered by the create date. When I change a Blogpost, that POst won't show as first Post. Also when I create a new Post, the new Post is showing in my browser at the end of the Posts. I am sure there is a way to show the Posts from top, to be the newest Post. I am googling right now in Django Docs and Stackoverflow, trying things out, but I could not find the right solution for this. Maybe someone can Point me to the right direction how I can sort the Posts in Django ? Thanks a lot and keep this good work going.",True
@internetbro6519,2023-03-09T01:17:15Z,0,Cory da 🐐 no 🧢 !!!,True
@casperparker9000,2023-02-24T02:56:17Z,0,Is anyone getting glitches with this video specifically. The video just freezes up and colorful pixels appear,True
@MrRahul15937,2023-01-29T19:17:11Z,0,"Love you my first django project.. It's been 2 years, and i still take references from it.",True
@vishwanathpujar8704,2023-01-28T06:15:49Z,1,Corey thank you very much.. I'm regretting why I didn't learn from your videos from beginning... Anyway never too late to learn things... THANK YOU,True
@jpoblocki77,2023-01-18T20:09:47Z,0,"File ""C:\Users\jeffp\AppData\Local\Programs\Python\Python311\Lib\site-packages\django\db\backends\sqlite3\base.py"", line 357, in execute     return Database.Cursor.execute(self, query, params)            ^^^^^^^^^^^^^^^^^^^^^^^^^^^^^^^^^^^^^^^^^^^^ django.db.utils.IntegrityError: NOT NULL constraint failed: blog_post.date_posted >>> Post.objects.all() <QuerySet []>",True
@jkendall1975,2023-01-07T17:34:00Z,0,"Fantastic tutorial series on django, i'm learning so much by watching your videos, thank you!!",True
@selcretnoserelba5206,2022-11-17T03:05:15Z,0,@17-25- TypeError: Post() got unexpected keyword arguments: 'title',True
@ragab0,2022-11-13T13:35:15Z,0,"Thank you sir for everything. This video and tutorial, as well as all your videos, are so amazing. your approach is so amazing at teaching. You are great teacher.",True
@nawabfaiyazkhan5915,2022-10-29T17:07:16Z,0,"hey, Im getting error while filtering date in home.html the error is django.template.exceptions.TemplateSyntaxError: Could not parse the remainder: ' : ""F d, Y""' from 'post.Date_posted | date : ""F d, Y""'  Date_posted is my variable name instead of date_posted can you please tell me how can i get rid of this? literally im loving your way of teaching really adorable man thank you and plaese comment me back",True
@baky5372,2022-10-06T01:59:03Z,0,MSuch a fantastic series even 4 years later. Thanks so much,True
@muntadher8087,2022-09-19T09:39:46Z,0,"Watching it for teh second time, thanks!!",True
@AllAboutCode,2022-09-10T05:24:42Z,0,""" Hey there, how's it going everybody ?""",True
@user-tu2rz2qy3z,2022-09-07T20:05:24Z,0,You recorded this awesome tutorial at 3 am! Great work :) Thank you so much Corey,True
@metehansert647,2022-08-30T10:35:46Z,0,incredible,True
@OtherSideMystery,2022-08-09T11:39:59Z,3,"To anyone who ran into this error: 'QuerySet' object has no attribute 'post_set' even though your model is named correctly, this might help  when Corey defined the user attribute, he added .first() to the end of the code which made it no longer a QuerySet. If when you type user it says QuerySet infront of it, you need to redefine user and add .first() at the end like this: user = User.objects.filter(username='usernamehere').first()",True
@sucidwimaysaroh4610,2022-06-13T12:16:35Z,0,"Thank you soo much, this is very helpful for my project",True
@benjaminmcgregor7490,2022-06-12T16:21:46Z,0,"Anyone getting 'table not found', use 'python manage.py migrate --run-syncdb'",True
@SPLICY,2022-05-07T10:43:36Z,0,Thank you for the excellent... 'content' 😄,True
@brian3947,2022-05-04T15:10:54Z,1,1:38 what does the “db” in django.db mean? Does it stand for database?,True
@petergames4819,2022-04-30T13:54:51Z,0,Excellent tutorial! Thank you,True
@jackbrown9395,2022-04-22T00:01:57Z,0,"Great Tutorial ... rock'n and roll'n here following along, thank you",True
@egorkolobov2392,2022-04-19T15:24:08Z,0,"After a course of NestJS in my university, Django seems so cool, simple and straightforward. Many thanks for your videos, they are great!",True
@congcuongnguyen413,2022-04-19T13:58:21Z,38,0:15 - object relational mapping - ORM 1:52 - create Post model 5:34 - ForeignKey 7:39 - make migrations after modify models.py 9:19 - have a look on SQL code that will be migrate 11:25 - why migration useful 12:05 - query database on shell 18:27 - __str__ method 24:41 - special query set of user model 28:11 - pass data from model into view 31:13 - template filter 34:52 - add Post model into admin page,True
@kevinkrause6901,2022-04-18T11:02:47Z,0,just started using python & django and cannot underline enough how awesome your videos are in terms of detail and understanding! Thanks!,True
@vask5500,2022-04-09T12:59:23Z,0,Corey changed the date-time format because he doesnt want to reveal he was up at 2 am writing all this,True
@uchiha_sasuke_48,2022-04-03T07:38:01Z,1,When I used User.objects.all() It is displaying an empty query set. Can u please solve this?,True
@vladyslavkotov7570,2022-03-30T04:18:37Z,0,"stumbled across this channel some weeks ago, just devouring the content. Corey, your ability to explain is fantastic. thank you, thank you for this amazing gift. 11/10",True
@Rahul_coder.,2022-03-26T11:30:34Z,0,you are best....,True
@GDLAPROD,2022-03-18T22:32:39Z,0,Great tutorial! It's crazy how this stuff still works in 2022!,True
@anchithacharya7836,2022-03-15T19:17:53Z,0,22:20 can anyone please explain how this works please? There wasn't any field called author_id in the Post model. And links to the docs would be appreciated,True
@xarisalkiviadis2162,2022-03-02T08:36:25Z,0,"Probably this have already been questioned below, but the data that you registered through the terminal, are there saved anywhere in a file? i cannot find the data anywhere as a ""code"".   Moreover, amazing job on the tutorials!!!",True
@anasmomani647,2022-02-19T21:31:23Z,0,literally the best channel,True
@JohnBoen,2022-02-16T17:47:45Z,1,"I'm enjoying this tutorial series - great work!  But I have 25 years of database development experience - the idea of managing a database in this way makes my skin crawl.  Throughout my career the rule has been that the database is managed as its own project. ""nobody has direct access to the tables"" - all access is through stored procedures or views.  The database presents a data interface for the potential users.  At minute 11 you say ""don't have to get your hands dirty with SQL"".    That's the fun part :)",True
@Grimlord1993,2022-02-16T05:36:59Z,0,"Corey I hope you're doing well, Bless you for all the work you put in these videos. Such a great teacher",True
@thiagonunes2751,2022-02-13T21:47:10Z,0,"Congratulations, you are the best teacher in Youtube. Thanks for all help!!!!",True
@dannyhd8301,2022-02-07T08:16:56Z,0,game changer..life changer..will always be ...thankful bruh,True
@bene8114,2022-01-27T17:59:45Z,1,"@Corey Schafer you are a genius as a Python teacher, Django etc. Why don't you publish anymore?",True
@EFFICIENTCORPORATES,2022-01-22T08:49:08Z,0,"Just wated to ask, When we make the changes to the Blog content using the admin backend, does that auto updates the database as well?? or we need to make migrations to that?",True
@muntadher8087,2022-01-21T09:59:20Z,0,"This is pretty helpful, going through the shell was extremely informative. I mean thanks would never be enough for all this free content you're creating. God bless you!!",True
@muntadher8087,2022-01-21T07:51:29Z,0,Thank you so much!!,True
@m.m9804,2022-01-15T08:23:08Z,0,"amazing approach, thx god you exist!",True
@AFunkyHypnoCat,2022-01-09T21:01:36Z,0,I DO NOT DESERVE THIS PLAYLIST THANK YOU,True
@LtMewS,2021-12-25T05:36:45Z,0,wheres the database where does it store all infromation sir,True
@stephenburgess5710,2021-12-24T05:43:20Z,0,"This content is invaluable to me right now. Coming from PHP, I find nicknames like dunder for double underscore frustratingly non-intuitive. I have been wondering why it was called that. I know that there is history to these names but I’m just ready for things to be fully spelled out .",True
@bhargav1811,2021-11-30T04:32:57Z,0,"25:25 when i run this query , i am getting attributeerror: User object has no attribute 'post_set' !!!wtf?? By the way your video are the best !!!",True
@aktanbekaidarov3470,2021-11-29T06:03:54Z,0,"Fantastic!!! Excellent explanation! Thanks a lot, Corey!",True
@shreypatel6866,2021-11-23T13:51:29Z,0,how to remove redundant data,True
@veneneify,2021-11-18T18:21:36Z,0,you are amazing. Thank You!!!!!!,True
@nkushal_iirm,2021-11-18T13:57:52Z,0,"Hello sir, I'm having some trouble showing up the date in the posts. Btw your videos are really helping me a lot Thanks 👍",True
@danielcallaghan6892,2021-11-17T11:22:40Z,0,Where does the table name come from? blog_post? thanks,True
@hshs510,2021-11-07T21:03:48Z,0,Where do u get all this info from? Like the terminal commands?,True
@anand_dudi,2021-10-25T19:26:46Z,2,He made this video in 2018 in so depth not even today's youtuber makes these days,True
@Winston-fm7qp,2021-10-11T05:05:08Z,0,"Thanks a lot for these videos. Everything is very clear. I haven't finished YET, but I came back to  this video to ask a question. What if I want to display the time and day of the post in another language? For example spanish?",True
@PmanProductions100,2021-10-09T16:42:34Z,0,Your terminal being semi-transparent gave me a heart attack I had burnt something into my monitor lol. Thanks for the amazing content,True
@tarungupta5994,2021-10-03T08:57:33Z,0,"Hi Corey, I am new to django and learning the same from you tutorials. I followed till 5th tutorial and able to create the same form as like yours but I am facing one issue, the Email ID is not getting saved in User table of django. Can you please help me on this",True
@cugzarui5568,2021-09-27T21:38:26Z,2,33:35 putting a space between the colon and the string breaks it in case anyone was wondering,True
@krupeshanadkat635,2021-09-23T18:55:28Z,0,Loved this! Awesome Awesome stuff! Even in 2021.,True
@336_saranyamaity8,2021-08-24T16:25:13Z,0,This Django series is even better than the Flask one and easier to understand. And people say Flask is easy!! With Master Corey everything is easy !!!,True
@ankitaburman5406,2021-08-20T07:49:05Z,0,Corey U r god sent ❤️❤️❤️❤️❤️,True
@lwazoor212,2021-08-15T19:27:22Z,0,can we call you Master Corey ?,True
@angelguzman477,2021-08-12T01:30:35Z,0,13:00,True
@sithuhtun3609,2021-08-09T05:07:51Z,0,I want to delete the user but the record will still exist. How can I make that?,True
@bluborghi2987,2021-08-07T17:35:22Z,0,Did you really record this at 3 a.m.?,True
@letstranscript2404,2021-08-07T15:17:42Z,0,"When updating the post from the admin panel, is it possible to have a rich text area field instead of TextArea field.",True
@laravelvandi2739,2021-07-22T14:22:20Z,0,you are incredible,True
@ImmediatelyLeaveYT,2021-07-22T10:05:48Z,0,Thank you Corey!!!,True
@kelvinokelvino783,2021-07-19T09:59:04Z,0,"Hello Corey, Is there a way to add another model for e.g (ImagePost model) to the already Post model, to display in a single listview. Because I mean I am trying to create a site where users can post content as blog post and also post images as social feed for likes apart from the blog post but they should all appear in the same if not the same listview but it should just appear amongst the latest post on the homepage.  Is it possible? If it is pleaseeeee!!!! Help me Corey. I'll highly appreciate it.. And I almost forgot, Thanks man for the tutorials it is so in-depth and understanding even for beginners like me..",True
@janphillips7177,2021-07-16T15:34:00Z,0,Thanks. Coding along to your videos is what I imagine pair programming is like.,True
@mitra9234,2021-07-06T11:14:32Z,0,very well explained sir thank u,True
@carewen3969,2021-07-04T21:51:38Z,0,"Amazing tutorial series. Thank you very much. I'm new into Django after starting with Flask and I'm getting a great deal from your delivery, organization and code snippet resources.  I was wondering if you can filter for the first and last name on the blog home page instead of just the user name?",True
@pratikpatil2646,2021-07-04T13:04:35Z,1,You can directly use DateField instead of doing this 30:00,True
@Ko-wk1lp,2021-07-04T06:25:34Z,0,Gosh that's a lot to absorb,True
@sohamhegde2386,2021-07-02T12:46:24Z,0,Is the vid stuttering only for me ?,True
@tink417,2021-06-29T20:10:31Z,0,anybody know how to get shell history with the arrows? my arrows just move the cursor,True
@justicefreeman6598,2021-06-29T16:56:22Z,0,Thank you..,True
@alexanderpadalka5708,2021-06-29T09:00:11Z,0,🗽,True
@touseefcheema2557,2021-06-28T13:52:09Z,0,Thank You So much for giving us such a skill of django,True
@meralmaradia4774,2021-06-11T11:41:07Z,0,Excellent (y),True
@Kingslayer94,2021-06-08T10:18:19Z,0,"Why does post_2 = Post(title='blog 2', content = 'Second post content!', author_id = user.id) work? I expect it to raise an error. I don't remember specifying or instantiating author_id anywhere. I know that an author variable is in the Post class, but I don't see an author_id. How does that work?",True
@jayeshnaidu9662,2021-06-03T19:36:21Z,0,I had a question if for example I am using a mysql database so will I get the admin things the same way or will I have to do any changes,True
@julian4169,2021-06-02T18:08:44Z,0,"I am actually familiar with raw SQL, so is there any way I could run raw SQL in the shell. And is there any problem if I directly edit the db, let's say using the sqlite browser.",True
@dineshdharmapal5105,2021-05-26T19:21:06Z,0,This is really excellent content 😍❤️✨,True
@marcinzub9013,2021-05-23T22:24:36Z,0,Still the best content out there to actually UNDERSTAND and learn this framework - very well done sir! :),True
@codestudio497,2021-05-20T10:42:24Z,0,thank you so  much  this  is  the  most clean  and  details  for  anyone  some  day  decide  to  learn  django  i will go through all of  your  series  and  watch them,True
@ahmedlimam2241,2021-05-16T14:52:49Z,0,36:03 I had an orgasm  *DJANGO MAKES THINGS SO MUCH EASIER!*,True
@srirajasingam8920,2021-05-15T18:30:28Z,0,You are an absolute teaching god. You also must know your subject insanely well to teach it so precisely. Can't believe you only have 10K likes. This is so much better and more concise many more expensive paid courses.,True
@alibitolebay5380,2021-05-08T12:30:59Z,0,Putting like before watching the video,True
@eddhyne3380,2021-05-03T14:30:09Z,0,I screwed up my sqlit3 database. How do I delete it and recreate it so I can complete the course?,True
@log_of_1,2021-05-01T22:02:00Z,0,When Schafer also has Anki,True
@shubhamsirothiya2551,2021-04-27T23:39:00Z,0,U r an amazing teacher. Hats off to u.,True
@nathanleopold8972,2021-04-25T13:07:18Z,0,Thanks Corey. Great content even now in 2021. More informative than other code alongs on YouTube and even paid content on Udemy.,True
@firstofherkind4136,2021-04-24T16:23:49Z,0,"Thank you so much for this tutorial!!! I actually have a problem with Post.objects.all().  It returns the django.db.contrib.operationalError: column not found,  when i run it on my computer. Thank you for your time!",True
@hamedbakhti1752,2021-04-24T11:22:55Z,1,"Wonderful, wonderful, wonderful..   and nothing else",True
@zaturntarto3814,2021-04-22T11:13:44Z,0,Felt like this is the toughest video in this Django series,True
@alpstinger5083,2021-04-21T19:52:10Z,0,this video was a hit!,True
@electricimpulsetoprogramming,2021-04-21T00:04:54Z,0,34:14 admin painel how to appear,True
@orkhanahmadov9963,2021-04-18T18:32:15Z,1,"This man is the best python developer and the best tutor I have ever seen... I learned Flask with him and without even visiting the Django documentation, I started watching these tutorials and now I feel like learning the core concepts of Django Framework. Thanks So much Corey !",True
@vishnuvardhan8827,2021-04-16T06:34:22Z,0,really very very thankyou,True
@michaelbartek8974,2021-04-13T17:33:40Z,0,I am a little confused at where exactly is our database. Anybody can clarify? It isnt my in mysql workbench and I dont quite see it in folders in the project.,True
@Aditya-pr7xn,2021-04-13T10:27:17Z,0,While i am using django shell and try to import post from blog models i am getting import error,True
@shabnamparveen4572,2021-04-12T18:35:49Z,0,"Sir is it possible to make more than one class inside the models.py file and import them as the need, in different html pages?",True
@vidura23,2021-04-11T12:41:34Z,0,I just made you a small donation. You taught me so much about Python and now Django. Thank you! I will give you more if I go on to make money from coding,True
@abhyudayabora4758,2021-04-10T12:34:35Z,0,"we are not able to add new users from the admin page, why is that?  Also sir, this tutorial is amazing. Thank you for walking this earth.",True
@subharupchakraborty522,2021-04-09T08:13:35Z,0,"29:05..when I run Post.objects.all() in my cmd prompt,its running fine...its showing the contents...but when I run it in VSCode,it says 'Post' has no member called 'objects'...If you could please help...",True
@oogieboogie7028,2021-04-02T15:27:39Z,0,The best video on YT for understanding Django Models. Great work bro! Thanks a lot!!,True
@razajaved6848,2021-03-29T03:55:54Z,0,"Hi, I am also creating a similar app, using one 'Client' model and one 'Installment' model. my 'Installment' model has these fields (client, installment_month, installment_amount), and the client fields is connected to the Client model using 'ForeignKey'. But when I create a new installment from the shell with the following command: (Note: client_1 is already created. and has an id = 4)  installment_1 = Installment(client_id = client_1.id, installment_month='April', Installment_amount='12345')   it gives a big error (the last line of that error is below):  ValueError: Cannot assign ""4"": ""Installment.client"" must be a ""Client"" instance.",True
@nathanellis7819,2021-03-28T20:16:10Z,0,2021 here. THANK YOU  SO MUCH!!!,True
@internetbuzz7143,2021-03-27T02:28:07Z,0,Respect from INDIA. Great tutorials from you sir.,True
@leonidasaslanidis9088,2021-03-25T21:25:33Z,0,First of all congratulations for all your videos. I have a problem. I try the video step by step but during 28:36 when i am writing Post.objects.getall() i am receiving an error saying no objects member found in Post. Any idea about it?,True
@narayanpanta1668,2021-03-25T12:03:32Z,0,Even I don't want to skip add I got because at least this contributes some. what a tutorial thanks,True
@Ehxx,2021-03-23T09:21:40Z,0,"Ah so for posts, 'author = (if this value is removed, delete all of these instances with missing author value)' So if you were to put 'gender = on_delete=models.CASCADE', any entry with that matching gender would be deleted instead of setting it to a new value.",True
@shubhamkundu2228,2021-03-18T12:41:20Z,0,Does anyone getting error during 26:00 when using user.post_set and user.post_set.all. Error appearing as  'User' object has no attribute 'post_set',True
@adeeasrauf1710,2021-03-12T20:18:25Z,0,Ouff Django is so perfectly simple *-*,True
@srinisomisetti,2021-03-09T10:34:56Z,0,"Excellent Tutorial Corey. Thank you very much. I am getting below error when I was trying to add user from admin module. Can you please help me out on the below error OperationalError at /admin/auth/user/add/  no such table: main.auth_user__old  Request Method: 	POST Request URL: 	http://127.0.0.1:8000/admin/auth/user/add/ Django Version: 	2.1 Exception Type: 	OperationalError Exception Value: 	  no such table: main.auth_user__old  Exception Location: 	C:\Users\tsipl0149\AppData\Local\Programs\Python\Python39\lib\site-packages\django\db\backends\sqlite3\base.py in execute, line 296 Python Executable: 	C:\Users\tsipl0149\AppData\Local\Programs\Python\Python39\python.exe Python Version: 	3.9.1 Python Path: 	  ['D:\\python\\django_project',  'C:\\Users\\tsipl0149\\AppData\\Local\\Programs\\Python\\Python39\\python39.zip',  'C:\\Users\\tsipl0149\\AppData\\Local\\Programs\\Python\\Python39\\DLLs',  'C:\\Users\\tsipl0149\\AppData\\Local\\Programs\\Python\\Python39\\lib',  'C:\\Users\\tsipl0149\\AppData\\Local\\Programs\\Python\\Python39',  'C:\\Users\\tsipl0149\\AppData\\Roaming\\Python\\Python39\\site-packages',  'C:\\Users\\tsipl0149\\AppData\\Local\\Programs\\Python\\Python39\\lib\\site-packages']  Server time: 	Tue, 9 Mar 2021 10:34:49 +0000",True
@ogyrfiwargf,2021-03-05T02:16:53Z,3,"Man, your free course is honestly better than a paid one I've finished recently. Way better.",True
@rubel1477,2021-03-02T17:21:17Z,0,28:08 __str__(self) 33:42 Date Formating,True
@taiwan323,2021-03-02T16:24:01Z,0,Wow this series has explain the concepts better than my bootcamp... I really regret choosing this bootcamp lol,True
@sethlk2240,2021-02-28T10:56:44Z,0,How to add functions to Web?,True
@hadibuxmahessar8903,2021-02-27T17:44:22Z,0,thanks,True
@zacksims3623,2021-02-24T21:51:27Z,0,The series keeps getting better :) Especially love that you do recaps in the videos after describing how to do things!,True
@TrainWithShubham,2021-02-22T15:41:08Z,0,"Django is amazing, just dropped a video on migrations",True
@JonnyRootsDem,2021-02-13T14:35:55Z,0,"You are the best Corey, for so long I've been wanting to use Python inside of browsers. I'm really grateful for the tutorials mate, i'm sure many others are too, thank you.",True
@andreapartenope2660,2021-02-12T21:48:21Z,0,"sorry I don'y understand how does it work without have connected any database to the project, thanks",True
@minnami778,2021-02-10T15:13:01Z,1,Thank you so so much for the tutorials. I really have to make a comment here. You are such an amazing teacher /person. Stay safe.,True
