author,updated_at,like_count,text,public
@yuriyarin4027,2021-02-07T20:00:46Z,1,"I find these tutorials to be really good. I´ve had a bunch of errors which were caused by mistakes I made, but I eventually figured them out. However, this one I´m stuck on. I´m getting: NameError: name 'author' is not defined  when I run ""python manage.py makemigrations"".  I have the code in models.py exacly like in the video ""8:54"" I've checked it several times. Any suggestions where I should look?",True
@chamaleon1304,2021-02-05T22:51:58Z,0,My UserCreationForm is not displayed on the webpage. Between Join Today and Sign Up ist nothing. No Error Message. What can i do ?,True
@zestful14,2021-02-04T19:20:46Z,1,"FYI: Make sure you don't have a space between the colon and the ""F"". It was giving me an error and I finally figure out that was the reason",True
@ozzyboy6438,2021-02-03T16:36:00Z,0,When i try to do the migration it says no changes detected? Why is that do you think?,True
@dogustemizsoy9081,2021-02-02T03:48:06Z,0,You're teaching is an art to me thank you.,True
@rafaelperezmederos6958,2021-02-01T03:51:35Z,0,Why won’t it let me change the CSS?,True
@EmadGohari,2021-01-28T07:19:27Z,0,"Corey your tutorials are super great, thank you a lot man! Also, the way you set up your examples and increasingly explain things through them, its really well and I think carefully decided. Everything makes perfect sense.",True
@petrospetridis2667,2021-01-24T00:31:51Z,0,That's just a perfect turorial. Congratulations !,True
@SkyfallKnight,2021-01-22T06:43:02Z,0,is this object relational mapping?,True
@josephgitonga8033,2021-01-21T09:30:09Z,0,you are a great Teacher. i have looking around for someone to teach me python and yours are clear,True
@josbexerr5166,2021-01-15T02:47:47Z,0,Grande corey......saludos de los andes peruanos,True
@azrmuradl6420,2021-01-14T20:47:59Z,0,Huge thanks,True
@preciousimoniakemu4106,2021-01-13T18:59:44Z,0,Please i'm using PostgrelSQL and i'm stucked the blog post is not showing for editing in the admin page,True
@salonijain3249,2021-01-12T08:57:59Z,1,Corey:Hey there how's it going everybody.... I just love this start 😍,True
@Lucas-zd8hl,2021-01-07T17:24:00Z,1,"If you get an error saying ""Class 'Post' has no 'objects' member"", it is it not because there actually is an error. Django automatically adds the property to all the classes, but your editor just can't see it. You can just run the code while the error is still being reported",True
@GajananaGanjigatti,2021-01-05T14:39:07Z,0,"@Corey Schafer,  10:48 I see commit after create a table script. Per my knowledge, we only when we do DML operations, not during DDL operations.  Please clarify here.",True
@dr.zoidberg8666,2021-01-01T05:50:08Z,0,"For anyone using Visual Studio Code & getting ""Post class has no object member"" error:  first: pip install pylint-django  then Crtl+Shift+P & type ""Perferences: Configure Language Specific Settings"", then choose Python.  This will open a settings.json file.  Inside the first curley brackets, you need to add:  ""python.linting.pylintingArgs"": [     ""--load-plugins"",     ""pylint_django"",     ""--disable=all"",     ""--enable=F,E,unreachable,duplicate-key,unnecessary-semicolon,global-variable-not-assigned,unused-variable,binary-op-exeption,bad-format-string,anomalous-backslash-in-string,bad-open-mode"", ]  That will get rid of your no object member error, but will add a new error titled ""from django.contrib.auth.models import User""  to fix this, you need to go into your models.py file & change how you reference the User model.  Get rid of ""from django.contrib.auth.models import User"" and replace it with ""from django.conf import settings"", then change where you call User in your Post class to ""settings.AUTH_USER_MODEL"".  That should take care of your errors.",True
@vhuwan8879,2020-12-31T09:48:32Z,0,completed,True
@Hubert_Bojanowski,2020-12-28T22:02:12Z,0,"Hi, why would we add all this data via prompt if we could just do this via the admin page?",True
@veenak108,2020-12-26T17:24:52Z,1,"@22.27 author_id = user.id , we are referencing the field using index. For every ForiegnKey field, Django automatically creates a field with field_name_id. https://docs.djangoproject.com/en/3.1/ref/models/fields/#django.db.models.ForeignKey",True
@minidupasan1520,2020-12-25T07:19:46Z,0,"Please I am getting an error ""AttributeError: module 'django.db.models' has no attribute 'model'"". Please can you help me? I really appreciate your works.",True
@venkateshvullaganti4348,2020-12-21T12:54:10Z,0,"Thanks Corey , your tutorials are very clear and you makes them easy to understand",True
@SkoloOnline,2020-12-21T09:17:16Z,0,"Amazing tutorial, well explained as well",True
@constantfear,2020-12-20T16:32:51Z,1,"the only thing I didn't really like was the fact the .modelname_set was not in the same case as the actual model name (Post) user.post_set as opposed to user.Post_set but I assume that the sql engine compiliation behind django is not case sensitive (like most sql engines) other than that, great tutorial as always Mr Schafer.",True
@sushilkumarlohani6709,2020-12-19T15:52:40Z,1,30:14 Wait it that 2:46 *AM*??,True
@aslanzurabov3755,2020-12-19T12:58:25Z,0,Awesome,True
@matthiasdunkel9782,2020-12-18T16:38:42Z,0,Does .modelname_set only works with User?,True
@uralbishkek,2020-12-18T06:49:57Z,0,"for loop in posts, : new blogs are posted at the end, not at the beginning, how to fix this?",True
@loosabway3400,2020-12-18T01:06:13Z,0,"About 1'30"" - says that in a future video we will see how to add custom fields to a user model - I don't think we do, do we..?",True
@yashuppot3214,2020-12-06T18:04:44Z,0,Is there a way to actually view the database in SQLite,True
@exismys,2020-12-05T20:10:57Z,0,This series is Gold!,True
@Iamlucasrodrigues,2020-12-03T12:57:21Z,0,Great video thanks!,True
@pantepember,2020-11-28T19:29:23Z,0,12:38 Clear the screen by which command/key combination?,True
@oc4026,2020-11-27T18:19:17Z,0,"Corey, I love you!",True
@akashkandasamy9762,2020-11-25T07:06:19Z,0,dude how to add a new column to already existing model,True
@elektrofreaks1982,2020-11-24T09:41:37Z,0,These tutorials are top-notch. Thank you for all these video series.,True
@PranavMurali2001,2020-11-20T12:56:25Z,0,i've hated and despised web development for as long as i can imagine. thanks for changing my mind!,True
@alisherxujanov2100,2020-11-18T16:22:03Z,0,Thank you for exiting lessons that are always too precious!,True
@deedanner6431,2020-11-18T01:50:39Z,0,"Posts, post, Users,  user, models, Model...",True
@himanshup3720,2020-11-17T15:13:32Z,0,the way you explained orm model...i fell in love with you corey...Lots of love dear,True
@swasthiknayak5653,2020-11-16T19:13:02Z,0,We have 39 imposters here.,True
@ibraheemolasupo7881,2020-11-13T21:40:48Z,0,Thanks for the video Corey ❤️,True
@MagicByIzzy,2020-11-11T03:50:10Z,0,Hi Corey! Thanks for the series it's really amazing!,True
@jagadeeshmandala4097,2020-11-10T09:34:01Z,0,At 25:53 I'm getting error.. User.post_set.all(),True
@McNuggets1996,2020-11-08T16:55:29Z,1,"To all people that get the ""User model imported from django.contrib.auth.modelspylint(imported-auth-user)"" error In the models.py file instead of writing: from django.contrib.auth.models import user try: from django.contrib.auth import get_user_model  User = get_user_model()  This will solve it :)",True
@jimmyjohn5970,2020-11-06T21:36:09Z,0,Hello Corey for some reason my cmd keeps saying no changes detected please help,True
@gianireyes405,2020-10-30T23:24:58Z,0,From where come and what is the 'objects' in Post.objects.all()?,True
@yachujoshi,2020-10-30T14:48:02Z,0,The quality of this series is just top notch. You're literally making me love django!,True
@sairamsr7131,2020-10-28T15:49:26Z,0,how to add images to blog using ADMIN GUI,True
@janchroscinski8139,2020-10-27T19:54:45Z,0,thanks!,True
@avraamavramopoulos5567,2020-10-27T04:50:20Z,0,"thanks corey you are great. I have a problem though.  I use Pycharm and when I write:  'posts' : Post.objects.all()  in my view file, I receive an error indication from Pycharm, ""Unresolved attribute reference 'objects' for class 'Post'  ""  what am I doing wrong ?  any one can help , thanks.",True
@snehankaroy1093,2020-10-26T13:04:00Z,0,"I am getting the following error  ""Post() got an unexpected keyword argument 'author' "" pls help me",True
@hyacinthfayetabasa2329,2020-10-26T03:30:12Z,0,Hi sir. thank you so much for your videos!  mmm may I ask if is it possible to integrate flask and django? Thank you!,True
@RajnishKumar-oj3vr,2020-10-24T21:25:00Z,0,You are just awesome man,True
@panagiotisgoulas8539,2020-10-20T20:57:01Z,0,"Can someone please explain me something because I literally spend countless hours through django documentation and general python inheritance.  I don't understand something around 17:30.    I notice we sort of instantiated the Post class creating a post_1 instance post_1=Post(title='Blog 1',content=First Post Content!',author=user) inside the shell.  But title, content, author are class-variables of Post class. How do you pass class-variables as arguments on Post class??????  In general what we pass as far as I know are arguments specified by an __init__ method of the parent class which is Model class (and in case of wanting additional arguments I would use a super().__init __() ).  But in this case I have not seen the __init__ method of Model class (to know how to instantiate my subclass)  and we use sublass class variables for that?  What is going on???",True
@waleedmashrequi5173,2020-10-17T19:55:45Z,0,Hey Corey can you make a tutorial on how to make custom user model using AbstractUser in Django.,True
@tumtum6910,2020-10-17T09:01:15Z,0,What is the difference between timezone.now and timezone.now() ?,True
@KevinTempelx,2020-10-16T20:06:05Z,0,Thanks!,True
@ighsajdsql,2020-10-14T17:52:36Z,0,"I'm getting 'ValueError: source code string cannot contain null bytes' when trying to run 'python manage.py shell', did this happen to anyone else? I'm on Windows",True
@abhishekratnawat7822,2020-10-11T09:03:49Z,0,You deserve more numbers <3 .  You are amazing.,True
@Farreach,2020-10-09T13:04:08Z,0,even 2 years later still a great Tutorial .. Thank you so much.. I am using windows how do i clear screen within interpreter?,True
@harshvardhanp6184,2020-10-03T08:49:35Z,0,Thanks bro!!!!,True
@MrStylesp9,2020-10-02T11:56:50Z,0,Hello. There is no way for me to extract the code from github.,True
@egemenguney1715,2020-10-01T16:49:41Z,1,real master,True
@minakshee4672,2020-10-01T12:42:45Z,0,This gets really difficult in django? How can we write queries using SQL,True
@gyeolkim1109,2020-10-01T06:46:44Z,0,"Hi Corey, thanks for the videos. Where is all data that I made through this tutorial saved?",True
@fery7982,2020-09-30T04:22:26Z,0,wait a minute!!! You dont have to create the page where user needs to update blog content? Just register and viola ???? Im confuse,True
@swatisrivastav5620,2020-09-28T15:14:04Z,2,You level of teaching is simply amazing. Thank God that someone like you exist.,True
@nys8260,2020-09-27T09:04:44Z,0,thanks,True
@giridharjadala2182,2020-09-26T16:42:14Z,0,"Thanks man , it was fun learning from you .",True
@jaymehta7260,2020-09-24T07:09:53Z,0,"PLEASE HELP ME OUT: I forgot my password to get to my admin page, how do I get it back?",True
@ashayzemse7094,2020-09-21T10:19:56Z,0,I've been searching for easy for Django Python for a month You are the best teacher Thankyou Sir from India,True
@philipallen4230,2020-09-20T15:36:25Z,0,"Thank you for creating these videos, they are some of the best dev tutorials I have seen.",True
@md.bodruzzamansifat7357,2020-09-20T14:48:10Z,0,"I really want to know who are these geniuses, who can dislike a video like this. If I had enough money, I would file a case in court against them. Thanks for this. You have my gratitude and respect. I will wait for your upcoming videos.",True
@kapilraj5140,2020-09-17T04:35:06Z,0,"OperationalError: no such table: blog_post. SOLUTION: Delete your sqlite file, migration folder should have only __init__ file. Then create your model , import the model in admin.py , register your model there. In the models.py, use this code for getting the user >  from django.conf import settings     author = models.ForeignKey(         settings.AUTH_USER_MODEL, on_delete=models.CASCADE)",True
@justzee504,2020-09-15T18:22:06Z,0,"if anyone made a typo in models then exit powershell, make migration, migrate and then run the python shell again",True
@naveedarif6285,2020-09-15T08:27:51Z,0,"Amazing tutorials corey  but i have  a problem in part 5 at 16:41 it does'nt give empty query set  rather it gives <QuerySet [<Post: Post object (1)>, <Post: Post object (2)> any one can solve this problem",True
@neighbourhoodcoder5988,2020-09-13T13:41:11Z,0,hey Corey i am a big fan !! one simple question though...wouldn't it be easy without shell? i am sure there is a better way !!,True
@shayhalfon5460,2020-09-12T16:53:02Z,0,"About date_posted when we passed timezone.now without the parentheses, I can't understand why was that and can't find an explanation",True
@bricegnanago409,2020-09-12T00:31:35Z,0,Thank you so much ! Can you show me how to create a database view in sqlite and use it in django ?,True
@preranaanand4480,2020-09-11T13:49:02Z,1,"So, why do we need a python shell if we already have a GUI for admin.",True
@owonubijobsunday4764,2020-09-09T15:16:39Z,1,You just earned a new subscriber,True
@ananyamahapatra6597,2020-09-08T17:49:28Z,0,M just obsessed with ur tutorials🤩 Best ever😊,True
@darraghhoyne5226,2020-09-06T16:09:02Z,1,Thank lord for the day when I wanted to learn django and found this guy,True
@qulu1443,2020-08-30T02:27:45Z,0,"Hi, thanks for making this video! I have a question: at 22:25, why we can set the author_id? We don't have this attribute when we define class Post.",True
@yuliiakhalus7339,2020-08-29T16:22:18Z,0,thank you!!,True
@javaguitarist,2020-08-27T17:38:13Z,1,The date filter documentation at 32:44 for v3.1 is at https://docs.djangoproject.com/en/3.1/ref/templates/builtins/#date,True
@waleedmashrequi5173,2020-08-25T14:42:29Z,0,when I read Corey's comments it feels like he is narrating the line for me in my brain. I can literally hear his voice!,True
@svenm2364,2020-08-24T13:35:56Z,0,"How can I make an Age check, like one post is only for persons from 0 to 6 and the next is Post is only for persons from 18 to 25, ...?",True
@atomnpc8182,2020-08-22T15:38:08Z,0,"Am i the only person who made Bat files to run, update(migrate), update & run, and one that opens the web with its HTTP? I'm a lazy person",True
@KnomChomper,2020-08-21T00:39:21Z,0,The user.post_set did not work for me 🤔,True
@ahmadabdallah2896,2020-08-20T08:03:36Z,0,the default date that gets shown in my posts is only the hour the post was created and when I put your design in the home.html file the data disappears completely. What am I doing wrong?,True
@zigginzag584,2020-08-20T01:02:09Z,1,"at 19:10 you don't have an 'objects' member for class Post When I call Post.objects.all() in the views.py app, it throws an error What did I do wrong?",True
@anuoluwapodavid476,2020-08-18T09:48:38Z,0,Pls how did you get the USER table that you imported to the models.py,True
@thomaspynchon8400,2020-08-18T07:57:00Z,0,"Post() got an unexpected  argument ""title""?",True
@amanvyas9480,2020-08-14T19:06:51Z,0,Thanks 😊 for this amazing tut,True
@dasabaja,2020-08-14T11:43:23Z,0,"Man, amazing series! I have a question, I'm curious about one thing. When you created the blog app, Django seemed to recognize the ""blog"" concept somehow - we got an admin page out of the box, registering posts to the admin page was very easy...almost as if a blog is a built in template of some sorts. Are there other templates in Django, like, a twitter template? Or I got the whole thing wrong...which is very likely :)",True
@SumanthLazarus,2020-08-14T07:29:44Z,0,I will return here with $$$ once I get my new dev job during the pandemic!,True
@jayadevkodali7734,2020-08-13T14:26:52Z,0,"@Corey Schafer This tutorial has been very useful for me. However at the very end, when you go to the admin page, it comes up on the screen with no errors for you. Unfortunately for me it says 'Invalid base64-encoded string: number of data characters (221) cannot be 1 more than a multiple of 4'. I have followed though your code properly but I am still getting this error. I have researched for hours but have gotten no where. It would be a massive help if you could suggest a solution. Thank you.",True
@jyotijangid5243,2020-08-12T17:30:30Z,2,"If someone is having error  Post.objects.all() no post in models, then go at 7th answer https://stackoverflow.com/questions/45135263/class-has-no-objects-member  //add objects = models.Manager() in the Post class in models.py",True
@ploppyploo,2020-08-11T11:39:28Z,0,can anyone explain how to delete or change and modify content or title of posts in shell,True
@tsoltsol9316,2020-08-10T15:42:19Z,0,"when run the makemigrations command, it returns an error and does not create a migration. I have checked my code and it works fine. What do I do?",True
@SushilKumar-wt7js,2020-08-07T16:59:08Z,0,"thanks man,,  MIMP thing I learned   "" python3 manage.py shell """,True
@hamza-325,2020-08-03T20:19:27Z,0,"Nice tutorial, but I have a comment: using .filter(username='CoreyMS').first() is redundant, you can simply use .get(username='CoreyMS')",True
@anandkanade9500,2020-08-03T07:30:28Z,0,"I would have paid 50 dollars if the exact course was on coursera and there wasnt any option  but guess what ,,,,,,,,they are free",True
@abhishekshukla7234,2020-08-02T23:54:48Z,0,"thankyou for your lectures, can u explain to me how to save  all of our post in profile",True
@anjankumar547,2020-07-31T16:29:02Z,0,Amazing explanation,True
@amitkohar1921,2020-07-30T17:43:47Z,0,"return Database.Cursor.execute(self, query, params)  django.db.utils.OperationalError: no such column: blog_data.author_id   Showing me this error can you help me with this... And thank you for your precious time for giving us this great tutorial.",True
@leadegalzain9371,2020-07-28T16:48:36Z,0,"I can’t find the video where he creates the PostgreSQL db, can someone point me to it?",True
@AdamHopeGreen,2020-07-28T14:40:59Z,0,i love uuuuuuuuuuuuuuuuuuuuuuuuuuuuuuuuuuuuuuuuuuuuuuuuuuuuuuuuuuuuuuuuuu <3,True
@florent9555,2020-07-27T19:41:03Z,0,First guy that is actually explaining stuff in a structured way. Good job!,True
@ajaswanth6607,2020-07-27T14:26:32Z,0,Explained everything upto the mark🥰,True
@fastenergy5809,2020-07-26T19:52:01Z,0,how do you delete a post?,True
@yanis2183,2020-07-25T21:44:20Z,0,Thank you so much for this video.,True
@etienne.etienne.etienne,2020-07-25T15:24:09Z,0,the whole series is just fucking on point. thank you,True
@jschvach,2020-07-25T09:58:16Z,0,"These are seriously GREAT tutorials. I can't believe these are free. You need to charge for these! I feel guilty that I'm receiving this quality of teaching for nothing, and you honestly deserve compensation. I will gladly contribute to your efforts. Again, just ecstatic I found your channel!",True
@qaipak1,2020-07-24T17:35:11Z,0,"I am confused. At 5:56, line 6, why do we say models.Model? Are we saying this function should take a variable of type model? I thought in python we do not define such variables.",True
@achyuthbudi9838,2020-07-23T15:00:11Z,0,"for me when i type user.id  i get an error : Traceback (most recent call last):   File ""<console>"", line 1, in <module> AttributeError: 'QuerySet' object has no attribute 'id'",True
@bendoy4555,2020-07-22T10:30:28Z,1,Little flair you can add when displaying dates on posts: use the html title attribute to give the full date and time when you mouseover the date.,True
@rabithbo7089,2020-07-21T22:57:44Z,0,How good it is,True
@sanghyuphan392,2020-07-21T16:59:04Z,1,It's so much helpful.  now in 2020 but it still working very well.  Respect ! thank you :),True
@deshario,2020-07-21T06:39:48Z,0,Class 'Post' has no 'objects' member.  [pylint (no-member)] [vscode],True
@syedkashifnaqvi1268,2020-07-20T10:29:10Z,0,I made a video after see Corey Schafer tutorial iun which I explain how website works see website preview https://youtu.be/03IfV_-HXK4,True
@GelsYT,2020-07-19T07:22:42Z,0,Thank you so much corey! I've watched tutorials on youtube other tuts on django but I am really having a hard time with them then I found yours and it's really cool! very simple THANK YOU MAN! :D,True
@jenilgandhi2111,2020-07-18T14:54:03Z,1,nice explanation,True
@sahilamin219,2020-07-18T11:44:04Z,13,"You never need to say"" this video is getting longer "" just keep making them 🙋🙆🙌",True
@shashanksharma7242,2020-07-17T18:17:24Z,0,"Hi folks, I am confused about the modelname at 25:20 where the modelname is written as post while I think it should be 'Post' as the model we created had the name 'Post' and not 'post'. I appreciate your time and effort guys.",True
@Yasharvl,2020-07-16T16:03:05Z,1,Corey MSchafer FTW! <3,True
@stefancaky2725,2020-07-14T18:11:12Z,0,best django tutorial on youtube.. thank you so much mate,True
@grouchydrago1396,2020-07-13T20:57:52Z,0,while being in shell...          IT WAS THE WORST EXPERIENCE WHILE DOING PYTHON AND FOR SOME REASON I COULD'NT CLEAR MY SCREEN!!!  Corey if you are reading this your tutorials are amazing!,True
@liorbm1,2020-07-12T14:09:09Z,1,"Hi,  In 25:50,  you use ""user.post_set.all()"" command. But we didn't define it, so how it been created ? And Where its sits ?",True
@menafilfil4594,2020-07-11T03:08:35Z,1,Thank you very much for these tutorials they really make things simple and understandable.,True
@kshitijchourey441,2020-07-10T03:36:36Z,2,"This guy is so good, I had to follow him on instagram, and guess what, he posts pictures and vids of his dog. *Angel sent from above*",True
@kshitijchourey441,2020-07-10T03:24:59Z,1,"Can't stress this enough, You are doing God's work",True
@Oda3908,2020-07-07T02:44:37Z,0,"Excellent tutorials. Master Schafer never fails you. For those who feel confusing on those class variables in models, check python descriptor here. It looks very strange at the beginning, how could you assign a class variable and retrieve without conflicts. Each of those class variables is linked with a descriptor (e.g. models.TextField()), which will create an instance under the descriptor class. When you try to retrieve data from an instance (model level),  it will 'redirect' to a descriptor instance. You may imagine this system like puppetry, a class defined in models.py is one puppet, while the value passed in is held by those hands and fingers (descriptors) behind it, those class variables are just cables and sticks connecting between the puppet and the manipulator.  https://www.geeksforgeeks.org/descriptor-in-python/",True
@devanshuchaudhary5700,2020-07-06T07:26:30Z,0,If i want to add an optional picture column in the post how can i do that???,True
@pbeeby,2020-07-05T05:23:20Z,1,"fantastic stuff - really well thought out and easy to follow. Thanks, Corey",True
@abi_xyz,2020-07-03T13:41:47Z,0,I recive an err when running (python manage.py makemigrations)  .. no changes detected,True
@aquah202002,2020-07-02T23:20:42Z,0,sooo what is the shortcut to clear the screen??? ive been trying crtl + L   but doesnt work  also cls and clear dont work,True
@ashkan941,2020-06-29T09:37:32Z,0,I have a problem . When I use Post.objects.all() It gives an error that can not find the culom  Can you help me ?,True
@yetiireham3563,2020-06-29T04:19:37Z,0,Hey Corey I have been getting some errors when I am using python manage.py runserver  and it's coming  Watching for file changes with StatReloader . Exception in thread django-main-thread: And then 7-8 lines of import errors with 3-4 statements of frozen importlib_,True
@xtent2736,2020-06-26T01:51:41Z,2,"I've been programming some backend for my startup's website, and let me just say, I appreciate your work. I honestly can't believe this golden resource is free. If my startup succeeds, I will make sure  to send some money your way, because that's just how helpful this was",True
@hansalexander1051,2020-06-25T15:39:47Z,0,"I did the same thing you did, but why after I typed 'post' = Post .objects.all()  in views.py I got this problem: Class 'Post' has no 'objects' member pylint(no-member)  [7,15] I have installed pylint, and checked if the Post is empty on Python Shell.. it says <QuerySet [<Post: Blog Title 1>]> Can someone help me?",True
@amongdoomers9464,2020-06-24T17:13:18Z,0,Why is this guy using Incognito mode🤨,True
@Digital963,2020-06-22T21:06:07Z,0,"I just want to point something out - there are 2 ways to create new object, in this case a new post. The first way is how Corey is demonstrating here in which you also have to call the save() method to save and then query. But there is another method you can use to create another instance of the Post object and save it all in one shot -  that is by using the ""create()"" method. From what I have found there isn't a right or wrong way with these two options, seems to just boil down to preference - Corey please feel free to respond I'm curious of your input. BTW I found this by following the official Django docs as I follow along his video. I highly recommend this approach as it will clear up any confusion and you will become accustomed to looking for information from credible sources when stuck on an issue - AN OFTEN UNDER-LOOKED SKILL OF EFFECTIVE PROGRAMMERS LOL !!!",True
