author,updated_at,like_count,text,public
@Digital963,2020-06-22T20:50:59Z,0,"For everyone watching this video and just getting started with Django, I highly recommend adding the Python and Django extensions to your code editor. It will make programming so much more efficient with features like autocomplete etc. Check these out and I hope you enjoy.  - Corey, as always man, thank you for the great, high quality content! I really appreciate your work!!",True
@vikasvk9174,2020-06-19T07:40:44Z,0,"29.27   I get an error msg "" Class 'Post' has no 'objects' memberpylint(no-member)""  .... am using VS code editor can any help me?",True
@MariusSemeonOrtiz,2020-06-18T14:12:25Z,1,Simple question but what keyboard shortcut do you use to clear the screen when in a python interactive shell? I know you are in Terminal so maybe it's different on Windows. I'm using PowerShell but ofc 'cls' and 'clear' don't work within python shell,True
@johnlemontv7590,2020-06-18T03:36:45Z,0,"Keep it up bro, You`re helping young programmers. <3",True
@noureddineettayyeby5210,2020-06-14T22:23:15Z,1,Thank you,True
@lolipopjojo6218,2020-06-14T15:51:07Z,2,"i thought that Flaks was exciting then i met Django <3 , thx Corey",True
@mggarekar,2020-06-12T02:18:13Z,1,Nice,True
@programmingexpress9302,2020-06-10T17:47:01Z,0,"Bro if I want that user will add their post through a form asking him to fill title,description etc.how we can do that??please help!!",True
@nehapendem3155,2020-06-10T13:56:57Z,0,hi im getting this error for post_1.save() IntegrityError: NOT NULL constraint failed: blog_post.author_id,True
@nehapendem3155,2020-06-10T13:34:57Z,1,"I m not able to run Post.objects.all(), i keep getting an error stating that there is no column names author_id in table blog_post and i dunno how to fix it...these are the errors >>> from django.contrib.auth.models import User >>> from blog.models import Post >>> Post <class 'blog.models.Post'> >>> Post.objects.all() Traceback (most recent call last):   File ""/Users/nehapendem/env/lib/python3.7/site-packages/django/db/backends/utils.py"", line 86, in _execute     return self.cursor.execute(sql, params)   File ""/Users/nehapendem/env/lib/python3.7/site-packages/django/db/backends/sqlite3/base.py"", line 396, in execute     return Database.Cursor.execute(self, query, params) sqlite3.OperationalError: no such column: blog_post.author_id  The above exception was the direct cause of the following exception:  Traceback (most recent call last):   File ""<console>"", line 1, in <module>   File ""/Users/nehapendem/env/lib/python3.7/site-packages/django/db/models/query.py"", line 252, in __repr__     data = list(self[:REPR_OUTPUT_SIZE + 1])   File ""/Users/nehapendem/env/lib/python3.7/site-packages/django/db/models/query.py"", line 276, in __iter__     self._fetch_all()   File ""/Users/nehapendem/env/lib/python3.7/site-packages/django/db/models/query.py"", line 1261, in _fetch_all     self._result_cache = list(self._iterable_class(self))   File ""/Users/nehapendem/env/lib/python3.7/site-packages/django/db/models/query.py"", line 57, in __iter__     results = compiler.execute_sql(chunked_fetch=self.chunked_fetch, chunk_size=self.chunk_size)   File ""/Users/nehapendem/env/lib/python3.7/site-packages/django/db/models/sql/compiler.py"", line 1152, in execute_sql     cursor.execute(sql, params)   File ""/Users/nehapendem/env/lib/python3.7/site-packages/django/db/backends/utils.py"", line 100, in execute     return super().execute(sql, params)   File ""/Users/nehapendem/env/lib/python3.7/site-packages/django/db/backends/utils.py"", line 68, in execute     return self._execute_with_wrappers(sql, params, many=False, executor=self._execute)   File ""/Users/nehapendem/env/lib/python3.7/site-packages/django/db/backends/utils.py"", line 77, in _execute_with_wrappers     return executor(sql, params, many, context)   File ""/Users/nehapendem/env/lib/python3.7/site-packages/django/db/backends/utils.py"", line 86, in _execute     return self.cursor.execute(sql, params)   File ""/Users/nehapendem/env/lib/python3.7/site-packages/django/db/utils.py"", line 90, in __exit__     raise dj_exc_value.with_traceback(traceback) from exc_value   File ""/Users/nehapendem/env/lib/python3.7/site-packages/django/db/backends/utils.py"", line 86, in _execute     return self.cursor.execute(sql, params)   File ""/Users/nehapendem/env/lib/python3.7/site-packages/django/db/backends/sqlite3/base.py"", line 396, in execute     return Database.Cursor.execute(self, query, params) django.db.utils.OperationalError: no such column: blog_post.author_id   please helpp",True
@nehapendem3155,2020-06-10T11:55:47Z,0,django.db.utils.OperationalError: table blog_post has no column named author_id i keep getting this error when i'm trying to save post1,True
@renejacques8288,2020-06-10T11:33:23Z,5,"Corey, I was always told and taught that ORM stood for object relational model, I believe.  To me that was the hardest thing to understand.  Now you say it's object relational mapper, it makes sense.  It's a mapper; that's all there is to it.",True
@Speedstackingboy251,2020-06-08T00:16:22Z,1,Your tutorials are so good ugh it's like I'm eating a dessert,True
@Feronom,2020-06-07T21:47:45Z,0,Ok but can youexplain why we can use author_id? What is that?,True
@kevinlao3690,2020-06-07T04:23:36Z,0,Here's the reference for Django 3.0 builtins https://docs.djangoproject.com/en/3.0/ref/templates/builtins/#ref-templates-builtins-filters,True
@iamanas9799,2020-06-05T05:47:58Z,0,"Please help, why my django admin site does not have the css style.",True
@santiagotorres6929,2020-06-05T00:11:34Z,0,"every time i watched one of your videos i learn a lot about really useful stuff, thank you for being so kind and share your knowledge",True
@ravenflores8012,2020-06-03T10:03:14Z,1,this is worth it and satisfying one,True
@yvetteshi5823,2020-06-02T09:13:44Z,0,"Just got a problem here, I followed every step but when  tried to update blog post in the admin panel, the following error comes out, any ideas why?  OperationalError at /admin/blog/post/1/change/ no such table: main.auth_user__old Request Method:	POST Request URL:	http://localhost:8000/admin/blog/post/1/change/ Django Version:	2.1 Exception Type:	OperationalError Exception Value:	 no such table: main.auth_user__old Exception Location:	C:\Users\shiy29\AppData\Local\Programs\Python\Python37\lib\site-packages\django\db\backends\sqlite3\base.py in execute, line 296 Python Executable:	C:\Users\shiy29\AppData\Local\Programs\Python\Python37\python.exe Python Version:	3.7.6",True
@leiyang3112,2020-05-31T15:36:34Z,1,Corey you are the best!,True
@NitinSawant1988,2020-05-31T06:56:24Z,1,Corey... You are the best teacher i learned from. Whatever Python i have learned is because of you and your teaching urges to learn more. Thanks a lot for these awesome vidoes.,True
@techadda6570,2020-05-28T16:33:09Z,1,Very well explained brother. Thanks for the Awesome tutorial,True
@mggarekar,2020-05-28T01:51:04Z,0,Nice,True
@chrisjaurigue102,2020-05-27T18:22:15Z,1,This may seem like a pretty basic question: How do you clear the screen from the Django shell?  I'm a windows users-- I've tried 'cls' and 'clear' Thanks in advance!,True
@cyreneluka2917,2020-05-23T13:20:57Z,0,"how did you continuously write down 3 imports modules in terminal shell? when I finish 1 import and hit enter, error coming up",True
@fredychondo2049,2020-05-21T16:03:09Z,0,"Hi,i just added that __str__ to the model exactly as you instructed but when i run the shell again there are sum errors appear...can you help me  please,and to help you to help me i wish a can send to you the picture for you to see those errors",True
@tharlinhtet97,2020-05-20T05:19:23Z,1,Best tutorial django.,True
@anandbharti7735,2020-05-19T18:15:27Z,1,You are the best,True
@marcusmeyer3266,2020-05-18T22:41:50Z,2,Great video Everything you did actually works! (unlike other tutorials),True
@MyThillai,2020-05-15T16:51:17Z,0,"please respond to this : when i typed Post.objects.all() for the posts key, it ran perfectly, but my text editor(VS code) said there is no 'objects' in class Post. What should i do to prevent this ?",True
@bhashyasheth1925,2020-05-13T17:10:01Z,0,im getting an error while running makemigrations after creating the class.......module 'django.db.models' has no attribute 'DateTimefield'......any clue why so........also great tutorials love them,True
@parthivijaya195,2020-05-13T11:28:23Z,3,"Man! you're ""code god ""for me. The best tutor i've ever seen",True
@briantuju,2020-05-12T18:54:48Z,1,You are awesome man. Thank You!,True
@hrishimaurya1989,2020-05-12T17:01:03Z,0,"hi,  got a problem here, when i use ""python manage.py shell"" in command line, it does not open interactive console... Help!!! Thanks!",True
@cagriazcan7711,2020-05-12T13:40:45Z,2,20% of my first webdev related pay check is gonna be yours. Thank you for this amazing tutorial.,True
@afikile,2020-05-11T11:16:39Z,0,That moment I realise this was recorded in the wee hours of the morning. Thanks a lot Corey,True
@banaras.wala.foreignaala,2020-05-10T10:06:30Z,0,"So far so good, Corey WOW",True
@techwithgio3333,2020-05-10T01:05:25Z,1,"Amazing Stuff, I can't stop watching!",True
@nicolasmaure1715,2020-05-09T19:14:35Z,1,u're the ONE,True
@kamalmaurya6634,2020-05-09T19:08:39Z,0,"Corey , I have a question about in database section You  used some syntax which we don't see  generally in python language, how do i know about these syntax. If you have any links or pdf files for these syntax , a little help here , please respond to this comment  Oh by the way your vids are amazing though, one of your subscriber from india",True
@afekhaijoseph5678,2020-05-05T16:15:36Z,0,"please who else gets this error when trying to create a post model in the python shell   raise TypeError(""%s() got an unexpected keyword argument '%s'"" % (cls.__name__, kwarg)) TypeError: Post() got an unexpected keyword argument 'title'   i can't seem to find what's wrong",True
@palepuaditya9370,2020-05-04T11:48:29Z,0,I am once again Thanking you for Your Tutorials!,True
@muzik6808,2020-05-03T11:15:33Z,0,'User' object has no attribute 'post_set' ................................................plzz help me sir,True
@muzik6808,2020-05-03T05:09:50Z,1,'User' object has no attribute 'post_set'      ..................................plzz help me sir thanku,True
@sante4940,2020-05-02T13:12:18Z,0,"I have just finished with this video-5th, Corey, I can surely tell you there are many who know technology but very few can present like you do.  coming Monday 4th may 2020.  i am starting with new Django project, I feel confident I can pull this off, thanks to your tutorials....",True
@SumukhDhawade,2020-05-02T13:12:04Z,0,I love your videos but how are we suppose to remember all this? You guys take notes or just keep using google while you coding by yourself?,True
@hanfeichen2612,2020-05-02T11:49:13Z,0,amazing,True
@nishchalchandrajwar4885,2020-04-28T19:31:11Z,0,"Corey namaste from  India . Thanku so much. Whenever I will get my first coding job , i will donate a part of it to you. Your explainations are just wow.....",True
@tanphan3970,2020-04-28T06:43:41Z,0,"Dear Corey, can you collect all command in Shell Editor in a file?",True
@yuvarajbarole4450,2020-04-26T20:05:43Z,0,"For the class Posts you are using class variables, would that make any difference  if they're made instance variables?  And why did you use those fields as class variables?  Please reply.  And seriously  thanks a lot for these lovely tutorials. Love your content. I've been following you from more than 2 years and I just love your tutorials.",True
@dariogarcia9572,2020-04-23T12:41:57Z,0,"Where all this data is saved? I mean, is there a database file that can be opened with another database explorer?",True
@mayursatav8852,2020-04-23T12:20:00Z,0,"one of the best Django tutorial series on youtube. by the way during execution of this query  """"""Post.objects.all()"""""" i got this error """""" OperationalError: no such column: blog_post.title  """""" could you help me with this?   thank you Mr.Schafer",True
@pixmestudio,2020-04-22T21:31:27Z,2,Best instructor on youtube. Amazing,True
@syazwanazlan5655,2020-04-22T13:52:26Z,1,thanks for the tutorial. I did learn something new here,True
@BoscoNFTs,2020-04-21T16:49:26Z,1,"Thank you for all your videos, man. You explain really well, so easy to understand, makes things more exciting... I sent you few BATs as grateful!",True
@dupmanngemuse5786,2020-04-21T11:22:38Z,0,So you know a way how to store checkboxinput to a specific non primarykey field in django like ib this question https://stackoverflow.com/questions/61125585/django-sql-server-hot-to-bind-checkbox-values-to-a-specific-id-in-database ?,True
@12e2aela7,2020-04-19T21:13:58Z,1,"As allways amazing I love you Corey, my best teacher. Keep up great work.",True
@ilijaangeloski4140,2020-04-19T13:03:19Z,0,When I execute python manage.py shell  instead of shell it opens IPython and in the terminal instead of >>> I have In [1]:    Any idea why is this happening ?,True
@tariknavarro87,2020-04-18T19:25:36Z,1,"Well done, Corey!!",True
@rp2804,2020-04-17T16:09:24Z,0,What does author_id = user.id set? Does it set the author's id to the users and give it user's name. Why do we need to do this when we can set author = user?! Thanks for the tutorial,True
@ayeshaansari2083,2020-04-17T13:04:18Z,0,If it is not for these tutorials it would have been very difficult for me to understand django. Every time a topic is covered in my class i first refer your channel. Your explanation is very clear and easy to understand👌. Thank you very much.,True
@radhikabhandari1605,2020-04-17T06:04:09Z,1,"on 22:27, we have provided author_id and pointed it to id of one user object but in our model we have defined only author. How does this work?  Please anyone explain it.",True
@david_9607,2020-04-17T04:19:44Z,1,By far the best Django tutorial I've seen,True
@mukondinengwani1791,2020-04-16T19:49:29Z,0,"guys i need help, user.objects.all() gives me the error: ""name 'user' is not defined"" even though i imported User in models.py",True
@thetruereality2,2020-04-15T15:00:08Z,0,@23.10 you wrote author_id-user.id   user.id is there but I am struggling to understand author_id attribute because i dont remember us creating it. Could you please leave a comment on this?,True
@dishantgandhi6007,2020-04-15T14:35:01Z,0,"having issue with user.post_set AttributeError: 'User' object has no attribute 'post_set' anyone with solution",True
@emilyava5813,2020-04-14T16:49:45Z,0,"Around the 17 minute mark, I get error ""name  'user' is not defined, this happens when I try to access user.id or user.pk, and when I try to create post. Import of user model is included in models.py and in the shell when running so I am not sure what is wrong",True
@code_n_gainz,2020-04-13T17:40:46Z,0,How to create custom user models?,True
@rojanshrestha822,2020-04-13T15:43:48Z,0,Can anyone tell me the difference between timezone.now and timezone.now(). Please,True
@CharisHub,2020-04-13T14:01:07Z,0,"This is what I am getting when trying to call Post from the database:   >>> Post.objects.all()  Traceback (most recent call last):   File ""<console>"", line 1, in <module> NameError: name 'Post' is not defined   Post not defined",True
@_lfaustoo,2020-04-11T07:00:05Z,1,You are an absolute beast!,True
@gautamnair8886,2020-04-10T23:24:36Z,9,Wow thanks Corey. I guess you were recording this video in the middle of the night. 30:27. Thanks for working hard to get all the content out fast!!!,True
@paulshim3216,2020-04-10T19:43:34Z,0,Is there a way to view the Post Query Set through a text editor?,True
@arunrajg2306,2020-04-09T09:13:47Z,0,ModuleNotFoundError: No module named 'users.forms',True
@himanshisharma5326,2020-04-08T10:04:29Z,1,It shows error in views.py file in Post.objects.all() line that Post doesn't have function objects,True
@r.w.7267,2020-04-07T21:11:55Z,3,I want to know we really appreciate all your hard word and content I will definitely sort you like the video and donate. Thank you sir!,True
@aidanmohammed-ali,2020-04-07T15:28:59Z,0,Does anyone know how I could set it to show the newest posts at the top,True
@SimonYells,2020-04-07T14:14:58Z,0,"Anyone having problem with adding ForeignKey to your model? I use Django 3.0 and it says that author is non-nullable and it needs a default value...WHAT THE FUCK DOES THIS MEAN? IT DOESN""T MAKE ANY SENSE!?",True
@jean-louisgirishaka4586,2020-04-06T12:44:48Z,0,I just got a django.db.utils OperationalError and i had followed the whole video and all the codes . Could you help me out??,True
@jamaalskeete5150,2020-04-02T16:11:48Z,1,My migrations folder is empty..even when i run the commands   any suggestions?,True
@tiagotele1,2020-03-31T08:45:24Z,1,Awesome explanation as always! I'm excited about how a dev can be so productive with Django!,True
@MATSAMPOYKAS,2020-03-30T16:23:27Z,0,can we use only the gui edit anything in posting instead of shell? it's easier at first though,True
@zeelsinojia1289,2020-03-30T08:24:35Z,178,"Everyone: ""World is going through pandemic!!!"" Corey: ""Let's clear the screen first""  :) Love your tutorials and explanation man Keep it Up man",True
@vimalbelwal7292,2020-03-29T12:11:14Z,0,user.post_set won't work. Showing Attribute error: User has no attribute post_set. What am I doing wrong?,True
@llewellynhattingh3496,2020-03-28T10:11:00Z,5,"You know what... I've BEEN trying to actually get whats up with Object Oriented Programming.. And now I finally do, this is super helpful especially in the workplace, thanks so much! I hesitated to watch a 40 min video, but it is every second worth it.. thanks Corey",True
@rishikambhampati2862,2020-03-27T13:43:14Z,1,Thanks a ton,True
@sureshbabu1638,2020-03-27T06:48:47Z,0,"15:25 I got error when I typed user.id..    Error _________   Traceback (most recent call last):   File ""<console>"", line 1, in <module> AttributeError: 'QuerySet' object has no attribute 'id'   why is this happening? Please help me",True
@amirhosseinahmadi3706,2020-03-26T21:37:55Z,1,Great series so far! Your explanations are really on point and clear! Thank you!,True
@junecnol79,2020-03-26T19:15:01Z,0,31:55 date filter https://docs.djangoproject.com/en/3.0/ref/templates/builtins/#date,True
@hassanzaid5060,2020-03-26T03:13:14Z,0,Thank you so much,True
@ishanpand3y,2020-03-25T15:27:36Z,113,sir this is the third series from you I'm learning. Actually I am regretting why I've not watched u earlier. THIS IS THE BEST OF THE BESTS CHANNELS on PYTHON. HUGE RESPECT TO YOU SIR... *from India import love*,True
@hjluna7760,2020-03-25T13:32:22Z,0,"when I want to migrate this error appear how can I solve it plz :    django.db.utils.InterfaceError: ('IM002', '[IM002] [Microsoft][Gestionnaire de pilotes ODBC] Source de données introuvable et nom de pilote non spécifié (0) (SQLDriverConnect)')",True
@aldemarocruz9668,2020-03-25T12:54:34Z,1,thanks to you I finally understood url's in django,True
@DrErrday,2020-03-24T16:55:54Z,0,"def home(request):     context = {         'posts': Post.objects.all()     } # Why does it underline 'Post' and say ""Class 'Post' has no 'objects' member"" # Works on the website everything shows as normal however it is saying that this is an error",True
@kareemjeiroudi1964,2020-03-23T01:29:08Z,0,I am in love with your videos,True
@kerrickcavanaugh6962,2020-03-22T15:31:31Z,0,I love you,True
@janekalam,2020-03-20T06:07:32Z,0,"Hi Corey. Thanks for this awesome tutorial. A quick question. When I go to ""date format"" link you have provided, I see the following message: This document is for an insecure version of Django that is no longer supported. Please upgrade to a newer release! Any idea?",True
@Caffer9286,2020-03-19T15:42:48Z,1,This has to be the best django tutorial I have come across. You sir are star. Keep up the good work,True
@syedkashifnaqvi1268,2020-03-19T11:10:50Z,1,Love you so much.You are king of coding,True
@satyajeetdharmadhikari109,2020-03-18T17:55:21Z,1,on 9:15 min we implement on command python manage.py makemigrations it should reflect some changes but it showing no changes detected what to do now.,True
@deliciafernandes9946,2020-03-18T16:36:47Z,1,*HANDS DOWN THE BEST BEGINNERS GUIDE TO DJANGO!*,True
@hrushikeshvazurkar,2020-03-17T06:50:58Z,0,Next Level Tutorials Corey. You have reduced the learning curve for a lot of web development beginners like us. No one could have taught Django better.,True
@syedseraaj4645,2020-03-16T17:23:57Z,0,Thank god i found your lessons. Thank you so much Corey !,True
@multitudes389,2020-03-13T15:40:28Z,0,https://youtu.be/aHC3uTkT9r8?t=638 just wow when I saw that sql code :),True
@babi1364,2020-03-10T08:51:07Z,1,Thank you so much.,True
@blahblahblah747,2020-03-09T20:22:11Z,3,"once I get my job, ima donate to your patreon. cant do it now cause im broke af LOOOOl",True
@SHINEILCHI,2020-03-04T17:45:37Z,0,"First and foremost, thank you for this astounding tutorials Corey! It's amazing!   I have a question, you said that in this tutorial we'll be using sqlite for the development and postgresql for production, my question is, are those already installed in your unit?   Am I also correct in my understanding that the database manipulation here was just on the built in ORM of Django and you have not use sqlite nor postgresql yet?   Thank you so much in advance! God bless you! 🙏🙌",True
@leandrocosta4283,2020-03-01T23:07:07Z,0,"hello, I love your videos you do an excellent job.  I would love a video about Django and ways to do research with search forms?",True
@cawag98,2020-02-28T20:42:15Z,0,"If anyone gets stuck on Django tutorial 5, even after loading it in your environment from Corey's github snippets, in my case, I had to do a pip install of the crispy-forms packages from the usual pypi.org and files.pythonhosted.org location.  I was stuck for some days until I began to look at the bottom of the errors (when the server was trying to start).  It kept patiently telling me that crispy forms weren't recognized...",True
@advikkabra8039,2020-02-28T10:50:09Z,0,I keep getting this error: no such column: blog_post.author_id Can anyone help me?,True
@madhurapatil3503,2020-02-28T07:53:17Z,0,How can we delete a post?,True
@vedanshugoyal1210,2020-02-27T12:36:45Z,0,"Can anyone please tell me, why on 25:21 it is post not Post. [Doubt because real name of model is Post not post].",True
@ahsanmasood2485,2020-02-26T07:55:48Z,0,"Hey Corey!  I just wanted to ask, what If we need time somewhere? Suppose people around the world are accessing a website then how can we able that time to view as according to that specific country's timezone? No matter from what country it is posted, it should show the time according to viewer's country's timezone.   And thank you so much for your tuts, trust me I have seen many other courses and tuts, but by far this THE BEST of them all, really loving it.",True
@ericgitonga6127,2020-02-23T16:34:59Z,1,"Visiting for the first time in 2020. This was very helpful. Thank you, sir.",True
@tritopboy,2020-02-23T12:23:18Z,0,First i would like to thank you for great tutorial. You think you can add one tutorial with MSSQL database instead of Django built in database ?,True
@ggcmod,2020-02-23T03:01:52Z,0,"I follow the tutorial exactly the same but when running SQLmigrate https://youtu.be/aHC3uTkT9r8?t=618, I get much less information, than in the video, why will this be?   python3.8 sqlmigrate blog 0001 BEGIN; -- -- Create model Post -- CREATE TABLE ""blog_post"" (""id"" integer NOT NULL PRIMARY KEY AUTOINCREMENT, ""title"" varchar(100) NOT NULL); COMMIT;",True
@saliksheraz6236,2020-02-20T17:45:10Z,0,"A very awesome and easy to understand tutorial, Brother I;m using django  3.0.3, whenever i add that author line in my models i.e author = models.ForeignKey(User,on_delete=models.CASCADE) my site goes down and gives me this error ""django.db.utils.OperationalError: no such column: student_data.author_id"", any solution please?",True
@narasimhanmb4703,2020-02-20T12:41:08Z,0,"Hi Corey, in the Post model, for 'date_posted' attribute, instead of using the 'models.DateTimeField', I used 'models.DateField(auto_add_now=True)' and migrated the changes. Suddenly, I have started to see the string to into conversion error as: ""invalid literal for int() with base 10:...."". If I change it 'DateTimeField' type, everything renders as before. As I went through the documentation, I see that both field types are python datetime objects but am not able to get the issue resolved. Could you please help here?  Also, here's a stackoverflow link which describes the exact problem: https://stackoverflow.com/questions/54706411/my-datetime-field-in-models-py-does-not-work-even-though-it-does-not-raise-any-e",True
@hovopetrosyan1655,2020-02-18T19:03:22Z,1,Oh Dear!!! Thank you VERY VERY VERY and VEEEEERY much!!! God Bless You.,True
@SagarSapkota-eo4ei,2020-02-18T15:24:34Z,1,Thanks Corey..I can't express my gratitude from words...,True
@Historymaker431,2020-02-17T00:00:17Z,1,"finally someone who makes django coding make sense. thank you again for your detailed, step by step tutorial.",True
@slickwillie3376,2020-02-16T22:10:45Z,1,So far so good. Great video.  Continuing on to the next...,True
@teddytalks499,2020-02-16T17:03:58Z,1,thanks,True
@DaniiyOoP,2020-02-15T20:58:47Z,2,"This is the first tutorial from your channel that I see and I'm really loving it. I hope to really understand Django, but I'm sure that this tutorial will help me to get it! Thank you! I hope one day I will have money to contribute, since this will help me with my career :)",True
