author,updated_at,like_count,text,public
@nikhilkatkar2774,2024-04-11T20:47:07Z,0,I am having 6 years of web development experience but want to make transition into ML/AI and recently started watching Krish sir’s ML NLP. Can someone please let me know how can i proceed from here?  What should i do next  How to do hands on projects Which topic should i go on next and what are the chances to survive in this market  You responses are much much appreciated  Thank you guys,True
@pranitatiwari4981,2024-04-11T20:34:28Z,0,I have just started learning and I am waiting for my transition...from jobless to a data scientist. I just want to thank you. I truly appreciate your work.,True
@manojnagabandi9779,2024-04-11T20:06:02Z,1,"I have no knowledge about python in my Bachelors(Electrical Engineering) but after joining Full Stack Data Science Bootcamp my interest grew more in Data science and got an Masters degree in Data Science and also learnt and learning practical skills from ineuron.  I am working as Full Stack Data Scientist and worked in predictive maintenance(deep learning), databases , at present in multiple Generative ai use cases at my company. Thanks to ineuron for paving the way.",True
@shikharmusic,2024-04-11T19:56:13Z,1,"Hi Krish, I tried reaching out to you and your team at ineuron a while back, I enrolled in DS Bootcamp at ineuron and took subscription of One Neuron platform but could'nt get any revert. My transition story is still work in progress, but I wish I could have had some support from your team in this journey...i was mis sold the ineuron course by your sales team, sad  to see this practice in an organization which has such a huge icon and Data Science leader as yourself..",True
@charon2247,2024-04-11T19:49:45Z,0,"i have just started to follow krish, and hoping for the best. The class and your aim is great.",True
@huzaifaimran9468,2024-04-11T19:08:46Z,4,"Completed whole FYP, got a job in company, fufilled more than 10 Orders on freelancing while still being in my last semester. Krish you have transitioned me from a hobby enthusiast to a professional DL,ML engineer. Krish you have been the best tutor I had. Love from Pakistan. THANK YOU SO MUCH!",True
@MuhammadFaisal-sx5gl,2024-04-11T19:06:24Z,1,"Hi Krish, thank you so much! I have an engineering background and am transitioning into the Data Science industry. Your videos have been incredibly helpful and have truly been a game changer for me. Thanks to your guidance, I've received more job offers. Love from Pakistan!",True
@rohitguleria100,2024-04-11T19:01:41Z,0,Your content is definately very good ❤❤.....but i love to watch code with harry..,True
@mars5617,2024-04-11T18:54:49Z,6,"As a junior Machine Learning engineer who recently graduated, most of my personal projects and job projects were on jupyter notebook in my local computer. Yes I was able to build successful projects with my knowhow but none of them was at production scale. Even in work I was just pushing my experiment codes and results to our company's repo and some senior developers were using it for actual product. Thanks to you @Krish I learnt how I can build production scale projects just by myself and I've gained courage to tell my boss I can deploy custom LLM models to embed our internal dashboard's workflow. Your difference is this. You teach us how we can leverage our real world projects. Thanks a lot.  Love from Turkey.",True
@nabehaaashna2545,2024-04-11T18:49:21Z,1,"Had started with data science only, Got into big company as a data analyst with 100% hike, your videos have really helped me in learning almost all the algorithms and many projects that you have uploaded. Still helps me whenever I am preparing for interviews. I am very grateful. Still need to work on my coding skills though :)  Whoever is reading this please keep learning and dont make the mistakes I have made (not giving enough time on implementation :p)  @Krishh Naik forever grateful 🙏",True
@RaushanKumar-qb3de,2024-04-11T18:36:22Z,0,❤❤❤❤❤❤❤❤❤❤❤❤❤❤❤❤,True
@njabulohadebe5413,2024-04-11T18:28:42Z,0,"Hi Krish, thank you for this opportunity. I have been working as a Computational linguist and I struggled a lot back 2018, but 2021, I saw you videos, things started to flow, I managed to develop models. However, I have a challenge, I always apply to companies or go to linkedin and apply, but I am struggling to recieve any feedback or invites from interviews. I would really appreciate if maybe you can advice. thanks.",True
@DappuDon,2024-04-11T18:28:30Z,1,No transition but you have made my concepts very clear.Thanks to you very much. I started at 9k per month. My CTC is 21 LPA now Accenture.,True
@user-zx6fy8pl2q,2024-04-11T18:17:02Z,1,Desktop support engineer to creating AI chatbot. This is my journey so far. Thank you so much for your tutorials. You are the best.,True
@mahadevhummanagol9064,2024-04-11T18:11:55Z,1,I am mech background.  I also got transition working in ai ml,True
@Supinderkaurbedi,2024-04-11T18:06:54Z,0,"I had a gap of 8 years after completing masters of IT and started masters of data science professional 2 years back. Okay, i took this brave step BUT was struggling to understand even a very small concept of DS then a blessing popped up in my youtube channel which was your videos about each and every concept of DS. I have posted this on LinkedIn as well about how you have helped me throughout this journey and still helping me and i would like to pay my huge huge thanks to you. Love and respect 🫡",True
@Data_Scientist_interview,2024-04-11T18:02:36Z,1,From working in HPCL to Data Scientist in TCS-Research.,True
@paracyber.x6797,2024-04-11T17:57:21Z,0,❤Comditional probability,True
@sambamurthykaki8467,2024-04-11T17:54:59Z,1,hello sir I am SAMBA MURTHY a MECHANICAL ENGINEER GRADUATE in passed out in 2019 have nearly 5 years of career gap (prepared for gate and some family health issues) and my job in past is not at all related to DATA SCIENCE. Now I have completed GOOGLE DATA ANALYTICS PROFESSIONAL CERTIFICATE PROGRAM in coursera. and also I have completed your recently upload ROAD MAP TO BECOME A DATA ANALYST IN 2024. SO Please Help me how to build the RESUME WITH RESPECT TO THE CAREER GAP OF 5 YEARS and HOW TO TO CRACK THE INTERVIEW WITH 5 YEARS CAREER GAP please PLEASE,True
@nineai,2024-04-11T17:54:01Z,0,❤❤❤❤❤,True
@rajvernekar8605,2024-04-11T17:53:10Z,0,Transitioned from a biomedical engineer to data scientist. Thank you Krish!,True
@sqlsql4304,2024-04-11T17:43:36Z,0,"Hello Krish, Iam a learner on INeuron, joined the course on GenAi. Amazing knowledge gained. Iam 49 yrs now, still learning. I want you to experiment with Teaching school Kids on GenAI / ML . There is lot of traction we can add to school curiculums",True
@Jayshreeram22583,2024-04-11T17:16:36Z,0,❤❤❤❤❤❤❤❤❤❤❤❤,True
@ayushbanerjee4442,2024-04-11T17:15:26Z,1,"I am still learning daily from your videos. From 0 knowledge to being able to develop insights from data, and yet learning daily, all credit goes to Krish and your team.",True
@ludovicgardy,2024-04-11T17:11:25Z,1,"I've been following your channel for a while, your pedagogy and your end-to-end examples have helped me on several occasions to review or learn concepts in which I had gaps. Your content was very useful to me in my transition from academia to industry. Thank you :-) Wish you the best",True
@vvskushwanthreddy3790,2024-04-11T16:54:53Z,1,Thank you so much Krish for your knowledge sharing videos... I transitioned form service based to Product Based companies with 2-3X increase in salary in last 2-3 years. Especially Machine Learning In 6 Hours was a Life saver ..,True
@da-ot4tl,2024-04-11T16:54:12Z,0,Hi Krish Iam 2023 graduate I couldn’t know what to do with my life.Thoughts of suicidal were here and there in my mind.I couldn’t do anything nothing is going on my way.wish to get reply from you😔😔😔,True
@user-oi6rs3fp2b,2024-04-11T16:50:22Z,0,"Thank you for your kind words and appreciation. Krish Sir   It's wonderful to hear that you're dedicating time to learn from the resources you have provided. Learning is a journey, and every step it take brings  closer to your goals.",True
@y.svamsiyadav7022,2024-04-11T16:46:36Z,1,From unemployed for 3 years to data engineer in an MNC,True
@padmapriya3261,2024-04-11T16:40:49Z,0,I want to get transition,True
@abubakarsaddiq4098,2024-04-11T16:37:42Z,0,good,True
@AshishGoyal1018,2024-04-11T16:36:47Z,1,I have got a hike of 150% transitioned from mechanical engineering background to data science field. Your videos helped me understand the concepts better. Thank you Krish :),True
@shortx11,2024-04-11T16:33:54Z,0,I'm learning a lot from your video about how to get familiar with artificial intelligence ❤❤ thank you for that 🙏🙏,True
@NADEEMALAM0094,2024-04-11T16:33:11Z,0,I’m doing Phd from AMU and my research topic is gender bais in Algorithms for this purpose I learnt data science from your channel which helped me alot now I’m following your path to become an AI Engineer without looking anywhere else. Currently I’m doing literature review for my research. I want some help from you like conferences related to ai and journals related to ai  Thank you,True
@tapasswinmanchala7249,2024-04-11T16:32:12Z,0,I am still trying for the transition to the data science domain but still I am learning a lot from your tutorials thanks a lot Krish Naik Guruji.,True
@tailorjaimin5161,2024-04-11T16:31:35Z,0,"I am looking for career transition, still struggling for getting entry level job as a Machine learning engineer.",True
@ibdarammar,2024-04-11T16:29:46Z,0,Every company is asking experienced candidates with minimum 4-6 years in data science. I want to switch from non tech to tech but do not carry experience. No company wants freshers in data science,True
@KachraLagaan,2024-04-11T16:20:32Z,0,"Krish, I'm there, from where u started ur career and I'm also thinking that I'll become like u. For this I'm alot of hardwork nd it's possible because of u..... Thank u Krish",True
@amolt1985,2024-04-11T16:16:56Z,1,"I have been following your channel since more than 3 years now. Have learned a lot of things from you. Two and a half years back, I  joined CTS with more than 100% hike and now also I have recently switched to one of the big 4 firms with more than 100% hike again. Would like to thank you from bottom of my heart ❤️",True
@shreedhargaming,2024-04-11T16:14:53Z,1,Joined as Data science Trainee @Element tech  (as fresher) .Everything is possible because of your videos sir..  Still In company I am following your course and gaining more knowledge of trending technology #ThanksKrishnaik,True
@VoiceofNamasvi,2024-04-11T16:09:19Z,0,Hello krish I am following your channel form 2018 that i don't have  any idea about the IT industry how it works then I start learning python from your channel I got my first job as test engineer and then completely moved like you know java and selenium into that platform recently I have moved to the development in one of our new project.. But I am following your channel what happening in the industry so From this year onwards again I am starting to learn the AI from your channel... Thank you so much ❤,True
@user-cf5sw4gf8l,2024-04-11T16:08:14Z,7,"cracked job as a junior data scientist at a startup , you have been posting wonderful content Krish. Even after recession, I am able to get job because my fundamentals and skills are strong. You have been helping me since 2021 with your wonderful content. We are blessed to have your support",True
@SaffronKage,2024-04-11T16:06:53Z,0,"Hello Krish sir / Data learners,  I started my Data Science learning journey in 2021 end using various resources available online out of which your channel has contributed the max. I haven't got any offer yet but that's mainly because of my own mistakes, but whenever I'll receive my first offer ill reply to this comment and update the community hope that happens soon.",True
@shivamkumarmishra,2024-04-11T16:05:48Z,1,"You  played a big role in my career , from being in Accenture to now a DS at Fortune 20, I owe a lot to your videos. Thank you",True
@working7343,2024-04-11T16:01:26Z,0,ye kon hai 😂,True
@suryaprakash9170,2024-04-11T15:58:42Z,0,sir my background is non tech and i have done a certification in data science but am not getting any job in datascience...what to do now pls suggest me!!!,True
@suryaprakash9170,2024-04-11T15:55:33Z,0,what a look sir !!!,True
@somanathking4694,2024-04-11T15:53:59Z,0,I havd studied and understood many complex machine learning topics from your channel sir. I am on my hunt to crack a job in th data world. Sonner i will post my carrer transition sir. Bless me 🙏🏾,True
@arpitasingh7734,2024-04-11T15:51:52Z,0,"from this video, I need your help krish,  don't ignore my comment.",True
@pranaykrishna3617,2024-04-11T15:44:45Z,0,"Sir, why did you change your handsome look.",True
@pravinkumartiwari7671,2024-04-11T15:44:00Z,0,Sir i wanted to start a career in data scientist course but i have 5yrs gap for govt job preparation i had done btech from ece 2019.. Is there any problem sir to get into this...,True
@SamirAghalarov,2024-04-11T15:40:48Z,0,You realy scared me with title and hair syle.,True
@jpprajwal3606,2024-04-11T15:16:06Z,1,it helped me complete my unisys project which would not be possible without you,True
@twinklepardeshi3113,2024-04-11T15:13:06Z,3,Joining your Ineuron Data Science full stack course helped me transition from Project Management to Data Analyst role and recently have joined Mastering GenAI course from Ineuron. Many thanks for your support ❤❤,True
@praveenbhandari2516,2024-04-11T15:08:31Z,1,This kind of teacher we need to learn new technology and I'm learning from you sir and i proudly said that you are a blessing for all aspirants of data science students,True
@DeepaDey-lv7gx,2024-04-11T15:06:32Z,1,Hopefully one day I will  shear my career transition with you. Thankyou Sir! for making knowledgeable videos'.,True
@kaushalshah5380,2024-04-11T15:03:27Z,2,Thank you krish  Back in 2020 i saw your video AI VS ML vs DL vs data science  Started exploring different parts of DS from your videos and get motivation  In back in 2022 successfully done transition from Biomedical engineer to data science  Currently working as a data scientist,True
@yashinfinite8338,2024-04-11T15:02:19Z,0,Hi krish i love your content so much.. your video and andreai nagoe sir helped me so much grasping the command over ml and dl...  I am working in an it firm from a finance and mba background. I am thinking to switch to freelancing now. Is it my good decision?,True
@michelebufano2416,2024-04-11T14:53:19Z,0,"I've just started yesterday. I'm very happy, that I've found this channel. I'd like to use LLM to create radiological reports. I think, this is the right place to learn about that.😁",True
@user-yp1ol4qc2r,2024-04-11T14:53:18Z,0,bro i think you can also make a small interview of the freshers who got transitioned by you. since those videos gateher more attention among college students,True
@barunbodhak720,2024-04-11T14:53:16Z,20,"Started on ML/DS path on 2018(november), I didnt have any knowledge of Python or any programming knowledge back then, ( I was in marketing field and had 0 idea of any computer language).  I first started to just copy your code blindly ,never knowing any idea of coding. I use to print each and every sentence, and tried to understand some logic. Then created my first ML model just by copying your codes and then once I knew what I was dealing with. Took some course ineuron/appliedai and ofcourse your channel started me on this path. Today it feels normal to me coding/visualising the data on different tools, and creating ML model from scratch. But if you ask 5 years back me, he will say that it will be a Miracle if I achieved that in 5 years. So here I am living a miracle or a dream. It was struggle but Krish you helped me a lot. I am an active viewer of your videos but inactive on comments section. But seeing this video, I had to comment. Sath Sath Pranam Gurudev...  Gurur Brahma Gurur Vishnu Gurur Devo Maheshwaraha Guru Saakshaat Para Brahma Tasmai Shri Gurave Namaha",True
@nandinimnair9915,2024-04-11T14:51:22Z,0,"Hi Krish, I have developed interest in data analytics through ur channel.I have been watching eda basics and it helped me a lot.Keep doing wonders as before.Thanks a lot😊",True
@user-yp1ol4qc2r,2024-04-11T14:51:01Z,1,proud to be a krish follower,True
@user-yp1ol4qc2r,2024-04-11T14:50:18Z,1,i will and do support you forever,True
@user-yp1ol4qc2r,2024-04-11T14:49:46Z,5,i transitioned from math graduate with no cs degree to a web developer using many resources including your videos . thanks a lot bro for your help,True
@yitayewsolomon4906,2024-04-11T14:49:29Z,52,"Dear Krish Naik,  I am Yitayew Solomon from Ethiopia, and I want to express my heartfelt gratitude for the invaluable content you share on your YouTube channel. Since 2021, I have been an avid follower of your videos. Following your guidance, I successfully transitioned my career to become a data science trainer and data analyst at my institution.  Thank you for your dedication and inspiration.  Best regards, Yitayew Solomon Ethiopia",True
@bvscar,2024-04-11T14:48:27Z,5,Thanks Krish. I couldnt narrate here but when time demanded I saw your videos and helped me to get back.  Last 3 or 4 months it was daring time due to family issues but now I can see hope. Your videos helped me a lot. Thanks man 😊,True
@ravitanwar9537,2024-04-11T14:47:57Z,2,"got data scientist role at walmart and also got shortlisted for google,amazon,microsoft etc. hike was close to 250-300%",True
@DataWithChinna,2024-04-11T14:46:48Z,1,Learnt basics of stats and ML - - helped to get job in OLA electric and Capri Global as a data analyst with over all. Hike of 70%,True
@devashishsoni9371,2024-04-11T14:45:01Z,0,Always loved your contact to keep myself up with the latest technology,True
@rithikmathur8944,2024-04-11T14:43:39Z,0,Already in AI field but still got a lot of learning from your videos👍,True
@user-um3vb7eu4k,2024-04-11T14:41:41Z,0,"Still, students sir exploring the things. Thanks for help ❤❤",True
@KapilMurarkar,2024-04-11T14:37:43Z,0,Have been watching your motivational videos and like it.,True
@100srecordwarehouse6,2024-04-11T14:36:36Z,0,"hi , i was preparing for civil services from 3 years , its been 11 months since i stopped the preparation ,i have 3 azure certifications ,my resume is also good ,but i am not getting any interview calls .Any help is appreciated.",True
@BelhsanMohamed,2024-04-11T14:36:27Z,3,"i have been following your channel for a couple of month the same time as i started my data science journey and your content has been extremly helpful and motivating in my learning journey, my learing pace has been better since i started following your videos carfully i realy hope to share with you as soon as i land a  job/internship position wich i'm sure won't be far from now . great love and thanks from tunisia",True
@sridharm4254,2024-04-11T14:32:19Z,2,Learning a lot from videos. I am 18years experience. Already made internal company movement in gen ai. Hopefully I grow as lead architect with your videos,True
@shauryavardhan7225,2024-04-11T14:32:00Z,25,"You and Sentdex played a big role in my career , from struggling in Accenture to now a Lead DS at Top management consulting firm, I owe a lot to your videos. Thank you",True
@mamtagoel4392,2024-04-11T14:29:27Z,0,"Hi Krish , your videos are so helpful for me In field of data analyst ,data scientist ,Where can we do text regarding any query to asked .Thank you so much !",True
@naehalmulazim,2024-04-11T14:29:06Z,2,"I haven't been able to make a transition but as a fresher I was handed ML projects and really wanted to learn ML concepts. From 2021 I've been watching you teach on that whiteboard, before you came to this type of setup. Your channel had hit 300 K subs by then I think. I was focused more on the academic side and was amazed at how easy you tried to make it by giving intuition first of the math involved.  Thank you for all that you do Krish Sahb",True
@gershonworship,2024-04-11T14:28:56Z,21,"I graduated with bachelors in Electrical Engineering in 2019 with Zero knowelegde about AI, data science or machine learning. I learnt about data science from a friend who shared me the links to your videos, there i developed interest for data science and learned from your videos and pyrhon, which pushed me to do my masters in Artificial intelligence, still following your tutorials for my projects and thesis. I am finally employed as an AI software developer.  I never knew it would be possible but thanks to all your resouces, vidoes and motivations. It really went a long way in my career.",True
@pradeepjungkarki4510,2024-04-11T14:28:34Z,0,Still learning sir 😊,True
@abhilash8973,2024-04-11T14:27:48Z,21,"I got hired from making the South German Bank project. What I learnt from the internship is that we are expected to deliver a solution to business problem, doing things end-to-end.  So I made a django application with django templates engine that  could take the inputs from the user . it would then use those input parameters to predict the credit risk of the customer.  In the interview i was asked how django works, the request response cycle etc. etc. and that is how i got the job.",True
@aiasaanhai,2024-04-11T14:26:58Z,0,Due to some unforeseen situation I got terminated from my previous company and  there also career gap . No company was selecting me due to career gap and termination so I learned from your channel and started my YouTube channel.,True
@casually202,2024-04-11T14:25:52Z,0,I am new to your channel and I like your content. You motivate us learn AI or Machine Learning. Keep it up. Thank you ❤,True
@aiasaanhai,2024-04-11T14:24:04Z,0,I made transition and start my YouTube channel,True
@shreyasb.s3819,2024-04-11T14:20:49Z,8,I have transitioned from software automation testing to data science 3 years ago using your channel.  I am following ur channel from last 3 years.  Now again following your GenAi videos very deeply.  Its helping in my current work.,True
@devanshsrivastava7046,2024-04-11T14:16:46Z,0,still learning but soon will make a transition,True
@RishiRajxtrim,2024-04-11T14:15:10Z,0,"Hi highly respected Krish, I have only bookmarked your 1-year-old ML playlist to watch and learn out of.   I peomise you and myself to utilise that kind Lot (Punj) of your hard and beautiful work soon now.",True
@RishiRajxtrim,2024-04-11T14:11:43Z,0,🙏🙂,True
@commoncats5437,2024-04-11T14:06:18Z,52,"from a electricity board lineman working hard in 100+degree hot sun,  Day and night 24/7  with no idea in computer to ====>> Machine Learning Engineer in Agri Tech startup, thanks a lot man 🥺❤❤",True
@tianyiluo4643,2024-04-11T14:05:26Z,7,I just got accepted by a data science master in the us. your videos are very helpful. they helped me a lot when i prepare for my interview of the ds program. now i am ready to learn more. and expect more great content from you. thank you. love from china.,True
@SiddharthKumar-zq2kj,2024-04-11T14:05:21Z,0,Thank u so much for everything,True
@SiddharthKumar-zq2kj,2024-04-11T14:04:50Z,0,I am learning data science with ur playlist sir when I trasation I let u know,True
@Nikhilsingh-ij9qy,2024-04-11T13:59:21Z,0,Hii krish can you pls tell what  maths topics i need to master for machine learning?,True
@gauravbanerjee2898,2024-04-11T13:59:04Z,1,"""I am a fresher who wants to pursue a career in data science. Can someone please suggest the correct order in which I should follow the playlists on Krish Sir's channel to master data science? There are a lot of playlists available, and I am confused. I would appreciate it if someone could help me with this.""",True
@yamini436,2024-04-11T13:55:04Z,0,Nothing can be more motivating than this for a fresher. Grateful to have you Krish Sir :),True
@TheMak1529,2024-04-11T13:54:18Z,5,From a start up to GEP worldwide and then from GEP worldwide to Service Now ( December 2021 ) Got 100% hike from GEP to Service Now.,True
@aparnapradhan0198,2024-04-11T13:53:36Z,0,"No transition,  I'm going out alongside with web development,  ❤❤❤🎉",True
@deadlyofficial5529,2024-04-11T13:53:29Z,0,❤,True
@sivabalaram4962,2024-04-11T13:52:38Z,1,"I am immensely grateful to my lecturer, Krish Naik, whose insightful lectures have been instrumental in shaping my career trajectory over the past three years.Thanks to his comprehensive teaching style and invaluable guidance, I have not only deepened my understanding of the subject matter but also honed my skills to a level where I've experienced a remarkable 200 percent hike in my professional endeavors.I cannot thank him enough for his unwavering support and mentorship.",True
@Half_agnostic,2024-04-11T13:51:18Z,41,"Unemployed Mechanical Engineer to Senior Data Analyst(Current designation)in a US product based company ,Thank You Krish❤",True
@MrRahulAnand,2024-04-11T13:48:35Z,3,"Buddy, once I mistakenly landed your channel, few months back . and I must admit It was the lucky mistake for me. Since that day have been regularly following your videos , specially in AI. they have been great. Please keep doing all the great works.",True
@shaileshbhat93,2024-04-11T13:46:52Z,0,I am in career break now krish. Using your videos in my studies in the path of becoming AI Engineer. My goal is to start a startup @krish Naik. Will post my success story once i begin my own company. Thanlk you krish,True
