author,updated_at,like_count,text,public
@imdsk28,2024-04-11T13:45:11Z,0,You look way cool than your previous look... Your videos really helpful and motivates to transition to data scientist roles... I am fullstack developer. What is your take on web developer knowing gen AI stuff... Can we expect such roles,True
@samrat.8839,2024-04-11T13:41:04Z,0,"Hey Krish, because of your channel I got inspired to learn Data Science. And currently I am at level zero, but I will keep utilising all the content you have made on Data Science till I get what I truly want. And that day when I become a full time data scientist I will get back to your channel and share how someone named ""Krish Naik"" helped me change my life.",True
@1murali5teja,2024-04-11T13:40:45Z,0,"Hi krish sir, I so glad to hear this video,i didn't got any offer, but sure I will write soon. Like u said I trust the process and learning. I never give up  on this.",True
@rurbleburble,2024-04-11T13:39:29Z,0,"I just finished 12th grade, and found out your channel. A Goldmine for a lot of people, as stated, i've seen some of your videos during devin ai hype, you help and sort out stuff easily sir, can't wait for you to guide more in the future. Please keep on guiding.  I can't wait to start my AI Engineer Journey .Thank you so much, Krish Sir.",True
@entertainmenthub2902,2024-04-11T13:38:53Z,0,Started learning CNNs after mechatronics engineering. Working as Computer vision engineer for three years now,True
@Gamer_A.1,2024-04-11T13:33:44Z,1,98LPA,True
@memessoul5230,2024-04-11T13:31:36Z,0,I will write about soon...when I make the transition,True
@reynoldoramas3138,2024-04-11T13:29:47Z,27,"I have been following your channel since 2 years ago. I studied control engineering in Cuba, and I was able to get my first job as an AI/ML engineer 1 year ago, online. And 6 months ago I was able to land a 2nd job, online, partial time. Now I work a lot but I am able to provide for my family, in this small island. I consider that this is the best channel on YouTube. My only regret is that now I don´t have the time to watch all your new videos but I still follow the content. Thank you so much, Krish, you are the best.",True
@geekyprogrammer4831,2024-04-11T13:29:41Z,245,From no knowledge about AI back in 2021 to Head of Machine Learning in a Dubai based startup in 2024. Thanks to you Krish!,True
@simp198720,2024-04-11T13:28:44Z,0,I’ve just starting following your channel from 1+ month. Love the way you teach and motivate all of us. Appreciate your help❤,True
@ganeprem4583,2024-04-11T13:25:02Z,2,Sir I am still learning whenever i got placed i will definitely share you thank you sir for doing like this kind of work who did not having money for study for them you are like a god thank you sir🙏🙏🙏🙏,True
@satvik4225,2024-04-11T13:22:50Z,0,"Please teach more mathematics, love you",True
@kamalch8928,2024-04-11T13:22:35Z,2,"I basic motive to watch you ML, DL and Langchain playlist came from one of your video only where you said to apply those concepts in real life. I am thoroughly impressed by the content which u put on and may be in future this knowledge will become my greatest strength...",True
@Ray_16383,2024-04-11T13:22:24Z,0,"Loves your video, sir.",True
@rohitborra2507,2024-04-11T13:21:46Z,32,from fresher to DS intern in Swiggy.,True
@saiprathyush9003,2024-04-11T13:20:29Z,3,Hey Krish sir yours and ineurons videos helped me get around 60% hike on my CTC thanks a lot for sharing your knowledge to all of us from all of us who follow you,True
@damodar3327,2024-04-11T13:16:45Z,5,"Yes ,, if they tell how transtition was done ,,, it will helpfull for all newcomers and motivation will be there,,, and it's Gurudakshina to Our Krish Sir that we have achieved some postion by seeing his vidieos means ,,Our Sir will be proud of Us,,and he always gives us good wishes to our future carrier also,,,,",True
@Glorytroly9092,2024-04-11T13:15:07Z,2,"Sir can u please guide. Took Bsc in Data Science from Osmania University. Regretting because it is a degree not Btech thought Bsc in DS is worth it ,  We didn't have 5% of lab work of Btech our lecturers themselves don't know subjects in DS and they admit  that they don't know I want to continue in DS tho. Got placed in Accenture only 3.4 LPA but not related to DS it normal IT role",True
@RaghavKamath-sf1zr,2024-04-11T13:14:32Z,0,Still a student sir. Helping the algorithm boost this video.,True
@aidataverse,2024-04-11T13:13:45Z,0,Definitely sir,True
@boru2297,2024-04-11T13:12:21Z,0,Create LLM video,True
@aidataverse,2024-04-11T13:11:44Z,0,Help,True
@anubhavv701,2024-04-11T13:11:35Z,5,"I am fresher, Right now I am following your end to end ML project, and honestly day to day I am getting more confident with concepts and process of any ML project. Probably by next week I am going to post on LinkedIn whatever I learned and I going to recommend that playlist, so that everyone learn and getting successful transition. Thank you Krish",True
@praveenpandey4804,2024-04-11T13:11:24Z,0,keep going sir,True
@CarlosGuerrero-jv8zv,2024-04-11T13:11:01Z,0,Data science is the best of the best.,True
@user-lk7bt1yz1t,2024-04-11T13:10:47Z,0,"Hi Krish, thank you for your effort. I am a full-stack data scientist with 3 years of experience. I learned from your videos and I'm still learning Langchain through your videos, although I haven't been able to focus on my studies as much due to time constraints. Could you please post some projects involving Azure Pipeline, MLOps with MLflow, and Langchain? It would be helpful for us. Additionally, could you include a project that utilizes image data? Thanks in advance",True
@GamesLab_369,2024-04-11T13:09:51Z,1,I'm still a student but your videos makes things easier to grasp. Thank you so much sir ❤,True
@goal8530,2024-04-11T13:09:37Z,0,Ok sir,True
@user-ro4hv6ex9t,2024-04-11T13:09:27Z,0,I m MBA+ bcom with 12yr insurance sales manager experience want to make transition,True
@panchananpadhy4053,2024-04-11T13:08:05Z,0,Trying to transition in data scientist,True
@AchieversGyan01,2024-04-11T13:07:31Z,1,Happy Eid Sir,True
@rajansharma5503,2024-04-11T13:06:00Z,1,I am from arts background and don't know weather i can do a transition or not,True
@cosmos1487,2024-04-11T13:05:31Z,3,Will help anyday.  I have not made transition as I am still learning as I am currently doing my Btech degree.,True
@pixelperfect1520,2024-04-11T13:04:42Z,1,Definitely we will help sir,True
@hamidraza1584,2024-04-11T13:04:24Z,14,Love from Lahore Pakistan,True
