author,updated_at,like_count,text,public
@Wowthatsfail,2017-12-16T02:59:13Z,105,The commenters on this video are all bots,True
@alesya4064,2024-02-15T00:17:43Z,0,Thank you very much for this tutorial!!! I also wanted to ask: will you make a tutorial on how to turn this chatbot into a telegram bot or to connect it to any other social networks? It would be very nice!,True
@thechoosen4240,2023-08-12T03:05:34Z,0,"Good job bro, JESUS IS COMING BACK VERY SOON; WATCH AND PREPARE",True
@amzker,2021-08-16T08:21:56Z,0,hey!,True
@asdf-ef8if,2021-07-09T19:00:04Z,1,"dude its so nostalgic... this was me in 8th grade, sentdex probably had 250k total subscribers back then and I used to watch his every tutorial getting mesmerized and so excited, Good old days :)",True
@GrandpasPlace,2021-02-26T16:23:15Z,4,This series was good up to part 7. I would have loved to see how you did the actual chat bot. How the user input is processed and fed to the NN and how the output is post processed. More so than pointing to a git repo of the stuff being done.  The previous bots I have done were AIML so trying to learn how I can get better results from NN and NLP,True
@zaneaussie,2020-12-31T07:42:35Z,1,"Love the videos man, watched them all! I know you did this one some time ago but do you think it's possible to just supply the AI with an English dictionary and let it learn the language on it's own?",True
@jayitsaha9508,2020-09-26T21:57:08Z,0,Amazin as always...a small request maybe...What about using react to implement a healthcare chatbot and backend served by django...using serializers... It would be a multi disciplinary project...🔥🐼...,True
@cellybot,2020-09-06T20:18:15Z,0,"If anyone has managed to deploy the model onto a website, can they please comment how? I’m trying to get it onto a discord bot",True
@basharabuein409,2020-08-19T10:01:51Z,0,"I am getting this error when I run the inference file: File ""inference.py"", line 185     def inference(questions, print = False):                                  ^ SyntaxError: invalid syntax",True
@superolo,2020-08-04T06:31:11Z,0,Can you give files to finished bot because i don't know how to do it. Please,True
@ylyasyylkybayev689,2020-07-13T18:05:37Z,0,Can i make it in pytorch,True
@jerrycrews3127,2020-07-10T22:58:46Z,3,"Great tutorial! Unfortunately, I don't feel like I learned how to build a chatbot.  most of the course was preparing the database and then it was running your code.  I love your tutorials and have watched a lot of them, but I think this one missed the mark.  Is there any way that you could make a video of creating and training the model with Keras?",True
@namantuli1357,2020-06-09T12:24:20Z,0,"If anyone is not keen enough to follow the steps or need the train files or checkpoints, I can help!",True
@aayushshandilya1617,2020-05-01T06:43:16Z,3,"it is replying with ""I'm not sure"" everytime. what to do ???",True
@crazyking4985,2020-04-19T06:51:20Z,1,when you asked the bot are you better then version2 on twitter what did you mean by that?????  i know that you won't see this but.......you never know,True
@altairsama9411,2020-03-21T17:25:13Z,0,"I have a sql database with typical int and string attributes , i have created a training file based on queries which could be asked from the values in database.....could I link that database and dataset with the chatbot explained in the series?",True
@Puppacha,2020-02-26T06:36:32Z,0,Tensorflow got rid of contrib.training.Hparams along with many other modules. The code isnt working now,True
@ritapravadutta7939,2020-01-14T14:19:28Z,0,module 'nmt.nmt' has no attribute 'add_arguments',True
@frog706,2019-11-15T19:23:34Z,3,Hey did you ever find that big query that you mentioned in part 2 I believe?,True
@marcielxd100,2019-10-30T05:01:16Z,0,"I'm trying to create a bot similar to simsimi, but my language is ptbr. I'm struggling so hard to find any dataset whatsoever. These reddit comments take forever to download, super slow speeds and I don't even know if I'm gonna find the portuguese comments in it and even if I do, not sure if it will be enough data. I downloaded twitch chats from my fav channels and got 150k pairs, but with that much data the bot just answers with short sentences like ""i know"", ""i dont know"", ""yes, ""no"", ""I'm good"", ""I don't""",True
@danieldossantos5868,2019-09-15T17:22:03Z,0,Is there a way for me to make the chatbot understand context?,True
@anilgaikwad3596,2019-09-14T15:33:44Z,0,on github in  daniel-kukiela/nmt-chatbot your doesn't exist please share ur code,True
@SGIMartin,2019-09-02T18:35:22Z,0,"Sitting with a bleu score of 0.82 after 6 hours on my 980ti - and currently the most retarded chatbot in existence, hopefully a nights work will give me better answers than [ deleted ], (unk), random numbers, and a single instance of heyheyhey.  Did probably fuck up somewhere, but hey - the learning process is about making dumb mistakes and fixing them!",True
@baruchshemesh3601,2019-08-13T13:36:10Z,0,does someone know how do i make the bot response qith 1 answer instead of 10?,True
@homoerektus3069,2019-07-26T18:11:10Z,0,Any idea on how sentdex got it to production on twitter? HTTPRequests?,True
@RandomUser-ls9ez,2019-07-04T16:03:57Z,8,"Hey @sentdex, I followed your entire series and successfully made an amazing chatbot. The only problem is that I feel like I am taking someone else's code when I use the nmt-chatbot chatbot model to display and interact with my chatbot. Is there some way to deploy the chatbot with some simpler code or teach us simplistically how to build the chatbot structure.",True
@eyeselhamo3113,2019-06-25T17:50:59Z,0,I just run inference.py but nothings happen ?!,True
@akibulhaque8621,2019-04-18T11:25:12Z,0,What's the cheapest GPU I can buy for deep learning chat bot?,True
@thamizh666,2019-04-11T11:49:05Z,0,Can anyone find the full working model other than the demo given in github?,True
@vnaveenkumar982,2019-04-07T20:01:41Z,1,how will it be like having the dataset which is extracted from a chat box conversation from people and aggregate all of them together and train it.. i think we can get the desired results ... in that way...,True
@gitc13,2019-03-27T20:41:41Z,0,"if the inference.py is to be used for interacting with the chatbot, then the easiest way is to use it as a module, e.g.   in the model folder   import preference    print(inference.process_questions('Are you drunk?')) INFO:tensorflow:Restoring parameters from model/translate.ckpt-2763 [{'answers': ['http://i.imgur.', 'http://imgur.com/', 'http://www.youtube.', 'http://www.reddit.', 'http://youtu.be/', 'http://en.wikipedia.', 'http://en.imgur.', ""I don't think it's"", 'http://www.amazon.', 'http://i.wikipedia.', ""I don't think I'm"", ""I don't think you're"", 'Yes.', 'http://www.google.', ""I don't know, I'"", ""I don't know why I'"", ""I don't think I'd"", ""I don't think I've"", ""I don't know what I'"", ""I don't think I'll""], 'scores': [-86.25, -186.45, -86.15, -86.8, -187.1, -86.5, -87.1, -87.3, -87.3, -87.15, -87.45, -87.0, 10.6, -87.3, -99.6, -99.15, -87.45, -87.3, -99.0, -87.3], 'best_index': 12, 'best_score': 10.6}]   If this is being used in a chatbot, some post processing has to be done, for which I'm guessing using modded-inference is the best, still this gets it going if you have to use the model.",True
@facitoo5682,2019-03-27T12:25:03Z,1,find the modded file here https://github.com/facitoo/Chatter,True
@arpitsaxena5962,2019-03-19T06:40:25Z,0,I trained the model without any error but not able to generate output.dev and checkpoint file,True
@anmolchaudhary3893,2019-02-13T13:34:25Z,0,I think you have underfitted the model by doing only one epoch. I'm thinking about running a few epochs on a certain size of data (say 5 million pairs) before moving on to new data. It won't result in underfitting and if it running too many epochs results in overfitting then throwing more data will bring the high variance down.,True
@superblaubeere27,2019-02-07T15:43:00Z,0,Can you please provide the link to your trained model?,True
@asrielmandrak7220,2019-02-05T04:24:33Z,0,This is beautiful,True
@revanthpeddi1580,2019-01-17T15:22:00Z,0,Can you please upload your train.from and train.to files?,True
@theinternet2116,2019-01-08T09:04:43Z,0,"Hey Harrison ,A little guess on how much time my model will take on Tesla k80  1.12M pairs one epoch???",True
@TuyoIsaza,2019-01-02T04:21:48Z,2,"Hi Sentdex! Wow, Just finished this. Did everypart. Learned a lot. So first of all THANKS. Now i am a Python programming .net fan! Thanks for that. Second... Is there info on HOW to get the model to production. Beyond preparing the model... Somthing like to deploy it to faceboo, whatsapp or twitter (like Charlee the AI) can you point me in the right direction? Thanks!!",True
@akshaychechare7791,2018-12-29T19:29:45Z,0,from where all these files came suddenly ...means untill video 5 it was just a single file and then from there was a boom like a hundred files ....didnt understand that?,True
@fahadkhan661,2018-12-21T03:10:34Z,0,It is so amazing thanks alot for giving us this series of knowledge,True
@fahadkhan661,2018-12-21T03:08:58Z,0,When will be the next video comming,True
@m.zubairislam3405,2018-11-12T08:44:38Z,0,Hello Respected sir! How can i made a chatbot which solve math problems please suggest any material,True
@elizabethduncan7345,2018-11-09T09:55:10Z,0,Create your chat tool with botchief http://whitehatbox.com/BBS/index?auid=16881  Trascina l'elemento html per creare il comando e personalizzare il tipo di comando creato,True
@manjunathhampole9399,2018-11-01T21:01:15Z,0,A very beautiful series... Thank you Sir !!,True
@peytonmac1131,2018-08-28T02:53:11Z,0,"Really neat. I built a simple c# chatbot years ago that used scripted questions and answers to talk. Considering what a neural net can do, would you think there is any point in the older style of chatbot where all of it's responses are scripted?",True
@IstiyakHossainPro,2018-08-25T20:34:36Z,0,i did not find modded inference.py file :(,True
@TheNightmazePlayz,2018-08-20T14:11:27Z,0,Guys the modified inference files were deleted - look here for the files you need to copy: https://github.com/daniel-kukiela/nmt-chatbot/commit/1fa2f51e95a9cb8eb3d6661f94f363578852420a,True
@Chralt98,2018-08-20T09:37:03Z,0,"@sentdex Could you please paste us the 4 files (checkpoint, translate.ckpt- files) of the first video in this playlist? This would be great! Or give us your best chatbot please!",True
@Chralt98,2018-08-14T19:39:30Z,0,When I go on this link https://github.com/daniel-kukiela/nmt-chatbot i can't find the sentdex_lab. i really want your modded-inference file. Where i can get the sentdex_lab shown in this video at the end?,True
@StefanReich,2018-08-02T23:22:51Z,0,"So your nonsense-producing bot is now ready. Congrats, I guess? I mean... I personally just prefer bots that actually understand things.",True
@mayankraj9864,2018-07-19T18:11:37Z,0,Sir can we add sound in chatting,True
@27shogun58,2018-07-09T13:49:01Z,1,Wow! 1000000000000000000000 %,True
@hakuma2527,2018-07-03T18:32:38Z,1,"Hi setdex, I want to create a TRPG witch the GM is a chatbot. I think that is an excellent idea because the bot could read a million books of stories and the  TRPG could be more dynamic. But I have a problem, how can I implement a context to a bot? and how can I start?",True
@yashraj9892,2018-07-02T10:53:53Z,0,My output in most of the cases are some random link which directs to YouTube. Anyone else getting these type of outputs?,True
@BilbooProductions,2018-06-27T15:03:38Z,17,"sentdex loves his first bot more than his second, typical",True
@MrAnujchopra,2018-06-19T06:30:52Z,0,I want to learn attention mechanism. Do you explain that in this series of tutorial?,True
@jrM5492,2018-06-18T00:55:21Z,0,"if run it on a local computer, how slow can it be?",True
@aarooshpandoh3660,2018-06-15T20:33:27Z,1,I tried this using the dataset in GitHub only but it gives reply as link or I don't know I don't know that's it...I don't know where the problem is coming,True
@pranaymarella2260,2018-05-30T20:30:08Z,0,Why is overtraining on a chatbot a bad thing?,True
@athuldevin,2018-05-27T11:37:28Z,1,"Thanks a lot for the series of tutorial, It really helped me",True
@mokogwuchiedu1068,2018-05-18T04:11:15Z,3,"Hi Harrison, great series! I really enjoyed it.  I noticed the sendtex_lab folder has removed from the repo. Where is scoring now implemented?",True
@CodeBroRob,2018-04-29T13:42:27Z,0,so how would you integrate this into a discord bot? seems like a fun bot to make andit would keep channels quite active,True
@LinhPham-ky5rg,2018-04-18T07:36:03Z,1,Thanks for the tutorial. Very clear.,True
@randriakotonjanaharytolotr6249,2018-04-09T09:28:13Z,0,"It's been 4 hours and I get this : C:\tf_jenkins\home\workspace\rel-win\M\windows-gpu\PY\36\tensorflow\core\kernels\lookup_util.cc:362] Table trying to initialize from file data/vocab.bpe.from is already initialized.   created infer model with fresh parameters, time 1.65s # Finished an epoch, step 0. Perform external evaluation",True
@randriakotonjanaharytolotr6249,2018-04-09T09:20:54Z,0,"Why am I stuck on step 0 , it's been 4 hours? I use tensorflow-gpu 1.4 with 3 GeForce GTX 1060 6G . Please help",True
@stephenwalker700,2018-03-26T12:52:33Z,0,"Last video Noooo! Awesome channel dude, thanks a tonne!",True
@EMa-sf5gf,2018-03-25T20:42:17Z,0,Any tutorial about Pytorch?,True
@Red_Devil_-es1rt,2018-03-20T11:23:32Z,0,can I ask how many steps it took to get to this point? and if my bleu not changing after 77000 steps is bad?,True
@TheTrueSmitch,2018-03-19T04:46:41Z,6,> OOOOO GET BURNED!  Response from Charles: Get that checked out! <Wiki to Burns>,True
@nancyahmed7538,2018-03-16T12:53:15Z,0,@sentdex How can i make it talk,True
@russianfederations3881,2018-03-11T05:17:19Z,3,Please do let me know where can I get the modded inference.py file. Thank you so much.,True
@russianfederations3881,2018-03-11T05:15:54Z,2,Where can I locate the modded inference.py file?,True
@Prometheus_Storm,2018-03-10T18:16:12Z,0,How can I make it speak?,True
@wilhallman2890,2018-03-10T00:24:36Z,1,So how would one go about training additional data to a model?,True
@aarooshpandoh3660,2018-03-08T10:13:11Z,0,which data gets trained train.from or tst2013.from,True
@russianfederations3881,2018-03-07T13:29:43Z,1,I did not get any folder called as model under nmt-chatbot folder. Did I miss something?,True
@russianfederations3881,2018-03-07T13:27:23Z,2,How can I download these files? I do not see inference.py.,True
@ehawkins730,2018-03-05T21:41:16Z,1,"Question...How long did it take for each ""step"" to process? Right now, each ""step"" is taking almost an hour.  Is there a  way to make this faster?",True
@aabhaskarmacharya4104,2018-03-05T04:23:45Z,4,How to interact with that chatbot with web-based GUI??? #HELP,True
@tejapolisetty3806,2018-02-28T17:57:26Z,1,"sentdex_lab folder is missing , can you please mail it to tejapolisetty143@gmail.com thank you",True
@AnimeshBasak,2018-02-24T07:44:38Z,3,@sentdex i can't find the sentdex_lab and the modded inference file is it still available?,True
@harendrapratapsingh9281,2018-02-10T13:18:44Z,0,Can anyone tell me where to download modded_inference.py there is no such file on github,True
@felixboons,2018-02-06T20:42:13Z,1,I loved this series. I couldn't resist the subscribe button ;o,True
@laurentiumihai4214,2018-01-30T07:07:57Z,0,if you want your smart chatbot with ai download Merlin :    http://artificial.duckdns.org/download/merlin.rar,True
@MalSatori,2018-01-30T00:54:54Z,0,How do you get the answers from inference.py to Twitch or Twitter?,True
@shankerprem28,2018-01-26T05:19:48Z,0,"WARNING:tensorflow:ParseError: 1:24 : Expected string but found: 'C' WARNING:tensorflow:C:\Users\admin\Desktop\project\nmt-chatbot\model\checkpoint: Checkpoint ignored Traceback (most recent call last):   File ""inference.py"", line 277, in <module>     answers = process_questions(question)[0]   File ""inference.py"", line 238, in process_questions     answers_list = inference_helper(prepared_questions)   File ""inference.py"", line 174, in start_inference     return inference_helper(question)   File ""inference.py"", line 167, in <lambda>     inference_helper = lambda question: do_inference(question, *inference_object)   File ""inference.py"", line 91, in do_inference     loaded_infer_model = nmt.inference.model_helper.load_model(infer_model.model, flags.ckpt, sess, ""infer"")   File ""C:\Users\admin\Desktop\project\nmt-chatbot/nmt\nmt\model_helper.py"", line 483, in load_model     model.saver.restore(session, ckpt)   File ""C:\Python36\lib\site-packages\tensorflow\python\training\saver.py"", line 1662, in restore     raise ValueError(""Can't load save_path when it is None."") ValueError: Can't load save_path when it is None.  I get this error after typing the question in inference :(",True
@Badrlens,2018-01-13T13:19:26Z,0,"You are awesome, love from Egypt! ❤",True
@gauthamarunachalam,2018-01-11T10:41:03Z,0,hello harrison training the data set takes more time can you send the ckeckpoint file to me?? thanks in advance,True
@simonhanrath5180,2018-01-10T17:04:34Z,4,Great video!  Sadly training the bot on my pc takes some time. Does anyone know about a way to download a pre_trained model? I mean could not I just replace the translate.ckpt files with files that are from a trained bot?,True
@sura1990ify,2018-01-08T12:06:52Z,0,"You are one of the best tutors!!! I would like to ask if you can do a short series on ""Attention Model in Deep Learning"" to get an idea of what it is and how it works. It would be amazing :D :D",True
@don2311,2018-01-05T10:17:23Z,1,Is it possible to share your model?,True
@desalefentaw8658,2018-01-03T23:52:47Z,0,"it is awesome tutorial series. thanks, can I use your code for my bsc project?",True
@iam_Batman,2017-12-25T09:54:50Z,0,"Hey harrison, how are you? i am having a lil bit of trouble working with tensorflow and cuda because of some version compatibility. Can you provide me the final working chatbot that you created . I'll be using my own data that i have created from twitter,reddit and stackoverflow. I have a very slow internet and i can't help it downloading different versions of cuda. it takes a lot of time.",True
@ahmedjumaah9727,2017-12-23T13:12:23Z,1,"Hi Harrison, thanks for the great vids. I would like to know how to adapt the bot to make it communicate about domain specific dialogues (e.g., health, education, diet ... etc). The other inquiry is about training the mode, can I train it just with the CPU or I need to have a GPU ? Thanks",True
@seeisme1,2017-12-21T18:23:10Z,0,"I've loved the tutorials so far. Do you think that the original model could be retrained using an actor-critic algorithm, perhaps using one of your sentiment analyzers from previous tutorials as the critic? It should just mean redefining the loss function inside the model, right?",True
@Ziennde,2017-12-21T11:29:23Z,1,"Thanks for the serie of videos, found them to be really instructing ! You are mentionning several time the ""version 2 twitter"" chatbot but I looked for information about it on your YT channel and pythonprogramming.net and didn't find anything. Is it possible to take a look to its code ? Will you make a video around it ?  Also, will you (or did you, I ain't watch all of your video yet aha) make a video on neural networks, especially about the feeling of the layers (number of layers, length,..) in a neural network ? I would enjoy that, because I barely programmed a SLP (single layer perceptron) but I can't figure out the math behind MLP..  Finally, what do you think of code wrapper or integration or other language in python code ? I recently tried Fortran to compare speed but it didn't satisfy me..  Thanks for your answer, and bravo for the quality of your videos :)",True
@cominup85,2017-12-18T00:31:43Z,0,Great to follow this and see how you get to this point.,True
@maximkhanov4788,2017-12-18T00:17:12Z,0,you should use a neural network to select a response from the list,True
@kbinkows,2017-12-17T00:52:11Z,0,"I have a question :) I did run training on paperspace and then copied those files into a model folder inside my cloned nmt on my windows computer with cpu-tf installed, just to run the inference. I'm getting the following error message:  "" Traceback (most recent call last):   File ""inference.py"", line 273, in <module>     answers = process_questions(question)[0]   File ""inference.py"", line 234, in process_questions     answers_list = inference_helper(prepared_questions)   File ""inference.py"", line 163, in start_inference     inference_object = do_start_inference(out_dir, hparams)   File ""inference.py"", line 59, in do_start_inference     flags.ckpt = tf.train.latest_checkpoint(flags.out_dir)   File ""c:\anaconda3\lib\site-packages\tensorflow\python\training\saver.py"", line 1722, in latest_checkpoint     if file_io.get_matching_files(v2_path) or file_io.get_matching_files(   File ""c:\anaconda3\lib\site-packages\tensorflow\python\lib\io\file_io.py"", line 333, in get_matching_files     for single_filename in filename   File ""c:\anaconda3\lib\site-packages\tensorflow\python\framework\errors_impl.py"", line 473, in __exit__     c_api.TF_GetCode(self.status.status)) tensorflow.python.framework.errors_impl.NotFoundError: FindFirstFile failed for: /home/paperspace/Desktop/nmt-chatbot/model : The system cannot find the path specified. ; No such process""  Why ""/home/paperspace/Desktop/nmt-chatbot/model"" path is coming up here?",True
@chinmoyjyotikathar8793,2017-12-16T12:27:41Z,0,Is there any reason you stand and code? Just curious :-) xoxo,True
@IsalaPiyarisi,2017-12-16T11:17:09Z,0,Hey Sendex will I be able to train a model with Standard GPU Air VPS from paperspace ? and if so how much time will it take ? (can't afford dedicated GPU's). My Local Machine also have only nvidia geforce 920m and what will be faster my local gpu or paperspace gpu ?,True
@nicapotato7745,2017-12-16T09:33:29Z,9,Dad joke bot please,True
@vitorgohsev4938,2017-12-16T07:58:03Z,0,"Enjoy your channel , soon my chat bots will rule coffee shops. Love the channel .",True
@Tibetan-experience,2017-12-16T06:07:10Z,0,how I may use the trained ML in android ? I really do not want to use Transerflow.,True
@Wowthatsfail,2017-12-16T02:59:13Z,105,The commenters on this video are all bots,True
@kimokimo3507,2017-12-15T22:10:25Z,0,Awesome,True
@PhotoSlash,2017-12-15T19:28:48Z,16,"What if you start the conversation with ""do you like ice cream?"" and then after the bot answers you keep asking something about the ice cream but without mentioning again the subject of the question? (like ""what flavor do you prefer?"") will it be able to understand that you are referring to the last subject the bot read on the previous question? i think this is one of the things that MUST be accomplished with deep learning..",True
@nicapotato7745,2017-12-15T18:51:44Z,0,Thanks !,True
@revanttiwari4669,2017-12-15T17:55:11Z,1,If I ever achiever anything in this field it will all be because of you sir!! Much respect,True
@av088r,2017-12-15T17:35:05Z,0,any idea why i get   AttributeError: module 'nmt.inference' has no attribute 'attention_model'  when running inference.py after i ask a question,True
@funkupgamer5364,2017-12-15T16:43:09Z,0,Just one question why tensorFlow and why not keras??,True
@harrislastname4887,2017-12-15T16:14:46Z,0,Thankkk you,True
@SuperMellowFilms,2017-12-15T15:51:02Z,1,"Love watching a smarter person play with deep learning! Just got my PC up and running a month ago, trying to play with little self learning stuff. If only I had a GUI for the self learning.",True
@ishantpundir9747,2017-12-15T15:42:07Z,2,hey what if instead of scoring them manually  ... you can use a text classifier but as data will be a problem so instead of using DNN use SVM they works relatively better with small data as compare to DNN ...........  good part of classifier is that they will also output the score in the form of confidence level so  you can add any manual parameters on top of that score to get a nice and meaningfull output.   I can help you with that I am working on relatively bigger project(right now personal but it is going to be commercial within a year) but it is also completely  based on AI so I have been through all of this there are also many other ways in my mind to make it better then twitters version ......   I can help you if you want peace,True
@xarifsowad849,2017-12-15T14:57:25Z,0,Harrison...will u please do some video on python and android....Android is the hot topic right now and python is too.So if we can combine them them that will be great.I am dying for it.Java is a complete tear down to me.,True
@beckettman42,2017-12-15T14:55:41Z,21,Great video as always.  Currently in college again to specialize in industrial automation.  I'm taking the robot uprising seriously.  I've been trying to get my profs interested in machine learning and Tensorflow.,True
@xarifsowad849,2017-12-15T14:48:42Z,7,Oh...Harrison...you are my captain...oh captain oh captain...my captain,True
@sak8485,2017-12-15T14:43:15Z,2,Hey dude your volume is quite a bit low,True
@punithmailme,2017-12-15T14:39:22Z,2,Finally.... the wait is over !!!!,True
@chrischappell7643,2017-12-15T14:39:09Z,3,i've waited it so long...  :)) thk for next part of great series sentdex !,True
