author,updated_at,like_count,text,public
@igorsmet1123,2020-06-09T09:15:22Z,1,Thank you very comprehensive!,True
@ranfuchs3592,2020-03-20T03:39:36Z,0,"Excellent tutorial thank you. I have been using Mathematica for long time, but as there are so few Mathematica programmers around, the code can be mostly maintained by me, and I am looking for an alternative where I can prototype and pass it to others",True
@bjarke7886,2018-08-11T12:01:16Z,0,amazing tutorial,True
@BrendanBeckett,2018-01-29T00:48:21Z,1,"It seems to skip something at 11:12, suddenly the rows were removed but it never showed that step",True
@opetundeadepoju,2017-09-30T14:43:28Z,1,"This is an amazing tutorial that gets one's attention effortlessly from beginning to the end.  To answer your question, I use azure machine learning to learn ML without much coding because I'm a beginner. I have one question: why did we clean just the ArrDel15 column and leave the DepDel and DepDel15 columns uncleaned?",True
