author,updated_at,like_count,text,public
@FrankLi92,2018-09-20T06:06:05Z,0,"What other topics are in the works?! Sneak peek perhaps? I personally am interested in learning what coding in the real work world looks like. Most tutorials seem to handhold you and do something along the lines of ""hello world."" While not inherently bad, I think it makes me, a student, nervous because I'm not sure what to expect at my first job or internship.   Since you've worked as a programmer before, it would be cool to see you point out things in tutorials that we need to focus on or how something you do in the tutorial might not always be the same as what you see on the job. Maybe you can do a ""replica"" project of something similar to what you've actually shipped before in your career. I believe that knowing someone who got paid to make something similar would give me a tremendous amount of confidence if I could understand the material. It'll give me a good gauge of where I should be and where I currently am.  For future topics if you haven't already planned them, it'd be awesome to learn data science/ML topics. You're one of the few people who can condense difficult concepts into digestible and sensible bites, so if I'm going to learn it, I really hope it would be you!  Cheers!",True
@nekusakuraba4000,2018-09-19T04:38:25Z,1,"Thank you so much for all you do. I do plan on helping you out one day once I find myself economically stable and with a job, even if it's something like a temporary career at McD's. Hearing you say you'd keep courses accessible and free is honestly something that I really do appreciate, from the bottom of my heart, and I will support you through your teaching endeavor once I can support myself.",True
@The2468101214161,2018-09-18T03:15:06Z,1,You are awesome!,True
@BabaykaMoscow,2018-09-16T18:44:25Z,1,"Thank you for your efforts and such a great tutorials, Corey! Greetings from Russia!",True
@bernatvicens8026,2018-09-15T08:24:49Z,1,you are the man,True
@PentaC0re,2018-09-11T03:52:04Z,1,"When I get a job, first pay check needs to be forwarded to you! Such great content, and extremely helpful. Thank you.",True
@raphaelpz,2018-09-09T17:26:40Z,2,Corey you are the best coding teacher on the internet... I am so glad you made this choice for yourself of course (the dream!) but also for aspiring devs like me :) You should write a book ... you're a legend.,True
@alexpechauer476,2018-09-05T14:41:52Z,1,Keep up the great work! Your videos have really helped me develop this side project I'm hoping will advance my career.,True
@JR-yi5wb,2018-09-01T13:14:29Z,1,congrats man! Your python vids were always there when work was kicking my ass and I needed a shoulder to cry on!,True
@RahulDubey121,2018-08-31T12:03:12Z,0,i am unable to see the sponsor button.. would like to contribute.. don't have paypal account either.. please advice..,True
@RahulDubey121,2018-08-31T11:58:21Z,1,You are one true gentleman.. may god bless you with so much that you don't have to worry about the fund at all.. and you can concentrate on what you do best.. i.e. educate :) cheers!!!,True
@RahulDubey121,2018-08-31T11:55:20Z,1,Congrats CS .. :),True
@FrankLi92,2018-08-31T05:33:58Z,1,"You're a good person, Corey!",True
@ramstein74,2018-08-30T21:08:31Z,1,great instructor. Python expert!,True
@ciberciv,2018-08-30T00:21:45Z,1,"You're helping me to change my career path, from pure mathematics to software development. I can't afford funding you right now, but I'll make sure to do it as soon as I get a chance. Thank you, your channel and courses are awesome (and so are you)!",True
@Shahidma58,2018-08-29T18:54:48Z,0,"Hi Corey, First of all congrats on achieving this goal. Please let;s know why you are going for Django videos. Is this better than flask or just an alternative? Regards,",True
@sameerchoubey9724,2018-08-27T03:52:51Z,0,When are you going to release the Django course? I'm waiting. I suggest you to releasvideos as they're created. Flask was amazing.,True
@PACKERSFANSheshank,2018-08-25T14:39:10Z,0,"Just wondering, how did people start watching your videos?",True
@lukaszszmyd8767,2018-08-21T01:50:07Z,1,Always appreciate professional content. Thanks,True
@alkhashtee,2018-08-19T06:53:04Z,1,I love your way of explaining and examples,True
@reach_perumal,2018-08-19T03:34:26Z,1,Kudos!!  Great thoughts. Thank you so much.,True
@fxs2008,2018-08-17T23:20:08Z,0,Hi! What about tensorflow and keras tutorials?,True
@DrArleth,2018-08-14T19:55:41Z,1,This is such good news - I am a huge fan! just enrolled on Patreon <3,True
@styxnexus,2018-08-14T08:34:56Z,1,Thank you so much Corey. You are really awesome man. I learnt the Python completely from you. I always recommend people to  learn Python from your videos.,True
@theASHnetwork1,2018-08-12T23:03:30Z,1,"New subscriber here. I am a self taught programmer with main background in Python. I consider myself to be in between the newb to the intermediate python programmer. I watched a few of the OOP videos and enjoyed them very much. You are easy to understand and you don't put information in your videos that you are not going to discuss and apply in that same video. One of my main issues in finding good tutor using tutorials is that a lot of instructors will talk about something you can do and only give tidbits and then say 'don't worry about that now it will be discussed in a future video', then you have to wait 10 different tutorials later just to get back to that information. It becomes frustrating to get small pieces of information and have no clue what they are talking about only to be told don't worry about it now. I'm hoping to be a patron soon and hoping your content can put me in the path of getting my first programming job. Thank you for all your hard work in putting good content out that is definitely helping.",True
@mugalasirogers4066,2018-08-10T14:32:17Z,1,"am new in programming but have found what have  I was looking for through those videos ,Congrats Bro.",True
@nishantugale5926,2018-08-09T13:47:11Z,0,Hey please have a tutorial on Node.js . Becoz u r  really Good Teacher,True
@pardhabandaru1105,2018-08-08T19:40:35Z,1,"Congrats! and thank you Corey for all the effort you are keeping, can you do a video python3.5+  new *typing* module for your weekly videos eagerly waiting for  the django tutorial :-)",True
@imninja4220,2018-08-05T20:46:44Z,1,"Awesome, you deserve millions. Thanks for your great contents",True
@abhishekchoudhury3158,2018-08-04T13:11:27Z,1,Congratulations Corey! Your videos are very helpful. Best!,True
@JanSchultink,2018-08-04T05:43:13Z,0,"Thank you! I would put the camera on yourself for part of your videos, it creates a bigger connection with your viewers and helps build you brand / will convince more people to donate/support after they got to ""know"" you. Keep up the good work.",True
@ashishratnawat2711,2018-08-01T00:42:14Z,1,you are a Hero!,True
@paulmacgiollacaoine8619,2018-08-01T00:19:29Z,1,"Good news, well done and good luck 😉",True
@irfan4701,2018-07-31T19:16:31Z,1,Feel fortunate to have you found on youtube. Perhaps you could have been my faculty in college. appreciate from the bottom of the heart.,True
@MM-qn3go,2018-07-29T10:10:36Z,2,"Well done, your content is great!",True
@AngieCannons,2018-07-29T08:12:54Z,0,you're hot,True
@soldiergaming2722,2018-07-28T16:00:02Z,1,Really proud of you Corey I've always found your videos to be helpful and I'm glad that we all will be able to get to look forward to more of them coming out soon... Now if you can excuse me I have some more of your older content to re-watch and understand some more. lol,True
@ashutosh567,2018-07-26T20:19:20Z,1,"Huge respect for you for following your dream, Corey! Congratulations!",True
@736939,2018-07-26T15:20:14Z,0,Django and TensorFlow - - PLEAAAASSEEEEEE,True
@tkannab1,2018-07-25T18:55:02Z,1,Congrats! well deserved!,True
@selazfadli5850,2018-07-24T09:14:56Z,1,congrats Corey.. you are my best online teacher.. 🤗,True
@johnp7158,2018-07-23T20:48:55Z,1,"Corey is the first person i have ever subscribed to and even registered on patreon! If you ever buy any shitty udemy course, Corey deserves more than the udemy, don't cheap out!",True
@chokumba,2018-07-23T18:54:26Z,1,This is great!,True
@11oct12,2018-07-22T23:32:28Z,1,"Hey man, good for you! You truly deserve the praise. Your tutorials are the most useful videos I have ever seen. Thank you",True
@FranVarVar,2018-07-22T11:12:16Z,1,Congratulations Corey! You absolutely deserve every cent you are making. Sorry for your former employer though! ;),True
@N0AGI,2018-07-21T18:46:08Z,1,"Corey - you're a great, passionate and to-the-point teacher.  I learned a lot from your material and truly enjoy going back to your material almost to the point of reference material.  I just want to say, 'thank you' and also wishing you the very best in growing your passion, channel and cause.  God Bless - have a good one. - nagi - https://N0AGI.com/",True
@prashantyadav2197,2018-07-21T06:46:41Z,2,"You are great Corey, thanks a lot for these great tutorials. Could you please guide crating a simple python project, I have tweeted you regarding this. Once again thanks a lot for all the great work you are doing. God bless you!!",True
@shashankshekhar7052,2018-07-20T17:59:14Z,0,https://www.youtube.com/playlist?list=PL2_aWCzGMAwI3W_JlcBbtYTwiQSsOTa6P&feature=view_all     Hey corey can we get the python version of this? Please once open the link and reply!!!!,True
@billgreatness845,2018-07-20T13:15:29Z,1,I've followed most youtube videos but trust me yours is the best I've ever followed. Gracias Corey.,True
@narasimhanmb4703,2018-07-20T08:10:26Z,0,"Hey Corey, can't wait to get started on Django tutorials. I, will, surely be  helping the ad-less tutorial once I get a job. Starting Django tutorials anytime soon? Any schedules?",True
@kelvinpage4647,2018-07-20T07:37:40Z,1,Your videos are really great! I give thumb up to each of you tutorial,True
@justincrasi4638,2018-07-20T01:26:16Z,1,He'll yeah man your videos were boss when I was trying to build my own script!,True
@saikiranreddyskr2743,2018-07-19T15:21:51Z,0,"Sir,waiting for your Django cource Thank you so much and your idea for free cources is awsome We people from india are soo poor can not pay in doollars. Thank you sir ..",True
@saikiranreddyskr2743,2018-07-19T15:17:24Z,1,"Thank you sir,",True
@user-gh9sk1oe4m,2018-07-19T13:54:29Z,0,终于见到真人了！,True
@FlashStarGaming,2018-07-18T18:32:00Z,1,you sir are a legend.,True
@bialcus69,2018-07-17T19:59:44Z,1,I've just finished listening to your interview at TalkPython podcast. Great episode! You've got amazing flask course which I'm currently learning. It's a solid addition to flask mega tutorial :) Thanks!,True
@Hyp3rSp8c3,2018-07-17T02:41:54Z,1,Congrats and thank you for making these videos.  I also listened to your interview @ talk Python podcast!  Great episode! I must say and definitely enjoyed this episode.  Michael's podcast has been integral part of understanding more of Python.  And now your videos are the building blocks of learning Python for me.  Thanks again and keep up the great work!,True
@sentdex,2018-07-16T19:44:10Z,628,Congrats Corey on living the dream and improving lives at the same time!,True
@vukspasojevic2396,2018-07-15T10:03:06Z,1,Things went from perfect to super perfect. Best python tuts on the web.,True
@wenchen9476,2018-07-14T19:52:06Z,0,"Corey, thanks a lot for your quality videos, which offer me an easy start to the magical Python world. Before that, I never thought I'm able to program. I was wondering if you have a future plan to do some python GIS contents? Thanks and all the best.",True
@ravitejak3118,2018-07-14T18:33:01Z,1,Corey.. You are awesome person. I switched my job easily only with help of your videos. My first thing when i reach office  is to see any videos added from you. You are a good mentor i got.. Thanks and keep going.. All the best...,True
@sudheerkumar-gu1bb,2018-07-14T18:07:22Z,1,"Great Corey, Thanks a lot for educating us with quality content.",True
@cap.blue-97sama99,2018-07-14T13:14:18Z,0,Kill that 1 dislike,True
@byomkesh99,2018-07-14T07:36:02Z,0,"It's simply awesome Corey. Its a BIG social service as well, and we are getting knowledge & help from you. Thank you so much. I pray to Supreme to give you courage & strength in future too.  Namaskar!!!",True
@OliverGomes,2018-07-14T00:17:11Z,0,I hope you do some Machine Learning with Python,True
@dp2006a,2018-07-13T16:46:21Z,1,Congrats! Your videos are great and very easily to watch! Keep doing good job! Thanks again for your work here.,True
@bratpeki,2018-07-13T14:59:22Z,1,"""Best of luck in your future endeavors...""",True
@harvb5939,2018-07-13T11:31:40Z,1,"A completely deserved award, congratulations.  Your videos are extremely well prepared and brilliantly delivered.  Good luck for the future.",True
@akshaykathpal,2018-07-13T06:47:39Z,0,"I have watched your Python and Flask tutorials which have given me a lots of confidence to choose Python as my carrier language. It's simplicity makes it beautiful. I would like to suggest you to make some tutorials on  1). Design patterns which are I think 26-27 using Python 2). Although it is very hard for us but I think as you have worked in the industry so it will be easier for you to do and it will make a significant impact as It is not done by anybody. Breaking up a GitHub opensource project based on Python, (small) frameworks like Bottle and Flask based on the commits history and tell us how to construct it from scratch.  3). Multithreading , Socket Programming in Python , A simple web server and multi-threaded web server. With the basics of working of web which can help us why we need sockets and server and if the load increase how we can use Mulithreading to improve it. I think these resources are very rare on the web, If you can also include these in the separate topic then it will be very helpful.",True
@akilansubramanian3339,2018-07-13T03:23:36Z,1,Congrats Corey Schafer :) . Expecting more from you !!!,True
@Bhaskarchandraul,2018-07-12T18:32:20Z,1,great that you will be making more videos. I love learning form your videos. Please do make some videos on API's.,True
@sherrishah,2018-07-12T18:13:31Z,1,Congrats Corey! I have learned a lot from you.,True
@yeeteshpulstya9890,2018-07-12T04:30:54Z,0,Thank goodness. I thought you were gone after the full stack Vue course.,True
@DeepakP8910,2018-07-11T18:57:45Z,3,"Hi Corey, thanks for all your videos you posted so far, and congratulations. Your python videos helped me a lot to switch my job. Earlier I used to do manual testing, and now I'm doing automation in python, so the credit goes to your videos. Thank you very much. Glad to see you on screen :-)",True
@balajimarkante621,2018-07-11T04:59:09Z,1,Congratulations. Big thank you to being there and educate us. :-) Great tutorials,True
@dishanmadhuranga8032,2018-07-11T03:24:48Z,1,"love your teaching method.. now u r full time with this. I would like to suggest u can start python work shops and sessions for IT companies  , classes in your living area...  one of best teacher I have ever seen.. keep going... !!!",True
@snippets90,2018-07-11T01:43:51Z,0,"it's The Best thing i heard today because i'm new to back end specially that i'm Arabian and studying by my self and you were the best tutor that explained Python to me and it was awesome your explanation for OOP (Class methods / Static methods / Setters and Getters / Class Variables) trust me when i say it was very exhausting to me to understand it from any other tutor OMG You Explained CSV / JSON / OS module Like Master Piece , RE Module Was Awesome ... now i can read and understand it before you explain what Raw inputs are it was understood for me . maybe some of developers who will read my Comment will drop laughing but all these stuff are new for me and my language isn't English and i'm not perfect with :)  anyway i just wanted to say thank you very much for what you presented and thank you very much for what you present inshallah  <b>Suggestion</b>: Make Full PostgreSQL Course and how to Work with Python  <b>Give me Advise</b>: i just finished OOP + pgSQL ,, should i start flask ?",True
@vivekteega,2018-07-11T00:33:51Z,1,Congrats man! You tutorials are the best :D,True
@arshadyusuf4803,2018-07-10T19:13:35Z,1,Corey! You are my hero!! Congrats on going full time! Your videos are some of the best ones out here!,True
@wobsoriano,2018-07-10T13:51:13Z,1,Congratulations!,True
@chekuri,2018-07-10T10:25:30Z,0,"Hi Corey, Can you add a video on Python Arrays",True
@lilprotakeit,2018-07-10T07:37:44Z,1,"First of all, thanks for showing up. By God, you look so handsome for hiding yourself so long. I guess all videos which are based on counselling like best books, career advice etc should have your presence as it will bring impact like anything. BTW, i am definitely going to do some fund redirection to you as my career is largely driven by your videos. Keep releasing videos each week. Best of Luck and a good decision taken.",True
@omarkabada2923,2018-07-09T21:03:30Z,0,"Im sharing the channel with my coworkers, I just found your channel and I love how you explain things.   Do you have a a video explaining Page Object Model for testing in python and unittest??   (still looking around).",True
@SilvioFYT,2018-07-09T15:18:39Z,1,Thank YOU Corey!,True
@folorunso,2018-07-08T20:03:36Z,0,"flask ? yes; django ? yes; pyramid ? No !! please don't waste your time on that. Instead i will suggest you explore other great topics around web(APIs development course with flask, working with queues with celery/rabbitMQ, SQLAlchemy deep dive etc) or courses around data science(Pandas, Zipline api on trading etc) or AI. Congrats going full time !! You are awesome!",True
@dheerajtripathi9788,2018-07-08T14:08:17Z,1,you along with Bucky Roberts and a few others are GOD!,True
@hsumerfarooq5474,2018-07-08T13:47:53Z,0,"Corey schafer Congrats and Great to see you are making course on django, best of luck and make as much videos as you can its a great framework definitely! I would like to advise you please include some courses on web scrapping with scrapy & scrapy-splash which is special framework for web scrapping built on Django concept, OpenCV for image recognition and Blockchain web apps Dapps. finally Thank you so much for your great videos to all computer science students! (Y) :)",True
@Kabelman,2018-07-08T01:16:11Z,1,"Awesome, glad you can make more vids now.",True
@MistaT44,2018-07-07T17:44:20Z,1,Corey is a saint! I wish you all the best,True
@jytjfgjfgj,2018-07-07T16:34:02Z,0,You look like a decent man. I hope you achieve what you want in life and don't forget the people who supported you from the beginning.,True
@user-di4bt7qu2i,2018-07-07T13:17:37Z,1,Good on ya Corey!  Thanks for all of the great vids!,True
@howardzhu2298,2018-07-06T16:05:27Z,3,"Thanks a lot. Your tutorial is very easy to understand，and I learned a lot from your videos. It's the most friendly python tutorial that I've ever seen. And I'm from China, but people in China do not have the access to Google and I don't have a US credit card.  Hope that we can sponsor you by China's payment methods, such as Alipay(Alibaba by Jack Ma) or WeChat.  Keep going，U R THE BEST!",True
@pbdivyesh,2018-07-06T15:15:15Z,1,"I have been out of college after so much hassle with Administration in July '17 and I was depressed at that time but I wanted to move to software development anyway. And your videos is where my journey began. These are so helpful and I still refer some of the OOPs concept from your videos or where I wanted to check the run time, your videos are the rendezvous to Python.   I love your efforts man, please keep creating such content. I'm sorry I'm already 10 days late to this video, but I'm looking for a job and as soon as I land at some place I am definitely going to signup on Patreon, because if it wasn't you I would have never started my career.  I am gonna support you, Net Ninja, SentDex and Academind because you guys really shaped my learning.   I love your ideology about not doing paid courses though it would help you learn more, but the logic of not letting others missing out just because it is paid is awesome. Keep up with your efforts, and please do some Machine Learning stuff as well  if you like it.   Also I would love to see you code, please let us know if you build some project or do open source live on services like Twitch that would be awesome. Love you always and much Love from India. Even if you won't be able to see this you're always at a respected position in my mind sir, Thank you so much.   PS.: you look really Handsome and you must definitely do more videos like this and you can show your face on a corner just like ACADEMIND and Coding Train.",True
@rajalur1,2018-07-05T22:48:27Z,1,Congrats man and many thanks!,True
@Egregore1169,2018-07-05T16:03:42Z,1,You should do a video on how to transition from a crap job to a life passion. haha.......,True
@ikramshariff,2018-07-05T13:30:46Z,1,"We will support you for sure, In your upcoming array of contents, can you also include python design patterns. Which will help more advance developers too!!!",True
@yanggao4878,2018-07-05T12:14:37Z,1,Congrats Corey! Your Python videos really have been helping me through my learning process of machine learning. Thanks again!,True
@suneeldalavaie797,2018-07-05T06:45:35Z,0,sir pls make a in-depth video about recursion functions  with different and difficult examples,True
@shreyasamrutkar5181,2018-07-04T15:39:44Z,3,"You are a great and awesome person. Here are my reasons for saying that - 1. Excellent Content. From basic to advanced, you have got it all. All the videos of yours that I have seen are tuned perfectly to the industry standards. People watching them won't go wrong anywhere. Videos have correct pace; Neither slow nor fast. I myself have seen many websites and answers on Quora that include your videos as material for many topics. (I found your videos exactly like this)  2. Your statement - ""People should have free access to knowledge and education"". This won me over. Not many people can pay for courses when they themselves are starting on path of learning and earning. No one knows whether they will find any particular course helpful and satisfying until they themselves take it. You have taken a very bold but brilliant step which I feel will earn you great rewards later on.  Lastly best luck for all of your endeavors.   P.S - I liked this conversation format for a video. It is helpful when discussing topics that don't require writing codes and seeing output or explaining some concepts.",True
@vinaygaonkar,2018-07-04T09:53:34Z,1,Congrats and Good Luck Corey. I wish you a great success.,True
@satyasashi5859,2018-07-04T07:20:54Z,1,"Corey You Are Awesome! No words for you. I love your tutorials and you are really a great teacher. They helped me a lot & I share videos with my friends. And I really appreciate for the thought ""Every student should have access to Educational videos who might not afford them"" Lots of respect Corey! And the notes you wrote down for videos like these? I really like to support them and would be way more helpful for guys who are thinking to make a career choice. #Lots of Love. Congratulations & Good luck Corey. Keep going! <3 <3",True
@moonlightshow7,2018-07-03T16:14:25Z,1,"Thanks corey, your teaching and step by step explanations are amazing. Have been recommending your channel to friends and family for a while now :) Keep up the amazing job. A playlist on docker would be awesome!",True
@gokulsreekumar4371,2018-07-03T08:52:20Z,1,"Thank You very much Corey. I really love your views, and the good things you stand for. Hoping for THE BEST CONTENT",True
@Salman-xz4km,2018-07-03T04:42:48Z,1,Corey congratulations man !!!!!!!! because of your amazing content I was able to landed up to my first python coding interview..... You are the best,True
@felipedesousafranca,2018-07-03T03:42:50Z,1,You're the best Corey! Can't wait for the new content and I'm definitely telling my friends about it!,True
@kolotunbabubay,2018-07-02T21:42:33Z,1,This style of video is brilliant as well. I think that video like this can be uploaded from time to time to make videos more diverse. It's also just nice to see you there. :),True
@victornikolov537,2018-07-02T12:10:33Z,1,"I usually just watch videos on Youtube but hey, Corey, I can't miss telling that you are one of the best tutors/teachers here. Probably the best one. Everything you say is clear at once and I can't wait for the next video. I learned so much from your videos. I understand better how some things work because of your efforts. I'll support you in every way I can. For now, I just subscribed to your channel. For now. Keep going! One thing. You have to smile ;)",True
@jackma2760,2018-07-02T11:47:38Z,1,Thanks Corey and congratulations. You definitely deserve it!,True
