author,updated_at,like_count,text,public
@itzyourbwoytchybooxuur6475,2019-08-19T14:16:25Z,2,Fine ass dude...#winks,True
@jagadeeshm.n3828,2019-08-18T18:48:37Z,1,Thanks for the great work your doing Corey. Your way of teaching is really awesome .Error and trail method of teaching every concept is the most highlighted part of your coaching . Kudos to you Corey.,True
@mohamedabidalrekab9061,2019-08-18T08:56:41Z,1,Congratulations,True
@go2pee,2019-08-16T18:48:21Z,2,"So glad to see you reach this milestone. I’ve been watching your tutorials since the last 2 years. And it has pretty much helped me get through the semester and now even through my first job interview!  You, sir, are the best YouTuber out there teaching this language. I promise I’m going to contribute an amount to your efforts as soon as I’m handed my first pay check! Kudos! Love from India 🇮🇳",True
@pushpajitbiswas3752,2019-08-09T05:07:46Z,1,"I have seen your face for 1st time and it's beyond my expectation, and congratulation for silver button I know it's too late but anyway.",True
@nicolasleclerc5087,2019-08-08T16:05:44Z,1,"Thanks a lot Corey, your contributions helped me a lot. your django tutorials and flask tutorials are just great. I can easily say that the world is more beautiful with persons like you",True
@kaironbrewington9689,2019-08-07T02:21:54Z,1,"Hello there, Mr. Schafer. I know this may seem very awkward, weird, and kind of stalker-ish (promise I’m not), but I just wanted you to know that I just swiped right. Lol",True
@CaptainJRY,2019-08-01T05:18:31Z,1,"Congrats Corey, You are a wonderful educator. I keep telling to people to fallow you if somebody ask me how to learn python. Anybody simply can relay on you. You deserve lot of support.  Keep teaching. Cheers!",True
@deepv446,2019-07-31T18:41:11Z,1,I don't know you are going to notice this but your video is truly awesome.,True
@hamidsk2573,2019-07-29T13:49:04Z,1,"thanks for the intuitive and meticulous videos, I'm  learning many things form you I really feel good with American accent tutorial video  right on",True
@youseffau,2019-07-24T06:53:12Z,1,Well done and well deserved,True
@anshulsaraf6391,2019-07-08T21:37:29Z,1,Thanks Corey for Everything,True
@jl1267,2019-07-03T23:26:41Z,1,"Right now I am only learning how to code using Python as a hobby, and is quickly turning into something I'm doing more and more. Your videos are crystal clear in explaining things, sprinkled with a few examples and caveats, with just the right amount of pace.  I've nothing to give you at the moment except my gratitude. Perhaps someday it can be a monetary donation.",True
@moneyharry,2019-07-02T06:06:24Z,1,I did not know that he has a body too 😱,True
@TheDhrv04,2019-06-27T17:29:29Z,1,Keanu Reeves of programming,True
@TheDhrv04,2019-06-27T17:28:45Z,1,good man corey,True
@carloolleres5237,2019-06-24T00:46:05Z,1,"Congrats, Corey!",True
@Didanihaaaa,2019-06-20T05:49:04Z,1,I like your videos. I was curious and looking the internet to see you at least a picture which I found now this one. good job. thanks for your videos. I learnt a lot.,True
@musicfunny4388,2019-06-18T20:32:10Z,1,You are just a wonderful person who truly understands the Python through. I like your speed and voice. Your content is very logical and easy to follow.,True
@BreadWinner330,2019-06-18T03:31:38Z,2,"Awesome! I really enjoyed your Flask tutorial series so far, you've got a new fan!",True
@michaeldayreads4771,2019-06-17T01:01:22Z,1,"Thanks for the videos Corey, good luck on doing it full time.",True
@georgeliss4015,2019-06-15T01:27:42Z,1,thank you for being a BRO and not putting your content behind paywalls,True
@StevenTse,2019-06-04T14:39:11Z,1,"good job Corey, your vid really helpful, and you teach in good plain english (specially important for those non-native speakers like me), thankyou",True
@sphiwematone8196,2019-06-03T20:46:33Z,2,"I wish I had money to support you on patreon but I'm a student, I cannot thank you enough for your videos. I have learned a lot from watching your videos. Thank you from South Africa",True
@jean-paulcastel1461,2019-05-21T19:55:47Z,1,"I've just found your channel while trying to learn Python and am loving it! I love your clear, concise, to-the-point way of speaking.  Also really like the speed at which you cover stuff. If I want to go over something I didn't understand, I can always go back or even play it slower...much prefer a ""quick talker"" than a slow rambling instructor. Thanks Corey!",True
@lilprotakeit,2019-05-21T03:26:56Z,0,I would request you to take a shot at Data Analytics using python as well,True
@Shiva-zy7jq,2019-05-20T18:01:10Z,1,Thank you so much Corey. I love your videos. Your python videos was very helpful. I am supporting you on patreon.,True
@ckb823,2019-05-17T02:42:39Z,0,Hi Corey.  Question:  Do you think  A.I. threatens human jobs in the long run?,True
@ashbyrezvani3313,2019-05-16T02:12:02Z,0,Put a face cam on your videos,True
@navinbondade5365,2019-05-14T16:46:33Z,1,"I'm a big fan of you, thank you for all knowledge love you",True
@duckhorse2563,2019-05-13T16:23:17Z,1,Sensei,True
@sinbadgmail,2019-05-08T18:06:53Z,1,Finally I can put a face to the voice :) I’m really grateful for your efforts.. thank you..,True
@chandansarkar1123,2019-05-06T19:12:29Z,2,Thanks a ton Corey for everything that you have taught us for all this time...,True
@daegudude1048,2019-05-05T18:37:07Z,0,"Thanks a lot Corey, By the way can you make 5$ or 10$ tiers on Patron too? I support you on Patron, but I am doing 1$ tier since I am a student. But I feel like it's too less compare to the help I get from your videos. I would be happy to do 20$ but it's too much for a student for a month.",True
@jacoblim9439,2019-04-24T10:41:59Z,2,"OKAY.. i'm a Patron now! ""It’s real: you’re now a patron of Corey Schafer!""..",True
@estrellaverbeck,2019-04-23T17:24:25Z,1,First time seeing his face. I think he's really Cute with a capital C! Are all male programmers cute? BTW thanks for your Django tutorial,True
@bazareta6936,2019-04-21T01:06:33Z,1,Nice to see you,True
@wolfisraging,2019-04-20T03:41:40Z,2,"Your flask series helped totally to start my first startup. I'm just 19, and it's was pretty difficult for me to learn anything from some high end professionals. But your extremely intuitive explanation did the real magic. I'll definitely support you in anyway when I get the job. Thanks for everything. 🍺",True
@paasdfasd,2019-04-20T00:37:57Z,1,"YOU ARE THE  BEST, Gracias !!",True
@felixjosephbamba9917,2019-04-19T10:18:34Z,1,Great Corey!!!,True
@georgesmith3022,2019-04-17T08:07:22Z,1,"i think your biggest advantage is being true, modest and respectful, and i hope you continue like that",True
@jokosalsa,2019-04-16T04:32:03Z,1,Congrats Corey.,True
@MachineOverlords,2019-04-14T08:40:49Z,1,"Congratulations on the success of your channel!! You are hands down the best developer training channel on YouTube.  My favorite videos are when you walk through solving a problem and explaining your thought process.  Obviously all the videos are great, but my biggest challenge is learning how to solve problems in a project, so I like the videos where we can see your thought process and code you try before you get to the final version.   I don't know if it's in the works, but it would be awesome to have a series on doing a full system where it's maybe white-boarded with requirements, possibly also showing the web front-end being planned out with wire frame for Django/Flask, and then walking through steps, iterations, testing, documentation, making available for the client, and then how to handle updates/changes, etc.  A man can dream!",True
@DrRandyDavila,2019-04-10T15:12:55Z,1,"Love your videos Corey, I know I'm a little late, but congrats on your achievement. Well deserved. I often refer my my students to your videos(I'm an assistant professor of data science at the University of Houston-Downtown). If you can, take a look at Julia. There is a serious lack of Julia programming videos out there, and I'm sure you would like the language. Cheers.",True
@InternationG,2019-04-09T10:51:53Z,0,Sentdex and Corey collaboration,True
@JohnDoe-cq3ic,2019-03-30T13:01:29Z,0,"Yes dont go paid ...that would be tragic!  Your videos are lifesavers.  Could you address some things such as why when i open a program in python there are always multiple files ..like a .py file, an .ini file ...an md file etc...thanks one other thing...will u be doing more videos on python modules?",True
@rudrakshkashyap7467,2019-03-29T13:37:24Z,2,You look smart,True
@jonesmutua501,2019-03-28T13:29:47Z,1,"there are 2 bastards who actually disliked this video. love from Kenya, nairobi.",True
@ganeshsundar1484,2019-03-24T08:13:26Z,1,"Awesome, you are our gift. The beauty in your teaching is 'simple and nutshell'. I need not to understand the history and story behind it. Please do plan for live videos and also consider for Functional Programming in Python. Good Luck, Best Wishes!!",True
@walkmanlistner,2019-03-22T14:52:59Z,1,Greatest Effort,True
@devprakash5320,2019-03-17T17:48:32Z,1,At 4:45 you won my heart ... you're incredible ...,True
@user-gx9hk8gt3k,2019-03-12T05:34:47Z,1,You are  generous enough to give  the poor an opportunity to learn coding and other good stuff for free.  God bless you!,True
@aytekinozhan7554,2019-03-09T11:03:29Z,1,You're awesome Corey :) I learned many thing about python thanks to you . Keep doing these tutorials . We need you :),True
@hasantarek6521,2019-03-09T09:19:14Z,1,you are awesome,True
@gabrielfreire2935,2019-03-08T19:41:02Z,1,"you deserve, you can't imagine how you helped me with your unique tutorials",True
@saikumarp756,2019-02-24T20:40:21Z,1,your videos raised my confidence in doing something big. Fan of you always and will be. Good to see you on camera.,True
@calebmbugua7686,2019-02-22T12:38:43Z,1,Thanks corey!!! Your blessed mahn....from Kenya.Learnt a lot of python cause of your tutorials!!such a good teacher,True
@jerwinsamuel,2019-02-18T21:32:08Z,0,This guy changed so many lives.  <3,True
@johnpro2847,2019-02-17T09:54:35Z,0,Nice job ..bookmarked,True
@budhathokibijaya6636,2019-02-14T15:23:33Z,2,You are the best man !!!!!!!!!!!!!!!!!!!!!!!!!!!!!!!!,True
@ashishverma-mj1kl,2019-02-12T19:08:28Z,1,You're SOOO handsome!!,True
@marcinosr,2019-02-12T15:02:31Z,1,"I find Corey one of the best programing tutor on the web! The format is just great, very clear, strait to the point and also Corey is explaining the problems from the point of view and the way of thinking of the user or learner.  Coming back many times to his channel and every time I am learning new stuff. Corey, many thanks for your work. Helped a lot. Will support as much as I can. Regards.",True
@mikeface10,2019-02-10T05:44:38Z,1,Congrats! You are the best! Thanks for all your do!,True
@vtvvnha2230,2019-02-10T02:08:09Z,1,congrats,True
@noneedtoknowthishandle,2019-02-07T14:31:10Z,0,please make videos on machine learning it would be very much helpful. since ml is booming and python is a great language to do machine learning.,True
@FearCycle,2019-02-06T21:13:50Z,1,You are the man!,True
@ameygoes,2019-02-06T10:43:21Z,0,We want Python Machine Learning Course plzzzz,True
@DarnastTFT,2019-01-27T22:03:03Z,1,Thank you so much for creating these videos. You are probably the best teacher I have ever met. For some suggestions of new content: Python Programming for finance would be great. Also some basic R or Matlab tutorials like the series of 9 videos for Python would be great as well :] Again thank you Corey,True
@OladipupoPopoola,2019-01-27T14:22:50Z,1,"You deserve way more than a YouTube plaque. You have brought hope to so many lives, given many of means to feed themselves and be somebody. Thank you bro. If I could afford a plaque, I'll definitely give you as the best teacher I've ever met. Thanks again.",True
@suryatejasunny,2019-01-24T17:19:03Z,1,Good to see you after listening to you like hundred hours. You have a teaching style that makes me want to stick to my study table for hours. Watching your videos is more than enough for a beginner like me. I feel like I have learned a hell lot of stuff. Thank you. You are GREAT.,True
@PaulMcCannWebBuilder,2019-01-18T22:57:42Z,0,Love seeing the behind the scenes stuff in the Silver Play button reflection! Those looking to learn how to make video tutorials should look at your content quality and delivery for the right way to do it.,True
@treaper,2019-01-15T05:38:14Z,1,Nice to see your face after only hearing your voice for tens and tens of hours over the last couple months. You're one good-looking dude! Once I land my new gig I'll definitely help support the channel. Thanks again for all the amazing (free) content. You're a hero!,True
@sahilnagotra547,2019-01-13T15:49:26Z,1,your channel is one of the best for learning programming. Thanks a lot,True
@nikoscuatro7251,2019-01-12T16:13:05Z,1,"I am the one who is looking forward to find a job, so thanks a lot for all these amazing lessons!",True
@MagnusAnand,2019-01-09T04:31:42Z,1,You're doing a great job Corey!!,True
@sanaullahkhanhassanzai8432,2019-01-07T14:40:01Z,1,Corey you are simply brilliant. Keep it up. I ll support definitely once I start earning through python.,True
@shahrokhabbasirad2223,2019-01-05T16:39:43Z,1,I love your videos Corey. I'm glad that you have more time now.,True
@tunkyi7162,2019-01-04T14:03:18Z,1,"Not all heroes wear capes. I give you all my blessings to you, dude!",True
@gunasekarrajendran1256,2018-12-31T08:35:42Z,0,Awesome Corey and Thanks so much for taking time to do this. Your way of teaching is so engaging and the fact to be told after spending $$ to learn python learnt it from you so easily. I would like to contribute so wanted to know which is the best route Patreon or Youtube Join you have added to your courses.,True
@soumyaranjansahu7018,2018-12-29T09:04:17Z,1,Awesome Corey  and congratulation. You will be at the top of your goal soon...:),True
@mosesgithiora4404,2018-12-28T16:27:07Z,1,Wow! you just made my python life much simpler,True
@yhaouatis,2018-12-27T18:00:48Z,1,Congratulations Corey. I'm so excited for your full time videos that you will work on. I can't wait to seeing more fantastic courses that you will offer. Everyone should support kind of these people.,True
@rebelScience,2018-12-27T11:44:05Z,1,"Corey is Amazing person! I refer everyone to his videos. And a funny thing is, Corey says he is not going to ask for money for his videos (make paid courses), and boom! I go and donate via PayPal. People like that are most genuine and so needed! Keep it up, and we will keep bringing people to you, and keep supporting you with our $ when we can! I am transferring all my C++ skill to Python to switch from generic programmer to a Bioinformatics programmer as I am interested in longevity, life extension research, cell damage repair, etc... to end suffering. I hope to start my own course soon on that subject. So amazing, that Corey covers all the basics I can refer people to. Can't thank you enough!",True
@jamsheedvp8600,2018-12-23T13:57:39Z,1,Congratulations corey.. I am working  as a software engineer for an Indian company. And your big big fan. Your explanation is very simple. It's helps me lot of situations.,True
@arijitdey9099,2018-12-23T05:52:54Z,1,Thank you for not making paid videos,True
@arijitdey9099,2018-12-23T05:50:46Z,0,Do more Python related videos,True
@danielgitahi2847,2018-12-22T21:28:37Z,1,"Finally, there is a face to all this knowledge. I am very happy for you bro. I thought I knew all that python had to offer until I started watching your videos. Keep it up, man!",True
@SusanAmberBruce,2018-12-22T19:30:34Z,1,"In answer to your question about what does anyone think about a video like this, I think it's good to see a face, that human thing now and again. The format of your tutorials is excellent. For me what would be really useful on top of all the videos  that show how to use the nuts and bolts of python, would be a couple of videos to give some idea of, say for example how to turn a programming problem into a class, I don't know if that's a thing you would want to do? my estimation of what I have seen available on Utube is lots of videos on the nuts and bolts stuff, (don't get me wrong, yours are excellent and very useful), videos on how to approach a problem, writing psuedo code in fact, seem to be a bit thin on the ground.",True
@ajutamang7190,2018-12-22T13:44:07Z,1,You always motivated me  and awesome video.,True
@guilhermehx7159,2018-12-21T16:34:21Z,1,Good Corey,True
@mikewang9114,2018-12-21T07:17:25Z,1,"Hello Corey, your video helped me a lot. after you said you dont want to do paid courses, i joined your patreon immediately. thank you for your good work!",True
@addishiwottadesse2883,2018-12-20T12:43:50Z,1,hi Corey. i have forwared your channel to friends and students who asked me about studying python.,True
@krishnapatni,2018-12-19T09:14:39Z,1,subscribed to your channel today and your content is really good. I like that you keep it crisp and to the point. thanks a lot !,True
@shikharratnagupta3767,2018-12-18T06:32:45Z,0,"Hi Corey, I have loved your videos... Thanks for all the efforts..  Ur my online Guru for Python :D....Do you have videos in numpy and Pandas as I am struggling in those concepts...thanks again for wonderful job..",True
@Isnogood666,2018-12-18T02:03:28Z,1,"Your videos helps me greatly in my studies. I study digital forensics and programming is a big part of that course. Thanks man! Your the best! pss...I really would like to see you as you teach the courses you have :) Brings so much more, the connection you get when you see the tutor. Cheers from Norway",True
@vivekkc3354,2018-12-16T08:50:08Z,1,"Hey Corey, absolutely great seeing you speaking to the camera. I've been watching many of your python videos and really enjoyed them, you got very good content and the way of delivery is fantastic with right set of tools and perspective. Glad you are able to make this full time, happy having known such a kind hearted person yet very professional. Your editing, speed and content are just perfect - I'm sure people never have to fast-forward and afford to miss what you have to offer. I did recommend your videos to my colleagues and friends, they do enjoy. And I support you and thanks a bunch for standing different, yet impactful. Looking forward to your upcoming projects.",True
@hichamichkantana9438,2018-12-16T07:08:30Z,1,Congrats Corey.  I really value all the videos you are releasing. I hope you have plans to release some video on pytest.,True
@user-rg8gx2uz7e,2018-12-14T04:49:22Z,1,Thank you Corey!,True
@hrvooje,2018-12-10T17:17:06Z,1,"Thenewboston, sentdex and you were my first steps into programming.  Always going back to your git, regex .. My goal is to work as software developer and one should never give up of his dream. So I keep dreaming with good people from the internet.",True
@HappyAnimals3D,2018-12-08T06:09:10Z,0,"Some guys put their videos as pip object unnecessarily which only causes distraction whereas your videos are more effective. It should be fine in videos like this one as conversational style when it comes to announcements, career advice, tips etc. I hope you get my point.",True
@HappyAnimals3D,2018-12-08T05:58:22Z,1,You truly deserve even more recognition and respect from everyone who watches your tutorials!,True
@jkdarshni882,2018-12-04T15:30:37Z,0,"Hi, Could u please teach me/us how to create website of my own. pleaseeeeeeeeeeeeeeeeeeeeeeeeeeeee............",True
@MalDoc-ts6tp,2018-12-01T07:29:30Z,1,Congrats Corey! Love your passion and awesome videos. Keep it up!,True
@jonipierce8649,2018-11-08T18:22:13Z,1,Python BTW,True
@jonipierce8649,2018-11-08T18:20:58Z,1,Congratulations! You are a life saver for those of us in some college classes that are supremely confusing.I learned more in 17 minutes with you than in 4 hours in class.,True
@hamzamohd.zubair1709,2018-11-06T09:26:37Z,1,Congrats!!!!!!!!,True
@info9049,2018-11-04T15:36:15Z,1,"Congrats Corey, your content is very useful for me.",True
@matiasvergara6826,2018-11-02T13:46:38Z,0,"Your videos are great!, thank you so much!. Could you please continue to add videos on the SQL series? --->they are so useful!",True
@imransuleiman2684,2018-11-01T00:42:09Z,1,Thank you Man. Big Thanks,True
@sanxyzee,2018-10-30T03:32:19Z,0,please make C tutorials,True
@abhijitubale,2018-10-26T23:36:57Z,1,"Corey, You are an inspiration in the Python Community and we thank you for all you are doing. Am learning so much from your videos.",True
@davidk5855,2018-10-25T10:35:44Z,1,thanks Corey Schafer! You are genius with your training videos!,True
@muhammadsalah9598,2018-10-23T21:26:45Z,0,You don't look anything like your channel  pic,True
@shashidharreddy9463,2018-10-22T15:57:40Z,0,"Please can you make videos on Data science, like Bigdata with Python and ML",True
@shashidharreddy9463,2018-10-22T15:56:28Z,1,"Hi, Great videos for python...",True
@w4scriptfullstackwebdev505,2018-10-20T15:44:56Z,0,"Please, putting E-commerce tutorial with Django.",True
@NinjaBunny9000,2018-10-19T19:17:32Z,1,"Love this update. Congrats on all the things! Signing up for Brilliant now. Seen lots of adverts from them over lots of videos but you’re the first Brilliant-sponsored YouTuber that I feel really deserves an affiliate-linked signup from me. Thank you!  On a side note, your teaching and instructional style has been a huge inspiration to me as well lately. Decided to finally give it a go and record some videos. I’ll be happy if they are 1/10th as effective as yours have been for me. Cheers!",True
@Dpcs59,2018-10-18T17:36:43Z,0,For those larger courses have you ever thought about creating a udemy course? I would pay for a version that gets regular updates as time goes on.,True
@yuliyakotenko4606,2018-10-17T09:49:36Z,1,"Congrats)) Your way of explaining difficult (for me definitely, as I am a complete humanitarian turning into a developer) things is obtainable, clear and ""step by step""! Thank you so much for helping! Looking forward to learning more with you!",True
@jbobstl8390,2018-10-11T13:36:13Z,1,"Congrats Corey, and thank you for all of the awesome tutorials!  I've recently stopped listening to the radio during my commute to/from work, which can be as much as 2 hours per day. Instead of listening to music/news, I'm listening to training videos and podcasts, and have found yours very helpful -- even if I can't see the screen while driving.  Your explanations are so clear that I have no trouble following.  With regard to funding, in addition to patreon donations and ad revenue, I encourage all users of the Brave browser (brave dot com) to enable payments for Corey's channel.  Again, thank you, Corey, your videos are very helpful and in the past couple of weeks, I've actively applied what I have learned every single day.",True
@tragedy_723_latviski,2018-10-10T20:15:21Z,1,Had to login to do thumps up! Let's goo!!,True
@deep433,2018-10-06T19:34:08Z,1,"you are the best, you really deserve 1M subscribers at least",True
@MrJohn2475,2018-10-05T16:20:01Z,0,"thank you man and congratulations! Your videos are helping me a lot through college! could you please produce some tutorials on how to create a compiler (lexical, syntactic, semantic analyzers, and code optimizers)? My teacher is great however he has challenges to pass the knowledge sometimes so I support my learning with YouTube tutorials like yours. We are coding in NetBeans Java.",True
@yadneshkhode3091,2018-10-05T15:35:30Z,2,I am not earning so I cannot support right now but I will soon... meanwhile I am sharing this channel with students in my college and I have successfully shared it with more than 100 students till now,True
@jaitiwari9604,2018-10-03T17:18:47Z,0,"Thanks a lot for ur reply..U are no doubt best mentor, a teacher on youtube platform..The best part is your way of teaching is just Wow..you reply to your viewers. Many YouTubers started their course but fail to complete their course..We all are thankful to you, Sir",True
@jaitiwari9604,2018-10-03T12:36:26Z,0,Hello sir!  I want to know what minimum skills are required to get started with python job? Python program+html+css+django or flask..Or any1 of these is enough is enough to start the job,True
@backgroundnoiselistener3599,2018-09-30T12:02:29Z,107,"""I won't exclude people who can't pay for paid courses"". Man with a golden heart.",True
@beyassin,2018-09-26T16:48:10Z,0,"when i hear your voice i automatically open my text editor no matter what you're about to say!! i am veay pleased about your new plans. Thank you for all, you're the man.",True
@ultiumlabs4899,2018-09-25T14:07:38Z,0,"I like this video style for career advice videos, etc. nice background. awesome!",True
@LarryPanozzo,2018-09-21T21:54:36Z,1,Just subscribed! You really are a highly effective and concise teacher.,True
