author,updated_at,like_count,text,public
@abirbiba3307,2024-04-04T11:49:10Z,0,Thank you so much ❤,True
@rpnsamuelaigbornajohn9096,2024-03-01T14:46:08Z,0,thanks alot for this now i know when to use scaling and when not to use scaling,True
@YashSharma-eq3sn,2023-10-05T16:48:04Z,0,This was helpful. Easy and quick answer to the question beautifully explained.,True
@eleanortay7351,2023-08-21T14:54:59Z,0,Grateful for all the knowledge you have shared. It makes my learning journey much more interesting and easier to remember the key concepts now. 🙏🙏🙏😊,True
@AllRound8255,2023-07-23T07:45:10Z,0,This kind of content😍,True
@akhileshkumar-mu8gb,2023-04-17T04:00:05Z,0,your classes are really helpful in understanding the basics of ML.,True
@m0tivati0n71,2023-03-15T10:48:47Z,0,"Wow, very succinct and simple explanation. Thank you.",True
@Lucia-el6ex,2023-01-01T22:01:59Z,0,Gracias por compartir todos tus conocimientos con la comunidad! Eres un crack!,True
@uttamgupta5653,2022-09-30T13:39:59Z,0,Sir mere liye toh aap hi Andrew NG sir ho thanks sir for this all content,True
@Person-hb3dv,2022-08-06T10:05:33Z,0,explained way better than so many paid courses,True
@Gaaravify,2022-08-06T01:57:53Z,0,"amazing explanation, thank u bro",True
@yingjiedong3568,2022-07-31T05:42:48Z,0,"Wow, you are a amazing instructor of Machine learning. I am so lucky to find your videos. Your explanation is clear and easy to understand. I can tell you really understand and have experience as well. Thank You!",True
@aguyfromparalleluniverse,2022-07-26T09:13:20Z,0,thats how you earn a subscriber,True
@jamesclicks1344,2022-06-03T15:33:57Z,0,"That make sense! Thanks. It's like using ""log"" when a dataset has a very high standard deviation",True
@SahilShah-cd5bi,2022-05-16T11:27:34Z,0,"Do we need feature scaling for dataset containing values only 1,0, -1 only",True
@arcsaber1127,2022-04-17T09:25:27Z,0,So basically perform scaling wherever gradient descent or euclidian distance is used?,True
@apoorvasrini2196,2022-03-02T02:28:36Z,0,Doesn't XGBoost use Gradient descent to find the the minimum of loss function? Shouldn't we use scaling in that case?,True
@mercyjhansi8190,2022-03-01T16:37:57Z,0,Is scaling necessary for LinearRegression (OLS)?,True
@Pride_Of_Ultras,2022-01-26T16:58:44Z,0,Love the way u speak :D,True
@sadiasafdar4788,2022-01-25T09:48:19Z,0,"hello sir, perfect explaination. please can you make vodeo , how to perform CNN on matlab using image dataset..... i will be greatfull to u for this.",True
@MrKB_SSJ2,2022-01-13T20:52:44Z,0,Thank You...,True
@MadhuSudhan-qp7ik,2021-12-25T06:17:17Z,0,generally we do scaling with more number of records so we get scaled values but how can I give scaled value as single input record for predicting the target value?,True
@sandipansarkar9211,2021-10-19T19:17:31Z,0,finished watching,True
@dontgiveup5271,2021-10-19T05:41:25Z,1,Nice!! Simple and clear explanation,True
@amilachathuranga5541,2021-09-28T07:17:05Z,0,thank you..understood well.,True
@deeplearningwithjay,2021-09-07T06:14:00Z,0,"Thank You Sir , The Scaling makes so much sense now",True
@0SIGMA,2021-07-18T08:27:37Z,0,"if there are classification problems, we should do encoding first and feature scale over it ?",True
@RahulKumar-lv9yz,2021-07-03T11:28:35Z,0,"Did anyone get the feature engineering material that Krish keeps on mentioning? If yes, can you share it?",True
@vrushankkhadgi9118,2021-07-02T11:57:57Z,0,Nice jacket sir,True
@atoffice7323,2021-06-23T08:47:15Z,0,very good bro.. amazing,True
@thelastcipher9135,2021-06-14T11:26:55Z,0,"Why does scaling not skew the data? I understand why it makes the algorithm more efficient, but I feel like scaling skews the results. Why does it not seem to be the case?",True
@its_mrpanchal,2021-06-12T17:27:01Z,0,"kuch bhi samajh nhi aaya sirji, aap to kuch or topics pr hi bol rhe ho,,,, aap simple ye btaao ki scaling kyon karni chahiye",True
@dkhundley,2021-06-06T14:44:12Z,0,Excellent video!,True
@vinaykumar15,2021-06-04T18:57:08Z,0,Its very confusing video and doesn't answer why do we need feature scaling.,True
@RahulDable,2021-05-26T13:51:46Z,0,"Thanks for highlighting SGD here, never thought in that way. Great Intuition.",True
@atiladursun7075,2021-04-18T20:26:18Z,0,Good explanation man thanks,True
@windaseptarini9647,2021-04-05T22:55:31Z,0,Thank you for clear explanation,True
@keshabdoley1727,2021-04-04T03:32:16Z,0,can i use feature scaling in Polynomial regression?,True
@lakshmisri8978,2021-03-22T05:51:32Z,1,What about logistic regression?,True
@nyinyisoe3604,2021-03-17T09:39:17Z,1,This is a very clear explanation of what really scaling is. Thanks  for uploading this video.,True
@devendunegi247,2021-03-16T15:20:30Z,0,your intent is good but i would say try to explain in such a way that  a layman would understand what you are trying to tell...like you did not explain 'why'  a  lot you just told good things about feature scaling but you did not put time in explaining why is it used..,True
@muhammadshariqkhan6065,2021-03-10T20:09:14Z,0,"I have trained my model on international data based on Decision tree algorithm but when it comes to test set that is based upon pakistani data . So the answers are not coming out to be same because the data set on which the model was trained with the features was not having mentioned any units and in my test data , I have the units as well. So how feature scaling is not important for this particular case i.e. linked with Decision tree algorithm ? do reply",True
@husnaramohammed8881,2021-02-03T13:07:16Z,0,sir iam ur new subscriber can u please share the material with me,True
@manavshah2119,2021-01-29T18:52:19Z,0,Sir please can you given some practical video on this on real data sets,True
@ankitganeshpurkar,2021-01-19T03:27:49Z,1,"Should be we perform feature scaling in SVM, Naive Bayes, logistic regression and stochastic gradient descent??",True
@nihalshukla7718,2021-01-07T12:29:03Z,0,Hello sir can you organize your statistics and feature engineering playlist. I think it is not in sequence.,True
@nabiltech1366,2021-01-05T15:01:35Z,0,My fav netflix series,True
@leoyuanluo,2020-12-16T20:33:34Z,0,voice of reason!,True
@qamilmirza4739,2020-12-16T14:16:37Z,3,This is amazing content man! Decided to learn ML during lockdown and your videos have been great in explaining the technical aspects when it comes to data.   Keep it up!,True
@Nobin12346,2020-11-08T06:09:19Z,0,Hi,True
@md.khaledhasan8191,2020-10-25T09:51:22Z,0,Well explained,True
@tanaygupta2865,2020-10-13T14:08:31Z,0,Nicely explained. :) Thanks K. NAIK. :),True
@wildananugrah,2020-10-06T04:17:22Z,0,"thank you for the video, it has enlightened me",True
@nandhukumar86,2020-09-24T09:25:50Z,0,"How about Naive Bayes, it does not deal with any distance but the probability. If my understanding is correct NB doesn't need Feature scaling?",True
@abhishekdubey2328,2020-09-22T03:28:48Z,0,we can use feature scaling on SVR ? it is recommended or not.,True
@himalayasinghsheoran1255,2020-08-24T07:25:21Z,0,Thanks for the video :),True
@tirumaleshn8504,2020-08-18T11:43:52Z,0,"Krish Naik sir! You were amaze with this approach of teaching. A lot better than online courses. And sir, pls arrange videos of playlist in sequence.",True
@benvelloor,2020-08-15T22:50:51Z,6,"You had mentioned that Feature scaling helps speed up algorithms which use gradient descent. Even though Xgboost is an ensemble learning algorithm, it uses gradient descent to calculate the loss of each model before passing on the wrongly calculated data points into the next model. Isn't it advised to use feature scaling for xgboost then?",True
@ulysses_grant,2020-08-11T10:49:40Z,15,"May God reward you in centuple for your work sir. We can see you are really know what you are teaching, and that you are passionate about teaching it. Thank you.",True
@tempura_edward4330,2020-07-13T17:59:36Z,0,great video! thank you !,True
@hariprasad1744,2020-07-09T12:50:23Z,0,"Hi krish, I am unable fill the google form, it is no longer available. Can you please help me",True
@GelsYT,2020-07-07T07:11:33Z,0,Thank you so much sir Krish! You explained it very well thank you! because of you I clearly understand it now THANK YOU!!,True
@letslearndatasciencetogeth479,2020-07-01T15:37:27Z,0,can someone please share the materials,True
@priyanshuvats4066,2020-06-27T07:18:11Z,1,"Scaling features helps make gradient descent faster by changing the shape of the cost function Also, it improves the performance of distance-based models by reducing bias. Here is a link for deeper understanding. https://www.youtube.com/watch?v=P3xPA7XFGCQ",True
@pranjalgupta9427,2020-06-22T14:55:54Z,1,Nice explaination,True
@NadinMagdy,2020-06-19T07:14:06Z,0,"I'm still not sure why it is bad to have a big range of numbers, scaling for the normal number or if feature scaled between 0 and 1, will end up giving the same curve shape if the axis scales are adjusted, can someone help me undertsand",True
@MasterofPlay7,2020-06-15T23:07:49Z,4,what does linear regression have to do with gradient descent? I think the purpose of standardization in linear regression is cuz to reduce the effect of extreme values/outliers have on the model,True
@adiflorense1477,2020-06-13T14:45:21Z,2,"7:32  sir, what about naive bayes",True
@mohammadarif8057,2020-06-08T17:41:02Z,0,Can you specify from which of your playlist is this video is from,True
@Official-tk3nc,2020-06-05T13:14:36Z,115,"If you are watching this in lockdown believe me you are one of the rare species on the earth who are working hard to achieve something in their life. Many students are wasting their time watching youtube , playing games, pubg, watching webseries, netflix, etc, all the best, nitjstudenthere.",True
@reachDeepNeuron,2020-06-03T19:03:51Z,0,It dint come out clearly,True
@lijinhui6902,2020-05-30T12:35:33Z,0,thx so much,True
@abhishekshrivastav6193,2020-05-27T07:21:07Z,0,Sir I didn't get what actually  fit  and  transform do.,True
@palavirajgude5717,2020-05-15T04:41:17Z,6,"you talked less about why scaling is important, i didnt get it, practical examples would have been better",True
@abhishekshrivastav6193,2020-05-09T01:05:35Z,0,awesome sir....!!!!,True
@ladan1360,2020-05-08T11:05:51Z,0,Thank you 👌,True
@saqibkhanbhai1859,2020-05-04T07:43:01Z,0,Helpful explanation. Thanks.,True
@fahdciwan8709,2020-05-03T19:36:25Z,2,thanks brother!! found this very helpful,True
@_HrickKarnaRoy,2020-03-28T08:41:17Z,1,Amaizing vid brother just impressed.... Nice way to explain..,True
@zulfiqarali-zq1rg,2020-03-11T17:42:21Z,0,I got something new is your every video that is very important for my project .thx,True
@geraldlivingstone8104,2020-02-17T20:49:51Z,0,"Krish - Great job and thank you for posting, better than my MBA professor presented, I now understand.",True
@suyashneelambugg,2020-02-06T19:52:59Z,0,This is what happens when you learn from practical implementation. You have no real mathematical answers to anything. More like somebody learn to press buttons and was able to make some sense of the process. Stop calling Eucledian distance as Eucledian distance unless you can explain people why euclediam norm (L2 norm) is preferred over L1 norm which gives us the Manhattan Distance....,True
@rudrapavankumar4607,2019-12-05T04:17:44Z,0,super sir,True
@ninjawarrior_1602,2019-11-02T10:03:13Z,1,i still have doubt that how does scaling helps because even after scaling the relative distance doesnt change,True
@mrrasel871,2019-09-30T15:26:54Z,0,Great! I want to say I am enjoying your each and every tutorial not only learning.,True
@nirajsharma7384,2019-09-28T02:06:38Z,0,Sir their is no video for feature scaling,True
@PuneethSaiBhaskar,2019-09-20T06:43:19Z,4,pleade do make a video on how to select features only required for the dependent variable . (when there are hell lot of variables/features ) :),True
@adwaitpande11,2019-09-13T04:39:34Z,7,Is there a scenario where feature scaling may adversely affect the algorithm?,True
@vishalkap62,2019-08-21T02:14:35Z,0,"Do we need to scale our dependent variable Y, as well...",True
@jithinkgeorge2237,2019-08-18T04:22:45Z,2,"Started watching your channel from last week, Such a great videos.",True
@kumarrishu3026,2019-08-16T12:51:38Z,0,Sir can language like c++ or java can get us jobs,True
@deepaktiwari54,2019-08-16T11:43:43Z,3,"Sir, please make video on github, how to use it, how it is help to make profile stronger.",True
@siddharthdhingra1,2019-08-16T11:16:07Z,2,I wait for your videos every day... You explain so well. Keep up the good work! :),True
@khushalivaghani61,2019-08-16T10:49:09Z,4,"Hello sir,  All the videos related to ML posted by you are really helpful.  Your teaching methodology is also very nice and I can learn easily. Can you make a video related to Audio Processing/ Speaker Diarization?  As I want to dive deep in Speaker separation from the audio recording. It might be useful to others also. Thank you.",True
@siddhantagarwal431,2019-08-16T09:52:49Z,1,Sir can we use java for AI and ML (like weka and deeplearning4j frameworks),True
@cutyoopsmoments2800,2019-08-16T02:52:33Z,3,"Bro, is features engineering linked to the machine learning???",True
@SP-jv5lv,2019-08-15T18:28:17Z,0,Hiii bro.. Im passout this year in entc stream. I don't have knowledg of programming. Im going to learn java directly... Can i go direct or learn first c or c++??  Please answer 🙏 Then im going to machine learning.,True
@ashishdwivedi575,2019-08-15T17:50:56Z,2,Sir who have an upper edge in data science a cs btech or stats undergrad student,True
@AManKumar-pz6et,2019-08-15T17:27:27Z,3,Making video might be of 3 reason 1. You want to learn 2.  You want other to learn 3   both 1 and 2  If  you want 1 then keep continue Else please make a systematic video or make a website like where  any one can learn you can also make it paid if you want but in minimum cost like 2999 or 3999 rs. This would be very helpful for you and others.. Its just an advice. Thank you.,True
