author,updated_at,like_count,text,public
@SanjeevKumar-hj1fb,2021-08-26T07:07:56Z,0,"Really a fantastic explanation  !!. Some of the resources on the internet explain Entropy in terms of Information Gain/No of bits needed. Could you please prepare a video explaining that as well? Thanks in advance, Sanjeev",True
@namratachavan6024,2021-08-26T06:39:17Z,2,It is very well explained about Entropy with simple example. Thank you so much. And most important you are not doing shamelessly promotion its actually worth it for everyone like me to understand the concept in very easiest manner.,True
@johnathancorgan3994,2021-08-26T03:02:49Z,1,How can you small bam anything published by Claude Shannon 😏,True
@paulkoh6887,2021-08-26T01:31:27Z,1,I love you StatQuest,True
@verticlelimits,2021-08-25T22:59:26Z,0,"thanks Josh for explaining so very nicely. as we are using univariant we are using log2, but say if we have more than 2 colors of chicken? then would we use log instead and add p(x).log(1/px) for all the diff colors?",True
@AhmedGamal-mm4sp,2021-08-25T21:15:50Z,1,Thank you so much for the clear explanation! Could you please make a video on DESeq negative binomial modeling clearly explained?,True
@rabbitazteca23,2021-08-25T19:31:02Z,0,"Hi! I wonder if you might be able to create or curate topics related to stats in Data Science and Machine Learning ranging from beginner to advance? For example, what kind of stats should we use for Data Exploratory Analysis and basically what kinds of stats we may need to start of with Data Science.  EDIT: Your playlist called #66daysofData seem to be a very good start and it certainly contains some data science topics that I applied on datasets before when I got started with Data Science!",True
@SaffaGains,2021-08-25T19:04:41Z,1,My surprise for this result occuring is undefined.,True
@leopapuda,2021-08-25T18:41:56Z,1,"So this is entropy? Finally understood it, What a surprise! DOUBLE BAM! 😯",True
@calebterrelorellana2478,2021-08-25T18:00:39Z,1,"great way to explain ML algorithms, thank you very much!",True
@Bigheadbear666,2021-08-25T17:11:02Z,1,BEST STATS CHANNEL EVER!,True
@nick_g,2021-08-25T15:50:30Z,1,Omg if there’s a statsquach 5-panel hat then just take my $40 now,True
@MrDaanjanssen,2021-08-25T15:22:15Z,1,superb explanation my man,True
@chrisvause5693,2021-08-25T14:23:03Z,1,"StatQuest! C'mon grab your friends.  You'll really start to under-stand. With Josh Starmer and StatSquatch the StatSquatch, The learning never ends it's StatQuest Time!",True
@OwenMcKinley,2021-08-25T14:22:14Z,22,"😊😊15:45 hahaha “psst… the log of the inverse of the probability...” Josh this was a fantastic tutorial. Love how I can just wake up and see content like this fresh in my YT recommendations We all appreciate it",True
@nakul___,2021-08-25T14:09:53Z,1,Been looking forward to this one for a while and was not disappointed at all — thanks!,True
@chaoli932,2021-08-25T13:20:03Z,1,"Thank you, sir. Thank to your videos, I begin to do some research using ML technology.",True
@TotorasLife,2021-08-25T13:18:51Z,1,Thank you for the great explanation. It’s very inspirational.,True
@ceseb23,2021-08-25T12:39:25Z,3,"Hello, Thanks for this video, its really helpfull as always :D. Quick question : why not use Surprise = 1- P(x), as it scale inverse to the probability and the surprise of a sure event is 0 as requested ?",True
@DrJohnnyStalker,2021-08-25T12:27:40Z,1,even though i knew xgboost and entropy. statsquest explanation is always worth watching and adds value to your intuition and understanding. best intuition videos for xgboost and entropy and many other topics. 10€ Donation is out ... keep going.,True
@ahmedabuali6768,2021-08-25T11:52:43Z,0,"very very nice, great work, I love it too much,  could you please teach us how to compute the confidence interval for kruskal.test() by R, please.",True
@SPLICY,2021-08-25T11:19:15Z,1,"You down with en-tro-py?  (yeah, you know me)",True
@alexmiller3260,2021-08-25T10:35:16Z,0,"Why don't we use Bernoulli's formula to calc the probability of getting Head, Head, Tail?",True
@pseudounknow5559,2021-08-25T09:53:41Z,2,Best explanation ever,True
@algorithmo134,2021-08-25T09:14:40Z,0,Good video. Please make videos on math behind all machine learning concepts. It would be so helpful to us learners! Quadra Bam!,True
@louisszeto31620000,2021-08-25T09:08:26Z,1,Josh can we have explanation on the fancy dimension reduction algorithm you mentioned in the video related to entropy up next.,True
@surendrabarsode8959,2021-08-25T08:24:37Z,1,This is the best ever explanation of entropy I have seen!! The real surprise is the totally innovative idea of 'surprise! Thanks with entropy of zero!!!.,True
@redcat7467,2021-08-25T08:07:28Z,1,"You know what is common between a gun and StatQuest? The both do BAM!  Basically, the concept I have reviewed maximum times. Still, watched the Quest.",True
@user-or7ji5hv8y,2021-08-25T07:57:49Z,0,"If we had to come up with another measure for surprise that still relates to probability, would it still be expressed in this formulation? Just wondering how much of it is design.",True
@mewdlez,2021-08-25T07:04:20Z,1,i am also surprised when i get heads,True
@shahf13,2021-08-25T07:00:48Z,1,YAY I have been waiting for a good explanation of entropy for a long time,True
@bjornnorenjobb,2021-08-25T06:46:44Z,2,"I love your videos, you make a wonderful effort for explaining difficult topics on a easy way. Huge thanks!",True
@work4ai,2021-08-25T06:32:50Z,1,Wow!,True
@shaz-z506,2021-08-25T06:26:32Z,1,"Wow! this is quit a surprise to see such a clear explanation on entropy, could you please create a future video on KL divergence also.",True
@wangsherpa2801,2021-08-25T06:26:13Z,1,World's best explanation. Thanks!,True
@notnilc2107,2021-08-25T06:08:00Z,1,Bam!,True
@eliotbehr5340,2021-08-25T05:56:02Z,1,You should make a shirt with statsquatch :),True
@RoRight,2021-08-25T05:54:09Z,1,I was NOT surprised by the high quality of this video given StatQuest's high probability of producing awesome videos.,True
@cls8895,2021-08-25T05:51:27Z,1,"WOW its SUPEERRR EASY and well explained!! I only had known about the entropy in physics, but now I can see the calculation way of the entropy. THANK YOU for your hard work for easy understanding from S.Korea!",True
@dvo66,2021-08-25T05:39:37Z,37,"best entropy explanation. I took a 500 level ML class last spring in my masters and this is better explanation than my prof(no disrespect to him, he is amazing too)",True
@eliyahubasa9401,2021-08-25T05:23:21Z,3,"Thanks, I’d been waiting for good explanation about entropy for a long time. Thanks :)",True
@Stop-and-listen,2021-08-25T05:17:52Z,1,The best of the best!,True
@EngRiadAlmadani,2021-08-25T04:53:26Z,0,Great work Just one question if we say entropy  =1 at this case thay are similar and when we decreasing the entropy the similarity decrease as well is that right??,True
@esorminihaz8269,2021-08-25T04:52:49Z,1,I was just reading about information theory on Wikipedia. What a surprise!,True
@thechhavibansal,2021-08-25T04:33:04Z,1,Thank you for explaining this concept so easily :),True
@lan30198,2021-08-25T04:25:42Z,3,"Fuck, I never understand about the entropy before watching this video, you are amazing",True
@tranquil123r,2021-08-25T04:23:20Z,7,Loved it. The best explanation I came across on Entropy. Thanks Josh!,True
@cambridgebreaths3581,2021-08-25T04:21:42Z,0,"Thanks Josh. Are surprise and surprisal ( Free Energy Principle) the same thing, statistically speaking. Thank you kindly",True
@luischinchilla-garcia4840,2021-08-25T04:18:57Z,766,This is quite possibly the best explanation of entropy I've ever seen. This is even better than Shannon's own paper!,True
@Erosis,2021-08-25T04:17:58Z,0,KL divergence would be awesome to learn about! They are used in VAEs.,True
@vaishnavi4354,2021-08-25T04:14:37Z,2,Bam! !! This is awesome  Kudos to you 🙇🙇🙇🙇🙇🙇,True
@VadexVx,2021-08-25T04:03:16Z,0,"Hey josh, can i request an explanation video about feature hasher? especially library from sklearn",True
@cat-.-,2021-08-21T07:29:03Z,1,I love the surprise explaination!!,True
@Shionita,2021-08-19T02:44:18Z,22,I feel so happy because I just learned something new thanks as always!! 😁,True
@deepakmehta1813,2021-08-18T19:18:29Z,76,"Amazing video on Entropy Josh. Thank you. I am certainly more addicted to statquest than Netflix.  I really liked the way you have introduced the notion of surprise, how you used it to pedagogically explain entropy.  It is certainly now easy to think and remember the definition of entropy.",True
