author,updated_at,like_count,text,public
@leesweets4110,2023-02-04T17:38:19Z,0,"5:30 The probability of something can be zero but it can still happen.  Take for example the probability of an infinitesimally thin dart hitting a specific point on a circular dart board. It is zero. But there is still a 100% chance of hitting some point in the circle, so no specific point is impossible.  If you want surprise to be zero at x=1 then why not just downshift?  S = (1/x) - 1. This achieves the same goal without the logarithm.  Im sure there are more complicated reasons for using the logarithm you did/nt go into (besides computational convenience, I mean), but surely an argument can be made that multiple conceivable definitions of entropy can be put forward, yes?  6:05 In general, what is the appropriate base of the logarithm?  Suppose I were computing the entropy of the probability distribution associated with a set of sample data that was collected empirically. Why would I use base 2 over the natural? Does it matter, is it relevant at all?  Its often implicit, but the logarithm does introduce another variable, the base, which many gloss over.",True
@vinodraman2423,2023-01-30T15:02:11Z,1,When you understand the concept just by looking at the 1/3rd of the video!,True
@luisbielmillan8467,2023-01-28T11:29:56Z,1,WOW,True
@zhelin927,2023-01-17T07:42:45Z,1,This is really really really sooooooo amazing!!!!!! THANK YOU SOOOO MUCH!,True
@yalcinbulut8948,2023-01-14T20:24:16Z,0,"Thanks for the great intuitive explanation. As far as I understand, surprise can be thought of as instantaneous velocity, while entropy is equivalent to the average velocity.",True
@dohasan5053,2023-01-12T21:14:33Z,0,can you please do a video on the Maximum entropy bootstrapping method please 🙏,True
@dohasan5053,2023-01-12T11:14:39Z,1,Hello! your videos are amazing and you do a great job in simplifying such difficult concepts and making them easier to understand. Thank you so much.,True
@data_kai,2023-01-06T16:39:01Z,1,"Dear Josh! Unfortunately, the following video is blocked in Germany :( Could you please have a look into it? Thanks so much for your extremely hard work! <3 ""The Main Ideas of Fitting a Line to Data (The Main Ideas of Least Squares and Linear Regression.)""",True
@ryanperkins1525,2022-12-26T04:03:29Z,0,is Surprise log2 or log?  at 11:58 you seem to change them?,True
@TheParkitny,2022-12-25T08:53:00Z,2,If only text books explained things this way. Life would've been easier as an undergrad.,True
@edip_c,2022-12-22T13:09:55Z,0,🙇‍♂️,True
@mohammadidreesbhat1109,2022-12-22T10:47:41Z,0,Probability of tossing a coin three times and getting HHT is 1/8 = 0.125 How come it is 0.9 x 0.9 x 0.1,True
@alphatradingvol,2022-12-20T17:14:37Z,0,Entropy is one of the greatest piece of information when used properly for certain things.,True
@TShrimp,2022-12-19T13:06:23Z,1,That explanation was so freaking awsome.,True
@pietronickl8779,2022-12-19T09:50:13Z,1,"Thanks for these super clear explanations – you really manage to break down complex concepts till they seem simple and (almost) intuitive. Also really appreciate the pace, ie the patience of going step-by-step and not making any crazy leaps 2 mins to the end 👏👏👏",True
@TheArrogan,2022-12-18T23:24:27Z,0,This only explains the formula on the paper. It helps you memorize the formula. Unfortunately it gives no intuition entropy reveals.  I appreciate you can talk more about “surprise”.,True
@itugamayotaner4036,2022-12-18T00:00:19Z,1,"""Calculate the Entropy of the chicken"" 😁 Who knew you could have fun and learn at the same time as an adult?  I love this channel.",True
@qZoneful,2022-12-17T16:50:13Z,1,"I am a biology student who is trying to understand the entropy concept for my species distribution models, and I choose to believe that this video uploaded from heaven with the consensus of all the passed statisticians",True
@johnlu7655,2022-12-17T02:50:08Z,0,I'm a bit confused. I think 0.9*0.9*0.1 is not the possibility of getting two heads and one tails: it's the possibility of getting just the last one tail. Isn't the following deduction built on this?,True
@leassis91,2022-12-12T11:52:57Z,1,"this is gold, bro. one of your best videos",True
@herojedrus2567,2022-12-10T13:16:44Z,1,we need to understand what surprise is.... so lets talk about chickens xd that made me laugh so hard,True
@veeek8,2022-12-08T15:25:57Z,1,Thanks,True
@conan-thelastbarbender,2022-12-04T19:15:17Z,1,Triple Bam indeed Josh!,True
@shaporovanatalia6805,2022-12-01T21:20:23Z,1,amazing ! thank you!,True
@brokenmachine9207,2022-11-29T05:56:30Z,1,BAM 🔥🔥,True
@mikeshinoda2806,2022-11-23T06:12:48Z,1,slow video but good content!,True
@Arm-if2yz,2022-11-21T16:35:37Z,1,Less than 20 minutes to well-understand a topic than i took hours to vaguely understand,True
@whatitmeans,2022-11-20T07:25:34Z,1,"Amazing video... but the reason of the use of logarithms is much deeper, related with the meaning of what information really is. I highly recomend you to read the paper ""Transmission of Information"" (1927) by R. V. L. Hartley",True
@SowrabhAdiga,2022-11-12T09:53:17Z,1,You sir are an ideal math teacher !!,True
@sade922,2022-11-11T16:39:07Z,52,9 minutes of your video explained everything better than 2 hours of my professor giving a lecture... Thank you!!!,True
@danielpaul65,2022-11-09T07:09:08Z,2,Starting the video with a message declaring that we can understand Entropy is the best starting line I have ever seen from any teacher in my life. Great work!!!,True
@veenapanini2253,2022-11-08T10:16:07Z,1,Thanks a ton!,True
@sofilove...20,2022-11-06T10:04:22Z,1,Thanks a lot..I mostly fall in lovE with log(s):)(:,True
@jnico7,2022-11-01T13:22:15Z,1,Very easy to understand thanks you !!!,True
@amourzombie,2022-10-31T19:45:05Z,1,Triple BAM!!!,True
@sandeepmishra3275,2022-10-31T10:37:01Z,0,Do we have to take the modulus of surprise as I think you did not take the negative value for consideration and just wanted to ask what does entropy actually say.,True
@randomyoutubeaccount6906,2022-10-26T17:23:50Z,0,How do you do this with a calculator?,True
@randomyoutubeaccount6906,2022-10-26T17:01:02Z,0,when/how is Log used? like the calculator button? I got kind of lost after calculating for S,True
@_________________404,2022-10-25T22:58:10Z,1,Finally something that makes sense. The theoretical CS university course only showed the equations without trying to explain what they mean.,True
@korkutkaynardag9147,2022-10-25T18:35:03Z,1,"after my parents, I love you the most in the world.",True
@johnyf.q.8043,2022-10-22T14:29:13Z,0,"I've got to say, this is a good video (upvoted) but I definitely feel the need to add a note. This example of n=3 coin tosses must be taken for the specific outcome of one head, followed by one head, followed by one Tail, P(HHT) = .9*.9*.1, because the probability of having two tails and one head is of 0.243 (or 0.081*3) which can be confirmed by a binomial distribution or a tree diagram. Maybe it was just me, but I had some issues watching the video the first time.  If I got the point made in the video correclty, the P(2H, 1T) would have an entropy equal to log_{2}(1 / 0.243) ≈ 2.041.",True
@duongphanai7094,2022-10-22T10:35:43Z,1,15:47 LOL,True
@nagainu,2022-10-21T15:15:52Z,1,First time i see a medium bam and it was amazing,True
@bagavathypriya4628,2022-10-20T14:57:37Z,3,You are the BEST teacher !! Thanking God that you exists.,True
@yakubsadlilseyam5166,2022-10-19T17:23:48Z,1,It's amazing 100% clear,True
@_justinxu,2022-10-18T08:26:43Z,0,I don't expect this ,True
@LaranjaAcid,2022-10-16T14:08:44Z,1,Valeu!,True
@hosseineyvazi3122,2022-10-16T10:14:00Z,1,"great , bro",True
@okohmiracle1002,2022-10-15T19:23:14Z,0,"Hello Josh, this is an amazing video. Thank you very much. please, how did you arrive at 0.9? Do you have a video on probability? I would like to learn how you split the 0.9, 0.9, and 0.1 on the head, head, and tail.",True
@rafirafi5919,2022-10-11T13:56:06Z,1,Very Well Explained,True
@amisadaisanchez1897,2022-10-10T01:58:33Z,1,"Best video ever, never saw entropy that way.",True
@master_zenrade,2022-10-08T14:19:52Z,1,Aware! So much surprises can give you heart attack.,True
@jaysonl3685,2022-10-07T02:07:10Z,2,"Absolutely amazing and intuitive explanation Josh! I couldn't have understood it without you, huge thanks :D",True
@_bohemian2778,2022-09-29T00:55:14Z,1,Nice ❤,True
@sjungbae,2022-09-28T04:22:33Z,1,영어 설명이지만 이해하기 쉽네요.. 고맙습니다.,True
@baharehbehrooziasl9517,2022-09-26T19:42:30Z,0,Thank you for the very clear explanation as always. What is the application of this concept in machine learning?,True
@devrus265,2022-09-26T14:55:13Z,1,This is by far the best explanation I heard on entropy.,True
@sanjaykrish8719,2022-09-25T13:59:12Z,1,Thanks!,True
@docteurlambda,2022-09-23T17:46:43Z,1,BAM,True
@phucnguyenthanh9223,2022-09-23T03:53:52Z,1,Better than my master course. Thank you!,True
@qingfangliu4687,2022-09-21T21:11:04Z,0,Do you have a recommendation for understanding mutual information and KL-divergence along this way?,True
@chetankumarnaik9293,2022-09-18T03:31:34Z,0,Why can't we just use 1-p to calculate surprise why take the inverse,True
@salahamani9619,2022-09-12T14:27:15Z,1,Thank you  for the amazing explanation !,True
@ryanyu512,2022-09-10T02:57:54Z,1,"Really thanks for your crystal clear explanation! When I need to learn something about statistics/machine learning, I search ""xyz, statquest"" in the first place!",True
@Ali-wf9ef,2022-09-05T15:20:25Z,0,"Such a good explanation. So entropy shows how balanced a distribution of data is, if we have same amount of data from each value the entropy is 1 and it decreases when there is imbalance between amount of each value correct?",True
@user-pz9bg4sb7n,2022-09-05T10:47:37Z,1,"really thank you , that was too helpful❤❤✨✨",True
@teodorskerimovs4300,2022-09-04T20:27:55Z,1,Insanely good,True
@crampedspacebrew,2022-09-02T20:10:58Z,1,Your videos rule. That is all.,True
@nicolasparis7518,2022-09-02T13:01:14Z,1,"What a freaking genius man. If we'd all had such explanations from school, Elon Musk would be just a normal guy ;)😉",True
@lowerlowerhk,2022-08-28T14:07:25Z,1,Excellent explanation ane the jokes are so lame that it's funny!,True
@jacobmoore8734,2022-08-14T20:34:12Z,0,"For continuous variables, if entropy is still an appropriate idea, I assume we use likelihood (because P(X=x) => 0). I imagine that a monte carlo simulation is easier than analytically evaluating the integral.",True
@this-is-bioman,2022-08-14T12:10:51Z,0,"Let's say I get it, but why do we need it in machine learning and how does entropy helps us with anything?",True
@jonascoelho,2022-08-13T03:28:11Z,1,It would take me years to understand this if it were not for this video,True
@ninjackk,2022-08-12T08:19:33Z,1,Super great ! thanks a lot for your video !,True
@achyuthnandikotkur5647,2022-08-11T09:28:38Z,1,BAM!,True
@vunguyenthai4366,2022-08-11T06:18:41Z,1,"Nice video, thank you for your contribution.",True
@ashutoshpanigrahy7326,2022-08-09T06:19:55Z,1,WoW!,True
@lauro199471,2022-08-08T03:24:34Z,0,I know this sounds silly. But why do we multiply expected value and surprise instead of adding them together? What is the intuition of when to add or multiply values?,True
@ralphchien184,2022-08-03T09:07:39Z,1,This is the most excellent explaination that I have ever seen. Impressive! Impressive! Impressive! Three times I must give. Thanks a lot!,True
@rangjungyeshe,2022-08-02T20:05:38Z,1,"Fantastically clear explanation of a notoriously tricky subject. Apparently Johnny Von Neumann told Shannon to call his measure of information entropy, since “no one really knows what entropy is, so in a debate you will always have the advantage.” I suspect J V N wouldn't have said that if he's known about your video...",True
@namesurname1040,2022-08-01T23:35:51Z,1,It was just amazing .Thank you for that video!It really helped me.,True
@tamirrozenfeld3572,2022-08-01T06:13:22Z,1,thank you !,True
@bimoindracahya1124,2022-07-31T08:46:16Z,1,love the intro,True
@alialthiab7527,2022-07-27T22:19:50Z,1,You are awesome. I finally understood the entropy concept without any equations. Big love😍,True
@Akshay-vq1uv,2022-07-27T16:52:07Z,1,Thanks!,True
@Akshay-vq1uv,2022-07-27T16:49:04Z,1,please turn on donations from google pay! You have helped me more than my teacher ever tried,True
@ignacio-urbina,2022-07-24T21:49:54Z,1,This is great. Thank you!,True
@user-pk6pd8oy2o,2022-07-22T17:57:25Z,1,Best explanation ever,True
@nossonweissman,2022-07-22T02:46:33Z,0,"Correction: 6:43, I think you mean to say ""P(HHT)"" and not ""two heads and a tail"", which is equivalent to ""P(HHT) + P(HTH) + P(THH)""",True
@litttlemooncream5049,2022-07-20T09:00:54Z,1,chickens yyds,True
@fichardreynman4944,2022-07-19T16:46:44Z,1,"Just, SO GOOD.",True
@saichandsharma4162,2022-07-16T18:38:54Z,0,"What is the use of entropy? If entropy is used to check the imbalance of classes in dataset, then why can't we just calculate the count of examples in each class?",True
@arieljiang8198,2022-07-15T19:54:54Z,1,THE BEST video about entropy,True
@arieljiang8198,2022-07-15T19:53:31Z,1,StatSquash is sooo cute,True
@trashantrathore4995,2022-07-14T18:40:47Z,1,"This Content is GEM to any learner studying these topics, Thank u Whole Team of ""STATQUEST with Josh Starmer"" for making such a Great channel and awesome videos that have explanation of what even a 10th Class student can easily Understand. 🙌👏",True
@Ra-pt6tx,2022-07-14T07:44:41Z,1,So intresting,True
@uchungnguyen1474,2022-07-10T17:46:24Z,1,Bam!!! this guy know how stupid i am to teach me that clear!!!!,True
@dimpap9659,2022-07-10T14:59:29Z,0,Now this also makes perfect sense https://www.youtube.com/watch?v=NsLKQTh-Bqo&ab_channel=rawuncutvines,True
@adirozeri7162,2022-07-03T06:23:28Z,0,Thank you for this amazing explanation! I’ve been coming back to statsquest for the past five years now and it is amazing! thank you so much but I do have one question tho.  At 09:00 -“Now we can add the two terms together to find out the total surprise.”  I’m trying to understand if you are trying to calculate the surprise for getting tales 100 times out of 200 times of coin flip. In this case shouldn’t you divide by 200?,True
@mackr1581,2022-07-03T05:55:35Z,1,Your contents are awesome. Hope to finish all your contents in ML playlist. Will comment once again when I finish this playlist.,True
@marioadiez,2022-07-03T00:36:21Z,1,"I understand, so will buy my own guitar, and compose a beautiful Hooray song!",True
@gianlucalepiscopia3123,2022-06-30T16:41:11Z,1,"The name is Josh, Saint Josh",True
@mohammedlabeeb,2022-06-29T08:06:27Z,1,Really Great video. Right to the point. I met with one of my coworker who is very seasoned in Data science to help me work on a project and use entropy for the first time. After one hour I was as confused as I could be. But this video really helped. I wish if I saw this video before I had my meeting.,True
@AndreiSAA,2022-06-26T13:37:15Z,1,Amazing explanation! Bam! THANK YOU SO MUCH!,True
@Regular.Biceps,2022-06-25T11:10:34Z,0,1. How to determine the probability of an event before punching that into the formula?  2. What if the probability that we are using is a continuous variable? It changes with the change in dynamics of the system ?,True
@nikhilgupta4859,2022-06-24T18:13:06Z,1,"Heyy Sir, I am your subscriber from past 1.5 year and I feel honoured to tell you, after following you I finally got a job transition as a senior data scientist at an MNC 6 month back. Now I have understood the datascience project ecosystem in my company. You are one of the contributors for my success. Thanks a Ton!!!!!  Also I would like to open my hands for helping learners. So learners you can tag me asking any doubts. I would be more than happy helping you.",True
@tomashernandezacosta9715,2022-06-22T09:50:16Z,1,This is THEE single BEST explanation for Entropy that I have ever heard. After this video I bought your book instantly. TRIPLE BAM!!,True
@tianyiluo0105,2022-06-19T15:44:44Z,2,This is a great explanation! Thank you Josh and StatQuest!,True
@iannemo1736,2022-06-18T14:17:36Z,0,15:50,True
@lorenzologiudice3147,2022-06-15T07:37:18Z,0,6:31 log(1/0.9) is 0.105 not 0.15 and log(1/0.1) is 2.30 not 3.32 (btw great video :D),True
@luisalejandrohernandezmaya254,2022-06-13T04:23:18Z,1,I feel surprised as I expected.,True
@torosalvajebcn,2022-06-12T16:53:57Z,0,Great video. Will you make one about the link between entropy and information theory?,True
@zavar8667,2022-06-10T15:54:31Z,0,"Okay, but why the log function?  It is not a constructive argument to show that the log function has all the desired attributes (as my math notes introduced the formula). I'm looking for an explanation where someone sets out the goal to measure some well-defined quantity like in physics (I believe in physics there is a similar concept with the same name) and show the thought process that concludes in using the log of the probabilities. Could you help me out?   PS.: I love your videos, good job, thank you!",True
@KleineInii,2022-06-09T12:47:52Z,1,"Thank you so much for sharing this great explanation with us! I stopped the video after you derived the formula and then derived it again on my own. Makes so complete sense!!!  I am giving a talk at a conference in 2 weeks, and in my presentation there is a formula using mutual information. I was asked to explain this in my pratice presentation and was not able to. Now, after seeing your video, I am so clear about the concept of entropy and feel much more confident when I need to explain it :)",True
@SushilKumar-dr9rj,2022-06-08T19:19:43Z,2,"I have been following your channel for a very long time now. I know that the probability that you will create kickass content is 1. Yet every time I see new content on this channel, I am hugely surprised. Guess there are some things that even Maths can't explain.",True
@himeshkoli8607,2022-06-08T10:54:40Z,0,"Just wanted to ask what will be surprise in ""ML terms"" in general in decision trees? Is it uncertainty?",True
@yawkool596,2022-06-08T03:21:41Z,1,Thank you so much. The feeling of discovering a new world. Bam.,True
@paungchandal2788,2022-06-07T18:41:50Z,1,"very good explanation, appreciate much for your enlightment",True
@joaovitordeon3245,2022-06-07T12:56:10Z,1,"Nice, nice, nice!",True
@nuranichandra2177,2022-06-05T00:00:17Z,1,Amazing explanation of the most mysterious term - entropy!,True
@marioadiez,2022-06-03T15:21:30Z,0,"I've started here for the songs, and now I see a lot of people coming and making me bang questions...",True
@paulkosmala2730,2022-06-02T20:04:13Z,0,so at 5:32 i see this picture and I'm staring at it...  given a flipping of a coin - with the mere existence of the tails side - how can we assume log(1/1) is even valid...  in other words - is it proven that bits can be 'stuck' and never flip? I think that very premise is suspect. can certainty exist - can a bit always be 1 - and if so - is it (by definition) a bit?  given a coin and 100 attempts - if it lands heads every time you can say for certain it lands on heads every time... but if you flip it: that process (flipping) is some amount of certainty removed from the system.,True
@kevalan1042,2022-06-02T11:18:36Z,2,"You had me at ""let's talk about chickens""",True
@MLDawn,2022-05-29T20:37:57Z,0,"By the way, at 12:05, I am not sure p(x) should be defined as probability of surprise! It is the probability of a given outcome x, which will then be multiplied by the surprise of having such an outcome.",True
@sharatsidis3425,2022-05-28T16:35:47Z,1,"it was so easy? thanks for the video, best explanation",True
@muskanmahajan04,2022-05-24T05:12:55Z,1,By far the best explanation I've seen. You are a true saviour.,True
@MLDawn,2022-05-21T21:42:23Z,1,Great video! I had posted a question earlier but by the end of the video you explained it :-). Thanks a lot!,True
@ArmanAli-ww7ml,2022-05-14T01:47:01Z,1,I can’t thank you enough for your efforts and the way of teaching,True
@hansenmarc,2022-05-13T00:39:51Z,0,"Expectation of surprisal is a fascinating concept.  So if the probability of being surprised is 1, then the entropy for twist endings in M. Night Shyamalan movies is 0.   Bam?",True
@jongcheulkim7284,2022-05-12T10:12:32Z,1,Thank you so much,True
@abdilive3023,2022-05-11T19:30:52Z,2,"Ever best explanation, thank you!",True
@GiasoneP,2022-05-10T02:45:53Z,1,Orange chicken… I just ordered some Chinese.,True
@user-nt6rm2cd6k,2022-05-10T02:39:57Z,0,應該要再舉例 三種顏色的雞,True
@sukursukur3617,2022-05-07T23:12:37Z,0,"Imagine you have a raw set. You want to build a histogram. You dont know bin range, bin start and end locations and number of bins. Can ideal histogram be built by using max entropy law?",True
@ahmednagi7074,2022-05-07T22:59:29Z,1,u just killed it,True
@statquest,2022-05-07T18:25:06Z,37,Support StatQuest by buying my book The StatQuest Illustrated Guide to Machine Learning or a Study Guide or Merch!!! https://statquest.org/statquest-store/,True
@DubZenStep,2022-05-06T21:15:39Z,2,The world needs an army of people like you man. This explanation is outstanding. A triple bam.,True
@krushnakantbabhale6161,2022-05-06T04:11:30Z,0,The natural tendency of a system to be get disordered(surprised) is entropy,True
@heliosobsidian,2022-05-03T19:00:23Z,0,Thanks for this such a 100% understandable explanation!  May I know what is the log base in other number of output?  Let say the something occur in a whole week.,True
@pbawa2003,2022-05-03T18:03:18Z,5,"this is most simple way to explain Entropy, way to go Josh, love your videos !!!",True
@forresthu6204,2022-05-03T01:38:16Z,1,Thanks,True
@forresthu6204,2022-05-03T01:37:36Z,1,This is the BEST version of the explanation about entropy.,True
@Xcalator35,2022-04-30T23:10:38Z,1,Wow!! You're amazing!!! You are capable of explaning complex stuff like this as if it was concieved to a 8 year old...and that's PRECISELY how I want things explained to me!!!,True
@tooljerk666,2022-04-28T19:52:20Z,0,"Thanks for the video. In Data Science/ML, is the goal to lower entropy to we can make accurate predictions, or is entropy potentially a good thing, indicating we found something completely surprising in our data? Or does it just depend on the problem at hand?",True
@jsmdnq,2022-04-27T18:09:49Z,0,sum(plogp) = log(prod(p^p)),True
@skbanerjee6909,2022-04-27T15:25:42Z,1,Excellent!,True
@rmcgraw7943,2022-04-27T08:32:26Z,1,Found it.,True
@danieltrivino6736,2022-04-26T14:35:12Z,1,Best explanation ever!,True
@MrCracou,2022-04-25T13:11:44Z,0,Hello. I have a problem at 13.36 as we move from log (base e or base 10 depending on the language) to ln with base 2 in the second line.... and it's not (exactly) the same thing. Who can explain?,True
@gustavderkits8433,2022-04-25T00:38:15Z,0,The statement “it is customary” is a much worse argument for log base 2 than the fact that you are flipping coins.,True
@Regular.Biceps,2022-04-22T20:36:12Z,0,"If there are more than two outputs, say three, shall we use log3 ?",True
@Regular.Biceps,2022-04-22T06:07:58Z,1,Man you're the best,True
@wong4359,2022-04-18T16:59:04Z,0,It is really log(1/probability)!,True
@michaelzavin969,2022-04-05T06:23:18Z,1,Just wow !  i've watched my prof's lecture (1.5 h long) 3 times and did not understand anything  and here you come with 15 minutes long video and BAM and medium BAM !! and I finally got it  THANK YOU!!!,True
@markoconnell804,2022-04-04T20:09:39Z,1,This is cool!,True
@markoconnell804,2022-04-04T20:02:11Z,0,So now I need to learn what log is.,True
@pianisteddy,2022-04-04T17:12:10Z,0,"The bams sound pretty awkward, but the content is real nice. Thanks for the video!",True
@TheOnlySaneAmerican,2022-04-04T05:34:16Z,0,"at 4:32, Isn't the probability of getting another heads .5? If so then the inverse would be 2?",True
@jimmylander2089,2022-04-03T14:03:27Z,1,This video is a HUGE BAM!!!,True
@CC-px1xv,2022-03-31T01:03:50Z,1,The best video on entropy!!!,True
@wanmei_xiatian4977,2022-03-27T19:37:48Z,2,Thank you and BAMBAMBAM!!!,True
@cdvs100,2022-03-27T19:05:03Z,1,Excelente!!!!!,True
@StephenHsiang,2022-03-23T16:06:13Z,1,This is a sort of ephiphany to me.,True
@ais3153,2022-03-21T06:53:57Z,1,You are GREAT! Thanks a million,True
@jorgelinasassera1884,2022-03-19T16:06:23Z,1,Thank you so much! I know nothing about stats and I undertood!,True
@ahmrh,2022-03-19T01:02:18Z,1,"better than my professor lmao, thank you so much",True
@machater1001,2022-03-17T13:55:53Z,1,Thanks for another great video. Can you look into getting some StatSquatch merch for your store? I'd love to be able to purchase some.,True
@snapfinger1,2022-03-17T12:30:23Z,0,Things fall apart.,True
@vahidnikoofard2939,2022-03-15T02:07:22Z,1,The best ever explanation of entropy!!!,True
@hkhademian,2022-03-12T10:14:25Z,1,I 1/log(prob)ed when I saw this high quality content,True
@joyageuse,2022-03-11T20:13:38Z,0,"Thank you for the easily understandable video!  Just a quick question: at 12:14, is the label for P(x), ""the probability of each outcome"" instead?",True
@mishmohd,2022-03-11T11:27:30Z,1,UUUUUGH 😩,True
@tiago9617,2022-03-11T08:40:06Z,1,I can't understand how it's possible to be so good at teaching something,True
@code_tuner,2022-03-09T08:26:04Z,1,ohmygod this is so clear!!!!!,True
@AtiqurRahman-uk6vj,2022-03-05T09:56:02Z,33,"Your self promotion is not shameless, it a gift to humanity. Free content that explains way better than paid content on Coursera. Thanks for helping out poor guys like us Josh",True
@SonSon-rq5dj,2022-03-03T09:41:24Z,1,"Solid video, solid explanation. Best channel out there for your data mining needs",True
