author,updated_at,like_count,text,public
@mmaroti,2022-03-02T20:04:25Z,1,"You have just explained ""entropy"" in terms of ""surprise"". The entropy is the average number of bits you need to encode an element from a distribution. Fractional bits are not really a problem, but you can encode 1000 elements with Huffman encoding, and you get an approximation.",True
@ostanin_vadym,2022-03-01T20:30:03Z,1,Thanks for the content,True
@lucavisconti1872,2022-03-01T20:17:41Z,0,That's indeed a very clear explanation.Can entropy be used to retrieve missing information from a set of data? how?,True
@azamatbagatov4933,2022-02-27T22:34:37Z,1,I am surprised how easily understandable entropy is! Thanks!,True
@delzosmith9240,2022-02-27T12:30:03Z,1,I really like this thanks. Short and simple and easy to follow. New subscriber and a like :),True
@shilashm5691,2022-02-26T08:01:58Z,0,"At 12.11 is it a mistake ?, you used the word probability of suprise,  it is probability of outcome ryt?",True
@ronaldjohnson7449,2022-02-25T14:23:43Z,0,enthalpy vs entropy ... order vs chaos,True
@eddiechen6389,2022-02-24T22:31:06Z,1,Your video is million 💥 bam,True
@davids3477,2022-02-22T19:37:58Z,1,"great video, thanks!",True
@kaushaljani6769,2022-02-22T18:15:05Z,1,Bam!!! Hats off man that was the easiest explaination i ever come across... Thanks for making such kinds of tutorials.,True
@kebman,2022-02-22T17:23:22Z,0,How would you translate this to a Markov chain?,True
@pushpakkothekar9271,2022-02-21T05:03:59Z,1,"Awesome explanation, liked + subscribed done",True
@anibaldk,2022-02-21T02:18:28Z,1,Priceless channel for anyone interested in statistics. Just BRILLIANT.,True
@AbCd-fo6ys,2022-02-20T22:08:47Z,1,"you are amazing, thank you a lot",True
@CellRus,2022-02-20T17:56:21Z,9,"Absolutely amazing. I always come back to your videos from time to time for simple (but absolutely useful) explanation of complicated concepts that I found in papers. They all have helped me a lot, and I feel I'm better at communicating these concepts to other researchers too.",True
@lezaroo,2022-02-20T05:18:42Z,1,Awesomeee!,True
@arkabose89,2022-02-20T02:09:50Z,0,"Thank you for this video. However, is there any video that explains the use case for this quantification of surprise? Would be great if you can cover that",True
@sheng-peichen3767,2022-02-19T07:05:53Z,1,"Hat off to you, sir.",True
@3g1991,2022-02-18T16:34:10Z,1,Beautiful.,True
@franky07724,2022-02-18T01:24:37Z,1,"Genius ... concept, equation, and explanation.",True
@angryworm80,2022-02-17T23:12:13Z,1,Awsome!!!! 👍🏻,True
@reidflemingworldstoughestm1394,2022-02-17T06:52:21Z,0,"Hey stat guy, I have an interesting problem you might be able to help me with. We have a game with an S sided die, no numbers, all smooth white faces. We color one face black and roll. If we get a black, we stop rolling. If we get a white, we color one more face black, and roll again. This pattern continues until the S-th roll when every face is black and rolling a ""stop"" is guaranteed.  What I want to find is an equation I can plug the number of sides into that will give the expected number of rolls, on average, it will take to roll a black side.  I have an equation for the probability of rolling a stop given which roll I'm on, and a summation of that expression from 1 to the kth roll. I made a noodler for it on that calculator web space, name of (visual cues here against the possibility that youtube will axe the outright spelling of the name) DESert MOSquito, with the word sdgp1yrrg8 to be pasted in the calc addr bar.",True
@wcottee,2022-02-15T21:07:44Z,0,What if we had a single die with 6 possible outcomes?...do we use log base 6 instead of log base 2?,True
@sdsa007,2022-02-15T07:38:39Z,1,"OMG! finally, Entropy! CLEARLY EXPLAINED! The Nobel BAM! prize is to be rewarded!",True
@zhafranp8639,2022-02-13T15:51:10Z,0,"i have 45 output, does the log base stay the same or change to 45? thank you",True
@ajokaefi,2022-02-13T13:41:58Z,1,"Josh, voce e o cara! ... (meaning: you are ""THE MAN"")",True
@dystopiaseven,2022-02-13T07:59:10Z,1,oh,True
@mattizzle81,2022-02-13T01:27:40Z,0,"As not so much of an information theory wiz I got a first-hand taste of this. I wanted to try creating a machine learning model that can predict input colors and mixing percentages for a given paint color. It does not work with a machine learning model like xgboost. xgboost could model the mixing algorithm just fine, but the inverse, unmixing I found is impossible without a brute force search. Entropy. lol hence why I searched this video",True
@becayebalde3820,2022-02-12T19:18:38Z,2,"If you were my mathematics teacher, man I would have loved maths so much",True
@monazaizan947,2022-02-12T06:04:03Z,1,This explanation is amazing. Thank you so much!!,True
@adancastro2220,2022-02-11T17:56:36Z,1,"Excellent video!  You made it again fellows! it just log(1/P(x)) me that i understand it after a couple of years trying, Thank you sincerely!   😄",True
@eduardovenegas782,2022-02-11T09:47:17Z,0,"Sorry but that ""bam"" thing its really hard to accept... it annoying",True
@grahamhenry9368,2022-02-08T07:07:16Z,0,Why not just use 1-Probability as the surprise? The surprise seems like an arbitrary value as it doesn’t have an upper limit,True
@emmydistortion3997,2022-02-08T07:01:44Z,36,Awesome world-level teaching... Thank you!,True
@oldcowbb,2022-02-08T02:32:03Z,0,took me too long to finally understand what this magical entropy is,True
@markbanash921,2022-02-07T05:00:23Z,1,This should be included in every class on statistical mechanics.  It makes the equation on Boltzmann's grave obvious,True
@ChocolateMilkCultLeader,2022-02-07T04:09:35Z,1,Baaammmm,True
@chyldstudios,2022-02-06T10:53:58Z,1,This video surprised me ... about 0.7.,True
@pomfrittbroccoli,2022-02-05T17:37:53Z,1,Very entertaining! Thank you!,True
@jonathanrockhill6039,2022-02-05T16:01:59Z,1,Major bam!,True
@mayurmulik1647,2022-02-05T14:09:30Z,1,"First time in my 25 years of life so far, I understood entropy.............",True
@pramodkhatiwada6189,2022-02-02T12:34:19Z,0,"After understanding the math behind the entropy, it makes sense to know who derived it and when!  Thanks for the explanation.",True
@mail2valan,2022-02-01T17:59:22Z,2,"Hey, thanks for a great explanation. Quick question: my dataset has a target that has 3 different states. So as per the explanation you gave at around 6 min mark, should I be using 3 as the base of log function while calculating entropy?",True
@nashaeshire6534,2022-01-31T09:52:11Z,0,"Help me a lot for my Data Science Master.  When I'm stuck in some lecture, I alway take a look at your chanel and hope for the subject to be here. Thanks a lot!  I'm actually stuck about calculating Intrinsic Dimension, like: Suppose A={0,1,2,3,…,25} What is the asymptotic intrinsic dimension of A?  I really appreciate some help or some lecture (I'm pretty sure this problem concern so few people than you'd probably won't do a video about it).  Best,",True
@hunortotbagi,2022-01-30T09:39:23Z,1,Brilliant explanation! I'm blown away :),True
@chaitu2037,2022-01-28T18:58:27Z,1,"""This is by far the best explanation for entropy that I have ever come across"", thanks so much!",True
@shrankhlapandey263,2022-01-24T17:50:53Z,1,BAM! got the entropy! 😎,True
@gianlucalepiscopia3123,2022-01-22T14:56:56Z,1,Bam is the sound of the hit I give to my head for not having known you before,True
@ichimatsu8422,2022-01-18T21:04:40Z,1,The absolute GOAT when it comes to stats on youtube,True
@boyemarc-antoine7027,2022-01-18T16:55:48Z,1,last joke is just so FUNNY ! great job i love ur serie,True
@sandraviknander7898,2022-01-12T10:24:42Z,1,"Next “surprise”  party I’m going to instruct everyone to yell log of the inverse probability instead of the traditional surprise.  Great explanation as always, thank you Josh!",True
@monoarul_islam_3,2022-01-11T08:07:37Z,1,I haven't finished the video yet. But seems like even a 5-years old kid will understand this thing at ease. I'm sure your dad's influence has a bigger role in making you this much cool.  Time for me to learn Machine Learning :3,True
@olegkazanskyi9752,2022-01-05T00:00:52Z,1,This is a purely amazing explanation. Bravo!,True
@libertyrosevengeance7471,2022-01-04T21:59:02Z,1,"Lovely intro, the content is great too!",True
@victornyabutiongera709,2022-01-02T21:22:14Z,0,Thanks 🤩,True
@pradyumnagupta3989,2021-12-29T18:31:42Z,1,Awesome awesome video. The best explaination of entropy I have seen so far!,True
@jinyunghong,2021-12-28T19:19:14Z,2,The best explanation of entropy! Thank you so much as always :),True
@Asdun77,2021-12-26T18:52:27Z,1,"God bless you, it's really great video .",True
@tommymerelte4399,2021-12-16T03:06:19Z,1,Jesus you don't know how much this helped me,True
@patturnweaver,2021-12-14T22:02:21Z,1,awesome explanation,True
@cristianofroes4681,2021-12-14T14:52:09Z,1,"Hello from Brazil, thank you very much for this (the best so far) explanation.... I really impressed how simply you do the hole thing. Keep going.... Good Bless you.",True
@GokulAchin,2021-12-11T05:34:13Z,9,"Please give Josh a nobel prize for not getting a single dislikes in many of his videos and for his contribution to the ML , Stats community. I have to forgive myself for not finding this channel way before when i started my interest in data science. You are definitely inspiring me to teach many people the same content you taught us.",True
@hajarhajar8906,2021-12-08T15:10:47Z,1,This guy is a life savior!!!!!!!!!!,True
@doot2359,2021-12-05T15:22:50Z,1,*BAM!* You explained much better then Shannon him self. Hir is a like and a sub from my heart *DOUBLE BAM!*,True
@bacnguyenkhac154,2021-11-29T16:13:38Z,1,"Oh BAM, the way you explain is so interesting and easy to understand ! Thank you, Mr. BAM !!!!",True
@rwamux6882,2021-11-29T08:22:33Z,1,You make learning fun. Subbed immediately,True
@emsdy6741,2021-11-23T23:40:36Z,1,"DOUBLE BAM! Thanks for the video. I liked how you derived the formula of entropy, and now it is easier to understand.",True
@mothehs,2021-11-12T11:32:09Z,1,"Hey Josh,  You are literally the man, Can I get a whoop..whooop. Or a Bam!!!!!! hehe.",True
@antibioticsOfWorld,2021-11-12T00:18:32Z,0,Superb explanation  Just one query . While doing that coin thing the surprise for 100 coin flips and getting head is just 0.15*100 right ? Y did u multiply probability as well ? ...  Bcoz while doing for 2head and 1tail example u just added their surprise values thats 😅 ..may be i am missing something,True
@lourencopintodasilva4321,2021-11-09T14:49:57Z,1,Best explanation about something I've ever seen. Just subscribed the channel,True
@K17LL,2021-11-07T16:06:11Z,1,OMG - Now I get it! :D  Huge thank from Germany :),True
@neuodev,2021-11-07T08:54:01Z,1,"Thanks, Josh for this clear explanation!!. Also you have a migical ability to simplify math!!",True
@BhanudaySharma506,2021-11-06T05:30:17Z,0,"So, Basically, Entropy of some event is ""How uncertain we are about the results"".  More certainty of the expected results, lesser the entropy of the system.",True
@user-ui5rx9hg9r,2021-11-03T03:48:15Z,0,mark,True
@danielmcleod6535,2021-11-01T21:34:39Z,2,"Hi Josh, you're always my go to for stats videos. Thank you, they're amazing. Would love to hear you talk through chi squared? I couldn't see anything on your channel thus far on it.",True
@haya4895,2021-10-31T18:24:15Z,1,phenomenal explanation,True
@wanderingseeker2932,2021-10-30T13:29:14Z,1,hoooraayyyy!!!!!!!,True
@pacco2012,2021-10-30T00:39:24Z,1,wow! your explanation saved my butt big time! probably the best one on this platform,True
@ojithmagamage1809,2021-10-29T16:40:50Z,1,Thanks sir!,True
@XuankangLin,2021-10-28T05:05:10Z,1,"Thanks soooooo much, for my life I have never understood entropy so clearly!",True
@alecvan7143,2021-10-26T19:18:22Z,1,amazing.. as always!,True
@marcoventura9451,2021-10-23T18:16:09Z,1,I am surprised! :-),True
@shoumiknandi6912,2021-10-21T17:23:04Z,0,Could you please make a video on KL divergence and cross entropy ?,True
@pilupz232,2021-10-20T10:28:14Z,1,"Thanks for this awesome video Josh !! I have 1 question, do you have any idea on when we should use entropy / gini for classification trees ? BAMM !",True
@isaiaskaung8856,2021-10-18T17:54:25Z,1,BAM!!!!,True
@drdlecture6137,2021-10-15T10:03:51Z,1,The best explanation ever. Thank you and a quadruple bam!,True
@haipengli4769,2021-10-14T12:08:39Z,1,Big bam!,True
@shahedmahbub9013,2021-10-13T15:34:52Z,8,"Thanks for all your efforts in creating a smart, funny and most importantly CLEAR explanation. This was awesome.",True
@Ken-S,2021-10-12T10:25:23Z,1,I am surprised that entropy has another meaning with surprise! Thank you!,True
@auzaluis,2021-10-11T16:37:26Z,1,"Mr statquest: I beg your pardon for leaving you for a few weeks, I was busy being a mere mortal",True
@sumitmishra8449,2021-10-07T15:38:56Z,2,"Thank you, Josh, you literally are the best teacher out there. I got a job as a Data Analyst and I Only watched your videos for all the explanations and understanding. Made a lot of notes as well. Sincerely Thank you.   PS: First thing I'm gonna do with my salary is buy a membership!! Infinite Bam!!",True
@nonlinearfit6785,2021-10-06T20:41:47Z,1,Was quite usefull. Thanks.,True
@eduardoh.m2072,2021-10-06T19:04:26Z,14,"You, sir, you are the very first person to actually explain this subject and not just repeat some random definition without giving any thought to it. I'm amazed by the amount of people who confuse rambling on about the topic with actually explaining it. Thank you!",True
@debarunkumer2019,2021-10-06T11:23:08Z,1,Beautiful,True
@secondago1929,2021-10-06T09:28:08Z,1,Bam!,True
@vitorribeirosa,2021-10-04T14:05:15Z,1,Amazingly explained!!! Thank you very much...,True
@jiaweizhang6189,2021-10-04T05:37:11Z,1,I have studied ml for a lot of time. i dont clearly know what is cross-entropy or entropy until now. This is the best explanation for entropy!,True
@ZaidAlhusainy,2021-10-04T02:38:29Z,1,"Your videos is global treasure. I feel sorry for other scientific fields, because they don't have Josh Starmer ♥",True
@wolfgangi,2021-10-03T04:28:45Z,9,"I freaking love these video, Josh has a gift to explain things so vividly",True
@adityajnhs3816,2021-10-02T06:11:52Z,0,"The description is good, but it doesn't explain why the units of entropy and information is 'bits', And why is it 'customary' to use log base 2 , for coin flip, and not e, or 10 etc. I understand that there are 2 alternatives in coin flip, so 2 might be natural. But is it necessary? There's no logical explanation for that ? Also, why only log,..any other function with 'similar' properties can be chosen ?",True
@TheBoSSmiCK14,2021-09-28T16:07:59Z,1,super clear ! thanks,True
@shaahinfazeli9095,2021-09-27T17:51:59Z,1,You are truly amazing in simply explain the complicated things!,True
@mvikyk,2021-09-26T01:53:09Z,1,"Even though I dont like advertisements, I watched through 'Shameless self promotion'. That much respect I have for your awesome video on Entropy!",True
@yacinerouizi844,2021-09-25T13:27:28Z,1,thank you,True
@TuNguyen-ox5lt,2021-09-23T09:39:02Z,1,this is definitely the most intuitive way to really gasp the ideal of entropy. you're just wonderful.  Thank you soo  much,True
@cmacompilation4649,2021-09-23T08:54:35Z,1,MAAAAAANNNNNNN   ❤❤❤  Triple Looove,True
@googol-boy-data,2021-09-23T03:47:05Z,1,what the f***... how can you make this concept looks like so easy! Thanks for that <3,True
@cv21a,2021-09-22T19:33:02Z,1,Really good.,True
@ihbarddx,2021-09-21T18:16:35Z,1,"Entropy, as you described it, is the log likelihood of a data sample drawn from a binomial distribution.",True
@DanielTompkinsGuitar,2021-09-21T17:52:38Z,1,"Much to my log(1/probability), I found myself eating orange chicken whilst watching this.",True
@lullabyX86,2021-09-21T07:10:58Z,0,"Physics Teacher: When we mix two kinds of gas molecules, the entropy increases in the system Stat Teacher: Well, the same but with chickens",True
@0305jhurley,2021-09-20T17:26:10Z,0,"I wish people wouldn’t  call this the entropy. It is not the same as the Boltzmann entropy, which you may find inscribed on his tombstone, S is equal to k log W, where W stands for the German word for probability, wahscheinlichkeit.",True
@igorkuivjogifernandes3012,2021-09-20T00:13:49Z,1,Very nice video! Never though entropy was that simple!,True
@rishikaushik8307,2021-09-18T14:04:30Z,0,"is the definition of surprise fundamental (like a definition), or can it be derived from another starting point? I always thought the definition of a ""bit"" was defined as the number of yes or no questions required to have full information and all information theory was developed on it.  Can we derive ""surprise"" from ""bit"" or they are independently defined quantities that happen to work together?",True
@Miguel_Noether,2021-09-18T13:19:47Z,1,"15:42 Quadruple bam if you would have ended saying ""and thus I have proven to you the second law of thermodynamics""  :')",True
@prajaktakadam2010,2021-09-18T09:23:18Z,1,Best!,True
@hemanbassi12,2021-09-16T15:29:32Z,1,"Sweet and perfect explanation, this was so insightful. thank you.",True
@dagoninfinite,2021-09-15T17:42:20Z,1,It sounds almost like hal,True
@alexmanners1540,2021-09-15T13:41:29Z,1,Very  well explained its remains me when it was presented by mi Statistical Physics Professor.,True
@Zonno5,2021-09-15T13:06:17Z,0,So if I want to win a lottery I should pick one with a high entropy so I have a better chance of getting the winning ticket?,True
@SanderKonijnenberg,2021-09-14T12:16:11Z,0,"Thanks for this clear explanation! I think it's very interesting and well-presented. However, it does raise one question for me, and I'm curious whether you have any thoughts about it.  In physics, systems tend to a state of highest entropy, because such a state is statistically most likely. I.e. such a state would be 'least surprising', whereas if a system would spontaneously evolve towards a state with low entropy, that would be 'extremely surprising'.  These observations appear to contradict the idea that you can intuitively think of entropy as 'the degree of surprise'. The problem of course lies in the precise, technical definition of 'surprise', but do you happen to have a suggestion for how this paradox can be resolved in simple layman's terms?",True
@18meiy13,2021-09-14T08:12:30Z,1,Nice explaination. I finally get it.,True
@serathicsides4837,2021-09-13T15:54:15Z,1,Just want to say BAM. Also entropy is denoted by S. I knew why it is today.🤗,True
@vitauscas1972,2021-09-13T14:03:48Z,0,"Hi, Why it is called Entropy. (thermodynamics)",True
@reiitenshi,2021-09-13T13:10:52Z,1,you don't know how much you've saved my ass with this explanation of entropy,True
@sumitpaliwal1540,2021-09-13T12:36:42Z,1,StatQuest: super easy explanations to complex problems. BAM!!!,True
@christiansiemes9902,2021-09-11T19:12:19Z,1,"Great video! For the first time, I understood what entropy means. Thanks!",True
@victorcoulon9375,2021-09-09T17:03:46Z,2,Outstanding explanation made of simplicity. Huge thanks!,True
@lukafarkas420,2021-09-07T21:17:29Z,1,Nice video,True
@cexploreful,2021-09-07T14:08:53Z,0,"*Kullback Leibler DIVERGENCE. It's not symetric so it's not a distance. d(A,B) neq d(B,A) try Thomas & Cover book for a better approach based on the 20 question guess game... ^_^ edit: ""Elements of Information Theory""¬Thomas  & Cover (Ch. 1, p. 5-6)",True
@Anujkumar-my1wi,2021-09-07T12:15:10Z,0,"Can you me what is the meaning of weights parameter used in logistic and linear regression etc ,is it rate of change of function with respect to inputs or is it just some multiplicative factor and if it is the rate of change then shouldn't the value e multiply with our weights be change in inputs rather than inputs itself so that when multiplied we can get change in y",True
@user-gx3eg5sz9n,2021-09-06T16:06:13Z,1,"Do you have a WeChat or Alipay Josh, that would be easier for Chinese fans to donate🤪",True
@maurocruz1824,2021-09-06T12:59:36Z,1,Good explanation!,True
@woddenhorse,2021-09-06T06:43:06Z,1,Simply Amazing. The best explanation out there 🔥🔥,True
@michaelgeorgoulopoulos8678,2021-09-05T13:21:46Z,3,The inverse probability is a much better way of putting it than the minus sign. It was all this time in front of me and I didn't notice. Thank you!,True
@md.adnannabib2066,2021-09-05T04:54:59Z,1,"Damn,man.you are a jem.man a crystal clear and intuitive explanation of what entropy is.best of luck.go on.BAM BAM BAM!!!!!!!!!!!!!!!!!",True
@BenitoAndito,2021-09-04T16:06:11Z,2,The total surpise of me picking out an orange chicken every time I go to Panda Express: 0,True
@ebeb9156,2021-09-04T11:02:09Z,1,Bim ... para bim bum BAAAAM !,True
@pyakpepyak,2021-09-04T06:08:30Z,1,"In the second half of the video you start using given probability of heads and tails 0.9 (T) and 0.1 (H) as a ""probability of a surprise"" (10:20 in the video). Did you mean just the probability of a given event and not the probability of a surprise, because surprise itself is already calculated? I think the chicken example uses the right wording.",True
@dafeiwang7797,2021-09-04T02:33:51Z,1,我所见过最易于理解的老师👨‍🏫 Greate,True
@PedroRibeiro-zs5go,2021-09-04T00:33:44Z,0,"Hi Josh, you're the BEST!!! Would love a subsequent video on the KL-Divergence!",True
@souravdey1227,2021-09-03T07:48:10Z,0,"Brilliant as always. Sir, request you to please do a series on Causal Analysis. I am going through the seminal works of Judea Pearl and would love to learn from you about it. With actual comparative examples, showing how it leads to insightful results as compared to normal statistical anlaysis.",True
@sumailsumailov1572,2021-09-03T06:31:22Z,1,Small bam :( Your interpretation is much better than I've ever met in student books. Thank you for job!,True
@laiwang4820,2021-09-03T04:35:09Z,0,fun but sometimes the too annoying(the voice),True
@deschryverjan,2021-09-01T20:47:56Z,1,No surprise here: yet another amazing video! Great explanation!,True
@amalnasir9940,2021-09-01T17:13:00Z,1,Wow! I don’t know what to say! Genius! Triple thank you!!!!,True
@bobsalita3417,2021-09-01T10:24:58Z,0,I don't have an intuition about the magnitude of surprise. Wish that was given a couple sentences.,True
@ufooex,2021-08-31T21:32:32Z,1,Your explanation is really clear. Thank you.,True
@chaitanyasharma8212,2021-08-31T20:04:09Z,0,Decision Trees ID3 algorithm gang wya ?,True
@pittypat2,2021-08-31T16:51:15Z,0,Can you explain the motivation for using log of inverse? Surely there must be a more fundamental reason for it's use other than it working out nicely,True
@ChrisadaSookdhis,2021-08-31T15:36:15Z,0,I'd really like to see your explanation of cross entropy now!,True
@BillHaug,2021-08-31T11:36:41Z,1,This is really helpful thank you... even though we didn't do a lot of maths step- by-step by-step by step... statquest,True
@lakminiwijesekara8662,2021-08-31T02:09:09Z,1,The best explanation I've ever come across.,True
@zhuxuanfu3126,2021-08-30T14:24:19Z,1,,True
@karthiklogan9384,2021-08-30T10:46:16Z,1,Amazing video.Pls keep doing this,True
@LouisChiaki,2021-08-29T19:56:26Z,0,Great video! Though we should have a video in the future to note why we pick log(1/p) rather than any other form.,True
@ilyboc,2021-08-29T19:02:41Z,1,log(1/p(x)) ... 👁️👄👁️,True
@adipurnomo5683,2021-08-28T11:39:05Z,1,Please explain about Information gain a.k.a mutual information sir. You SUCH great man!,True
@erv993,2021-08-28T04:02:00Z,2,This is a brilliant explanation! It all makes sense now!,True
@marwolaeth111,2021-08-27T18:38:10Z,2,"Well, I guess how angry some of the starchy mathematicians might become, but ¡this is simply damn brilliant! ",True
@algorithminc.8850,2021-08-27T17:48:21Z,2,"""Hello .... I'm Josh Starmer, and welcome to StatQuest.""  ---  hehehe ... cracks me up.  You've got a great channel ... solid explanations ... thanks and cheers.",True
@felixvanderspek1293,2021-08-27T16:50:33Z,315,"""Simplicity is the ultimate sophistication."" - Leonardo da Vinci  Thanks for explaining in such simple terms!",True
@kusy,2021-08-27T09:34:09Z,0,What is the reason to believe that the number of two chickens will gradually become equal with time as if guided by some universal law?,True
@djaym7,2021-08-26T21:56:08Z,1,This is GOLD,True
@user-vi3pi9rf7w,2021-08-26T20:50:21Z,1,"How crazy is that, I was studying entropy yesterday  But it was for thermodynamics.",True
@SierraDN,2021-08-26T18:46:30Z,1,"Very, very good!",True
@nataliatenoriomaia1635,2021-08-26T18:07:49Z,6,"Awesome as always, Josh! Thank you for continuing to share high quality content with us. You’re a very talented teacher. I wish you all the best!",True
@nicolasmora9331,2021-08-26T17:08:56Z,1,Excellent video! Thank you. I never thought of entropy as sur p r i s e.,True
@rafaelcorreiadasilva2301,2021-08-26T14:19:47Z,1,"it is indeed, clearly explained.",True
@crabson1864,2021-08-26T12:49:57Z,0,"Thank you for the video. It made me wonder why the term is called entropy and not uncertainty? You are very uncertain when there is 50/50 chance of getting something, and a bit less uncertain when it is 30/70.",True
@khursani8,2021-08-26T11:52:43Z,1,This video really helpful for me to understand entropy I have been using it for a while but don't know how it exist and why I need it Now I understand thanks :),True
@arunvaibhav5059,2021-08-26T07:51:34Z,1,"BEST, BEST and The BEST!!! TRIPLE BAMMM!",True
@Endocrin-PatientCom,2021-08-26T07:44:03Z,1,"Great video, as usually. In most textbooks, you see only the final equation of entropy, but no such a clear explanation.",True
