author,updated_at,like_count,text,public
@ilikethatboulder.thatisani5496,2024-02-07T02:22:23Z,1,as much as data science interests the hell out of me i know data engineering is more in demand so i’ve been studying that. it’s been fun so far.,True
@DevlL_J0ker,2023-09-12T20:50:27Z,1,What be your approach to get into data science after some career gap. Yes I'm studying data science. Building up my resume right now with some projects. But still worried if I can land a job or not.,True
@ntsingaelijah9866,2023-09-09T15:56:41Z,1,I would love to know the differences between all three,True
@animetv3885,2023-05-06T15:29:00Z,4,"I just completed my data analyst course , Am I able to shift from data analyst to data engineer role in future after working 1-2 year as a analyst",True
@Overheated521,2023-04-07T02:50:00Z,1,Do you think is possible to get a data engineer job in an entry-level position 🤔?,True
@Cristobal512,2023-04-04T17:25:49Z,3,What about Machine Learning Engineers?,True
