author,updated_at,like_count,text,public
@dragoneer121,2023-06-05T11:40:44Z,0,Where do i even start with the cloud though?,True
@bc4198,2023-02-21T17:22:34Z,0,Sooooo.... What _did_ you need?,True
@jordanmartinetti8224,2023-02-17T06:14:55Z,0,"I think you hit the nail on the head, Cloud can be useful but expensive if you don’t know what you’re doing.",True
@asadon1950,2023-02-11T02:32:30Z,0,"I just had a convo with my mentor on this. Love the video. Maybe one video can be about how people wanting to learn (on their own dime) can start with a cloud service to see what it’s like to schedule code and all the cool useful features, if you haven’t already.",True
@flowsolo,2023-02-10T17:29:45Z,0,just want to randomly say that I have 3 of those shirts your wearing ( currently wearing one now ) and that I love them. hahah,True
@El_Duderino01,2023-02-10T17:15:22Z,0,"Hey Luke,  Love your reels and storytelling style. Would love to hear your thoughts on best ways to prepare for GCP Data engineering certification.",True
@moamenyasser7832,2023-02-10T16:28:20Z,2,Hey Luke could you recommend me a course where I can learn data cleaning specifically since I am working on that rn?,True
