author,updated_at,like_count,text,public
@madScientist404,2021-01-09T23:32:27Z,0,"why does he say ""ok?"" after almost every sentence...",True
@yumnazia8894,2018-10-20T07:54:44Z,0,Why did you not stratify DepDelay15? It has the same ratio.,True
@yumnazia8894,2018-10-20T07:16:48Z,0,We use Azure ML for data mining.,True
@Tropax1,2018-08-23T11:20:31Z,0,"I'm currently doing my internship at a company when i'm going to do some machine learning which sounds cool but i haven't work with it before. I'm in the  fifth semester of computer science and i've only been learning java until the fourth semester where i learn some javascript in the form of nodejs and angular, and also asp.net. So i know where to start, any advice? I've been watching so many tutorials and still don't know where to begin.",True
@bjarke7886,2018-08-11T15:10:25Z,0,"Wierd, I have 504397 rows, instead of the 499... thousand",True
