author,updated_at,like_count,text,public
@whatthe2530,2017-02-27T00:40:11Z,1,"Getting the following error using Windows 7 Python 3.5.2 w/ TensorFlow GPU CUDA 8.0.  from tensorflow.python.ops import rnn, rnn_cell ImportError: cannot import name 'rnn_cell'",True
@glongoria8004,2017-02-24T18:40:25Z,0,"Awesome video! I implemented a ""use_rnn"" function to use the rnn in the video. It seems to be working but I have a question, is the output ought to be non-deterministic? That is, every time i run the code, with the same input file (e.g. two.jpg) i got different results. Thanks.",True
@sixalphaone,2017-02-19T13:49:52Z,36,"tf.split has changed arguments order (https://github.com/tensorflow/tensorflow/blob/64edd34ce69b4a8033af5d217cb8894105297d8a/RELEASE.md):  ""tf.split now takes arguments in a reversed order and with different keywords. In particular, we now match NumPy order as tf.split(value, num_or_size_splits, axis).""  Now you need to type: x = tf.split(x, n_chunks, 0)",True
@sukumarh3646,2017-02-18T05:17:09Z,42,"For people using the newer version of tensorflow, you may get this error:   AttributeError: module 'tensorflow.python.ops.rnn'  has no attribute 'rnn'  go to this link to get the solution: http://stackoverflow.com/questions/42311007/attributeerror-tensorflow-python-ops-rnn-has-no-attribute-rnn",True
@cristinaheghedus1281,2017-02-15T10:01:37Z,0,"Hi, great video, I ran the code and it work super fine. But I have a question. Does this really count like an LSTM neural network? Or it's a simple RNN and we are using the LSTM cell?  I just need an LSTM code and I want to make sure this is good for me :D",True
@urvishnakum914,2017-02-09T05:51:52Z,4,"sir , i get this error can i get some help ?   ValueError: Variable RNN/BasicLSTMCell/Linear/Matrix already exists, disallowed. Did you mean to set reuse=True in VarScope? Originally defined at:    File ""<ipython-input-4-dbc0fb083256>"", line 10, in recurrent_neural_network     outputs, states = rnn.rnn(lstm_cell, x, dtype=tf.float32)   File ""<ipython-input-5-ad727660c55a>"", line 2, in train_neural_network     prediction = recurrent_neural_network(x)   File ""<ipython-input-6-7c7cbdae9b34>"", line 1, in <module>     train_neural_network(x)",True
@DanielWeikert,2017-02-08T19:31:43Z,0,"Great tutorial. Is there a good way to learn how to reshape/transpose,... the tensors? I got confused with that.",True
@lkwjohn,2017-01-30T13:38:50Z,0,"Hi, any advice on what perm should we pass for the tf.transpose function?",True
@chrisv5330,2017-01-26T22:39:54Z,3,"Hi Harrison,  Thanks again for this video. Would you consider doing a video or two describing and showing how to implement an RNN + encoder + decoder for a translation problem? The few explanations about this on the web truly suck and the official Tensoflow explanation about this is the worst. This would be extremely interesting and useful!",True
@TheCanon03,2017-01-14T15:45:31Z,1,Can u please explain the actual significance of RNN size ? thanks in advance ...,True
@aneekdas8320,2017-01-14T06:13:24Z,156,"for those having problems understanding the format of the input :  say , u have a 5*5 image and u have 1 such image then it is :  x = np.ones((1,5,5))  so u have ,   x  =  array([[[ 1.,  1.,  1.,  1.,  1.],                      [ 1.,  1.,  1.,  1.,  1.],                      [ 1.,  1.,  1.,  1.,  1.],                      [ 1.,  1.,  1.,  1.,  1.],                      [ 1.,  1.,  1.,  1.,  1.]]])  now for the rnn u need to convert each row of pixel into a single chunk. so , u would have 5 chunks of 5 values each so, u need to convert each row to an array  x = np.transpose(x,(1,0,2))  this swaps the 0th dim with the 1st dim . so, u get shape of x as (5,1,5) which is 5 arrays of 1 chunk each of 5 elements   x = array([[[ 1.,  1.,  1.,  1.,  1.]],                    [[ 1.,  1.,  1.,  1.,  1.]],                    [[ 1.,  1.,  1.,  1.,  1.]],                    [[ 1.,  1.,  1.,  1.,  1.]],                    [[ 1.,  1.,  1.,  1.,  1.]]])  now , u need to remove 1 pair of extra braces . so flatten by one dimension  x = np.reshape(x,(-1,chunk_size))  so, u will have :  x = array([[ 1.,  1.,  1.,  1.,  1.],                   [ 1.,  1.,  1.,  1.,  1.],                   [ 1.,  1.,  1.,  1.,  1.],                   [ 1.,  1.,  1.,  1.,  1.],                   [ 1.,  1.,  1.,  1.,  1.]])  and finally u will need to split the entire thing into 5 chunks(5 arrays) x = np.split(x,n_chunks,0)  so, finally u have :  x = [array([[ 1.,  1.,  1.,  1.,  1.]]), array([[ 1.,  1.,  1.,  1.,  1.]]), array([[ 1.,  1.,  1.,  1.,  1.]]), array([[ 1.,  1.,  1.,  1.,  1.]]), array([[ 1.,  1.,  1.,  1.,  1.]])]  hope this helps :)",True
@xinpingzhang4506,2017-01-09T16:57:19Z,0,Why do we need to store states if it is not used anywhere?,True
@vinayakkailas,2017-01-03T09:32:31Z,0,Can you please cover a tutorial for sentiment analysis using LSTM,True
@quangtuonglam9067,2017-01-02T09:25:11Z,0,Thanks for the great video. And Can you help me how to use RNN to text summarization with TensorFow?. Thanks a lot!,True
@thegeniusfool,2016-12-07T10:48:37Z,1,"Epic epoch :-) Otherwise, love your videos, man. Wish we could exchange some knowledge. You --> me = ML. Me --> you = Python coding practices.  Keep it up!",True
@anmolsjoshi,2016-12-01T03:33:11Z,0,How would one use this method for text data?,True
@vineetkaushik5044,2016-11-18T22:57:43Z,0,How do we process stock data using this?,True
@gissemari,2016-10-23T16:30:00Z,0,"Hello. I still have trouble understanding the concept of cell, can we see rnn_cell.BasicLSTMCell as a definition of a layer?",True
@mohammadrezazahiri7490,2016-09-24T23:29:54Z,1,"Hey Harrison, thanks for your great videos. Actually there are two things that I don't understand, 1- The input format does not make any sense to me, it seems the input is a 2D matrix with size of (batchsize*chunck_size,n_chunck) which I guess it means that for e.g. the RNN is being trained at first with the first row of all the images in the batch and then gets trained with  all the second row of images and so on, is that right ? If so this doesn't make any sense to me. 2- Can you clarify on size of the 'outputs '? is it (batchsize, RNN size)? If so, by considering outputs[-1] in the next line, we just pass the last row of outputs (the last row of all images) to matmul which this also does not make sense to me . Thanks",True
@DaRealDJ,2016-09-24T04:35:49Z,0,Any tips for a time series with continuous data forecast version of RNN? I'm having a bit of trouble understanding how the chunk_size and n_chunks with the transposition would translate for that code. Nearly everything I google is focused on sentence or MNIST data or overcomplicated for a basic example to backwards engineer.,True
@Sunnyc432,2016-09-23T04:29:20Z,0,tensorflow-0.5.0-cp27-none-linux_x86_64.whl is not a supported wheel on this platform.   i got this error and i can't fix it?,True
@MasthaX,2016-09-22T10:35:51Z,0,"I've been following allot of  you video's. I was working on some NN's in Caffe which also worked pretty well. I really like the hands-on approach which is way easier for me to understand (as a long time programmer) than all this academic terminology which is usually the case when it comes down to neural networks.   I was trying to get the epoch number saved in the model by assigning a new TF Variable counter variable (as described in the docs) and increment it every epoch and after that saving it to a checkpoint with the saver. However my counter never increments, but that's just a little thing I have to find out, it is possible. Looking forward to more stuff!",True
@chrisv5330,2016-09-20T20:26:57Z,0,"Hi Harrison. Would you be able to do a tutorial on using a RNN + LSTM on sentence translation? For example from English to French. That is truly sequential data and the sentences/sequences are of varying length. It would be awesome to see you explain this, given that the Google tensorflow documentation about this is extremely bad.",True
@schoneschone,2016-09-19T15:42:35Z,18,"great tutorials as always! question tho... you explain you're doing reshaping/transpose/etc to fit the requirements of the rnn, would love if you could elaborate more and explain those three lines better.  Also why didn't epoch_x be reshaped for the final needed shape already and had to do further reshaping inside the recurrent_neural_network(x)? why couldn't it be shaped already as per the requirements of the rnn which i assume is - [batch_size, input_size] ? (thats the only thing i could find in the API docs)",True
@chrisv5330,2016-09-15T23:48:11Z,0,"Thank you, thank you, thank you!!!!!!! You're the best sentdex!",True
@cebas9472,2016-09-15T02:42:20Z,0,dude you rock  holy fucking christ never seen another yt channel like this before i don't have words to describe it thank you so much man,True
@sixthinsomniac,2016-09-14T22:25:21Z,0,"Hey Harrison, thanks a lot for the invaluable content that you've been uploading. Have you considered using Jupyter notebooks to write your code ? It'd make it a whole lot easier for anyone to jump straight in without having to copy paste or type out again.",True
@kevinz1777,2016-09-14T22:19:48Z,5,Thinking of covering Keras sometime down the line?,True
@DaRealDJ,2016-09-14T19:00:50Z,0,I want to thank you for these amazing tutorials. Its great for both learning the concepts and the coding in extremely easy to understand ways. And the website tutorials is amazing for practicing the code on my own.,True
@acelere,2016-09-14T18:20:35Z,7,"Hi Harrison, as always, great video. But I lost you there when you reshaped, transposed and split the input data... on the classic NN, it was easy to understand you had ""unfolded"" the image... but now I could not follow... could you explain a little better? perhaps and example? tks!",True
@blaksand1,2016-09-14T17:49:18Z,0,your so awesome brother I respect you alat,True
@RaoufGnda,2016-09-14T15:27:45Z,0,amazing as usual  and still waiting for your tutorial about the ConvNets for text classification .,True
@K6G8M9P0,2016-09-14T14:29:54Z,0,Thank you for your videos :),True
@toprakozturk3150,2016-09-14T13:43:26Z,10,"Those tutorials are awesome, keep them coming!",True
@ImGooblie,2016-09-14T13:42:51Z,0,you rock man,True
