author,updated_at,like_count,text,public
@fersanta7109,2017-01-18T22:06:45Z,3,"Great tutorial!, but i have a question about the opencv_createsamples: if a have a text file  with several images coordenates like this img/img1.jpg  1  140 100 45 45 img/img2.jpg  2  100 200 50 50 ... who can i put this txt file in this code line opencv_createsamples -img watch5050.jpg -bg bg.txt -info info/info.lst -pngoutput info -maxxangle 0.5 -maxyangle 0.5 -maxzangle 0.5 -num 1950,  because i'm trying to repleace -img watch5050.jpg to -img info.txt but doesn's work. my apologize for my bad english.",True
@bhanu0047,2017-01-13T09:29:33Z,0,First up.. thank u for the tutorial..  My Query is that if there is  a reason for scaling to resize the negative images to 100*100 after downloading?? what if my positive image is of 240*480 ?,True
@muhammadabraranwar7600,2017-01-07T22:47:34Z,6,"You are star mate.  Just a quick one, how I can use multiple images for a same object and create info.lst file using multiple images.For example, in this case we used watch5050.jpg how about, if i also have watch5051.jpg, watch5052.jpg.  look forward to hearing from you soon.",True
@Kyzuuh,2016-11-29T06:21:15Z,0,I'm not getting any errors but when I run opencv_createsamples everything looks the same as your's does in BASH but there aren't any samples being created.,True
@xuelaiw1894,2016-11-18T01:47:45Z,0,Error in `opencv_createsamples': corrupted double-linked list: 0x00000000018e48e0 Any idea? Appreciate,True
@jibrilqarni,2016-11-17T15:19:10Z,1,"dude, you know what? you're just awesome !",True
@3beerm93,2016-11-16T05:49:16Z,0,I got rid from the error 'invalid background message' by changing the .txt to .dat. However the samples are not created because the info file is empty.,True
@sumedhaagarwal702,2016-10-28T19:41:58Z,0,"I am constantly getting ""Invalid background description file."" Please help in removing it!!",True
@YOLO-gb5ie,2016-10-26T21:23:25Z,13,"If you got the error message ""Invalid background description file"" when creating samples, just open bg.txt file and delete any empty lines at the bottom. ;)",True
@farkasamongergely,2016-08-12T00:23:30Z,2,"Hi Sentdex, I love your tutorials, you are awesome! But with this  particular step I had a serious issue. When it comes  generating the info.lst, the opencv_createsamples returns a weird error message. I will just paste it in:  *** Error in `opencv_createsamples': free(): corrupted unsorted chunks:0x0000000001d8d730 *** The chunk Id is diferent every time I run the command, I think it has something to do with the jpg's metadata... By the way I'm using a virtual machine to emulate ubuntu.I would appreciate if you could help me solve this problem. Sorry for my crappy english, I'm not a native speaker... Stay awesome!  Amon Farkas",True
@abhilashkumar23,2016-07-22T11:42:41Z,0,"I am getting following error when i run opencv_traincascade command :-  OpenCV Error: Assertion failed (_img.cols == winSize.width) in get, file /builddir/build/BUILD/OpenCV-2.0.0/apps/traincascade/imagestorage.cpp, line 86 terminate called after throwing an instance of 'cv::Exception'  can anyone help, i'm stuck here and it's killing me",True
@nuwan78,2016-07-10T12:11:45Z,0,"don,t pay a cent for slooooooooooow vps servises",True
@nuwan78,2016-07-10T12:10:38Z,0,for super fast fast servers use google cloud  compute engine .  you can use up to  8 cpus. This is better for training any size of image.just open a free trial and use for 60 days.,True
@nuwan78,2016-07-09T05:47:05Z,2,"Hi , i fixed the google server  but now i get "" Invalid background description file"" error and info.lst file is created in info directory. why? , Should i try with different  set of negatives",True
@fotunetab,2016-07-03T14:09:25Z,0,"Hey +sentdex  I am stuck over here.... Plz tell where i have possibly gone wrong...  ===== TRAINING 0-stage ===== <BEGIN OpenCV Error: Bad argument (Can not get new positive sample. The most possible reason is insufficient count of samples in given vec-file. ) in get, file /home/idhant/Downloads/opencv-2.4.11/apps/traincascade/imagestorage.cpp, line 162 terminate called after throwing an instance of 'cv::Exception'   what():  /home/idhant/Downloads/opencv-2.4.11/apps/traincascade/imagestorage.cpp:162: error: (-5) Can not get new positive sample. The most possible reason is insufficient count of samples in given vec-file.  in function get  Aborted (core dumped)",True
@nuwan78,2016-07-03T13:18:34Z,0,"i did it using digital ocean  server , but i get empty info folder after  ""opencv_createsamples -img my.jpg -bg bg.txt -info info/info.lst -pngoutput info -maxxangle 0.5 -maxyangle 0.5 -maxzangle 0.5 -num 830""  command",True
@nuwan78,2016-07-02T12:43:08Z,0,sorry ifogot to tell i am using google cloud linex server,True
@nuwan78,2016-07-02T11:50:58Z,0,I get - libdc1394 error: Failed to initialize libdc1394 error and i get empty info file,True
@SogMosee,2016-06-28T19:23:54Z,1,"So you once mentioned that in college you majored in Criminology and one other degree that I cannot remember. The really interesting thing here is that you have no formal education in computer science. My question is did you begin learning computer science while you were still in college, or did you not even learn what programming was until after you finished school?",True
@sanjayastn,2016-06-17T04:07:19Z,4,"I need help..All things went right but when I execute the command opencv_createsamples it throws me an error saying ""Invalid background description file"".I have tried several times creating new bg.txt but gives me the same error.And also it shows me outputs same as yours and after ""Create samples from single image applying distortions"" it outputs as follows, open background image : neg/1.jpg open background image : neg/1210.jpg .. .. .. (After list of these at last it gives me the above error) what is the wrong I have done?please help :(",True
@lumierevr7473,2016-06-16T09:13:23Z,4,"my info.lst instead of getting the path to image with positive, I got a txt files in a directory named annotation. Any idea why ?",True
@traviswu1485,2016-06-13T10:35:51Z,2,I keep getting  info.lst(1) : parse errorDone. Created 0 samples when I try to create the vec file   I try manipulating the -num tag or even dropping it all together but to no avail. Any idea why this might be ?,True
@FritzFurtz,2016-05-22T18:09:20Z,1,Hey! When I put this Command:  opencv_createsamples -img 1.jpg -bg bg.txt -info /info/info.lst -pngoutput /info -maxxangle 0.5 -maxyangle 0.5 -maxzangle 0.5 -num 2000 and I look in the Folder info its empty? Any ideas? By the way: It says: Create test samples from single image [...] Done.  EDIT: Ok now it says invalid background description file.,True
@FritzFurtz,2016-05-22T12:36:23Z,0,Would it be better to use 4GB Memory?,True
@bbf2rob3,2016-05-18T15:30:47Z,0,"hello sentdex,  we tried your tutorial and at first everything worked fine. But then we tried using more images and more training stages to make the recognition more accurate. Unfortunatly now we are running into this error everytime we start the progress again:  opencv_traincascade -data data -vec vector.vec -bg jpg/bg.txt -numPos 60 -numNeg 30  -numStages 5 -h 20 -w 20  ===== TRAINING 0-stage ===== <BEGIN POS count : consumed   60 : 60 Train dataset for temp stage can not be filled. Branch training terminated. Cascade classifier can't be trained. Check the used training parameters.  All folders that are necessary exist and all image data is in .jpg format with 640x480 pixels.   It would be great if you can try to help us  Thank you!",True
@mohitchaturvedi1102,2016-05-08T13:06:37Z,0,Guys getting below error while running this command : opencv_createsamples -img haarcascade_mouse_1.jpg -bg bg.txt -info info/info.lst -pngoutput inyangle 0.5 -maxyangle -0.5 -maxzangle 0.5 -num 64   *** Error in `opencv_createsamples': free(): corrupted unsorted chunks: 0x0000000000ffde00,True
@arnoldadikrishna5772,2016-04-01T04:25:50Z,0,"Hi Sentdex. Thanks for your video. Just one quick question.  I have multiple positive images (a bit different with yours), and I saved the positive images as you suggested in the previous video (the number of object, x position, y position, width, and height information after the path directory of the corresponding image). Finally, I saved it in pos.dat file. However, when I  types the exact command like yours in the command prompt, there was nothing in my info folder.  I typed this command in my command prompt:  opencv_createsamples -img pos.dat -bg neg.txt -info info/info.lst -pngoutput info -num 60  I only have 60 negative images as my samples.  Nevertheless, if I used only a single positive image, just like you, I got the info.lst and all the images in my info folder.  here is what I typed in the command prompt:  opencv_createsamples -img rct.png -bg neg.txt -info info/info.lst -pngoutput info -num 60  Please give me your advice.  Once again, thanks for your videos.  -Arnold",True
@LAZofPIK,2016-03-23T21:17:01Z,0,can i use haar cascade for blood detection in video ??,True
@peretz7,2016-03-06T19:49:25Z,1,"When I use your image for the samples and training the number of steps per stage go above 40, but when I use my own image (resized as 50x50) it only trains for a maximum of 10 steps per stage (sometimes as low as 1 or 2! ) and the cascade file is very small... I tried a lot of other pictures, different interpolations for cropping, different dpi etc. It still doesn't work. The object is not detected :(.",True
@static75,2016-02-06T22:50:39Z,1,"I can't get create_samples to work to make a whole bunch of positives from one single positive and the pile of background images.  Is anyone else having a problem?  I found one sentence on his website tutorial that states: ""If you're a wizard and have figured out how to run create_samples and such on Windows, congratulations! "" So, I guess this doesn't work on windows?  Why not?",True
@MouseWanted,2016-02-06T13:32:13Z,0,thank you!,True
