author,updated_at,like_count,text,public
@krishnaik06,2020-06-05T19:39:34Z,0,Full podcast link : https://youtu.be/JS3humWYC9A,True
@jogdeepak,2021-05-01T17:24:18Z,0,"This is the only video where that guy is talking so much and Krish sir is listening,  maybe the video is not complete.",True
@rohitkamra7880,2020-06-07T04:59:16Z,0,Could you please provide your telegram channel link?,True
@AlgoTribes,2020-06-05T19:18:06Z,0,Krish bhai kahan se laate ho itne itne interesting bande..👃👃,True
@harshmakwana8001,2020-06-05T19:05:17Z,0,Can we get the full Podcast sir? Or any link where this might be uploaded?,True
@nocode659,2020-06-05T13:20:16Z,1,KRISH JI IS LEGENDARY,True
@keshavsharma267,2020-06-05T12:19:15Z,4,"Very aptly said. Data science has evolved into a magic wand everyone wants to have in their arsenal but they can have only a limited number of items in it. So over the years, Data scientists had to acquire Software Developer and DevOps skills as well. But that does not mean that you can manage with basic data science skills and be an expert in coding and managing the life cycle. The soul of data science is still and always will be Statistics/Math along with domain knowledge.",True
@ashishchawla6188,2020-06-05T11:58:38Z,2,Why did the video end abruptly??  It wasn't complete,True
